ObsID,National_Station_Identifier,StationName,Provider ID,Country code,StationLon,StationLat,Height,DrainingArea.km2.Provider,River,Catchment,EC_Catchments,Calibration ID,DrainingArea.km2.LDD5k,LisfloodX5k,LisfloodY5k,DrainingArea.km2.LDD,LisfloodX,LisfloodY,RealTime,PostProcess,FixedRepPoint,LSFCalib,HasWL,HasD,HasOpWL,HasOpD,Alive,HasRTWL,HasRTD,HasHWL,HasHD,Exclude5k,CAL_TYPE5k,Notes5k,EC_calib5k,Notes,QC,EC_issue,EC_calib,send_to_partners,first_valid_date_24H,last_valid_date_24H,data_count_24H,first_valid_date_6H,last_valid_date_6H,data_count_6H,HRES_cal_step_24,HRES_cal_step_6,first_valid_date_calib,last_valid_date_calib,data_count_calib,CAL_TYPE,Spinup_days,Min_calib_days,Cal_head,Cal_single,Cal_area,CalRes,CalLakes,DP_comment,calc_start_date,calc_end_date,calc_steps,KGE,KGE_r,KGE_B,KGE_y,NS,NSLOG,MAE,RMSE,CORR,BIAS,PC_BIAS,PC_BIAS2,APB,APB2,RSR,VR
1,10062000,Schwabelweis,1004,DE,12.13873,49.023585,324.49,35399,Danube,Danube,Danube,-,35525,4477500.0,2882500.0,35439.5,12.14167,49.025,True,True,True,False,1,1,1,1,1,1,1,1,1,0,NRT_6h,Oscillations in lower flow  use 3,1,,3,,1,0,01/01/1991,31/12/2021,10233.0,01/07/2013 00:00,31/12/2021 18:00,12235.0,True,True,01/07/2013 00:00,31/12/2021 18:00,3058.75,6.0,1095.0,1460.0,0.0,,2140.281216,,,,2013-07-01 00:00:00,2021-12-31 18:00:00,12235.0,0.8606325746918906,0.8742687440965594,1.0561849836978217,0.9785949040452858,0.7257145574169823,0.6636215130252507,74.19783774827542,99.00427448816116,0.8742687440965594,21.761790209710615,5.618498369782195,5.6184983697821576,19.15653199542502,5.6184983697821576,0.5237226771708643,0.9785949040452858
2,10088003,Hofkirchen,1004,DE,13.115212,48.676627,299.6,47496,Danube,Danube,Danube,C059,47525,4547500.0,2847500.0,47585.7,13.10833,48.675,True,True,True,True,1,1,1,1,1,1,1,1,1,0,NRT_6h,-,3,keeping it for routing,3,,1,1,03/01/1990,31/12/2021,10451.0,01/11/2013 00:00,31/12/2021 18:00,11585.0,True,True,01/11/2013 00:00,31/12/2021 18:00,2896.25,6.0,1095.0,1460.0,0.0,,880.483456,,,recommended,2013-11-01 00:00:00,2021-12-31 18:00:00,11585.0,0.843672604137433,0.8780937616470987,1.0978575852414618,1.0010083444487936,0.6754436997214627,0.6684061858132178,104.05626300253005,142.02753055726404,0.8780937616470987,53.94459975844094,9.785758524146239,9.785758524146189,18.87620757643065,9.785758524146189,0.5696984292400099,0.9989916555512064
3,10078000,Pfelling,1004,DE,12.747379,48.879843,310.25,37687,Danube,Danube,Danube,C362,37725,4517500.0,2867500.0,37764.2,12.75833,48.875,True,True,True,False,1,1,1,1,1,1,1,1,1,0,NRT_6h,Use 886 which has more data almost same location Same location as 886,2,close to 886  excluded by DP,3,DP,0,1,03/01/1990,31/12/2021,10482.0,13/10/2013 00:00,31/12/2021 18:00,11720.0,True,True,,,,,,,,,,,,exclude,,,,,,,,,,,,,,,,,,,
4,502070,Barby,1004,DE,11.882244,51.984836,46.11,94060,Elbe,Elbe,Elbe,C348,93975,4452500.0,3207500.0,93702.5,11.89167,51.99167,True,True,True,True,1,1,1,1,1,1,1,1,1,0,NRT_6h,-,3,,3,,1,1,01/01/1991,31/12/2021,10247.0,01/07/2013 00:00,31/12/2021 18:00,12230.0,True,True,01/07/2013 00:00,31/12/2021 18:00,3057.5,6.0,1095.0,1460.0,0.0,,975.535488,,,recommended,2013-07-01 00:00:00,2021-12-31 18:00:00,12230.0,0.6132590732458281,0.6529655534312593,1.1617930895036581,1.0543933222947905,-0.00022881048300349427,0.25109535956868356,131.30893431302502,192.26029276601938,0.6529655534312593,60.60369425672217,16.179308950365797,16.179308950365815,35.05541769771041,16.179308950365815,1.0001143986979706,0.9456066777052095
5,501420,Wittenberg / Lutherstadt,1004,DE,12.646309,51.856531,62.44,61879,Elbe,Elbe,Elbe,C164,61675,4497500.0,3197500.0,60768.0,12.64167,51.85833,True,True,True,True,1,1,1,1,1,1,1,1,1,0,NRT_6h,-,3,,3,,1,1,03/01/1990,31/12/2021,10865.0,15/08/2012 06:00,31/12/2021 18:00,13296.0,True,True,15/08/2012 06:00,31/12/2021 18:00,3324.0,6.0,1095.0,1460.0,0.0,,2987.836672,,,recommended,2012-08-15 06:00:00,2021-12-31 18:00:00,13296.0,0.6918231499486944,0.7532918646567068,1.1679263821659807,0.92313130002644,0.4246502916008592,0.1873268375782765,114.62361385456738,181.89644282999714,0.7532918646567068,46.292880326923395,16.79263821659824,16.792638216598057,41.57945811419623,16.792638216598057,0.7585181002449074,0.92313130002644
6,596390,Malliss OP,1004,DE,11.345254,53.190627,19.75,2879,Muritz-Elde,Elbe,Elbe,C558,2900,4407500.0,3342500.0,2935.1,11.34167,53.19167,True,True,True,False,1,1,1,1,1,1,1,1,1,0,NRT_6h,unrealistic low discharge same for daily data  possibly wrong location,0,low discharge but seems OK,1,,1,0,03/01/1990,31/12/2021,10080.0,11/07/2014 00:00,31/12/2021 18:00,9984.0,True,True,11/07/2014 00:00,31/12/2021 18:00,2496.0,6.0,1095.0,1460.0,0.0,,1695.675264,,1.0,,2014-07-11 00:00:00,2021-12-31 18:00:00,9984.0,0.3454619472253796,0.8999970040483128,1.6240234664642137,1.1703354826002643,-0.8134265393966362,0.2166833428114916,4.936124117790629,7.038186183606798,0.8999970040483128,4.122345722751791,62.402346646421,62.402346646421364,74.72098387772121,62.402346646421364,1.3466352659115395,0.8296645173997357
7,5910010,Schnackenburg,1004,DE,11.569159,53.038253,13.7,125482,Elbe,Elbe,Elbe,-,125175,4422500.0,3327500.0,123010.6,11.575,53.04167,False,False,False,False,1,0,1,0,1,1,0,1,0,0,-,No discharge data available for calibration period,-,,-,,0,0,,,,,,,False,False,,,,,,,,,,,,,,,,,,,,,,,,,,,,,,,
8,582670,Grosse Traenke Wehr UP,1004,DE,13.996386,52.369055,34.8,6170.92,Muggelspree,Elbe,Elbe,-,6625,4592500.0,3257500.0,5971.3,13.99167,52.375,False,False,True,False,1,0,1,0,1,1,1,1,1,0,HIST_24h,oscillations doscharge is too low compared to size of catchment possibly wrong data,0,discharge is too low compared to size of catchment  station is probably on a lateral channel,0,no_calib,0,0,03/01/1990,01/01/2020,9981.0,01/07/2013 00:00,01/01/2020 00:00,9501.0,True,True,,,,,,,,,,,,,,,,,,,,,,,,,,,,,,,
9,580650,Rathenow UP,1004,DE,12.321014,52.607446,24.52,19288.46,Lower Havel,Elbe,Elbe,C351,18875,4472500.0,3287500.0,18002.4,12.325,52.60833,False,False,True,True,1,0,1,0,1,1,0,1,1,0,HIST_24h,-,3,,2,,1,1,03/01/1990,19/05/2010,7381.0,,,,True,False,03/01/1990 00:00,19/05/2010 00:00,7381.0,24.0,1095.0,1460.0,0.0,,3049.74464,,,recommended,1991-01-03 00:00:00,2010-05-19 00:00:00,7020.0,0.692300189876089,0.7411893005241668,0.8904469374421178,1.1252769790157378,0.4443027378103024,0.540378909315624,22.92019850957775,30.671203741191835,0.7411893005241668,-7.918247661569354,-10.95530625578822,-10.955306255788223,31.711283209108263,10.955306255788223,0.7454510461389803,0.8747230209842622
10,596080,Plau OP,1004,DE,12.259913,53.456704,60.16,1230,Muritz-Elde,Elbe,Elbe,-,1250,4467500.0,3377500.0,1239.4,12.25833,53.45833,True,True,True,False,1,1,1,1,1,1,1,1,1,0,NRT_6h,low quality data  very small flow a   lake,0,Regulated,1,,1,0,03/01/1990,31/12/2021,10246.0,01/01/2014 00:00,31/12/2021 18:00,10955.0,True,True,01/01/2014 00:00,31/12/2021 18:00,2738.75,6.0,1095.0,1460.0,1.0,0.0,1239.42208,,1.0,,2014-01-01 00:00:00,2021-12-31 18:00:00,10955.0,-0.714552568761653,0.32431026346410197,2.575711270013478,0.9836328212649731,-10.05379441532364,-2.3335890986123724,2.561315369887364,3.4014097303555584,0.32431026346410197,2.350426721857178,157.57112700134806,157.5711270013478,171.70896913566935,157.5711270013478,3.3247247127128507,0.9836328212649731
11,570940,Calbe Grizehne,1004,DE,11.812211,51.916414,49.36,23719,Saale,Elbe,Elbe,C169,23725,4442500.0,3202500.0,23685.8,11.80833,51.90833,True,True,True,True,1,1,1,1,1,1,1,1,1,0,NRT_6h,-,3,,3,,1,1,01/01/1991,31/12/2021,10244.0,01/07/2013 00:00,31/12/2021 18:00,12238.0,True,True,01/07/2013 00:00,31/12/2021 18:00,3059.5,6.0,1095.0,1460.0,0.0,,5760.169984,1.0,,recommended,2013-07-01 00:00:00,2021-12-31 18:00:00,12238.0,0.7183327722773953,0.753044266552512,1.120465712267632,0.9380540149952966,0.4329154576914104,0.5482088475717486,21.449488189345903,33.68226990891659,0.753044266552512,9.524856889187376,12.046571226763273,12.046571226763202,27.128259275360072,12.046571226763202,0.7530501592248612,0.9380540149952966
12,502350,Tangermuende,1004,DE,11.978054,52.541308,27.56,97780,Elbe,Elbe,Elbe,C170,97875,4457500.0,3272500.0,97792.8,11.975,52.54167,True,True,True,True,1,1,1,1,1,1,1,1,1,0,NRT_6h,-,3,,3,,1,1,03/01/1990,31/12/2021,10871.0,27/08/2012 06:00,31/12/2021 18:00,13282.0,True,True,27/08/2012 06:00,31/12/2021 18:00,3320.5,6.0,1095.0,1460.0,0.0,,4090.345728,,,recommended,2012-08-27 06:00:00,2021-12-31 18:00:00,13282.0,0.7508311047529861,0.7751638116962256,1.107331810917524,1.003702587313207,0.4647018133117681,0.4115590885398055,143.5877465308271,218.86850905286352,0.7751638116962256,45.46742932410669,10.733181091752314,10.733181091752401,33.89576470413905,10.733181091752401,0.731640749745555,0.996297412686793
13,570910,Bernburg UP,1004,DE,11.73542,51.796794,55.11,19660,Saale,Elbe,Elbe,-,19700,4442500.0,3187500.0,19613.8,11.74167,51.79167,True,True,True,False,1,1,1,1,1,1,1,1,1,0,NRT_6h,Few outliers removed with qc close to 11,2,close to 11  excluded by DP,3,DP,0,1,03/01/1990,31/12/2021,10900.0,15/08/2012 06:00,31/12/2021 18:00,13367.0,True,True,,,,,,,,,,,,exclude,,,,,,,,,,,,,,,,,,,
14,503050,Wittenberge,1004,DE,11.759441,52.985531,16.72,123532,Elbe,Elbe,Elbe,C171,123300,4432500.0,3327500.0,122857.2,11.75833,52.99167,True,True,True,True,1,1,1,1,1,1,1,1,1,0,NRT_6h,-,3,,3,,1,1,03/01/1990,31/12/2021,10893.0,15/08/2012 06:00,31/12/2021 18:00,13410.0,True,True,15/08/2012 06:00,31/12/2021 18:00,3352.5,6.0,1095.0,1460.0,0.0,,1531.30944,,,recommended,2012-08-15 06:00:00,2021-12-31 18:00:00,13410.0,0.7445231259906456,0.755678070616542,1.0688044001942438,0.9709968537940029,0.4813340792068215,0.43147237789840465,166.59204302722995,251.19519474113406,0.755678070616542,35.086649488693226,6.880440019424417,6.880440019424384,32.66845300038136,6.880440019424384,0.7201846435416267,0.9709968537940029
15,502010,Aken,1004,DE,12.058857,51.857869,50.2,70093,Elbe,Elbe,Elbe,C349,69875,4457500.0,3202500.0,69041.1,12.05833,51.85833,True,True,True,True,1,1,1,1,1,1,1,1,1,0,NRT_6h,-,3,,3,,1,1,01/01/1991,31/12/2021,10232.0,01/07/2013 00:00,31/12/2021 18:00,12198.0,True,True,01/07/2013 00:00,31/12/2021 18:00,3049.5,6.0,1095.0,1460.0,0.0,,2094.724864,1.0,,recommended,2013-07-01 00:00:00,2021-12-31 18:00:00,12198.0,0.5610572446462637,0.6294876357738792,1.1824149070575762,1.148714935753865,-0.2579100293343699,0.1357657212128306,113.58436491547874,170.96064855109913,0.6294876357738792,53.47219168617852,18.241490705757723,18.241490705757617,38.748143129892505,18.241490705757617,1.1215658827435724,0.8512850642461349
16,502180,Magdeburg-Strombruecke,1004,DE,11.644332,52.1297,39.88,94942,Elbe,Elbe,Elbe,-,94975,4437500.0,3222500.0,94197.0,11.65833,52.125,True,True,True,False,1,1,1,1,1,1,1,1,1,0,NRT_6h,Close to 4,2,close to 4 excluded by DP,3,DP,0,1,01/01/1991,31/12/2021,10237.0,01/07/2013 00:00,31/12/2021 18:00,12230.0,True,True,,,,,,,,,,,,exclude,,,,,,,,,,,,,,,,,,,
17,580790,Havelberg Stadt,1004,DE,12.07804,52.824075,21.57,23858,Lower Havel waterway,Elbe,Elbe,-,23550,4462500.0,3302500.0,23533.1,12.075,52.825,True,True,True,False,1,1,1,1,1,1,1,1,1,0,NRT_6h,Outliers exclude 2013 flood  negative values removed with qc ,1,minor outliers,3,,1,0,01/01/1991,31/12/2021,10237.0,01/07/2013 00:00,31/12/2021 18:00,12227.0,True,True,01/07/2013 00:00,31/12/2021 18:00,3056.75,6.0,1095.0,1460.0,0.0,,5530.64192,,,recommended,2013-07-01 00:00:00,2021-12-31 18:00:00,12227.0,0.6299782298879784,0.6387320087369124,0.9576503236964913,1.0678826469913736,0.25608933227579833,0.5043630901219727,26.138507545597964,38.41693509414867,0.6387320087369124,-2.98458066052593,-4.234967630350953,-4.2349676303508765,37.089208150864415,4.2349676303508765,0.8625025609957365,0.9321173530086264
18,570810,Halle-Trotha UP,1004,DE,11.954551,51.514254,69.34,17988,Saale,Elbe,Elbe,C350,18000,4457500.0,3157500.0,17925.7,11.95833,51.50833,True,True,True,True,1,1,1,1,1,1,1,1,1,0,NRT_6h,small outliers,3,,3,,1,1,01/01/1991,31/12/2021,10237.0,01/07/2013 00:00,31/12/2021 18:00,12232.0,True,True,01/07/2013 00:00,31/12/2021 18:00,3058.0,6.0,1095.0,1460.0,0.0,,3215.503104,,,recommended,2013-07-01 00:00:00,2021-12-31 18:00:00,12232.0,0.7108434808271356,0.7579017797884344,0.9901486779712525,1.157806513822609,0.42313323336925124,0.44756458821127876,17.86084955587794,28.235887403317875,0.7579017797884344,-0.6960468367501398,-0.9851322028747437,-0.9851322028747499,25.2788995498485,0.9851322028747499,0.7595174564358296,0.842193486177391
19,5930010,Neu Darchau,1004,DE,10.8888,53.232262,5.68,131950,Elbe,Elbe,Elbe,C172,131450,4377500.0,3352500.0,131250.1,10.875,53.24167,True,True,True,True,1,1,1,1,1,1,1,1,1,0,NRT_6h,-,3,,3,,1,1,03/01/1990,31/12/2021,10903.0,10/08/2012 06:00,31/12/2021 18:00,13409.0,True,True,10/08/2012 06:00,31/12/2021 18:00,3352.25,6.0,1095.0,1460.0,0.0,,5457.8304,,,recommended,2012-08-10 06:00:00,2021-12-31 18:00:00,13409.0,0.7138697416080462,0.7227980928750859,1.0707231343896284,1.005278798714038,0.38420091842685633,0.45568559019958765,168.0349364425408,255.90574206516305,0.7227980928750859,37.49432287653703,7.072313438962835,7.07231343896283,31.69535140375923,7.07231343896283,0.7847286674852271,0.9947212012859621
20,603130,Schwedt-Oderbruecke,1004,DE,14.311627,53.035578,-4.99,112950,Oder,Oder,Oder,-,112475,4607500.0,3332500.0,112705.2,14.30833,53.04167,False,False,False,False,1,0,1,0,1,1,0,1,0,0,-,No discharge data available for calibration period,-,,-,,0,0,,,,,,,False,False,,,,,,,,,,,,,,,,,,,,,,,,,,,,,,,
21,603000,Eisenhuettenstadt,1004,DE,14.687965,52.153321,25.17,52033,Oder,Oder,Oder,C365,51150,4642500.0,3237500.0,52124.8,14.69167,52.15833,True,True,True,True,1,1,1,1,1,1,1,1,1,0,NRT_6h,-,3,,3,,1,1,01/01/1991,31/12/2021,10238.0,01/07/2013 00:00,31/12/2021 18:00,12238.0,True,True,01/07/2013 00:00,31/12/2021 18:00,3059.5,6.0,1095.0,1460.0,0.0,,725.516864,,,recommended,2013-07-01 00:00:00,2021-12-31 18:00:00,12238.0,0.6400666177532572,0.6911115807588262,1.1525339988330423,1.1042754204703589,0.055098785057273614,0.3016046223128126,68.94613586714374,104.42946083225839,0.6911115807588262,31.18720580023554,15.253399883304356,15.253399883304224,33.720974797371184,15.253399883304224,0.9720602938823961,0.8957245795296411
22,603050,Kienitz,1004,DE,14.433228,52.679839,5.2,109093,Oder,Oder,Oder,-,109425,4622500.0,3292500.0,109685.1,14.44167,52.675,False,False,False,False,1,0,1,0,1,1,0,1,0,0,-,No discharge data available for calibration period,-,,-,,0,0,,,,,,,False,False,,,,,,,,,,,,,,,,,,,,,,,,,,,,,,,
23,603031,Frankfurt (Oder),1004,DE,14.551714,52.357808,17.19,53580,Oder,Oder,Oder,-,51925,4632500.0,3262500.0,53690.4,14.55833,52.35833,False,False,False,False,1,0,1,0,1,1,0,1,0,0,-,No discharge data available for calibration period,-,,-,,0,0,,,,,,,False,False,,,,,,,,,,,,,,,,,,,,,,,,,,,,,,,
24,603100,Stuetzkow,1004,DE,14.19335,52.983722,-5,112143,Oder,Oder,Oder,-,112450,4602500.0,3327500.0,112545.3,14.19167,52.975,False,False,False,False,1,0,1,0,1,1,0,1,0,0,-,No discharge data available for calibration period,-,,-,,0,0,,,,,,,False,False,,,,,,,,,,,,,,,,,,,,,,,,,,,,,,,
25,603040,Kietz,1004,DE,14.630298,52.577597,8.69,53752,Oder,Oder,Oder,-,52450,4637500.0,3282500.0,54111.0,14.625,52.575,False,False,False,False,1,0,1,0,1,1,0,1,0,0,-,No discharge data available for calibration period,-,,-,,0,0,,,,,,,False,False,,,,,,,,,,,,,,,,,,,,,,,,,,,,,,,
26,603080,Hohensaaten-Finow,1004,DE,14.141123,52.864739,0.16,109564,Oder,Oder,Oder,C178,109875,4602500.0,3307500.0,111349.4,14.14167,52.85833,True,True,True,True,1,1,1,1,1,1,1,1,1,0,NRT_6h,-,3,,3,,1,1,01/01/1991,31/12/2021,10186.0,01/07/2013 00:00,31/12/2021 18:00,12238.0,True,True,01/07/2013 00:00,31/12/2021 18:00,3059.5,6.0,1095.0,1460.0,0.0,,1374.342656,,,recommended,2013-07-01 00:00:00,2021-12-31 18:00:00,12238.0,0.5719326199505415,0.5809872163650356,1.035121043842964,0.9197723159235747,0.19447805135737273,0.34407512686323427,116.73024621349217,167.65761295763892,0.5809872163650356,13.678093876490987,3.51210438429642,3.51210438429642,29.972656512544756,3.51210438429642,0.8975087457193008,0.9197723159235747
27,25800200,Leun (Neu),1004,DE,8.355275,50.545134,135,3571,Lahn,Rhine,Rhine,C338,3575,4207500.0,3047500.0,3559.9,8.35833,50.54167,True,True,True,True,1,1,1,1,1,1,1,1,1,0,NRT_6h,-,3,,3,,1,1,01/01/1991,31/12/2021,10246.0,01/07/2013 00:00,31/12/2021 18:00,12238.0,True,True,01/07/2013 00:00,31/12/2021 18:00,3059.5,6.0,1095.0,1460.0,0.0,,1907.729792,,,recommended,2013-07-01 00:00:00,2021-12-31 18:00:00,12238.0,0.8495521878692031,0.9155018374993277,0.9414256992058486,0.890165324257638,0.829614634753594,0.7545654873196347,7.604583721359484,12.828798788780563,0.9155018374993277,-1.5620951535016867,-5.857430079415117,-5.857430079415138,28.515111471327568,5.857430079415138,0.41277762202717105,0.890165324257638
28,23700200,Maxau,1004,DE,8.305614,49.038957,97.79,50196,Rhine,Rhine,Rhine,-,50425,4192500.0,2877500.0,50539.5,8.30833,49.04167,True,True,True,False,1,1,1,1,1,1,1,1,1,0,HIST_6h,Limited data period,1,,3,,1,1,01/01/1991,31/12/2021,10212.0,01/07/2013 00:00,31/12/2021 18:00,12238.0,True,True,01/07/2013 00:00,31/12/2021 18:00,3059.5,6.0,1095.0,1460.0,0.0,,10230.00064,1.0,,recommended,2013-07-01 00:00:00,2021-12-31 18:00:00,12238.0,0.9322785184215008,0.9337568662690019,1.0075876633580991,0.9881478413169468,0.8677663781126916,0.8384213446148421,140.53478250877225,185.39588418364133,0.9337568662690019,8.908179889829068,0.7587663358099154,0.7587663358099136,11.970241204914586,0.7587663358099136,0.3636394119004553,0.9881478413169468
29,24900108,Raunheim,1004,DE,8.44832,50.01613,82.9,27142,Main,Rhine,Rhine,-,27100,4207500.0,2987500.0,27128.7,8.44167,50.00833,True,True,True,False,1,1,1,1,1,1,1,1,1,0,NRT_6h,oscillations jumps missing data,0,some zeros,3,,1,0,03/01/1990,31/12/2021,10542.0,15/08/2012 06:00,31/12/2021 18:00,11877.0,True,True,15/08/2012 06:00,31/12/2021 18:00,2969.25,6.0,1095.0,1460.0,0.0,,713.199552,,,,2012-08-15 06:00:00,2021-12-31 18:00:00,11877.0,0.8003609262102735,0.813649032108336,1.0715918405697902,0.9980803872032116,0.5846883248160805,0.430720576413095,53.52281433782725,78.85595458739886,0.813649032108336,13.32507215040392,7.159184056978993,7.159184056979007,28.75629300666887,7.159184056979007,0.6444467977916557,0.9980803872032116
30,23500700,Plittersdorf,1004,DE,8.135974,48.885937,106.76,48276,Rhine,Rhine,Rhine,-,48500,4182500.0,2862500.0,48496.1,8.14167,48.89167,True,True,True,True,1,1,1,1,1,1,1,1,1,0,NRT_6h,-,3,excluded by DP,3,DP,0,1,01/01/1991,31/12/2021,10248.0,01/07/2013 00:00,31/12/2021 18:00,12226.0,True,True,,,,,,,,,,,,exclude,,,,,,,,,,,,,,,,,,,
31,24700404,Frankfurt-Osthafen,1004,DE,8.715027,50.105711,90.64,24764,Main,Rhine,Rhine,C211,24775,4222500.0,2997500.0,24783.0,8.70833,50.10833,True,True,True,False,1,1,1,1,1,1,1,1,1,0,NRT_6h,Quite large oscillations in low flow  no large flood peaks could use hist_24 instead,1,,3,,1,0,03/01/1990,31/12/2021,10484.0,13/10/2013 00:00,31/12/2021 18:00,11706.0,True,True,13/10/2013 00:00,31/12/2021 18:00,2926.5,6.0,1095.0,1460.0,0.0,,5925.946368,,,,2013-10-13 00:00:00,2021-12-31 18:00:00,11706.0,0.6071126765474837,0.8265770067019329,1.3079348714308172,0.8283578452649035,0.4795387081148563,0.20859301381883244,59.66517372540558,80.70346654294427,0.8265770067019329,41.51315843349294,30.793487143081688,30.793487143081723,44.25822629098415,30.793487143081723,0.7214300325638985,0.8283578452649035
32,26100100,Perl,1004,DE,6.369075,49.472537,138.5,11522,Moselle,Rhine,Rhine,C207,11525,4057500.0,2942500.0,11483.9,6.375,49.475,True,True,True,True,1,1,1,1,1,1,1,1,1,0,NRT_6h,Use after 03-2013  Outliers removed with qcc and small oscillations zeros,3,Outliers and small oscillations zeros,3,,1,1,01/01/1991,31/12/2021,10255.0,01/07/2013 00:00,31/12/2021 18:00,12227.0,True,True,01/07/2013 00:00,31/12/2021 18:00,3056.75,6.0,1095.0,1460.0,0.0,,848.150144,,,recommended,2013-07-01 00:00:00,2021-12-31 18:00:00,12227.0,0.8430011146276086,0.9147679294771444,1.0383807528494207,0.8738609419201493,0.83572169704576,0.6334308134939537,38.26964244476054,61.34417978948609,0.9147679294771444,4.844124442337277,3.8380752849421347,3.8380752849420725,30.32163409079086,3.8380752849420725,0.4053125990568742,0.8738609419201493
33,23800100,Plochingen,1004,DE,9.419239,48.707411,245.9,3995,Neckar,Rhine,Rhine,C342,3975,4277500.0,2842500.0,3980.4,9.425,48.70833,True,True,True,True,1,1,1,1,1,1,1,1,1,0,NRT_6h,-,3,,3,,1,1,01/01/1991,31/12/2021,10241.0,01/07/2013 00:00,31/12/2021 18:00,12187.0,True,True,01/07/2013 00:00,31/12/2021 18:00,3046.75,6.0,1095.0,1460.0,1.0,0.0,3980.3584,,,recommended,2013-07-01 00:00:00,2021-12-31 18:00:00,12187.0,0.7219828091986026,0.8066481421230352,0.927210196155634,1.1860383344714882,0.560138520772871,-1.2459536655204246,14.05920037362218,28.51187785289589,0.8066481421230352,-2.934461862999215,-7.278980384436565,-7.278980384436598,34.874075220001004,7.278980384436598,0.6632205358906854,0.8139616655285118
34,24300304,Schweinfurt Neuer Hafen,1004,DE,10.220745,50.031183,204.04,12715,Main,Rhine,Rhine,-,12825,4332500.0,2982500.0,12723.7,10.225,50.025,True,True,True,False,1,1,1,1,1,1,1,1,1,0,NRT_6h,Outliers  small oscillations  zeros  qc,1,,3,,1,0,01/01/1991,31/12/2021,10236.0,01/07/2013 00:00,31/12/2021 18:00,12200.0,True,True,01/07/2013 00:00,31/12/2021 18:00,3050.0,6.0,1095.0,1460.0,0.0,,714.83712,,,,2013-07-01 00:00:00,2021-12-31 18:00:00,12200.0,0.7805211010318436,0.8448084201503374,1.1523140426161118,0.9702175713217122,0.5879582566601171,0.5315618195206364,26.87937431022169,39.10388489482434,0.8448084201503374,13.77242453682595,15.231404261611331,15.231404261611178,29.726836790678163,15.231404261611178,0.6419047774708359,0.9702175713217122
35,24700200,Kleinheubach,1004,DE,9.233046,49.713596,119.62,21505,Main,Rhine,Rhine,C335,21550,4262500.0,2957500.0,21523.9,9.24167,49.70833,True,True,True,False,1,1,1,1,1,1,1,1,1,0,NRT_6h,Wrong hydrometric zero or wrong rating curve  could use hist_24 instead,0,Low flow is missing after 2010,0,,0,0,03/01/1990,31/12/2021,9044.0,22/10/2013 06:00,31/12/2021 18:00,5278.0,True,False,,,,,,,,,,,,,,,,,,,,,,,,,,,,,,,
36,25700100,Kaub,1004,DE,7.764994,50.085407,67.68,103488,Rhine,Rhine,Rhine,C202,103525,4162500.0,2992500.0,103713.5,7.75833,50.09167,True,True,True,True,1,1,1,1,1,1,1,1,1,0,NRT_6h,-,3,,3,,1,1,01/01/1991,31/12/2021,10234.0,01/07/2013 00:00,31/12/2021 18:00,12238.0,True,True,01/07/2013 00:00,31/12/2021 18:00,3059.5,6.0,1095.0,1460.0,0.0,,1174.58176,,,recommended,2013-07-01 00:00:00,2021-12-31 18:00:00,12238.0,0.9222882178106951,0.9304035534355233,1.016476779997959,1.03039689848545,0.8505249255696383,0.8346744562662056,190.0166623557347,258.42143151340235,0.9304035534355233,25.39647773527914,1.647677999795931,1.6476779997958944,12.327940804298043,1.6476779997958944,0.3866200647022367,0.9696031015145501
37,24700302,Obernau,1004,DE,9.129109,49.933776,107.8,22300,Main,Rhine,Rhine,-,22275,4257500.0,2977500.0,22349.2,9.10833,49.94167,False,False,False,False,1,0,1,0,1,1,0,1,0,0,-,No discharge data available for calibration period,-,,-,,0,0,,,,,,,False,False,,,,,,,,,,,,,,,,,,,,,,,,,,,,,,,
38,26900400,Cochem,1004,DE,7.16831,50.143322,77,27088,Moselle,Rhine,Rhine,C208,27025,4122500.0,3007500.0,27092.9,7.19167,50.14167,True,True,True,True,1,1,1,1,1,1,1,1,1,0,NRT_6h,-,3,,3,,1,1,01/01/1991,31/12/2021,10187.0,01/07/2013 00:00,31/12/2021 18:00,12077.0,True,True,01/07/2013 00:00,31/12/2021 18:00,3019.25,6.0,1095.0,1460.0,0.0,,2490.849792,,,recommended,2013-07-01 00:00:00,2021-12-31 18:00:00,12077.0,0.9114975874556198,0.9210314392988787,0.993046178210538,0.9606517114795398,0.8471764444276845,0.7081372153972014,77.82001535022563,127.88860620637712,0.9210314392988787,-2.0011764643219148,-0.6953821789462041,-0.695382178946206,27.041419287430596,0.695382178946206,0.3909265347508598,0.9606517114795398
39,24300202,Trunstadt,1004,DE,10.75524,49.92968,223.4,12010,Main,Rhine,Rhine,-,11950,4372500.0,2982500.0,12008.8,10.75833,49.925,True,True,True,True,1,1,1,1,1,1,1,1,1,0,NRT_6h,Outliers  zeros removed with qc,3,,3,,1,1,01/01/1991,31/12/2021,10218.0,01/07/2013 00:00,31/12/2021 18:00,12169.0,True,True,01/07/2013 00:00,31/12/2021 18:00,3042.25,6.0,1095.0,1460.0,0.0,,772.602752,,,recommended,2013-07-01 00:00:00,2021-12-31 18:00:00,12169.0,0.7976879680330464,0.8342596848873315,1.1119087974034287,1.0306060008604412,0.5663690824540153,0.4795488294323531,25.919678920503628,37.28567597046537,0.8342596848873315,10.203765426589682,11.190879740342995,11.19087974034288,28.427153857515258,11.19087974034288,0.658506581247282,0.9693939991395588
40,2730010,Koeln,1004,DE,6.963322,50.936914,34.97,144231.54,Rhine,Rhine,Rhine,-,144150,4107500.0,3092500.0,144452.7,6.95833,50.94167,True,True,True,False,1,1,1,1,1,1,1,1,1,0,NRT_6h,Few outliers removed with qc close to 58 and 62,2,close to 58 and 62,3,,1,1,01/01/1991,31/12/2021,10237.0,01/07/2013 00:00,31/12/2021 18:00,12238.0,True,True,01/07/2013 00:00,31/12/2021 18:00,3059.5,6.0,1095.0,1460.0,0.0,,3329.252864,1.0,,recommended,2013-07-01 00:00:00,2021-12-31 18:00:00,12238.0,0.9324797188167059,0.933545157083079,1.0117991300738143,0.9981231000400493,0.8651387162058891,0.8424926947895836,260.4281135776604,361.2413689843162,0.933545157083079,22.811392348114357,1.1799130073814363,1.1799130073814388,13.470572686173242,1.1799130073814388,0.36723464405487644,0.9981231000400493
41,27100700,Oberwinter,1004,DE,7.215007,50.601027,47.13,140738,Rhine,Rhine,Rhine,-,140625,4122500.0,3057500.0,140959.6,7.20833,50.60833,False,False,False,False,1,0,1,0,1,1,0,1,0,0,-,No discharge data available for calibration period,-,,-,,0,0,,,,,,,False,False,,,,,,,,,,,,,,,,,,,,,,,,,,,,,,,
42,25800600,Kalkofen (Neu),1004,DE,7.889898,50.317832,86.39,5304,Lahn,Rhine,Rhine,-,5275,4172500.0,3027500.0,5278.3,7.89167,50.325,True,True,True,True,1,1,1,1,1,1,1,1,1,0,NRT_6h,-,3,,3,,1,1,01/01/1991,31/12/2021,10243.0,01/07/2013 00:00,31/12/2021 18:00,12238.0,True,True,01/07/2013 00:00,31/12/2021 18:00,3059.5,6.0,1095.0,1460.0,0.0,,1718.455168,,,recommended,2013-07-01 00:00:00,2021-12-31 18:00:00,12238.0,0.8975228874609168,0.9346683423509978,0.9334943584495873,0.9574519948158611,0.8681085776394616,0.7820733667394704,8.858671710329117,14.588956299915772,0.9346683423509978,-2.4841825653454968,-6.650564155041261,-6.650564155041274,23.7161170679898,6.650564155041274,0.36316858669292723,0.9574519948158611
43,24300600,Wuerzburg,1004,DE,9.926005,49.796189,164.55,14031,Main,Rhine,Rhine,C340,14125,4317500.0,2967500.0,14111.8,9.925,49.79167,True,True,True,False,1,1,1,1,1,1,1,1,1,0,NRT_6h,Outliers  zeros removed with qc  small oscillations  close to 39 and 59 ,2,close to 39 and 59 excluded by DP,3,DP,0,1,01/01/1991,31/12/2021,10232.0,01/07/2013 00:00,31/12/2021 18:00,12233.0,True,True,,,,,,,,,,,,exclude,,,,,,,,,,,,,,,,,,,
44,26500150,Ruwer,1004,DE,6.70427,49.783015,121,23883,Moselle,Rhine,Rhine,-,23975,4082500.0,2967500.0,23885.2,6.69167,49.775,False,False,False,False,1,0,1,0,1,1,0,1,0,0,-,No discharge data available for calibration period,-,,-,,0,0,,,,,,,False,False,,,,,,,,,,,,,,,,,,,,,,,,,,,,,,,
45,23900200,Worms,1004,DE,8.377548,49.631858,84.16,68936,Rhine,Rhine,Rhine,C204,68950,4202500.0,2947500.0,68989.6,8.375,49.625,True,True,True,True,1,1,1,1,1,1,1,1,1,0,NRT_6h,-,3,,3,,1,1,01/01/1991,31/12/2021,10245.0,01/07/2013 00:00,31/12/2021 18:00,12238.0,True,True,01/07/2013 00:00,31/12/2021 18:00,3059.5,6.0,1095.0,1460.0,0.0,,2732.46848,,,recommended,2013-07-01 00:00:00,2021-12-31 18:00:00,12238.0,0.9228025694267314,0.9272852118029274,1.0215269055134466,1.014442825332484,0.8455532097865528,0.8358818838718995,165.87918117548364,224.28748691099847,0.9272852118029274,28.10219249990704,2.152690551344659,2.1526905513446706,12.706714822426584,2.1526905513446706,0.39299718855667143,0.985557174667516
46,2790020,Emmerich,1004,DE,6.245604,51.829213,8,159555,Rhine,Rhine,Rhine,-,159550,4057500.0,3197500.0,159367.2,6.25833,51.825,True,True,True,False,1,1,1,1,1,1,1,1,1,0,NRT_6h,Close to 153,2,close to 153  excluded by DP,3,DP,0,1,01/01/1991,31/12/2021,10245.0,01/07/2013 00:00,31/12/2021 18:00,12234.0,True,True,,,,,,,,,,,,exclude,,,,,,,,,,,,,,,,,,,
47,2770010,Ruhrort,1004,DE,6.727942,51.455309,16.09,153176,Rhine,Rhine,Rhine,-,152875,4092500.0,3157500.0,153711.1,6.725,51.45833,True,True,True,True,1,1,1,1,1,1,1,1,1,0,NRT_6h,-,3,,3,,1,1,01/01/1991,31/12/2021,10239.0,01/07/2013 00:00,31/12/2021 18:00,12238.0,True,True,01/07/2013 00:00,31/12/2021 18:00,3059.5,6.0,1095.0,1460.0,0.0,,1639.959424,,,recommended,2013-07-01 00:00:00,2021-12-31 18:00:00,12238.0,0.9330063394826964,0.9346191437152068,1.0145423680412244,1.00141905346218,0.8660861408177389,0.8442493639142321,269.42933703825213,378.4189288446645,0.9346191437152068,29.374084703375814,1.4542368041224307,1.4542368041224352,13.338766534785037,1.4542368041224352,0.3659424260485002,0.9985809465378199
48,2790010,Rees,1004,DE,6.395703,51.756915,8.73,159683,Rhine,Rhine,Rhine,-,159400,4067500.0,3192500.0,159320.3,6.39167,51.75833,True,True,True,False,1,1,1,1,1,1,1,1,1,0,NRT_6h,Close to 153,2,close to 153  excluded by DP,3,DP,0,1,01/01/1991,31/12/2021,10243.0,01/07/2013 00:00,31/12/2021 18:00,12238.0,True,True,,,,,,,,,,,,exclude,,,,,,,,,,,,,,,,,,,
49,25100100,Mainz,1004,DE,8.275352,50.003966,80.4,98206,Rhine,Rhine,Rhine,C333,98300,4197500.0,2987500.0,98470.5,8.275,50.00833,True,True,True,True,1,1,1,1,1,1,1,1,1,0,NRT_6h,-,3,,3,,1,1,03/01/1990,31/12/2021,10879.0,15/08/2012 06:00,31/12/2021 18:00,13312.0,True,True,15/08/2012 06:00,31/12/2021 18:00,3328.0,6.0,1095.0,1460.0,0.0,,2352.115968,,,recommended,2012-08-15 06:00:00,2021-12-31 18:00:00,13312.0,0.9297842645861532,0.9321211303329365,1.0015555344310545,1.017896616022672,0.8612058054656271,0.8425029075306649,190.2882708826598,260.3814722366353,0.9321211303329365,2.4637045172024257,0.15555344310542818,0.1555534431054398,12.014426044884486,0.1555534431054398,0.37255092877937135,0.9821033839773281
50,25900700,Koblenz,1004,DE,7.60477,50.358608,57.67,109806,Rhine,Rhine,Rhine,-,109850,4147500.0,3027500.0,109987.4,7.59167,50.34167,False,False,True,True,1,0,1,0,1,1,0,1,1,0,HIST_24h,-,3,,2,,1,1,03/01/1990,01/01/2001,3975.0,,,,True,False,03/01/1990 00:00,01/01/2001 00:00,3975.0,24.0,1095.0,1460.0,0.0,,995.60128,,,recommended,1991-01-03 00:00:00,2001-01-01 00:00:00,3614.0,0.8753963031765052,0.9320755737287394,1.0858032748973536,0.9404168514201316,0.8241671415125076,0.8012045071083103,245.25492958130255,325.4746190042948,0.9320755737287394,148.63756169468,8.58032748973536,8.580327489735353,14.157710812036798,8.580327489735353,0.4193242879770895,0.9404168514201316
51,26400220,St.Arnual,1004,DE,7.022796,49.214863,183.25,3945,Saar,Rhine,Rhine,-,3900,4102500.0,2902500.0,3899.6,7.025,49.20833,True,True,True,False,1,1,1,1,1,1,1,1,1,0,HIST_6h,Limited data period,1,,3,,1,1,02/08/1993,31/12/2021,9293.0,31/03/2008 00:00,31/12/2021 18:00,12232.0,True,True,31/03/2008 00:00,31/12/2021 18:00,3058.0,6.0,1095.0,1460.0,0.0,,2149.955072,,,recommended,2008-03-31 00:00:00,2021-12-31 18:00:00,12232.0,0.8804339056724632,0.8862914509881578,1.025433325679403,0.9731753333804811,0.7725565078280666,0.6276236518308944,11.118639660799776,20.350509982946736,0.8862914509881578,0.9480986126939183,2.5433325679403413,2.543332567940314,29.826431535592157,2.543332567940314,0.47691036073032966,0.9731753333804811
52,23300900,Kehl-Kronenhof,1004,DE,7.806693,48.563364,133,39330,Rhine,Rhine,Rhine,-,39525,4157500.0,2832500.0,42841.3,7.80833,48.55833,True,True,True,False,1,1,1,1,1,1,1,1,1,0,NRT_6h,Large Oscillations   change in low flow,0,wrond LDD but can be rep point,3,no_calib,0,0,01/01/1991,31/12/2021,10235.0,01/07/2013 00:00,31/12/2021 18:00,12238.0,True,True,,,,,,,,,,,,,,,,,,,,,,,,,,,,,,,
53,25800500,Diez Hafen,1004,DE,8.004968,50.371941,101.26,4907,Lahn,Rhine,Rhine,-,4900,4182500.0,3032500.0,4864.0,8.00833,50.39167,True,True,True,False,1,1,1,1,1,1,1,1,1,0,NRT_6h,close to 42,2,excluded by DP,3,DP,0,1,01/01/1991,31/12/2021,7828.0,01/07/2013 00:00,31/12/2021 18:00,11721.0,True,True,,,,,,,,,,,,exclude,,,,,,,,,,,,,,,,,,,
54,2770040,Wesel,1004,DE,6.606833,51.646106,11.2,154528,Rhine,Rhine,Rhine,-,154150,4087500.0,3172500.0,154180.9,6.59167,51.625,True,True,True,False,1,1,1,1,1,1,1,1,1,0,NRT_6h,Limited data period,1,excluded by DP,3,DP,0,1,01/01/1991,31/12/2021,10233.0,01/07/2013 00:00,31/12/2021 18:00,12238.0,True,True,,,,,,,,,,,,exclude,,,,,,,,,,,,,,,,,,,
55,25300200,Bingen,1004,DE,7.899702,49.970312,76.18,99090,Rhine,Rhine,Rhine,-,99225,4172500.0,2987500.0,99293.3,7.90833,49.975,False,False,False,False,1,0,1,0,1,1,0,1,0,0,-,No discharge data available for calibration period,-,,-,,0,0,,,,,,,False,False,,,,,,,,,,,,,,,,,,,,,,,,,,,,,,,
56,25100300,Oestrich,1004,DE,8.030081,50.002836,77.56,98600,Rhine,Rhine,Rhine,-,98675,4182500.0,2987500.0,98811.3,8.04167,50.00833,False,False,False,False,1,0,1,0,1,1,0,1,0,0,-,No discharge data available for calibration period,-,,-,,0,0,,,,,,,False,False,,,,,,,,,,,,,,,,,,,,,,,,,,,,,,,
57,27100400,Andernach,1004,DE,7.392084,50.443357,51.47,139549,Rhine,Rhine,Rhine,-,139600,4132500.0,3042500.0,139767.8,7.39167,50.44167,True,True,True,False,1,1,1,1,1,1,1,1,1,0,NRT_6h,Few outliers removed with qc close to 62,2,close to 62 excluded by DP,3,DP,0,1,01/01/1991,31/12/2021,10235.0,01/07/2013 00:00,31/12/2021 18:00,12238.0,True,True,,,,,,,,,,,,exclude,,,,,,,,,,,,,,,,,,,
58,2750010,Düsseldorf,1004,DE,6.769909,51.225463,24.48,147680.43,Rhine,Rhine,Rhine,C203,147750,4092500.0,3127500.0,147920.9,6.75833,51.225,True,True,True,True,1,1,1,1,1,1,1,1,1,0,NRT_6h,-,3,,3,,1,1,01/01/1991,31/12/2021,10237.0,01/07/2013 00:00,31/12/2021 18:00,12233.0,True,True,01/07/2013 00:00,31/12/2021 18:00,3058.25,6.0,1095.0,1460.0,0.0,,3468.195328,1.0,,recommended,2013-07-01 00:00:00,2021-12-31 18:00:00,12233.0,0.9280625211219429,0.9301808109775527,1.0172473561829463,0.998323570378076,0.8568077541764179,0.838634607929708,266.0698155253589,377.2371977649066,0.9301808109775527,33.689745966573426,1.7247356182946227,1.7247356182946245,13.621357912433714,1.7247356182946245,0.3784075129058399,0.998323570378076
59,24500100,Steinbach,1004,DE,9.60371,50.009961,146.33,17914.2,Main,Rhine,Rhine,-,17925,4297500.0,2992500.0,17932.0,9.60833,50.00833,True,True,True,True,1,1,1,1,1,1,1,1,1,0,NRT_6h,-,3,,3,,1,1,01/01/1991,31/12/2021,10241.0,01/07/2013 00:00,31/12/2021 18:00,12232.0,True,True,01/07/2013 00:00,31/12/2021 18:00,3058.0,6.0,1095.0,1460.0,0.0,,3086.222848,,,recommended,2013-07-01 00:00:00,2021-12-31 18:00:00,12232.0,0.7611925062415885,0.8546232988047522,1.1415624775269375,1.1259154429813782,0.4927438872820674,0.45722954674230154,33.844006474643415,50.294028961723136,0.8546232988047522,16.126468786642782,14.156247752693773,14.156247752693744,29.70917855219832,14.156247752693744,0.7122191465538777,0.8740845570186218
60,26400550,Fremersdorf,1004,DE,6.648444,49.408914,165.5,6983,Saar,Rhine,Rhine,C214,7025,4077500.0,2932500.0,6975.8,6.64167,49.40833,True,True,True,True,1,1,1,1,1,1,1,1,1,0,NRT_6h,-,3,,3,,1,1,01/01/1991,31/12/2021,10240.0,01/07/2013 00:00,31/12/2021 18:00,12237.0,True,True,01/07/2013 00:00,31/12/2021 18:00,3059.25,6.0,1095.0,1460.0,0.0,,3076.218624,,,recommended,2013-07-01 00:00:00,2021-12-31 18:00:00,12237.0,0.8485364013363386,0.8986802349349186,1.0959544960279495,0.9411080513200182,0.783410937262468,0.7013831420775094,19.6370539336693,35.20482096482959,0.8986802349349186,6.1443687009143035,9.595449602795037,9.595449602794949,30.6665127924131,9.595449602794949,0.46539130066808276,0.9411080513200182
61,23800620,Gundelsheim UP,1004,DE,9.153664,49.281374,136.63,12332,Neckar,Rhine,Rhine,-,12475,4257500.0,2907500.0,12329.2,9.15833,49.275,False,False,False,False,1,0,1,0,1,1,0,1,0,0,-,No discharge data available for calibration period,-,,-,,0,0,,,,,,,False,False,,,,,,,,,,,,,,,,,,,,,,,,,,,,,,,
62,2710080,Bonn,1004,DE,7.10807,50.736364,42.66,140901,Rhine,Rhine,Rhine,-,140775,4117500.0,3072500.0,141123.4,7.10833,50.74167,True,True,True,True,1,1,1,1,1,1,1,1,1,0,NRT_6h,-,3,,3,,1,1,03/01/1990,31/12/2021,10850.0,15/08/2012 06:00,31/12/2021 18:00,13128.0,True,True,15/08/2012 06:00,31/12/2021 18:00,3282.0,6.0,1095.0,1460.0,0.0,,2585.471744,,,recommended,2012-08-15 06:00:00,2021-12-31 18:00:00,13128.0,0.9300792770932328,0.9324392200008206,1.0162887249924333,0.9923106608978226,0.8626621406542615,0.8397561292226469,269.7938003033266,370.0449733540153,0.9324392200008206,31.567477000078373,1.6288724992433323,1.6288724992433388,13.921280493190643,1.6288724992433388,0.37059122945064155,0.9923106608978226
63,23700600,Speyer,1004,DE,8.44876,49.323786,88.51,53131,Rhine,Rhine,Rhine,C334,53250,4212500.0,2917500.0,53580.3,8.45833,49.325,True,True,True,True,1,1,1,1,1,1,1,1,1,0,NRT_6h,-,3,,3,,1,1,01/01/1991,31/12/2021,10240.0,01/07/2013 00:00,31/12/2021 18:00,12238.0,True,True,01/07/2013 00:00,31/12/2021 18:00,3059.5,6.0,1095.0,1460.0,0.0,,3040.817664,,,recommended,2013-07-01 00:00:00,2021-12-31 18:00:00,12238.0,0.9264279974065265,0.9304216963517526,1.0208828553173765,0.9883550190708669,0.8572001970676475,0.8380134125221508,144.6102933738883,192.29902260375346,0.9304216963517526,24.46118764803257,2.0882855317376436,2.0882855317376654,12.345581405869131,2.0882855317376654,0.3778886118055855,0.9883550190708669
64,23800760,Heidelberg UP,1004,DE,8.717778,49.414661,103.26,13783,Neckar,Rhine,Rhine,-,13900,4227500.0,2922500.0,13778.1,8.70833,49.40833,False,False,True,False,1,0,1,0,1,1,1,1,1,0,HIST_24h,Almost same location as 932  wrong hydrometric zero,0,Problems to rating curve  not consistent with nearby 932,0,,0,0,02/11/1999,31/12/2010,2112.0,,,,True,False,,,,,,,,,,,,,,,,,,,,,,,,,,,,,,,
65,23900600,Nierstein-Oppenheim,1004,DE,8.35244,49.864958,80.19,70387,Rhine,Rhine,Rhine,-,70500,4202500.0,2972500.0,70563.6,8.35833,49.85833,False,False,False,False,1,0,1,0,1,1,0,1,0,0,-,No discharge data available for calibration period,-,,-,,0,0,,,,,,,False,False,,,,,,,,,,,,,,,,,,,,,,,,,,,,,,,
66,23700700,Mannheim,1004,DE,8.45413,49.48476,85.16,54017,Rhine,Rhine,Rhine,-,54175,4207500.0,2927500.0,54262.8,8.45833,49.475,False,False,False,False,1,0,1,0,1,1,0,1,0,0,-,No discharge data available for calibration period,-,,-,,0,0,,,,,,,False,False,,,,,,,,,,,,,,,,,,,,,,,,,,,,,,,
67,23300320,Breisach,1004,DE,7.572627,48.043177,191.85,37575,Rhine,Rhine,Rhine,-,37575,4142500.0,2777500.0,37608.1,7.575,48.04167,False,False,True,True,1,0,1,0,1,1,1,1,1,0,HIST_24h,-,3,,2,,1,1,01/01/1991,01/01/2020,9611.0,01/07/2013 00:00,01/01/2020 00:00,9501.0,True,True,01/07/2013 00:00,01/01/2020 00:00,2375.25,6.0,1095.0,1460.0,0.0,,1750.870528,,,recommended,2013-07-01 00:00:00,2020-01-01 00:00:00,9501.0,0.7855337693832318,0.8824986049237242,0.9496509255462195,1.1722038238011614,0.7040495622403343,0.38619088889187436,160.82752582414196,204.12339812571523,0.8824986049237242,-55.06665362379213,-5.034907445378032,-5.03490744537805,14.704937632960565,5.03490744537805,0.5440132698378476,0.8277961761988386
68,23300130,Rheinweiler,1004,DE,7.529335,47.711025,217.24,36649,Rhine,Rhine,Rhine,-,36650,4137500.0,2737500.0,36937.9,7.525,47.70833,True,True,True,False,1,1,1,1,1,1,1,1,1,0,NRT_6h,Extremely low discharge possibly wrong location or wrong rating curve,0,this station is most likely on a regulated channel  not the main river  much lowr discharge compared to upstream station  excluded by DP,0,exclude,0,1,01/01/1991,31/12/2021,9618.0,01/01/2015 00:00,31/12/2021 18:00,10031.0,True,True,,,,,,,,,,,,exclude,,,,,,,,,,,,,,,,,,,
69,566100,Erlln,1007,DE,12.813374,51.155168,133.03,2983,Freiberger Mulde,Elbe,Elbe,-,5375,4517500.0,3117500.0,2995.6,12.80833,51.15833,False,False,True,False,0,0,0,0,0,1,1,1,1,0,HIST_24h,Moved on Elbe main stream  close to 82,2,excluded by DP,2,DP,0,1,01/01/1991,04/01/2013,7527.0,20/04/2009 18:00,04/01/2013 00:00,3678.0,True,False,,,,,,,,,,,,exclude,,,,,,,,,,,,,,,,,,,
71,567470,Kriebstein UP,1007,DE,13.02157,51.055167,182.84,1757,Zschopau,Elbe,Elbe,-,1800,4532500.0,3112500.0,1766.7,13.025,51.05833,True,True,True,True,1,1,1,1,1,1,1,1,1,0,NRT_6h,Dam,3,keeping this because downstream of reservoir,3,,1,1,01/01/1991,31/12/2021,9673.0,20/04/2009 18:00,31/12/2021 18:00,16584.0,True,True,20/04/2009 18:00,31/12/2021 18:00,4146.0,6.0,1095.0,1460.0,0.0,,199.721472,1.0,,,2009-04-20 18:00:00,2021-12-31 18:00:00,16584.0,0.8278290083430287,0.8327260389604586,0.9736915385740614,1.0311470252782953,0.663546594602671,0.625500874831306,7.337821562236957,12.324885107444914,0.8327260389604586,-0.49592259559766355,-2.630846142593862,-2.630846142593858,38.92679971314482,2.630846142593858,0.5800460373085272,0.9688529747217047
73,562070,Zwickau-Poelbitz,1007,DE,12.493595,50.740921,255.21,1030,Zwickauer Mulde,Elbe,Elbe,-,1025,4497500.0,3072500.0,1034.0,12.49167,50.74167,True,True,True,True,1,1,1,1,1,1,1,1,1,0,NRT_6h,-,3,,3,,1,1,01/01/1991,31/12/2021,9677.0,20/04/2009 18:00,31/12/2021 18:00,16543.0,True,True,20/04/2009 18:00,31/12/2021 18:00,4135.75,6.0,1095.0,1460.0,1.0,0.0,1033.99072,1.0,,,2009-04-20 18:00:00,2021-12-31 18:00:00,16543.0,0.7798274847135034,0.8239743565049351,0.9323688134402526,1.1136526811133445,0.6288151783352138,0.3861660430080416,5.18155677960184,8.157380205520614,0.8239743565049351,-0.8644159839654201,-6.763118655974721,-6.76311865597474,40.540068639590956,6.76311865597474,0.609249392010188,0.8863473188866555
74,562090,Wolkenburg,1007,DE,12.671394,50.901464,207.78,1416.38,Zwickauer Mulde,Elbe,Elbe,-,1400,4507500.0,3087500.0,1445.7,12.675,50.90833,True,True,True,False,1,1,1,1,1,1,1,1,1,0,NRT_6h,Outliers  zeros  negative values removed with qc close to 73,2,close to 73,3,,1,1,02/07/1993,31/12/2021,6943.0,20/04/2009 18:00,31/12/2021 18:00,16300.0,True,True,20/04/2009 18:00,31/12/2021 18:00,4075.0,6.0,1095.0,1460.0,0.0,,411.711136,,,,2009-04-20 18:00:00,2021-12-31 18:00:00,16300.0,0.6583964466720238,0.8155138005724966,0.9346926396414699,1.2799871042567783,0.5149916423881704,0.30200685588741216,5.995690041698549,9.689070280299987,0.8155138005724966,-0.9838649624812963,-6.530736035852978,-6.530736035853015,39.79841798245791,6.530736035853015,0.6964254142489582,0.7200128957432217
75,562115,Wechselburg 1,1007,DE,12.772535,51.006848,159.72,2107,Zwickauer Mulde,Elbe,Elbe,-,2125,4517500.0,3102500.0,2094.7,12.775,51.00833,True,True,True,False,1,1,1,1,1,1,1,1,1,0,NRT_6h,close to 80,2,close to 80,3,,1,1,01/01/1991,31/12/2021,9680.0,20/04/2009 18:00,31/12/2021 18:00,16576.0,True,True,20/04/2009 18:00,31/12/2021 18:00,4144.0,6.0,1095.0,1460.0,0.0,,648.96864,,,,2009-04-20 18:00:00,2021-12-31 18:00:00,16576.0,0.6517142666395739,0.8534481914529036,0.8792330052803997,1.2919603611115404,0.634055921048337,0.16173272825134588,8.921485980667882,13.902939797624871,0.8534481914529036,-2.7693377486539386,-12.076699471960058,-12.076699471960026,38.905368290379094,12.076699471960026,0.6049331194038425,0.7080396388884596
76,501110,Riesa,1007,DE,13.293276,51.31149,88.03,54485,Elbe,Elbe,Elbe,-,54450,4552500.0,3137500.0,54448.5,13.29167,51.30833,True,True,True,False,1,1,1,1,1,1,1,1,1,0,NRT_6h,Few outliers on 2013 flood  zeros  close to 78,2,close to 78,3,,1,1,02/11/2004,31/12/2021,5729.0,20/04/2009 18:00,31/12/2021 18:00,16667.0,True,True,20/04/2009 18:00,31/12/2021 18:00,4166.75,6.0,1095.0,1460.0,0.0,,1381.719936,1.0,,,2009-04-20 18:00:00,2021-12-31 18:00:00,16667.0,0.6817352017226055,0.7380597158737704,1.1636567268925868,1.0767870113836056,0.23029336680107593,0.23872312021778486,115.74552185798412,180.04149764824322,0.7380597158737704,45.54881977967258,16.36567268925866,16.365672689258677,41.58731960867513,16.365672689258677,0.8773292615654229,0.9232129886163944
77,501160,Muehlberg,1004,DE,13.190925,51.437427,81.68,55030,Elbe,Elbe,Elbe,-,55075,4542500.0,3152500.0,54954.8,13.19167,51.44167,False,False,True,False,1,0,1,0,1,1,0,1,1,0,HIST_24h,Extremely low discharge conpared to catchment size  Possibly wrong location or wrong data,0,Extremely low discharge conpared to catchment size  Possibly wrong location or wrong data,0,DP,0,1,03/01/1990,01/01/2011,7583.0,,,,True,False,,,,,,,,,,,,exclude,,,,,,,,,,,,,,,,,,,
78,501261,Torgau,1007,DE,13.01012,51.553713,75.18,55211,Elbe,Elbe,Elbe,C163,55150,4532500.0,3157500.0,55482.8,13.00833,51.55833,True,True,True,True,1,1,1,1,1,1,1,1,1,0,NRT_6h,-,3,,3,,1,1,01/01/1991,31/12/2021,10726.0,20/04/2009 18:00,31/12/2021 18:00,16658.0,True,True,20/04/2009 18:00,31/12/2021 18:00,4164.5,6.0,1095.0,1460.0,0.0,,827.20928,,,recommended,2009-04-20 18:00:00,2021-12-31 18:00:00,16658.0,0.7150121597000829,0.7620303306527656,1.1544396915069546,1.0271456677356754,0.3648299802783851,0.22762272542615858,115.936172977802,183.77843327665676,0.7620303306527656,43.93323853541441,15.443969150695368,15.44396915069547,40.755353773329,15.44396915069547,0.7969755452469147,0.9728543322643246
79,567451,Lichtenwalde 1,1007,DE,13.020015,50.886191,251.91,1575,Zschopau,Elbe,Elbe,-,1600,4532500.0,3092500.0,1567.0,13.025,50.89167,True,True,True,True,1,1,1,1,1,1,1,1,1,0,NRT_6h,-,3,,3,,1,1,01/01/1991,31/12/2021,9678.0,20/04/2009 18:00,31/12/2021 18:00,16560.0,True,True,20/04/2009 18:00,31/12/2021 18:00,4140.0,6.0,1095.0,1460.0,1.0,0.0,1566.955392,1.0,,,2009-04-20 18:00:00,2021-12-31 18:00:00,16560.0,0.8144308501199606,0.8317883667029173,0.9583507640678801,1.0663784374401728,0.654249932424389,0.6323448206448224,7.104739547773103,12.016200331676233,0.8317883667029173,-0.7794914060822559,-4.164923593211972,-4.164923593211985,37.96154407252531,4.164923593211985,0.5880051594804349,0.9336215625598272
80,562135,Colditz,1007,DE,12.806467,51.121355,139.17,2326,Zwickauer Mulde,Elbe,Elbe,-,2325,4517500.0,3112500.0,2324.3,12.80833,51.125,True,True,True,True,1,1,1,1,1,1,1,1,1,0,NRT_6h,-,3,,3,,1,1,02/11/2007,31/12/2021,3526.0,20/04/2009 18:00,31/12/2021 18:00,16415.0,True,True,20/04/2009 18:00,31/12/2021 18:00,4103.75,6.0,1095.0,1460.0,0.0,,229.662544,,,,2009-04-20 18:00:00,2021-12-31 18:00:00,16415.0,0.6676191403084148,0.8435936852863918,0.9088181676416074,1.2787471507563637,0.602094207756654,0.2422107384412634,9.219025099966526,14.989554676289561,0.8435936852863918,-2.13586123304435,-9.118183235839115,-9.11818323583926,39.356845293492356,9.11818323583926,0.6307977427379943,0.7212528492436363
81,576631,Kleindalzig,1007,DE,12.291583,51.210414,119.55,2891,White Elster,Elbe,Elbe,-,2975,4482500.0,3122500.0,2929.7,12.29167,51.20833,True,True,True,True,1,1,1,1,1,1,1,1,1,0,NRT_6h, zeros removed with qc,3,,3,,1,1,01/01/1991,31/12/2021,10594.0,20/04/2009 18:00,31/12/2021 18:00,16263.0,True,True,20/04/2009 18:00,31/12/2021 18:00,4065.75,6.0,1095.0,1460.0,0.0,,2595.843072,1.0,,,2009-04-20 18:00:00,2021-12-31 18:00:00,16263.0,0.8781002184887814,0.8811066922929363,0.9987551720695581,0.9731227137087858,0.768102241635441,0.5292898195750027,5.022719685334695,8.45053692311124,0.8811066922929363,-0.019829699910482914,-0.12448279304418286,-0.12448279304418772,31.530591886460655,0.12448279304418772,0.48155763763495635,0.9731227137087858
82,560021,Golzern 1,1007,DE,12.777398,51.253004,117.7,5442,United Mulde,Elbe,Elbe,C165,5500,4512500.0,3127500.0,5436.6,12.775,51.25833,True,True,True,True,1,1,1,1,1,1,1,1,1,0,NRT_6h,-,3,,3,,1,1,01/01/1991,31/12/2021,9679.0,20/04/2009 18:00,31/12/2021 18:00,16528.0,True,True,20/04/2009 18:00,31/12/2021 18:00,4132.0,6.0,1095.0,1460.0,0.0,,756.023424,,,,2009-04-20 18:00:00,2021-12-31 18:00:00,16528.0,0.8678647789984318,0.8792261153680104,0.9549135406448724,1.028993044042504,0.7607299110526292,0.6637682045976685,17.781772925810678,28.758600616471465,0.8792261153680104,-2.368271701301568,-4.508645935512809,-4.508645935512758,33.85241574440417,4.508645935512758,0.48915241893234807,0.9710069559574961
83,560051,Bad Dueben 1,1007,DE,12.580715,51.590779,81.5,6171,United Mulde,Elbe,Elbe,C353,6050,4502500.0,3162500.0,6178.3,12.575,51.59167,True,True,True,True,1,1,1,1,1,1,1,1,1,0,NRT_6h,-,3,,3,,1,1,01/01/1991,31/12/2021,9737.0,20/04/2009 18:00,31/12/2021 18:00,16581.0,True,True,20/04/2009 18:00,31/12/2021 18:00,4145.25,6.0,1095.0,1460.0,0.0,,741.72032,,,,2009-04-20 18:00:00,2021-12-31 18:00:00,16581.0,0.8632083783349056,0.8703220049374063,0.9884670767677519,1.0419828183431188,0.7318592132852242,0.6508883053904163,18.293047195312734,29.514255736500587,0.8703220049374063,-0.6113985649306967,-1.1532923232248438,-1.153292323224813,34.506510333623865,1.153292323224813,0.5178231230012577,0.9580171816568812
84,576900,Oberthau,1007,DE,12.147231,51.384405,87.27,4939,White Elster,Elbe,Elbe,-,4950,4477500.0,3142500.0,4995.5,12.15833,51.375,False,False,True,True,0,0,0,0,0,1,1,1,1,0,NRT_6h,-,3,excluded by DP,2,DP,0,1,01/01/1991,14/11/2015,8606.0,14/06/2009 06:00,13/11/2015 06:00,5397.0,True,False,,,,,,,,,,,,exclude,,,,,,,,,,,,,,,,,,,
85,577571,Boehlen 1,1007,DE,12.387218,51.211917,120.9,1359,Pleisse,Elbe,Elbe,-,1400,4487500.0,3132500.0,1261.7,12.39167,51.20833,True,True,True,True,1,1,1,1,1,1,1,1,1,0,NRT_6h,-,3,,3,,1,1,01/01/1991,31/12/2021,9681.0,20/04/2009 18:00,31/12/2021 18:00,16648.0,True,True,20/04/2009 18:00,31/12/2021 18:00,4162.0,6.0,1095.0,1460.0,1.0,0.0,1261.735808,,,,2009-04-20 18:00:00,2021-12-31 18:00:00,16648.0,0.7647675795949369,0.7790440564274448,1.074938300503181,0.9700498125668456,0.5306918293027442,0.45488065248352416,2.1976274218865126,3.7998019391193645,0.7790440564274448,0.453346513987298,7.493830050318215,7.493830050318104,36.326840298584315,7.493830050318104,0.6850607058482167,0.9700498125668456
86,553020,Neuwiese,1007,DE,14.197033,51.476458,109.72,669,Blacl Elster,Elbe,Elbe,-,675,4617500.0,3157500.0,696.4,14.19167,51.475,True,True,True,True,1,1,1,1,1,1,1,0,1,0,NRT_6h,-,3,,3,,1,1,01/01/1991,31/12/2021,9280.0,20/04/2009 18:00,31/12/2021 18:00,16548.0,True,True,20/04/2009 18:00,31/12/2021 18:00,4137.0,6.0,1095.0,1460.0,1.0,1.0,696.430784,,,,2009-04-20 18:00:00,2021-12-31 18:00:00,16548.0,0.7133245348205255,0.7669747451893084,1.1364247161350391,0.903717344325396,0.5058398808466887,0.4344068354216841,1.3730162046381265,2.45340348075925,0.7669747451893084,0.42449661664642446,13.642471613503934,13.642471613503924,44.12599267489191,13.642471613503924,0.7029652332465051,0.903717344325396
87,501010,Schoena,1007,DE,14.235233,50.875791,116.21,51391,Elbe,Elbe,Elbe,-,51400,4617500.0,3092500.0,51357.5,14.24167,50.875,True,True,True,True,1,1,1,1,1,1,1,1,1,0,NRT_6h,-,3,,3,,1,1,01/01/1991,31/12/2021,10723.0,20/04/2009 18:00,31/12/2021 18:00,16679.0,True,True,20/04/2009 18:00,31/12/2021 18:00,4169.75,6.0,1095.0,1460.0,0.0,,265.59408,,,,2009-04-20 18:00:00,2021-12-31 18:00:00,16679.0,0.6688256872374988,0.7545045021532245,1.220768886377202,1.0258744039245142,0.2496568936927227,0.2088355575249975,114.80753943161017,183.69376153678084,0.7545045021532245,56.80927305354113,22.076888637720128,22.076888637720188,44.61583693235338,22.076888637720188,0.8662234736528877,0.9741255960754858
88,501040,Pirna,1007,DE,13.933004,50.9645,108.06,52080,Elbe,Elbe,Elbe,-,52000,4607500.0,3102500.0,52059.1,13.94167,50.95833,False,False,True,False,1,0,1,0,1,1,1,1,0,0,-,No discharge data available for calibration period,-,,-,,0,0,,,,,,,False,False,,,,,,,,,,,,,,,,,,,,,,,,,,,,,,,
89,501060,Dresden,1007,DE,13.738831,51.054481,102.73,53096,Elbe,Elbe,Elbe,C155,53125,4582500.0,3112500.0,53066.8,13.74167,51.05833,True,True,True,True,1,1,1,1,1,1,1,1,1,0,NRT_6h,-,3,,3,,1,1,01/01/1991,31/12/2021,10728.0,20/04/2009 18:00,31/12/2021 18:00,16687.0,True,True,20/04/2009 18:00,31/12/2021 18:00,4171.75,6.0,1095.0,1460.0,0.0,,1216.057728,,,,2009-04-20 18:00:00,2021-12-31 18:00:00,16687.0,0.6997078882538157,0.7637712868495145,1.1853669926200963,0.9967711445944969,0.36166494336386934,0.24986875539798048,116.26011511198904,184.98361693960703,0.7637712868495145,50.27540415992513,18.53669926200969,18.536699262009616,42.865469229094614,18.536699262009616,0.7989587327491511,0.9967711445944969
90,501080,Meissen,1007,DE,13.474611,51.164463,94.84,53885,Elbe,Elbe,Elbe,-,53950,4562500.0,3122500.0,53863.2,13.475,51.15833,False,False,True,False,1,0,1,0,1,1,1,1,0,0,-,No discharge data available for calibration period,-,,-,,0,0,,,,,,,False,False,,,,,,,,,,,,,,,,,,,,,,,,,,,,,,,
91,660193,Podrosche 3,1007,DE,14.946656,51.47187,120.6,2173,Lusatian Neisse,Oder,Oder,-,2100,4657500.0,3167500.0,2069.4,14.94167,51.475,True,True,True,False,1,1,1,1,1,1,1,0,1,0,NRT_6h,close to 150,2,close to 150,3,,1,1,01/01/1991,31/12/2021,9010.0,13/03/2013 18:00,31/12/2021 18:00,12579.0,True,True,13/03/2013 18:00,31/12/2021 18:00,3144.75,6.0,1095.0,1460.0,0.0,,435.598432,,,,2013-03-13 18:00:00,2021-12-31 18:00:00,12579.0,0.7940007567982242,0.8297028120728623,0.921450329547496,1.0852320670617375,0.6505498997852059,0.5493127791366914,4.719230446440759,7.563276148853466,0.8297028120728623,-1.2042987507658587,-7.854967045250399,-7.854967045250401,30.780900181255582,7.854967045250401,0.5911430454761322,0.9147679329382625
92,582080,Sprey,1007,DE,14.522407,51.430489,114.11,1596,Spree,Elbe,Elbe,-,1650,4637500.0,3152500.0,1589.5,14.525,51.425,True,True,True,False,1,1,1,1,1,1,1,1,1,0,NRT_6h,close to 93,2,close to 93,3,close,0,1,01/01/1991,31/12/2021,9682.0,20/04/2009 18:00,31/12/2021 18:00,15547.0,True,True,,,,,,,,,,,,,,,,,,,,,,,,,,,,,,,
93,582820,Spreewitz,1007,DE,14.404286,51.510861,99.03,2033,Spree,Elbe,Elbe,-,2100,4632500.0,3162500.0,2099.0,14.40833,51.50833,True,True,True,True,1,1,1,1,1,1,1,1,1,0,NRT_6h,-,3,,3,,1,1,01/01/1991,31/12/2021,9682.0,20/04/2009 18:00,31/12/2021 18:00,16645.0,True,True,20/04/2009 18:00,31/12/2021 18:00,4161.25,6.0,1095.0,1460.0,0.0,,658.037376,,,,2009-04-20 18:00:00,2021-12-31 18:00:00,16645.0,0.7704392924235985,0.7756889978966518,1.0479778522995022,0.9910100897058426,0.5296388691007143,0.2683013534554227,4.008597912233346,6.643179072884389,0.7756889978966518,0.5265637393047723,4.797785229949998,4.797785229950223,36.524337740221725,4.797785229950223,0.6858287912440613,0.9910100897058426
94,660160,Goerlitz,1007,DE,14.993189,51.161195,175.63,1621,Lusatian Neisse,Oder,Oder,-,1600,4672500.0,3127500.0,1633.8,14.99167,51.15833,True,True,True,True,1,1,1,1,1,1,1,0,1,0,NRT_6h,-,3,,3,,1,1,01/01/1991,31/12/2021,9317.0,20/04/2009 18:00,31/12/2021 18:00,16601.0,True,True,20/04/2009 18:00,31/12/2021 18:00,4150.25,6.0,1095.0,1460.0,0.0,,920.006912,,,,2009-04-20 18:00:00,2021-12-31 18:00:00,16601.0,0.7917428147940371,0.8485526551183388,0.9477693359982485,1.1330665797867445,0.6669613731380497,0.5067192270277477,5.483800955804722,9.184146675193313,0.8485526551183388,-0.7640967946366998,-5.223066400175169,-5.223066400175148,37.48511539186674,5.223066400175148,0.5770949894618235,0.8669334202132555
95,1060,Gornja Radgona,1005,SI,15.9956,46.6811,202.34,10197.2,Mur,Danube,Danube,-,10200,4772500.0,2642500.0,10337.7,15.99167,46.675,True,True,True,True,1,1,1,1,1,1,1,1,1,0,HIST_6h,-,3,,3,,1,1,01/01/1991,31/12/2021,10800.0,05/01/1992 00:00,31/12/2021 18:00,24443.0,True,True,05/01/1992 00:00,31/12/2021 18:00,6110.75,6.0,1095.0,1460.0,0.0,,561.003072,,,recommended,1992-01-05 00:00:00,2021-12-31 18:00:00,24443.0,0.8094222645192517,0.8514441304075698,1.0768913951272794,1.091316702886096,0.602137080755516,0.6712995630979304,35.556600946442046,56.50285010040067,0.8514441304075698,12.012541701525743,7.689139512727967,7.689139512727946,22.75951851562479,7.689139512727946,0.6307637586644339,0.908683297113904
96,2110,Ptuj,1005,SI,15.8675,46.4169,214.62,13664.1,Drava,Danube,Danube,-,13750,4767500.0,2612500.0,13676.5,15.875,46.40833,True,True,True,True,1,1,1,1,1,1,1,1,1,0,HIST_6h,Dams  strongly regulated,3,,3,,1,1,02/01/2008,31/12/2021,4526.0,01/01/2008 06:00,31/12/2021 18:00,16554.0,True,True,01/01/2008 06:00,31/12/2021 18:00,4138.5,6.0,1095.0,1460.0,0.0,,1046.3392,1.0,,recommended,2008-01-01 06:00:00,2021-12-31 18:00:00,16554.0,0.7268870215305171,0.7377464337462697,1.0223438612914204,1.0729007397648493,0.41391611127031613,0.3542149201189374,106.284431737017,138.51738011540277,0.7377464337462697,6.724995536761558,2.2343861291420914,2.2343861291420377,35.313102992972084,2.2343861291420377,0.7655611593659145,0.9270992602351507
97,2150,Borl,1005,SI,15.9962,46.371,201.49,14661.5,Drava,Danube,Danube,-,14775,4777500.0,2602500.0,14650.7,15.99167,46.375,True,True,True,False,1,1,1,1,1,1,1,1,1,0,HIST_6h,Discharge is too small compared to catchment area wrong location,0,Discharge is too small compared to catchment area wrong location  not consistent with upstream 96,0,no_calib,0,1,01/01/1991,31/12/2021,10280.0,02/01/1994 00:00,31/12/2021 18:00,19056.0,True,True,,,,,,,,,,,,exclude,,,,,,,,,,,,,,,,,,,
98,3420,Radovljica,1005,SI,14.1654,46.34,408.09,907.97,Sava,Danube,Danube,C371,900,4642500.0,2587500.0,890.9,14.15833,46.34167,True,True,True,True,1,1,1,1,1,1,1,1,1,0,HIST_6h,Use after 01-2014 oscillations in low flow,3,,3,,1,1,01/01/1991,31/12/2021,10044.0,05/01/1994 00:00,31/12/2021 18:00,12387.0,True,True,05/01/1994 00:00,31/12/2021 18:00,3096.75,6.0,1095.0,1460.0,1.0,0.0,890.86208,1.0,,recommended,1994-01-05 00:00:00,2021-12-31 18:00:00,12387.0,0.8330831526440485,0.8407245505784315,1.0232883109118849,0.9558387079256191,0.6873769157911396,0.41396903140082475,17.113701154894052,26.925022589271865,0.8407245505784315,1.148920133913366,2.3288310911884937,2.3288310911884884,34.689025075289315,2.3288310911884884,0.559127073400007,0.9558387079256191
99,3530,Medno,1005,SI,14.4405,46.1225,300.27,2201.45,Sava,Danube,Danube,-,2125,4667500.0,2567500.0,2181.8,14.44167,46.125,True,True,True,True,1,1,1,1,1,1,1,1,1,0,HIST_6h,Dam,3,,3,,1,1,01/01/1991,31/12/2021,10577.0,01/01/1998 00:00,31/12/2021 18:00,32093.0,True,True,01/01/1998 00:00,31/12/2021 18:00,8023.25,6.0,1095.0,1460.0,0.0,,699.297344,1.0,,recommended,1998-01-01 00:00:00,2021-12-31 18:00:00,32093.0,0.8730136914024441,0.8764406046669718,1.0290363368506699,1.0039356750964203,0.7428023782163657,0.5747495932585637,25.8125614388531,43.81951253147281,0.8764406046669718,2.4558891516735923,2.903633685066891,2.903633685066987,30.51856914659103,2.903633685066987,0.5071465486263629,0.9960643249035797
100,3570,Å Entjakob,1005,SI,14.5824,46.084,268.19,2284.8,Sava,Danube,Danube,-,2150,4672500.0,2562500.0,2286.8,14.575,46.09167,True,True,True,False,1,1,1,1,1,1,1,1,1,0,HIST_6h,oscillation in low flow almost same location as 99 and almost same data   use 99,1,close,3,close,0,0,01/01/1991,31/12/2021,10801.0,01/01/1998 00:00,31/12/2021 18:00,32308.0,True,True,,,,,,,,,,,,,,,,,,,,,,,,,,,,,,,
101,3725,Hrastnik,1005,SI,15.0906,46.122,193.85,5176.79,Sava,Danube,Danube,C370,5200,4717500.0,2567500.0,4530.6,15.075,46.125,True,True,True,True,1,1,1,1,1,1,1,1,1,0,HIST_6h,-,3,,3,,1,1,02/03/1993,31/12/2021,10037.0,01/01/1994 00:00,31/12/2021 18:00,33502.0,True,True,01/01/1994 00:00,31/12/2021 18:00,8375.5,6.0,1095.0,1460.0,0.0,,348.568544,,,recommended,1994-01-01 00:00:00,2021-12-31 18:00:00,33502.0,0.9261880164373494,0.926692196424008,1.0011717564383293,0.991467600620809,0.8544090036517185,0.7679836359645615,35.202881063848736,56.15596897623759,0.926692196424008,0.1926693679115774,0.11717564383292353,0.11717564383293844,21.40932052739858,0.11717564383293844,0.3815638823949171,0.991467600620809
102,3900,Jesenice na Dolenjskem,1005,SI,15.6925,45.8605,129.43,10881.64,Sava,Danube,Danube,-,10675,4767500.0,2542500.0,9910.4,15.69167,45.85833,True,True,True,True,1,1,1,1,1,1,1,1,1,0,HIST_6h,-,3,,3,,1,1,02/01/1991,31/12/2021,10795.0,01/01/2004 00:00,31/12/2021 18:00,24614.0,True,True,01/01/2004 00:00,31/12/2021 18:00,6153.5,6.0,1095.0,1460.0,0.0,,1030.071296,1.0,,recommended,2004-01-01 00:00:00,2021-12-31 18:00:00,24614.0,0.8958157655444517,0.8982546474715598,0.9891647779017512,0.9803827649748058,0.8016112476502264,0.7624034357737772,64.52181435878826,113.32689146514637,0.8982546474715598,-2.9795283773554426,-1.0835222098248853,-1.0835222098248851,23.46371976426559,1.0835222098248851,0.44540852298734984,0.9803827649748058
103,5078,Moste,1005,SI,14.5444,46.0554,281.29,1762.32,Ljubljanica,Danube,Danube,C374,1825,4667500.0,2557500.0,1117.9,14.54167,46.05833,True,True,True,True,1,1,1,1,1,1,1,1,1,0,HIST_6h,-,3,,3,,1,1,01/01/1991,31/12/2021,10812.0,01/01/1994 00:00,31/12/2021 18:00,33953.0,True,True,01/01/1994 00:00,31/12/2021 18:00,8488.25,6.0,1095.0,1460.0,0.0,,962.567552,,,recommended,1994-01-01 00:00:00,2021-12-31 18:00:00,33953.0,0.932836717950369,0.9335766101708818,1.0099006201882186,1.0009041344899505,0.8655020564228292,0.8320221496807308,11.582380332953441,18.485432333572646,0.9335766101708818,0.49811978240326155,0.9900620188218534,0.9900620188218591,23.021119137008935,0.9900620188218591,0.3667396127733841,0.9990958655100495
104,6120,Medlog,1005,SI,15.2204,46.2332,238.16,1037.1,Savinja,Danube,Danube,-,1000,4722500.0,2582500.0,1153.2,15.225,46.24167,False,False,True,True,1,0,1,0,1,1,1,1,1,0,HIST_6h,-,3,Discontinued using 4248 which has RT data,2,close,0,1,01/01/2003,01/01/2020,4734.0,01/01/2003 00:00,01/01/2020 00:00,18581.0,True,True,,,,,,,,,,,,exclude,,,,,,,,,,,,,,,,,,,
105,6200,Laško,1005,SI,15.2336,46.154,215.03,1663.6,Savinja,Danube,Danube,-,1675,4727500.0,2572500.0,1676.9,15.24167,46.15833,True,True,True,True,1,1,1,1,1,1,1,1,1,0,HIST_6h,-,3,use 106 and 104,3,close,0,1,01/01/1991,31/12/2021,10774.0,01/01/1998 00:00,31/12/2021 18:00,32792.0,True,True,,,,,,,,,,,,recommended,,,,,,,,,,,,,,,,,,,
106,6210,Veliko Širje,1005,SI,15.1924,46.0919,189.96,1841.9,Savinja,Danube,Danube,C373,1700,4722500.0,2572500.0,1867.8,15.19167,46.09167,True,True,True,False,1,1,1,1,1,1,1,1,1,0,HIST_6h,almost same location as 105 and almost same data   use 105,2,close to 105,3,close,0,1,01/01/1991,31/12/2021,10344.0,02/01/1994 00:00,31/12/2021 18:00,31260.0,True,True,,,,,,,,,,,,recommended,,,,,,,,,,,,,,,,,,,
107,7160,Podbočje,1005,SI,15.4555,45.8644,146.32,2238.12,Krka,Danube,Danube,C372,1875,4747500.0,2547500.0,1838.8,15.45833,45.875,True,True,True,True,1,1,1,1,1,1,1,1,1,0,HIST_6h,use after 02-1998,3,,3,,1,1,01/01/1991,31/12/2021,10657.0,02/01/1994 00:00,31/12/2021 18:00,33398.0,True,True,02/01/1994 00:00,31/12/2021 18:00,8349.5,6.0,1095.0,1460.0,0.0,,424.243808,,,recommended,1994-01-02 00:00:00,2021-12-31 18:00:00,33398.0,0.8541464309691289,0.9142932065975978,0.8832982989795402,0.982440895733203,0.8225091920957222,0.717185279103879,14.523693278309604,22.990905945662302,0.9142932065975978,-5.790828978828899,-11.670170102045944,-11.670170102045988,29.269379511548422,11.670170102045988,0.4212965795069805,0.982440895733203
108,8180,Solkan,1005,SI,13.65517,45.98162,51.84,1572.8,Soca,Soca/Isonzo,Isonzo,C377,1550,4602500.0,2542500.0,1490.0,13.65833,45.975,True,True,True,True,1,1,1,1,1,1,1,1,1,0,HIST_6h,-,3,,3,,1,1,01/01/1991,31/12/2021,11147.0,01/01/2003 00:00,31/12/2021 18:00,26182.0,True,True,01/01/2003 00:00,31/12/2021 18:00,6545.5,6.0,1095.0,1460.0,0.0,,791.485184,,,recommended,2003-01-01 00:00:00,2021-12-31 18:00:00,26182.0,0.8661287902146583,0.8705804863176478,0.9697279062346866,1.0159903291610435,0.7441745504360031,0.2687488378665678,37.69189666962521,60.60839509051698,0.8705804863176478,-2.9115283156198397,-3.0272093765313275,-3.0272093765313315,39.189473928660064,3.0272093765313315,0.5057919034187839,0.9840096708389565
109,26200505,Bollendorf,1010,DE,6.359171,49.850921,170,3222,Sauer,Rhine,Rhine,-,3250,4062500.0,2972500.0,3259.8,6.35833,49.85833,True,True,True,True,1,1,1,1,1,1,1,1,1,0,HIST_6h,-,3,,3,,1,1,01/01/1991,31/12/2021,10836.0,01/01/1991 00:00,31/12/2021 18:00,43632.0,True,True,01/01/1991 00:00,31/12/2021 18:00,10908.0,6.0,1095.0,1460.0,0.0,,739.1184,,,,1991-01-02 06:00:00,2021-12-31 18:00:00,43627.0,0.8804330467887541,0.8860206493092151,0.9653657334382886,1.0102679840309412,0.7764642648228146,0.45865347603948214,13.365190406965356,25.740337238451797,0.8860206493092151,-1.3351653407256596,-3.4634266561711335,-3.4634266561711398,34.669381617656704,3.4634266561711398,0.472795659008398,0.9897320159690588
110,25400600,Boos,1010,DE,7.720027,49.780141,128.06,2832,Nahe,Rhine,Rhine,-,2850,4157500.0,2967500.0,2829.2,7.725,49.775,True,True,True,False,1,1,1,1,1,1,1,1,1,0,HIST_6h,Close to 112,2,close to 112,3,,1,1,01/01/1991,31/12/2021,10829.0,01/01/1991 00:00,31/12/2021 18:00,43622.0,True,True,01/01/1991 00:00,31/12/2021 18:00,10905.5,6.0,1095.0,1460.0,0.0,,264.938528,,,,1991-01-02 06:00:00,2021-12-31 18:00:00,43617.0,0.8925307148871413,0.9045821177165102,1.0029779017365525,1.04935794854378,0.7963895122522926,0.7051583435732736,7.8892645425765435,15.31436020421412,0.9045821177165102,0.07337212035961553,0.2977901736552781,0.29779017365526295,32.01959336368492,0.29779017365526295,0.4512321882885911,0.9506420514562199
111,25400826,Dietersheim,1010,DE,7.903167,49.940455,80.72,4037,Nahe,Rhine,Rhine,-,4025,4172500.0,2982500.0,4068.5,7.90833,49.94167,True,True,True,False,1,1,1,1,1,1,1,1,1,0,HIST_6h,Same as 112  use 112,2,close to 112  This station replaces Grolsheim,3,,1,1,15/10/2002,31/12/2021,6531.0,15/10/2002 00:00,31/12/2021 18:00,26417.0,True,True,15/10/2002 00:00,31/12/2021 18:00,6604.25,6.0,1095.0,1460.0,0.0,,1239.29536,,,recommended,2002-10-15 00:00:00,2021-12-31 18:00:00,26417.0,0.8520345218896809,0.8860573608137602,0.948406820064572,1.079050626005366,0.7646957148276292,0.6970736571699387,8.672807637675422,17.56400523482459,0.8860573608137602,-1.4230876572034012,-5.159317993542817,-5.1593179935428015,31.44273810056616,5.1593179935428015,0.48508173040465,0.920949373994634
112,25400804,Grolsheim,1010,DE,7.911185,49.911398,84.63,4013,Nahe,Rhine,Rhine,C332,4000,4172500.0,2977500.0,4024.1,7.90833,49.90833,False,False,True,True,0,0,0,0,0,1,1,1,1,0,HIST_6h,-,3,close to 111  discontinued  excluded by DP,2,close,0,1,01/01/1991,13/10/2017,9750.0,01/01/1991 00:00,12/10/2017 12:00,39029.0,True,True,,,,,,,,,,,,exclude,,,,,,,,,,,,,,,,,,,
113,25400407,Martinstein,1010,DE,7.536,49.803795,164.1,1468,Nahe,Rhine,Rhine,-,1525,4142500.0,2967500.0,1463.6,7.54167,49.80833,True,True,True,True,1,1,1,1,1,1,1,1,1,0,HIST_6h,-,3,,3,,1,1,01/01/1991,31/12/2021,10825.0,01/01/1991 00:00,31/12/2021 18:00,43615.0,True,True,01/01/1991 00:00,31/12/2021 18:00,10903.75,6.0,1095.0,1460.0,1.0,0.0,1463.570432,,,,1991-01-02 06:00:00,2021-12-31 18:00:00,43610.0,0.8418431814109696,0.8562039844058559,0.9413608465297543,1.0299622236448682,0.7186786742004918,0.48432368485019395,6.098965520976407,11.992754875209384,0.8562039844058559,-0.8918030902879641,-5.863915347024486,-5.863915347024576,40.10281855816258,5.863915347024576,0.53039732823564,0.9700377763551318
114,25460409,Odenbach,1010,DE,7.652247,49.68892,147.75,1085.53,Glan,Rhine,Rhine,-,1075,4152500.0,2952500.0,1100.7,7.65833,49.69167,True,True,True,True,1,1,1,1,1,1,1,1,1,0,HIST_6h,-,3,,3,,1,1,01/01/1991,31/12/2021,10833.0,01/01/1991 00:00,31/12/2021 18:00,43626.0,True,True,01/01/1991 00:00,31/12/2021 18:00,10906.5,6.0,1095.0,1460.0,1.0,0.0,1100.692224,,,,1991-01-02 06:00:00,2021-12-31 18:00:00,43621.0,0.8838239187553388,0.8947694646907765,1.041891704521605,1.0258553937153336,0.769408793300793,0.7640444217949152,2.8888053890133407,6.001672672875808,0.8947694646907765,0.3762908756577114,4.1891704521605515,4.189170452160495,32.16048796438275,4.189170452160495,0.48019913233907946,0.9741446062846664
117,24870055,Bad Vilbel,1009,DE,8.741063,50.182246,102.51,1619.3,Nidda,Rhine,Rhine,-,1575,4232500.0,3007500.0,1632.5,8.74167,50.175,True,True,True,True,1,1,1,1,1,1,1,1,1,0,HIST_6h,-,3,,3,,1,1,01/01/1991,31/12/2021,11278.0,01/01/1991 00:00,31/12/2021 18:00,45165.0,True,True,01/01/1991 00:00,31/12/2021 18:00,11291.25,6.0,1095.0,1460.0,0.0,,552.400512,,,recommended,1991-01-02 06:00:00,2021-12-31 18:00:00,45160.0,0.8567876109224573,0.8621679550018333,0.961697521218347,1.0067108774464932,0.7306214858357437,0.668237909360868,3.0625705575725624,4.874741229789751,0.8621679550018333,-0.36128052007141026,-3.8302478781652876,-3.8302478781653093,32.46896449760228,3.8302478781653093,0.5190168727163443,0.9932891225535068
118,24784259,Hanau,1009,DE,8.94581,50.132084,101.53,921.2,Kinzig,Rhine,Rhine,C749,900,4247500.0,3002500.0,925.1,8.94167,50.125,True,True,True,True,1,1,1,1,1,1,1,1,1,0,HIST_6h,-,3,,3,,1,1,01/01/1991,31/12/2021,11278.0,01/01/1991 00:00,31/12/2021 18:00,45163.0,True,True,01/01/1991 00:00,31/12/2021 18:00,11290.75,6.0,1095.0,1460.0,1.0,0.0,925.053056,,,recommended,1991-01-02 06:00:00,2021-12-31 18:00:00,45158.0,0.8868331632446136,0.8991535532930249,0.9516139610384599,0.9828093525017286,0.8051861788356137,0.6974601363879465,2.785988239689723,4.635836771433948,0.8991535532930249,-0.46825674247938787,-4.838603896153931,-4.838603896154015,28.78825295675299,4.838603896154015,0.44137718695508654,0.9828093525017286
119,24850058,Ilbenstadt,1009,DE,8.79551,50.283039,113.43,1072.6,Nidda,Rhine,Rhine,-,1075,4232500.0,3017500.0,1080.1,8.79167,50.275,True,True,True,False,1,1,1,1,1,1,1,1,1,0,HIST_6h,Close to 117,2,close to 117,3,,1,1,01/01/1991,31/12/2021,11278.0,01/01/1991 00:00,31/12/2021 18:00,45156.0,True,True,01/01/1991 00:00,31/12/2021 18:00,11289.0,6.0,1095.0,1460.0,1.0,0.0,1080.1216,,,,1991-01-02 06:00:00,2021-12-31 18:00:00,45151.0,0.8417884960251022,0.8555647804450992,1.0461468820006812,0.9548357151751309,0.7095414742165347,0.6691349590901818,1.9413206870420006,3.2274666487965438,0.8555647804450992,0.2613831366844086,4.614688200068175,4.614688200068125,34.27378590936952,4.614688200068125,0.5389420430653654,0.9548357151751309
120,25830056,Marburg,1009,DE,8.764476,50.798714,173.67,1666.2,Lahn,Rhine,Rhine,-,1675,4237500.0,3082500.0,1652.1,8.75833,50.79167,True,True,True,True,1,1,1,1,1,1,1,1,1,0,HIST_6h,-,3,,3,,1,1,01/01/1991,31/12/2021,11275.0,01/01/1991 00:00,31/12/2021 18:00,45165.0,True,True,01/01/1991 00:00,31/12/2021 18:00,11291.25,6.0,1095.0,1460.0,1.0,0.0,1652.132096,,,recommended,1991-01-02 06:00:00,2021-12-31 18:00:00,45160.0,0.8779470686141166,0.8812331420191407,0.9719769271575414,1.0024614820145237,0.7674462292931538,0.704784033241747,4.876980035906302,9.218230732637746,0.8812331420191407,-0.40606534876069283,-2.802307284245918,-2.8023072842458667,33.656643497045295,2.8023072842458667,0.48223829245182226,0.9975385179854763
121,24700109,Faulbach,1004,DE,9.438863,49.784963,128.29,20730,Main,Rhine,Elbe,-,20675,4282500.0,2962500.0,20729.4,9.44167,49.775,False,False,False,False,1,0,1,0,1,1,0,1,0,0,-,No discharge data available for calibration period,-,,-,,0,0,,,,,,,False,False,,,,,,,,,,,,,,,,,,,,,,,,,,,,,,,
122,6500250,Porttipahta,1011,FI,26.745701,67.962722,240,4868,Kitinen,Kemijoki,Kemijoki,-,2100,5022500.0,5062500.0,2570.6,26.74167,67.975,True,True,True,False,0,1,0,1,1,0,1,0,1,0,NRT_6h,dam  low data quality,0,Regulated,1,,1,0,01/01/1991,31/12/2021,7179.0,08/06/2009 12:00,31/12/2021 18:00,10370.0,True,True,08/06/2009 12:00,31/12/2021 18:00,2592.5,6.0,1095.0,1460.0,1.0,0.0,2570.609152,1.0,,,2009-06-08 12:00:00,2021-12-31 18:00:00,10370.0,-0.38852901014649865,-0.17309762016002106,0.25852900915926463,1.045558263081124,-2.599779699562424,-1.7677460535703262,71.22965986712643,81.43662109405776,-0.17309762016002106,-66.95220130906637,-74.1470990840732,-74.14709908407353,78.88422702507091,74.14709908407353,1.8973085409501542,0.954441736918876
123,6500550,"Kitinen, Kokkosniva",1011,FI,27.323837,67.222288,155,9820,Kitinen,Kemijoki,Kemijoki,C607,6575,5072500.0,4992500.0,7749.8,27.325,67.225,True,True,True,True,0,1,0,1,1,0,1,0,1,0,NRT_6h,oscillations in low flow  dam strongly regulated,3,,2,,1,1,01/01/1991,31/12/2021,11077.0,07/06/2009 18:00,31/12/2021 18:00,15975.0,True,True,07/06/2009 18:00,31/12/2021 18:00,3993.75,6.0,1095.0,1460.0,0.0,,5179.181056,,,,2009-06-07 18:00:00,2021-12-31 18:00:00,15975.0,0.6051942600192283,0.6301924543042458,0.8960840969958688,1.0911890156273405,0.256121693547786,-0.09813902307683797,59.896670281943386,75.30699595675735,0.6301924543042458,-12.407155186421566,-10.391590300413071,-10.391590300413128,50.16634744845163,10.391590300413128,0.8624838006897383,0.9088109843726595
124,6501351,Jumisko,1011,FI,27.781951,66.515144,160,1283,Jumiskonjoki,Kemijoki,Kemijoki,-,1300,5112500.0,4922500.0,1352.3,27.775,66.54167,True,True,True,False,0,1,0,1,1,0,1,0,1,0,NRT_6h, large oscillations low quality data,0,Regulated but no dam in model,0,,0,0,01/01/1991,31/12/2021,8423.0,29/06/2009 12:00,31/12/2021 18:00,11793.0,True,True,,,,,,,,,,,,,,,,,,,,,,,,,,,,,,,
125,6501700,Kemihaara,1011,FI,27.785512,67.198533,155,8538,Kemijoki,Kemijoki,Kemijoki,C608,10325,5092500.0,5002500.0,8525.0,27.775,67.19167,False,False,True,True,0,0,0,0,0,0,1,1,1,0,HIST_24h,-,3,,2,,1,1,03/01/1990,31/12/2012,8399.0,,,,True,False,03/01/1990 00:00,31/12/2012 00:00,8399.0,24.0,1095.0,1460.0,1.0,0.0,8524.97152,,,,1991-01-03 00:00:00,2012-12-31 00:00:00,8034.0,0.807227888633584,0.8337641908326285,0.9092031719723895,1.0358145039231275,0.6771181511569943,0.47297085082496115,46.51979563806685,78.5158959618749,0.8337641908326285,-11.037065178057727,-9.079682802761022,-9.079682802761047,38.26968325625524,9.079682802761047,0.5682269342815452,0.9641854960768725
126,6502050,Seitakorva,1011,FI,27.352968,66.475673,150,27424,Kemijoki,Kemijoki,Kemijoki,C243,28675,5092500.0,4912500.0,27337.8,27.35833,66.475,True,True,True,False,0,1,0,1,1,0,1,0,1,0,NRT_6h,dam moved downstream strongly regulated large oscillations in low flow  same for daily data,1,Regulated,1,,1,0,01/01/1991,31/12/2021,11180.0,07/06/2009 18:00,31/12/2021 18:00,17699.0,True,True,07/06/2009 18:00,31/12/2021 18:00,4424.75,6.0,1095.0,1460.0,0.0,,11063.04717,1.0,,,2009-06-07 18:00:00,2021-12-31 18:00:00,17699.0,0.6406775526759577,0.6584958605457988,1.04920410865074,1.100331946948471,0.1815190193964067,0.0021709361732141774,141.46002861071744,184.86167469452295,0.6584958605457988,15.965155207931023,4.9204108650739835,4.9204108650739915,43.597538056133395,4.9204108650739915,0.9046993868703499,0.8996680530515291
127,6502250,Vanttauskoski,1011,FI,26.685973,66.367788,86,29021,Kemijoki,Kemijoki,Kemijoki,-,30300,5062500.0,4897500.0,29078.4,26.675,66.375,False,False,True,True,0,0,0,0,0,0,0,0,1,0,HIST_24h,dam  oscillations moved downstream of dam,3,,2,,1,1,03/01/1990,31/12/2012,8397.0,,,,True,False,03/01/1990 00:00,31/12/2012 00:00,8397.0,24.0,1095.0,1460.0,0.0,,1740.554496,1.0,,,1991-01-03 00:00:00,2012-12-31 00:00:00,8032.0,0.6577422992656604,0.6943391370713935,1.0378113354261072,1.1492718107982576,0.23012422703793756,0.0018871509882566473,132.4481339775745,187.36044878132995,0.6943391370713935,12.797521761827122,3.7811335426107004,3.781133542610714,39.13289552142964,3.781133542610714,0.877425650959708,0.8507281892017424
128,6502400,Vikajärvi  luusua,1011,FI,26.219519,66.621822,118,3017,Raudanjoki,Kemijoki,Kemijoki,C609,3150,5037500.0,4917500.0,2862.2,26.225,66.625,False,False,True,True,0,0,0,0,0,0,0,1,1,0,HIST_24h,-,3,,2,,1,1,01/01/1994,31/12/2012,6940.0,,,,True,False,01/01/1994 00:00,31/12/2012 00:00,6940.0,24.0,1095.0,1460.0,1.0,0.0,2862.165504,,,,1994-01-01 00:00:00,2012-12-31 00:00:00,6940.0,0.8398902501937773,0.8465251516467328,0.9583152188252169,0.9814802288252978,0.7064525903755885,0.19120247522053613,14.62836248464085,21.966559983119573,0.8465251516467328,-1.4664758881689135,-4.168478117478378,-4.168478117478308,41.581323909734266,4.168478117478308,0.5418001565378228,0.9814802288252978
129,6502550,"Olkkajärvi, Permantokoski",1011,FI,26.126963,66.492834,99,3522,Raudanjoki,Kemijoki,Kemijoki,-,3550,5037500.0,4907500.0,3307.3,26.125,66.49167,True,True,True,False,0,1,0,1,1,0,1,0,1,0,NRT_6h,low quality data oscillations in low flow,1,Regulated but no dam in the model,1,no_calib,0,0,01/01/1991,31/12/2021,9942.0,07/06/2009 18:00,31/12/2021 18:00,13639.0,True,True,,,,,,,,,,,,,,,,,,,,,,,,,,,,,,,
130,6503200,"Ounasjoki, Köngäs",1011,FI,24.844374,67.878636,189,4488,Ounasjoki,Kemijoki,Kemijoki,C610,4625,4947500.0,5047500.0,4505.6,24.84167,67.875,False,False,True,True,0,0,0,0,0,0,1,1,1,0,HIST_24h,-,3,,2,,1,1,03/01/1990,31/12/2012,8399.0,,,,True,False,03/01/1990 00:00,31/12/2012 00:00,8399.0,24.0,1095.0,1460.0,1.0,0.0,4505.642496,,,,1991-01-03 00:00:00,2012-12-31 00:00:00,8034.0,0.7562459268594149,0.8267066103279732,0.8320931440287711,0.9654639755261005,0.6708832370287376,-12.845318616121553,26.45691335205424,46.08335589489115,0.8267066103279732,-8.80515362419788,-16.790685597122856,-16.790685597122888,50.45110317483327,16.790685597122888,0.5736869904148583,0.9654639755261005
131,6503510,Unari  luusua,1011,FI,25.747274,67.130471,180,1198,Meltausjoki,Kemijoki,Kemijoki,-,1175,5002500.0,4967500.0,1095.4,25.75833,67.125,False,False,True,True,0,0,0,0,0,0,1,1,1,0,HIST_24h,-,3,,2,,1,1,03/01/1990,31/12/2012,8399.0,,,,True,False,03/01/1990 00:00,31/12/2012 00:00,8399.0,24.0,1095.0,1460.0,1.0,0.0,1095.3984,,,,1991-01-03 00:00:00,2012-12-31 00:00:00,8034.0,0.7530344880077356,0.7762311407858297,0.911411667558753,0.9445782613510799,0.5889171614493145,0.2880469854755987,5.68045578282079,9.097479960239067,0.7762311407858297,-1.1394574732096523,-8.858833244124748,-8.858833244124698,44.163307287708314,8.858833244124698,0.6411574210368919,0.9445782613510799
132,6503600,"Ounasjoki, Marraskoski",1011,FI,25.420245,66.798477,93,12303,Ounasjoki,Kemijoki,Kemijoki,C242,12900,4997500.0,4932500.0,12198.4,25.425,66.80833,True,True,True,True,0,1,0,1,1,0,1,1,1,0,NRT_6h,-,3,,2,,1,1,01/01/1991,31/12/2021,11174.0,27/05/2009 12:00,31/12/2021 18:00,17983.0,True,True,27/05/2009 12:00,31/12/2021 18:00,4495.75,6.0,1095.0,1460.0,0.0,,6597.397504,,,,2009-05-27 12:00:00,2021-12-31 18:00:00,17983.0,0.832295166185328,0.8430340842958449,0.9616085832008575,0.9551367443433116,0.7034060349655413,0.2128290829444811,66.23064166816485,94.49746384536277,0.8430340842958449,-6.962726624836222,-3.839141679914227,-3.839141679914251,36.518569608741046,3.839141679914251,0.5446044115084491,0.9551367443433116
133,6504050,Valajaskoski,1011,FI,25.540257,66.424052,74,47425,Kemijoki,Kemijoki,Kemijoki,-,49325,5017500.0,4897500.0,47367.8,25.525,66.425,True,True,True,False,0,1,0,1,1,0,1,0,1,0,NRT_6h,low quality data oscillations in low flow,1,Regulated,1,,1,0,01/01/1991,31/12/2021,11180.0,26/04/2002 12:00,31/12/2021 18:00,27217.0,True,True,26/04/2002 12:00,31/12/2021 18:00,6804.25,6.0,1095.0,1460.0,0.0,,3228.76416,1.0,,,2002-04-26 12:00:00,2021-12-31 18:00:00,27217.0,0.8124152051021013,0.8236276582017412,1.0569754409166818,0.9711096649753832,0.6315027768112085,0.36038780521950164,178.17173038857402,251.24810707136965,0.8236276582017412,31.322737987811614,5.697544091668199,5.697544091668177,32.40908537985161,5.697544091668177,0.6070397212611325,0.9711096649753832
134,6504450,Isohaara,1011,FI,24.545286,65.792669,2,50683,Kemijoki,Kemijoki,Kemijoki,C241,52475,4987500.0,4817500.0,50986.7,24.54167,65.79167,False,False,True,True,0,0,0,0,0,0,0,0,1,0,HIST_24h,oscillations in low flow,3,,2,,1,1,03/01/1990,31/12/2012,8397.0,,,,True,False,03/01/1990 00:00,31/12/2012 00:00,8397.0,24.0,1095.0,1460.0,0.0,,3618.91456,1.0,,,1991-01-03 00:00:00,2012-12-31 00:00:00,8032.0,0.8427930546209961,0.848516238631095,1.0156864201692661,0.961004744657856,0.7033651226106241,0.5101231589818729,176.37002717343353,264.94264393675104,0.848516238631095,9.000125957288498,1.568642016926592,1.5686420169266047,30.739729250865256,1.5686420169266047,0.5446419717478416,0.961004744657856
135,6700510,"Muonionjoki, Kaaresuvanto",1011,FI,22.494588,68.442281,324,5732,Muonio,Torne,Torne,-,5875,4832500.0,5082500.0,5859.3,22.49167,68.44167,True,True,True,True,0,1,0,1,1,0,1,1,1,0,NRT_6h,-,3,,3,,1,1,01/01/1991,31/12/2021,11179.0,31/10/2008 12:00,31/12/2021 18:00,18727.0,True,True,31/10/2008 12:00,31/12/2021 18:00,4681.75,6.0,1095.0,1460.0,0.0,,5480.344064,,,,2008-10-31 12:00:00,2021-12-31 18:00:00,18727.0,0.6659726591981365,0.8242737970362672,0.7286442390707751,0.915972522317788,0.5670940274962384,0.18220692933427762,39.671342951174374,67.02874260626545,0.8242737970362672,-30.174303128243064,-27.1355760929225,-27.135576092922488,35.676209017480474,27.135576092922488,0.6579559046803675,0.915972522317788
136,6700800,"Muonionjoki, Muonio",1011,FI,23.660143,67.945748,233,9259,Muonio,Torne,Torne,C625,9250,4887500.0,5042500.0,9605.1,23.65833,67.94167,True,True,True,True,0,1,0,1,1,0,1,1,1,0,NRT_6h,-,3,,3,,1,1,01/01/1991,31/12/2021,11203.0,31/10/2008 06:00,31/12/2021 18:00,18933.0,True,True,31/10/2008 06:00,31/12/2021 18:00,4733.25,6.0,1095.0,1460.0,0.0,,3745.711872,,,,2008-10-31 06:00:00,2021-12-31 18:00:00,18933.0,0.6177905359086358,0.8025039331650525,0.6918471401146916,0.8899037104610729,0.473939705854006,-0.08067707435166782,73.47424917740476,110.90948776775848,0.8025039331650525,-56.2197582715856,-30.81528598853089,-30.815285988530842,40.272851943915924,30.815285988530842,0.7253001407320926,0.8899037104610729
137,6701950,"Tengeliönjoki, Haapakoski",1011,FI,23.783981,66.381335,53,3089,Tengelionjoki,Torne,Torne,-,3000,4937500.0,4867500.0,3001.5,23.79167,66.375,False,False,True,False,0,0,0,0,0,0,0,0,1,0,HIST_24h,oscillations,1,,2,,1,0,03/01/1990,31/12/2012,8186.0,,,,True,False,03/01/1990 00:00,31/12/2012 00:00,8186.0,24.0,1095.0,1460.0,1.0,0.0,3001.481728,,,,1991-01-03 00:00:00,2012-12-31 00:00:00,7832.0,0.6486139037918677,0.7012727874491642,1.1146763151871326,1.1452018726638882,0.14284676966461562,-17.899531506565523,20.77506509501655,24.75697859449254,0.7012727874491642,3.589257078903193,11.467631518713356,11.467631518713254,66.37607339057875,11.467631518713254,0.9258257019198525,0.8547981273361118
138,6800510,"Inarijoki, Karigasniemi",1011,FI,25.844885,69.395731,130,3133,Anarjohka,Tana,Tana,C611,3050,4942500.0,5212500.0,3061.1,25.84167,69.39167,True,True,True,True,0,1,0,1,1,0,1,1,1,0,NRT_6h,-,3,,3,,1,1,01/01/1991,31/12/2021,11188.0,01/11/2008 00:00,31/12/2021 18:00,18847.0,True,True,01/11/2008 00:00,31/12/2021 18:00,4711.75,6.0,1095.0,1460.0,1.0,0.0,3061.07264,,,,2008-11-01 00:00:00,2021-12-31 18:00:00,18847.0,0.6981987475515055,0.7869620047924458,0.7885428787466623,1.0313798414380515,0.5608525169811635,-0.07068771334961244,21.107476999461994,30.770499818197237,0.7869620047924458,-11.159807746136565,-21.145712125333937,-21.145712125333773,39.99465245960396,21.145712125333773,0.6626820376461369,0.9686201585619485
139,6801000,Onnelansuvanto,1011,FI,27.026975,69.911992,69,10864,Tana,Tana,Tana,C412,10650,4972500.0,5282500.0,10812.9,27.025,69.90833,True,True,True,True,0,1,0,1,1,0,1,1,1,0,NRT_6h,-,3,,3,,1,1,01/01/1991,31/12/2021,11201.0,31/10/2008 12:00,31/12/2021 18:00,18565.0,True,True,31/10/2008 12:00,31/12/2021 18:00,4641.25,6.0,1095.0,1460.0,0.0,,5710.014464,,,,2008-10-31 12:00:00,2021-12-31 18:00:00,18565.0,0.5283018673264713,0.7482165298112338,0.6038350557502529,0.9535505709939156,0.2909263542271464,-0.42771735199936645,98.19966595106169,155.50579765225044,0.7482165298112338,-90.31378737911619,-39.61649442497487,-39.616494424974704,43.075665760244725,39.616494424974704,0.842065107799186,0.9535505709939156
140,6801100,"Utsjoki, Patoniva",1011,FI,26.999533,69.783662,80,1520,Utsjoki,Tana,Tana,-,1500,4977500.0,5262500.0,1542.6,27.00833,69.79167,True,True,True,True,0,1,0,1,1,0,1,1,1,0,NRT_6h,-,3,removed Q data from 18-2-2021 to 10-03-21,3,,1,1,01/01/1991,31/12/2021,11011.0,31/10/2008 18:00,31/12/2021 18:00,17766.0,True,True,31/10/2008 18:00,31/12/2021 18:00,4434.5,6.0,1095.0,1460.0,1.0,0.0,1542.632576,,,,2008-10-31 18:00:00,2021-12-31 18:00:00,17738.0,0.6134826235783961,0.6706025736157663,0.9352557343828602,0.8084244330897588,0.44051872413333026,-25.75649844470705,10.808020666419013,21.192478970359822,0.6706025736157663,-1.2291601782211279,-6.4744265617140595,-6.47442656171398,56.92971292275987,6.47442656171398,0.747984809917067,0.8084244330897588
141,7100700,Kettujoki,1011,FI,26.74754,68.919106,150,2215,Kettujoki,Paatsjoki,Paatsjoki,-,2250,4992500.0,5172500.0,2226.0,26.74167,68.925,False,False,True,True,0,0,0,0,0,0,0,1,1,0,HIST_24h,-,3,,2,,1,1,03/01/1990,31/12/2012,8399.0,,,,True,False,03/01/1990 00:00,31/12/2012 00:00,8399.0,24.0,1095.0,1460.0,1.0,0.0,2225.984,,,,1991-01-03 00:00:00,2012-12-31 00:00:00,8034.0,0.7400776602891623,0.759137742827968,0.9450290285889461,0.9192337443428564,0.5612091870145102,0.023452722773146473,10.869696902913057,16.527969978411786,0.759137742827968,-1.383940293844483,-5.497097141105386,-5.497097141105388,43.175113865425146,5.497097141105388,0.6624128719956235,0.9192337443428564
142,7100800,Juutuanjoki,1011,FI,26.925191,68.889188,140,5160,Juutuanjoki,Paatsjoki,Paatsjoki,C612,5250,4997500.0,5162500.0,5194.4,26.925,68.89167,True,True,True,True,0,1,0,1,1,0,1,1,1,0,NRT_6h,-,3,,3,,1,1,01/01/1991,31/12/2021,10827.0,07/09/2008 12:00,31/12/2021 18:00,17620.0,True,True,07/09/2008 12:00,31/12/2021 18:00,4405.0,6.0,1095.0,1460.0,0.0,,2968.384768,,,,2008-09-07 12:00:00,2021-12-31 18:00:00,17620.0,0.829082313736643,0.8495613751775822,0.9479350356621911,0.9377881431906919,0.7171587264982133,0.5951969632080907,19.377827801948456,31.16801023368144,0.8495613751775822,-3.233072743591915,-5.206496433780902,-5.206496433780893,31.205790697173484,5.206496433780893,0.5318282368413587,0.9377881431906919
143,7101320,"Ivalojoki, Pajakoski",1011,FI,27.274471,68.554588,130,3345,Ivalo,Paatsjoki,Paatsjoki,C613,3300,5022500.0,5137500.0,3328.2,27.275,68.55833,True,True,True,True,0,1,0,1,1,0,1,1,1,0,NRT_6h,-,3,,3,,1,1,01/01/1991,31/12/2021,11175.0,01/11/2008 00:00,31/12/2021 18:00,18404.0,True,True,01/11/2008 00:00,31/12/2021 18:00,4601.0,6.0,1095.0,1460.0,1.0,0.0,3328.249088,,,,2008-11-01 00:00:00,2021-12-31 18:00:00,18404.0,0.835130025704185,0.8536709479456583,0.9446786695833832,0.9479474558727822,0.7251937762351682,0.5491107332667571,15.502645782660235,31.596803007686308,0.8536709479456583,-2.5644160379477734,-5.5321330416617345,-5.532133041661676,33.44336398553558,5.532133041661676,0.5242196331356045,0.9479474558727822
144,7101950,Kaitakoski,1011,FI,28.448919,68.908733,131,14575,Paatsjoki,Paatsjoki,Paatsjoki,C614,14575,5062500.0,5187500.0,14572.6,28.44167,68.90833,False,False,True,True,0,0,0,0,0,0,0,0,1,0,HIST_24h,lake  strongly regulated,3,,2,,1,1,03/01/1990,31/12/2012,8399.0,,,,True,False,03/01/1990 00:00,31/12/2012 00:00,8399.0,24.0,1095.0,1460.0,0.0,,6050.017792,,1.0,,1991-01-03 00:00:00,2012-12-31 00:00:00,8034.0,0.318627732644834,0.3288281503714724,0.9852794373040532,1.116532484830864,-0.4878895748418963,-0.6817584305957678,60.91971908908898,86.07277167161186,0.3288281503714724,-2.4060647027084423,-1.4720562695946706,-1.4720562695946784,37.27133951389274,1.4720562695946784,1.21979079142363,0.883467515169136
145,2395,Kallio 2,1014,SE,23.543048,67.224893,-,14477.1,Muonio,Torne,Torne,C627,14450,4907500.0,4957500.0,14436.0,23.54167,67.225,True,True,True,True,0,1,0,1,1,0,1,0,1,0,HIST_6h,-,3,,3,,1,1,01/01/1991,31/12/2021,10763.0,17/10/2002 00:00,31/12/2021 18:00,24795.0,True,True,17/10/2002 00:00,31/12/2021 18:00,6198.75,6.0,1095.0,1460.0,0.0,,4830.978048,,,,2002-10-17 00:00:00,2021-12-31 18:00:00,24795.0,0.6983222384523085,0.8273783927219499,0.801806456637181,0.8519102573354291,0.627196336656712,0.54057746197204,75.8606692517358,130.09341566098456,0.8273783927219499,-40.724662507996264,-19.81935433628191,-19.8193543362819,36.918893650559674,19.8193543362819,0.6105765008115573,0.8519102573354291
146,2012,Pajala pumphus,1014,SE,23.346358,67.225836,-,11038.1,Torne,Torne,Torne,-,16875,4887500.0,4957500.0,16742.4,23.34167,67.225,True,True,True,True,0,1,0,1,1,0,1,0,1,0,HIST_6h,-,3,,3,,1,1,01/01/1991,31/12/2021,10748.0,01/01/1991 00:00,31/12/2021 18:00,43283.0,True,True,01/01/1991 00:00,31/12/2021 18:00,10820.75,6.0,1095.0,1460.0,0.0,,15221.49581,,1.0,,1991-01-02 06:00:00,2021-12-31 18:00:00,43278.0,0.8371041771247567,0.8911684858544686,0.9017941637812215,1.0710377672197267,0.779621859793739,0.23333208775364744,50.39711126960706,78.49932892958891,0.8911684858544686,-15.847105174640689,-9.820583621877734,-9.82058362187785,31.231511375103356,9.82058362187785,0.4694445017318479,0.9289622327802733
147,17,Räktfors,1014,SE,22.815774,66.170645,-,23102.9,Kalix,Kalix,Kalix,C239,17425,4897500.0,4832500.0,17130.2,22.80833,66.175,True,True,True,True,0,1,0,1,1,0,1,0,1,0,HIST_6h,-,3,,3,,1,1,01/01/1991,31/12/2021,10838.0,01/01/1991 00:00,31/12/2021 18:00,43646.0,True,True,01/01/1991 00:00,31/12/2021 18:00,10911.5,6.0,1095.0,1460.0,0.0,,15702.02931,,,,1991-01-02 06:00:00,2021-12-31 18:00:00,43641.0,0.8294106693664218,0.8724570037868367,0.9078529248072135,0.9341029562393257,0.7521962293169766,-0.2812511438021035,104.99647350988444,159.37026788923816,0.8724570037868367,-29.321644713730784,-9.214707519278589,-9.214707519278658,32.996504916253485,9.214707519278658,0.4977989259560763,0.9341029562393257
148,2237,Granåker,1014,SE,19.666241,64.239979,-,11846.37,Vindel,Ume,Umealven,C635,11850,4792500.0,4602500.0,11850.3,19.65833,64.24167,True,True,True,True,0,1,0,1,1,0,1,0,1,0,HIST_6h,-,3,,3,,1,1,01/01/1991,31/12/2021,10662.0,01/01/1991 00:00,31/12/2021 18:00,42937.0,True,True,01/01/1991 00:00,31/12/2021 18:00,10734.25,6.0,1095.0,1460.0,0.0,,5757.5424,,,,1991-01-02 06:00:00,2021-12-31 18:00:00,42932.0,0.8622234659716586,0.8707082791110344,0.9938291177123789,0.9527988935487222,0.7522883303051755,0.10122928292213162,66.57485071150465,96.18784061972808,0.8707082791110344,-1.1669546387747793,-0.6170882287621148,-0.6170882287621094,35.20493028657729,0.6170882287621094,0.49770640913577413,0.9527988935487222
149,2238,Sorsele2,1014,SE,17.508312,65.542207,-,6054.39,Vindel,Ume,Umealven,C323,6175,4667500.0,4737500.0,6092.7,17.50833,65.54167,True,True,True,True,0,1,0,1,1,0,1,0,1,0,HIST_6h,-,3,,3,,1,1,01/01/1991,31/12/2021,10782.0,01/01/1991 00:00,31/12/2021 18:00,43423.0,True,True,01/01/1991 00:00,31/12/2021 18:00,10855.75,6.0,1095.0,1460.0,1.0,0.0,6092.699136,,,,1991-01-02 06:00:00,2021-12-31 18:00:00,43418.0,0.8419922596121145,0.8624578766862022,0.9558551329618232,0.9359699988208717,0.7416205933522706,-3.866200907042373,52.34439837453815,82.36630820724929,0.8624578766862022,-5.558097407310038,-4.414486703817726,-4.4144867038176825,41.574235518043906,4.4144867038176825,0.5083103448167575,0.9359699988208717
150,6602200,Klein Badelmeusel,1015,DE,14.747908,51.673212,83.24,2727,Lusatian Neisse,Oder,Oder,-,2650,4642500.0,3187500.0,2725.4,14.74167,51.675,True,True,True,True,1,1,1,1,1,1,1,1,1,0,NRT_6h,-,3,Temporary not working due to works in the river bed of the Zapadna Morava,3,,1,1,01/01/1991,31/12/2021,6632.0,31/07/2012 00:00,31/12/2021 18:00,13389.0,True,True,31/07/2012 00:00,31/12/2021 18:00,3347.25,6.0,1095.0,1460.0,0.0,,656.005184,,,recommended,2012-07-31 00:00:00,2021-12-31 18:00:00,13389.0,0.7465278397969284,0.7552450077800379,0.9529171854343516,1.0461122364887523,0.5086331957131507,0.4276142754494592,5.792059235118206,9.797080967865066,0.7552450077800379,-0.8131341326094728,-4.70828145656479,-4.708281456564843,33.53769568683131,4.708281456564843,0.7009756089100716,0.9538877635112477
151,6602800,Guben 2,1015,DE,14.706919,51.969154,37.48,4080,Lusatian Neisse,Oder,Oder,C193,4050,4647500.0,3212500.0,4069.1,14.70833,51.95833,True,True,True,False,1,1,1,1,1,1,1,1,1,0,NRT_6h,Close to 150,2,close to 150,3,,1,1,01/01/1991,31/12/2021,6951.0,31/07/2012 00:00,31/12/2021 18:00,13257.0,True,True,31/07/2012 00:00,31/12/2021 18:00,3314.25,6.0,1095.0,1460.0,0.0,,1343.68256,,,,2012-07-31 00:00:00,2021-12-31 18:00:00,13257.0,0.7162835117502062,0.7495229441816871,0.8903651143675952,1.075739567372376,0.4995362362145853,0.4013181700408558,7.225256092600711,11.603992909607337,0.7495229441816871,-2.2531584652043612,-10.963488563240476,-10.963488563240473,35.15687589710963,10.963488563240473,0.7074346356981808,0.924260432627624
152,5802600,Sachsenhausen Sohlabsturz,1015,DE,13.242927,52.77314,30.18,2779,Havel,Elbe,Elbe,C537,2575,4542500.0,3297500.0,1927.6,13.24167,52.775,True,True,True,False,1,1,1,1,1,1,1,1,1,0,NRT_6h,Unrealistic small data compared to cahchment size  same for daily data  possibly wrong location,0,Low flow but seems OK,3,,1,1,01/01/1991,31/12/2021,6453.0,23/07/2009 00:00,31/12/2021 18:00,14867.0,True,True,23/07/2009 00:00,31/12/2021 18:00,3716.75,6.0,1095.0,1460.0,1.0,0.0,1927.64352,,,,2009-07-23 00:00:00,2021-12-31 18:00:00,14867.0,0.6390738018982565,0.6574829685896673,0.9068130559612972,0.9346853987935329,0.38186172923730866,0.411404491774928,3.8563491462258144,5.393725994971384,0.6574829685896673,-0.8199010326508535,-9.318694403870177,-9.318694403870271,43.82984991751727,9.318694403870271,0.7862176993445859,0.9346853987935329
153,LOBI,Lobith,1008,NL,6.108333,51.844444,13,160800,Rhine,Rhine,Rhine,C368,159675,4052500.0,3202500.0,159514.5,6.10833,51.84167,True,True,True,True,1,1,1,1,1,1,1,1,1,0,NRT_6h,-,3,Rhine outlet,2,,1,1,01/01/1991,31/12/2021,10767.0,01/01/2014 06:00,31/12/2021 18:00,11475.0,True,True,01/01/2014 06:00,31/12/2021 18:00,2868.75,6.0,1095.0,1460.0,0.0,,5803.40992,,,recommended,2014-01-01 06:00:00,2021-12-31 18:00:00,11475.0,0.8965122046111562,0.918728248921384,1.0516730238066654,1.037875122200918,0.8036245962096727,0.7393692305333666,290.689270630437,441.8999866625013,0.918728248921384,102.59541250543059,5.167302380666536,5.167302380666529,14.640804335022052,5.167302380666529,0.4431426449692324,0.9621248777990821
154,BORD,Borgharen-Dorp,1008,NL,5.6966,50.869439,-,159555,Meuse,Meuse,Meuse,C085,22050,4022500.0,3097500.0,21370.1,5.69167,50.875,False,False,True,False,0,0,0,0,0,1,1,1,1,0,NRT_6h,Drainage area from provider is wrong  Oscillation in low flow  could use hist_24 instead  close to 953,2,close to 953,2,close,0,1,01/01/1991,01/01/2013,6872.0,24/10/2008 06:00,06/12/2012 12:00,5730.0,True,True,,,,,,,,,,,,,,,,,,,,,,,,,,,,,,,
155,4001092,Fischerau / Ager,1013,AT,13.838047,48.085815,348,1256.1,Ager,Danube,Danube,-,1225,4602500.0,2777500.0,1234.5,13.84167,48.09167,True,True,True,False,1,1,1,1,1,1,1,0,1,0,NRT_6h,small oscillations and change in hydrometri zero,0,Regulated,1,,1,0,03/01/1990,31/12/2021,7842.0,07/04/2011 00:00,31/12/2021 18:00,14213.0,True,True,07/04/2011 00:00,31/12/2021 18:00,3553.25,6.0,1095.0,1460.0,1.0,0.0,1234.523392,,1.0,,2011-04-07 00:00:00,2021-12-31 18:00:00,14213.0,0.6191391447719339,0.6943466456906857,0.8068860539847338,1.1197414794418856,0.36166292877552453,-0.24677816271787756,17.41724325545961,25.892379023206516,0.6943466456906857,-8.975655944152797,-19.3113946015265,-19.311394601526622,37.473724424126935,19.311394601526622,0.798959993506858,0.8802585205581144
156,10001019,Achleiten / Donau,1013,AT,13.503336,48.582691,288.04,76653.3,Danube,Danube,Danube,C360,76825,4582500.0,2837500.0,76651.6,13.50833,48.59167,True,True,True,True,1,1,1,1,1,1,1,0,1,0,NRT_6h,Moved to better reproduce confluence,3,keeping it for routing,3,,1,1,01/01/1991,31/12/2021,10917.0,16/05/2009 00:00,31/12/2021 18:00,16077.0,True,True,16/05/2009 00:00,31/12/2021 18:00,4019.25,6.0,1095.0,1460.0,0.0,,4668.110336,1.0,,,2009-05-16 00:00:00,2021-12-31 18:00:00,16077.0,0.8505292421449941,0.8909057179671322,1.083666104086286,1.0586509003213562,0.6892964791027609,0.688102929298601,223.01263835655192,308.6149683660653,0.8909057179671322,108.94242442977742,8.366610408628546,8.366610408628599,17.127027153066116,8.366610408628599,0.5574078586611769,0.9413490996786438
157,10001026,Grein,1013,AT,14.857051,48.227221,219.43,-,Danube,Danube,Danube,-,92225,4682500.0,2802500.0,92062.4,14.85833,48.225,False,False,False,False,0,0,0,0,0,0,0,0,0,0,-,No discharge data available for calibration period,-,,-,,0,0,,,,,,,False,False,,,,,,,,,,,,,,,,,,,,,,,,,,,,,,,
158,10001016,Kienstock,1013,AT,15.46122,48.382792,194,95970,Danube,Danube,Danube,C325,95975,4727500.0,2827500.0,95949.8,15.45833,48.375,True,True,True,True,1,1,1,1,1,1,1,0,1,0,NRT_6h,Outliers removed with qc,3,,3,,1,1,01/01/1991,31/12/2021,10547.0,31/10/2008 00:00,31/12/2021 18:00,17791.0,True,True,31/10/2008 00:00,31/12/2021 18:00,4447.75,6.0,1095.0,1460.0,0.0,,5565.089792,1.0,,,2008-10-31 00:00:00,2021-12-31 18:00:00,17791.0,0.8502511762584939,0.8750828199590854,1.0653810595720241,1.050455182011661,0.6852062005584936,0.7000076400226718,308.31107260383294,437.04080707737063,0.8750828199590854,112.8864445406248,6.5381059572024105,6.538105957202407,17.856621037764686,6.538105957202407,0.5610648798860141,0.949544817988339
159,10001035,Korneuburg,1013,AT,16.332121,48.329485,159.87,101536.6,Danube,Danube,Danube,C326,101800,4792500.0,2817500.0,101531.4,16.325,48.325,True,True,True,True,1,1,1,1,1,1,1,0,1,0,NRT_6h,-,3,,3,,1,1,02/01/1996,31/12/2021,8747.0,31/10/2008 00:00,31/12/2021 18:00,17805.0,True,True,31/10/2008 00:00,31/12/2021 18:00,4451.25,6.0,1095.0,1460.0,0.0,,3780.32768,1.0,,,2008-10-31 00:00:00,2021-12-31 18:00:00,17805.0,0.8377558435024849,0.8589160459140799,1.0661054798378102,1.0452609075526003,0.6508196773769535,0.6789804159516767,326.23629884498683,469.0587086808605,0.8589160459140799,116.84087399528516,6.610547983781008,6.61054798378103,18.45758794694516,6.61054798378103,0.5909148184155201,0.9547390924473997
160,10001023,Linz,1013,AT,14.284912,48.30692,247.74,79490.1,Danube,Danube,Danube,-,79650,4632500.0,2807500.0,79484.1,14.29167,48.30833,False,False,True,False,0,0,0,0,0,0,0,0,1,0,HIST_24h,old data,1,Regulated,2,,1,0,03/01/1990,01/01/2000,3236.0,,,,True,False,03/01/1990 00:00,01/01/2000 00:00,3236.0,24.0,1095.0,1460.0,0.0,,2832.469504,1.0,,,1992-01-02 00:00:00,2000-01-01 00:00:00,2874.0,0.9026149685229491,0.9383768536925801,1.0691013064972728,1.0301900916747613,0.8254451659562683,0.8266539966647328,180.0685564172117,240.01577905084073,0.9383768536925801,97.0456054627185,6.9101306497272486,6.910130649727283,12.821778428995746,6.910130649727283,0.4177975993752618,0.9698099083252387
161,10001036,Wildungsmauer,1013,AT,16.804302,48.114803,139.48,103992.7,Danube,Danube,Danube,-,103800,4832500.0,2802500.0,104028.8,16.80833,48.125,True,True,True,True,1,1,1,1,1,1,1,0,1,0,NRT_6h,-,3,,3,,1,1,02/01/1996,31/12/2021,8365.0,31/10/2008 00:00,31/12/2021 18:00,17689.0,True,True,31/10/2008 00:00,31/12/2021 18:00,4422.25,6.0,1095.0,1460.0,0.0,,2497.290496,,,,2008-10-31 00:00:00,2021-12-31 18:00:00,17689.0,0.8319418437278883,0.8679371773479483,1.0831732444656947,1.0623311011278003,0.6378719118002268,0.6667886443363022,325.59743389646707,465.3355874644508,0.8679371773479483,145.68559568271561,8.317324446569506,8.317324446569476,18.588656510594895,8.317324446569476,0.6017707937410842,0.9376688988721997
162,10001002,Ybbs,1013,AT,15.085603,48.180709,212.22,-,Danube,Danube,Danube,-,92525,4692500.0,2797500.0,92447.5,15.09167,48.175,False,False,True,False,1,0,1,0,1,1,1,0,0,0,-,No discharge data available for calibration period,-,,-,,0,0,,,,,,,False,False,,,,,,,,,,,,,,,,,,,,,,,,,,,,,,,
163,2001077,Amlach,1013,AT,13.52317,46.77402,522.79,4789.6,Drava,Danube,Danube,-,4900,4587500.0,2637500.0,4795.2,13.525,46.775,True,True,True,False,1,1,1,1,1,1,1,0,0,0,NRT_6h,oscillations,1,,3,,1,0,31/10/2008,31/12/2021,4241.0,31/10/2008 00:00,31/12/2021 18:00,16797.0,True,True,31/10/2008 00:00,31/12/2021 18:00,4199.25,6.0,1095.0,1460.0,0.0,,584.787904,,,,2008-10-31 00:00:00,2021-12-31 18:00:00,16797.0,0.7622986121981551,0.8636962664983514,0.9651220811133954,1.1915901165785283,0.6608085820517933,0.5037197696098199,34.185993816793264,47.64573743012501,0.8636962664983514,-4.610209697007586,-3.4877918886604484,-3.4877918886604675,25.862951964506365,3.4877918886604675,0.5824014233741219,0.8084098834214717
164,2001073,Lavamünd Ort,1013,AT,14.942619,46.64062,338,11051.8,Drave,Danube,Danube,-,11100,4692500.0,2627500.0,11063.0,14.925,46.65833,True,True,True,False,1,1,1,1,1,1,1,0,0,0,NRT_6h,dams  large oscillations change in hydrometric zero,0,Mildly regulated with change in low flow ,3,,1,0,19/11/2008,31/12/2021,4283.0,19/11/2008 00:00,31/12/2021 18:00,17122.0,True,True,19/11/2008 00:00,31/12/2021 18:00,4280.5,6.0,1095.0,1460.0,0.0,,2605.805056,1.0,,,2008-11-19 00:00:00,2021-12-31 18:00:00,17122.0,0.5263720135912981,0.6729883866598825,0.8610102522711549,1.3131592634371956,0.17583653207282657,0.00022093996278615968,108.53877949069636,146.17268444001922,0.6729883866598825,-41.872085204280815,-13.898974772884387,-13.898974772884504,36.02824532527975,13.898974772884504,0.9078344936865814,0.6868407365628044
165,7001147,Lienz-Peggetz,1013,AT,12.784082,46.824539,661.43,1876.2,Drava,Danube,Danube,-,1975,4532500.0,2637500.0,1884.5,12.79167,46.825,True,True,True,False,1,1,1,1,1,1,1,0,1,0,NRT_6h,oscillations  negative values  zeros removed with qc close to 166,1,Negative values,0,,0,0,03/01/1990,31/12/2021,10525.0,31/10/2008 00:00,31/12/2021 18:00,17715.0,True,True,,,,,,,,,,,,,,,,,,,,,,,,,,,,,,,
166,2001001,Oberdrauburg-OWF,1013,AT,12.97297,46.747615,616.08,2112,Drave,Danube,Danube,-,2275,4547500.0,2632500.0,2113.1,12.975,46.74167,True,True,True,True,1,1,1,1,1,1,1,0,1,0,NRT_6h,-,3,,3,,1,1,03/01/1990,31/12/2021,10404.0,31/10/2008 00:00,31/12/2021 18:00,17124.0,True,True,31/10/2008 00:00,31/12/2021 18:00,4281.0,6.0,1095.0,1460.0,0.0,,914.957376,,,,2008-10-31 00:00:00,2021-12-31 18:00:00,17124.0,0.8773478374928292,0.8938781832117545,0.9462550788788285,1.0298863919355707,0.7874506845727797,0.8069497536685282,14.035851056283093,22.764960204158033,0.8938781832117545,-3.5131485600282524,-5.374492112117172,-5.374492112117151,21.47235435675369,5.374492112117151,0.46103070985263145,0.9701136080644293
167,2001003,Sachsenburg (Brücke),1013,AT,13.349301,46.827063,555.04,2561.4,Drave,Danube,Danube,-,2650,4577500.0,2637500.0,2561.2,13.34167,46.825,True,True,True,False,1,1,1,1,1,1,1,0,1,0,NRT_6h,Large outliers removed with qc low quality data,1,Outliers,0,,0,0,03/01/1990,31/12/2021,9481.0,31/10/2008 00:00,31/12/2021 18:00,13422.0,True,True,,,,,,,,,,,,,,,,,,,,,,,,,,,,,,,
168,6001033,Admont (Enns),1013,AT,14.461733,47.581186,616.8,2637.5,Enns,Danube,Danube,C780,2650,4662500.0,2727500.0,2651.3,14.45833,47.575,True,True,True,True,1,1,1,1,1,1,1,0,1,0,HIST_24h,-,3,,3,,1,1,01/01/1991,31/12/2021,8229.0,18/01/2021 12:00,31/12/2021 18:00,1201.0,True,False,01/01/1991 00:00,31/12/2021 00:00,8229.0,24.0,1095.0,1460.0,0.0,,1130.908672,,,,1991-01-03 00:00:00,2022-01-01 00:00:00,8228.0,0.8891078002906001,0.8912146791639973,0.9870747570777442,0.9828019762066083,0.7876910241030123,0.7498354795448654,17.084924336126512,25.665289240955367,0.8912146791639973,-1.0418307360772876,-1.2925242922255995,-1.2925242922255795,21.196034029890335,1.2925242922255795,0.460769981549349,0.9828019762066083
169,4001134,Steyr (Ortskai),1013,AT,14.424931,48.043318,283.97,5915.4,Enns,Danube,Danube,C050,5975,4652500.0,2782500.0,5942.8,14.425,48.04167,True,True,True,False,1,1,1,1,1,1,1,0,1,0,NRT_6h,oscillations  change in low flow could use hist_24,1,Possibly regulated,1,,1,0,01/01/1991,31/12/2021,10735.0,27/11/2009 00:00,31/12/2021 18:00,15639.0,True,True,27/11/2009 00:00,31/12/2021 18:00,3909.75,6.0,1095.0,1460.0,0.0,,3291.56096,,,,2009-11-27 00:00:00,2021-12-31 18:00:00,15639.0,0.7308266716714582,0.7653490386145173,0.8730240319965787,0.9643585837272448,0.5455706696252216,0.5336266672518053,62.93455628298931,97.3599403724168,0.7653490386145173,-26.75876974350887,-12.697596800342101,-12.69759680034212,29.863765343086506,12.69759680034212,0.6741137369723152,0.9643585837272448
170,6001025,Trautenfels,1013,AT,14.08546,47.514579,639.96,1490.3,Enns,Danube,Danube,-,1450,4622500.0,2717500.0,1520.3,14.075,47.50833,True,True,True,False,1,1,1,1,1,1,1,0,0,0,NRT_6h,oscillations in low flow use 168,1,Possibly regulated,1,,1,0,01/11/2010,31/12/2021,2162.0,01/11/2010 00:00,31/12/2021 18:00,8469.0,True,True,01/11/2010 00:00,31/12/2021 18:00,2117.25,6.0,1095.0,1460.0,1.0,0.0,1520.34176,,,,2010-11-01 00:00:00,2021-12-31 18:00:00,8469.0,0.7054640327264798,0.8267372451337097,0.8400149673862533,1.17645464894264,0.5960595207260448,0.39480884408110717,14.982320719583678,20.575953571921925,0.8267372451337097,-8.018913632457759,-15.99850326137473,-15.998503261374676,29.891169537606785,15.998503261374676,0.6355631198189166,0.82354535105736
171,2001042,Faak (Bundessportheim),1013,AT,13.91535,46.57739,553.91,35.6,Lake Faak,Danube,Danube,-,25,4622500.0,2612500.0,35.5,13.90833,46.575,False,False,False,False,1,0,1,0,1,1,0,1,0,0,-,No discharge data available for calibration period,-,,-,,0,0,,,,,,,False,False,,,,,,,,,,,,,,,,,,,,,,,,,,,,,,,
172,5001060,Fuschl am See,1013,AT,13.299086,47.798127,662.4,29.5,Fuschlsee,Danube,Danube,-,25,4567500.0,2747500.0,25.4,13.25833,47.80833,False,False,False,False,0,0,0,0,0,0,0,1,0,0,-,No discharge data available for calibration period,-,,-,,0,0,,,,,,,False,False,,,,,,,,,,,,,,,,,,,,,,,,,,,,,,,
173,2001041,Federaun,1013,AT,13.814816,46.569332,498.54,1304.9,Gail,Danube,Danube,-,1300,4612500.0,2612500.0,1336.5,13.80833,46.575,True,True,True,True,1,1,1,1,1,1,1,0,1,0,NRT_6h,Large outliers  one remaining after qc,3,,3,,1,1,03/01/1990,31/12/2021,10338.0,31/10/2008 00:00,31/12/2021 18:00,16633.0,True,True,31/10/2008 00:00,31/12/2021 18:00,4158.25,6.0,1095.0,1460.0,1.0,0.0,1336.450944,,,,2008-10-31 00:00:00,2021-12-31 18:00:00,16633.0,-0.22933446160606463,0.7492457621092393,0.890592850742561,2.1985055721036333,-0.9147384325219505,-8.09676423473691,33.15157020321156,55.152227032090124,0.7492457621092393,-4.89536351836685,-10.940714925743784,-10.9407149257439,74.0908979636148,10.9407149257439,1.3837407389110041,-0.1985055721036333
174,5002212,Grabensee,1013,AT,13.096325,47.99661,501.4,64.5,Grabensee,Danube,Danube,-,75,4552500.0,2767500.0,60.0,13.09167,47.99167,False,False,False,False,0,0,0,0,0,0,0,0,0,0,-,No discharge data available for calibration period,-,,-,,0,0,,,,,,,False,False,,,,,,,,,,,,,,,,,,,,,,,,,,,,,,,
175,2001062,Gumisch,1013,AT,14.478061,46.606288,394.34,2555.4,Gurk,Danube,Danube,-,2175,4662500.0,2622500.0,2325.5,14.475,46.60833,True,True,True,True,1,1,1,1,1,1,1,0,1,0,NRT_6h,-,3,wrong location it should be moved downstream,3,,1,1,03/01/1990,31/12/2021,9237.0,31/10/2008 00:00,31/12/2021 18:00,12536.0,True,True,31/10/2008 00:00,31/12/2021 18:00,3134.0,6.0,1095.0,1460.0,0.0,,1321.382272,,,,2008-10-31 00:00:00,2021-12-31 18:00:00,12536.0,0.822023505664718,0.8390048126653907,1.041836964841277,0.9367082109287432,0.6766936281135439,0.6188934402300632,5.559426609635831,7.4993403778957815,0.8390048126653907,1.2156845920575912,4.183696484127678,4.18369648412771,19.132391503895413,4.18369648412771,0.5686003621933908,0.9367082109287432
176,2001071,Launsdorf,1013,AT,14.476932,46.760439,510,1243.1,Gurk,Danube,Danube,-,1275,4667500.0,2637500.0,1004.1,14.475,46.75833,True,True,True,True,1,1,1,1,1,1,1,0,1,0,NRT_6h,-,3,wrong location it should be moved downstream,3,,1,1,03/01/1990,31/12/2021,10239.0,31/10/2008 00:00,31/12/2021 18:00,16267.0,True,True,31/10/2008 00:00,31/12/2021 18:00,4066.75,6.0,1095.0,1460.0,1.0,0.0,1004.109696,,,,2008-10-31 00:00:00,2021-12-31 18:00:00,16267.0,0.681381865154316,0.7137989115410736,1.1335961417958564,0.9580652445490662,0.33289828110256026,0.4642026950387821,5.181125935653391,8.568944905768499,0.7137989115410736,2.0460277376441725,13.35961417958554,13.35961417958564,33.83035441927676,13.35961417958564,0.8167629514721165,0.9580652445490662
177,2001093,Mölbling,1013,AT,14.449981,46.860144,579.26,1061,Gurk,Danube,Danube,-,925,4662500.0,2642500.0,818.1,14.44167,46.85833,True,True,True,False,1,1,1,1,1,1,1,0,0,0,NRT_6h,use after 06-2011  close to 176,2,close to 176,2,close,0,1,31/10/2008,13/07/2021,2918.0,31/10/2008 00:00,14/07/2021 12:00,11020.0,True,True,,,,,,,,,,,,,,,,,,,,,,,,,,,,,,,
178,7001073,Brixlegg,1013,AT,11.872916,47.43255,512.5,8503.6,Inn,Danube,Danube,-,8550,4457500.0,2702500.0,8501.2,11.875,47.425,True,True,True,False,1,1,1,1,1,1,1,0,1,0,NRT_6h,large oscillations  increasing low flow,0,Mild trend in low flow  use 180  223,3,close,0,0,03/01/1990,31/12/2021,10160.0,31/10/2008 00:00,31/12/2021 18:00,16320.0,True,True,,,,,,,,,,,,,,,,,,,,,,,,,,,,,,,
179,7001049,Innsbruck (oberh. Sill),1013,AT,11.396506,47.275613,568.46,5771.6,Inn,Danube,Danube,C327,5850,4422500.0,2682500.0,5795.1,11.39167,47.275,True,True,True,True,1,1,1,1,1,1,1,0,1,0,NRT_6h,oscillations  zeros removed with sanitation strongly regulated,3,,3,,1,1,01/01/1991,31/12/2021,10530.0,31/10/2008 00:00,31/12/2021 18:00,17838.0,True,True,31/10/2008 00:00,31/12/2021 18:00,4459.5,6.0,1095.0,1460.0,0.0,,703.788544,,,,2008-10-31 00:00:00,2021-12-31 18:00:00,17838.0,0.7392552922490887,0.9027736834035057,0.7582895663865145,0.9894685108570905,0.6743095718596077,0.5830533377406639,44.83476271643805,65.82503066374319,0.9027736834035057,-39.52786193317389,-24.17104336134885,-24.171043361348556,27.41618040325393,24.171043361348556,0.5706929368236394,0.9894685108570905
180,7001062,Jenbach-Rotholz,1013,AT,11.789238,47.388857,521.67,7230.7,Inn,Danube,Danube,-,7300,4452500.0,2697500.0,7232.6,11.79167,47.39167,True,True,True,True,0,1,0,1,1,0,1,0,1,0,NRT_6h,oscillations strongly regulated,3,,3,,1,1,03/01/1990,31/12/2021,10534.0,31/10/2008 00:00,31/12/2021 18:00,17787.0,True,True,31/10/2008 00:00,31/12/2021 18:00,4446.75,6.0,1095.0,1460.0,0.0,,1437.528064,,,,2008-10-31 00:00:00,2021-12-31 18:00:00,17787.0,0.8046191266324041,0.9057237525256824,0.8404089357443477,0.9382232483065513,0.7455482736766169,0.7093192682871091,45.29325529824381,69.38837042876834,0.9057237525256824,-33.98636094683239,-15.959106425565162,-15.95910642556523,21.26852836041389,15.95910642556523,0.5044320829639853,0.9382232483065513
181,7001015,Kajetansbrücke,1013,AT,10.511638,46.951979,967.16,2162,Inn,Danube,Danube,-,2125,4357500.0,2642500.0,2162.5,10.50833,46.95833,True,True,True,False,1,1,1,1,1,1,1,0,1,0,NRT_6h,Large oscillations  strongly regulated close to 184,2,close to 184,3,,1,1,03/01/1990,31/12/2021,10507.0,31/10/2008 00:00,31/12/2021 18:00,15893.0,True,True,31/10/2008 00:00,31/12/2021 18:00,3973.25,6.0,1095.0,1460.0,1.0,0.0,2162.501376,1.0,,,2008-10-31 00:00:00,2021-12-31 18:00:00,15893.0,0.11038499123337775,0.7605888979606389,0.39680635986970086,1.6084855138370142,0.04581428618039485,-1.1216371911197736,37.02412898335367,48.36274790992158,0.7605888979606389,-35.62381076115567,-60.31936401303066,-60.31936401302992,62.69042715237728,60.31936401302992,0.9768243003834441,0.3915144861629858
182,7001081,Kirchbichl-Bichlwang,1013,AT,12.093312,47.522774,484,9310,Inn,Danube,Danube,-,9525,4477500.0,2712500.0,9304.6,12.09167,47.525,True,True,True,False,0,1,0,1,1,0,1,0,1,0,NRT_6h,oscillations,1,,3,,1,0,03/01/1990,31/12/2021,10401.0,31/10/2008 00:00,31/12/2021 18:00,17203.0,True,True,31/10/2008 00:00,31/12/2021 18:00,4300.75,6.0,1095.0,1460.0,0.0,,978.288192,,,,2008-10-31 00:00:00,2021-12-31 18:00:00,17203.0,0.8566613116084756,0.9006071356341612,0.9308675717487392,0.9232683542008855,0.7966855474573681,0.7985240049774691,50.96842010713982,78.33822974558237,0.9006071356341612,-19.589046478271232,-6.913242825126153,-6.913242825126073,17.987453600895993,6.913242825126073,0.4509040391731172,0.9232683542008855
183,7001043,Magerbach,1013,AT,10.874705,47.258747,652.98,5118.8,Inn,Danube,Danube,-,5175,4387500.0,2682500.0,5091.3,10.875,47.25833,True,True,True,False,1,1,1,1,1,1,1,0,1,0,NRT_6h,oscillations  outliers  and  negative values removed with sanitation strongly regulated,1,,3,,1,0,03/01/1990,31/12/2021,10547.0,31/10/2008 00:00,31/12/2021 18:00,17801.0,True,True,31/10/2008 00:00,31/12/2021 18:00,4450.25,6.0,1095.0,1460.0,0.0,,1435.001344,1.0,,,2008-10-31 00:00:00,2021-12-31 18:00:00,17801.0,0.6814250491523006,0.8991256705324266,0.6981004352965156,1.0130775301157426,0.6200746598343176,0.5034896212420972,47.17536018727478,68.44997672445642,0.8991256705324266,-43.22858957189221,-30.18995647034852,-30.18995647034844,32.94629976669159,30.18995647034844,0.6163808402000213,0.9869224698842574
184,7001027,Perjen,1013,AT,10.571568,47.146797,768.73,3503.1,Inn,Danube,Danube,-,3650,4362500.0,2672500.0,3486.7,10.575,47.14167,True,True,True,True,1,1,1,1,1,1,1,0,0,0,NRT_6h,Large oscillations  strongly regulated,3,,3,,1,1,31/10/2008,31/12/2021,4425.0,31/10/2008 00:00,31/12/2021 18:00,17802.0,True,True,31/10/2008 00:00,31/12/2021 18:00,4450.5,6.0,1095.0,1460.0,0.0,,1035.194944,1.0,,,2008-10-31 00:00:00,2021-12-31 18:00:00,17802.0,0.813113173800161,0.834603370397006,1.0028930259038955,0.9130386802990074,0.6899840706456088,0.635511248594184,20.294647329311164,34.86460449963018,0.834603370397006,0.14381655651747552,0.289302590389594,0.28930259038954204,40.82488265319221,0.28930259038954204,0.556790741081773,0.9130386802990074
185,7001017,Prutz,1013,AT,10.660908,47.076753,861.36,2461.5,Inn,Danube,Danube,-,2525,4367500.0,2657500.0,2451.5,10.65833,47.075,True,True,True,False,1,1,1,1,1,1,1,0,1,0,NRT_6h,large oscillations negative values removed with qc  strongly regulated close to 184,2,close to 184,3,,1,1,03/01/1990,05/11/2021,10455.0,31/10/2008 00:00,12/11/2021 12:00,17393.0,True,True,31/10/2008 00:00,12/11/2021 12:00,4348.25,6.0,1095.0,1460.0,0.0,,288.982016,,,,2008-10-31 00:00:00,2021-11-12 12:00:00,17393.0,0.004080051290852427,0.7548369185048173,0.3632076828987483,1.7254289438597252,-0.198990066070049,-2.9705135185584135,49.72819342486889,61.55792645865115,0.7548369185048173,-48.76242284368392,-63.67923171012542,-63.67923171012518,64.94043911188326,63.67923171012518,1.0949840483176274,0.27457105614027477
186,7001152,Telfs (Fussgängersteg),1013,AT,11.072913,47.301656,616.12,5289.7,Inn,Danube,Danube,-,5300,4397500.0,2687500.0,5278.2,11.075,47.30833,True,True,True,False,1,1,1,1,1,1,1,0,1,0,NRT_6h,oscillations strongly regulated,1,close,3,close,0,0,03/01/1990,31/12/2021,10548.0,31/10/2008 00:00,31/12/2021 18:00,17805.0,True,True,,,,,,,,,,,,,,,,,,,,,,,,,,,,,,,
187,7001140,Lienz,1013,AT,12.766335,46.831632,669.29,1198.7,Isel,Danube,Danube,-,1200,4527500.0,2642500.0,1198.1,12.75833,46.84167,True,True,True,False,1,1,1,1,1,1,1,0,1,0,NRT_6h,outliers negative values a zeros  larger values than daily data,1,,3,,1,0,03/01/1990,31/12/2021,10551.0,31/10/2008 00:00,31/12/2021 18:00,17804.0,True,True,31/10/2008 00:00,31/12/2021 18:00,4451.0,6.0,1095.0,1460.0,1.0,0.0,1198.149376,,,,2008-10-31 00:00:00,2021-12-31 18:00:00,17804.0,0.8041525758839487,0.8935945805461607,0.8377916428098635,0.9731197265374386,0.7633164225250884,0.885873887081053,10.661196086517894,20.082594702801963,0.8935945805461607,-7.036978843743111,-16.22083571901366,-16.22083571901365,24.57496521271498,16.22083571901365,0.486501364309404,0.9731197265374386
188,3001039,Stiefern,1013,AT,15.690083,48.534688,217,1493.3,Kamp,Danube,Danube,-,1450,4737500.0,2847500.0,1492.8,15.69167,48.54167,True,True,True,True,1,1,1,1,1,1,1,0,1,0,NRT_6h,dam,3,,3,,1,1,03/01/1990,31/12/2021,10521.0,31/10/2008 00:00,31/12/2021 18:00,17682.0,True,True,31/10/2008 00:00,31/12/2021 18:00,4420.5,6.0,1095.0,1460.0,1.0,0.0,1492.814208,1.0,,,2008-10-31 00:00:00,2021-12-31 18:00:00,17682.0,0.5841495276636621,0.6173387399882373,1.1512076728386205,1.0603176185147776,-0.011250157841228736,0.12734641134982438,4.023095224731315,6.506583095935035,0.6173387399882373,1.0899680608327251,15.120767283862088,15.120767283862053,55.81107267262841,15.120767283862053,1.0056093465363372,0.9396823814852224
189,7001007,Lechaschau,1013,AT,10.709677,47.497015,836.09,1012.2,Lech,Danube,Danube,C765,1000,4367500.0,2702500.0,1020.7,10.70833,47.49167,True,True,True,True,1,1,1,1,1,1,1,0,1,0,NRT_6h,outliers removed with qc,3,,3,,1,1,01/01/1991,31/12/2021,10024.0,31/10/2008 00:00,31/12/2021 18:00,16636.0,True,True,31/10/2008 00:00,31/12/2021 18:00,4159.0,6.0,1095.0,1460.0,1.0,0.0,1020.658624,,,,2008-10-31 00:00:00,2021-12-31 18:00:00,16636.0,0.8489503419991058,0.8517965248541651,1.0110147270123513,1.0270260046201505,0.6905719762039683,0.6787795872201978,12.446611494992915,18.733319806387545,0.8517965248541651,0.46110175342640397,1.1014727012351604,1.1014727012351369,29.732272069537252,1.1014727012351369,0.5562625493380179,0.9729739953798495
190,3001121,Deutsch Brodersdorf (Straßenbrücke),1013,AT,16.477205,47.937903,193.04,-,Leitha,Danube,Danube,-,1975,4802500.0,2777500.0,1619.5,16.475,47.94167,False,False,True,False,0,0,0,0,0,1,1,0,1,0,HIST_24h,close to 191,2,close to 191,2,,1,1,03/01/1990,30/03/2010,6534.0,,,,True,False,03/01/1990 00:00,30/03/2010 00:00,6534.0,24.0,1095.0,1460.0,1.0,0.0,1619.462912,,,,1991-01-03 00:00:00,2010-03-30 00:00:00,6172.0,-0.23400245506931294,0.6403906429629913,2.1555407468745034,0.7588180111176713,-2.4786005947820264,-1.6088049031696583,13.207722179758056,16.990953599739278,0.6403906429629913,12.551014710030971,115.55407468744984,115.55407468745035,121.60021723112797,115.55407468745035,1.8651006929337688,0.7588180111176713
191,3001122,Deutsch Haslau,1013,AT,16.943102,48.04761,139.19,1982,Leitha,Danube,Danube,-,2300,4832500.0,2792500.0,1997.5,16.94167,48.04167,True,True,True,True,1,1,1,1,1,1,1,0,1,0,NRT_6h,-,3,,3,,1,1,03/01/1990,31/12/2021,10525.0,31/10/2008 00:00,31/12/2021 18:00,17563.0,True,True,31/10/2008 00:00,31/12/2021 18:00,4390.75,6.0,1095.0,1460.0,0.0,,378.011904,,,,2008-10-31 00:00:00,2021-12-31 18:00:00,17563.0,-0.07430533156354113,0.7675064015056129,2.047416381134019,0.9452496884292327,-3.361986911484185,-1.2437653874207402,11.067670056257375,14.127135413225071,0.7675064015056129,10.880087643934374,104.74163811340189,104.7416381134019,106.54747734843131,104.7416381134019,2.0885370266012004,0.9452496884292327
192,2001020,Spittal (Fasan),1013,AT,13.494837,46.807338,556.19,1035.5,Lieser,Danube,Danube,-,1050,4587500.0,2642500.0,1044.2,13.49167,46.80833,True,True,True,True,1,1,1,1,1,1,1,0,1,0,NRT_6h,-,3,,3,,1,1,03/01/1990,31/12/2021,10423.0,31/10/2008 00:00,31/12/2021 18:00,17122.0,True,True,31/10/2008 00:00,31/12/2021 18:00,4280.5,6.0,1095.0,1460.0,1.0,0.0,1044.225024,1.0,,,2008-10-31 00:00:00,2021-12-31 18:00:00,17122.0,0.4234704178992158,0.7941902413691118,1.537654923970477,1.030917390250487,-0.6304883013956832,0.1229815938196619,10.142773925490676,14.957901041987197,0.7941902413691118,9.338614219562528,53.76549239704791,53.76549239704771,58.39530593667577,53.76549239704771,1.276905752745945,0.9690826097495131
193,5001055,Mattsee,1013,AT,13.107359,47.971451,501.4,10.4,Mattsee,Danube,Danube,-,25,4547500.0,2762500.0,13.8,13.10833,47.975,False,False,False,False,0,0,0,0,0,0,0,1,0,0,-,No discharge data available for calibration period,-,,-,,0,0,,,,,,,False,False,,,,,,,,,,,,,,,,,,,,,,,,,,,,,,,
194,2001018,Millstatt (See),1013,AT,13.573447,46.800407,587,286.3,Lake Millstatt,Danube,Danube,-,275,4592500.0,2642500.0,254.5,13.575,46.79167,False,False,False,False,1,0,1,0,1,1,0,1,0,0,-,No discharge data available for calibration period,-,,-,,0,0,,,,,,,False,False,,,,,,,,,,,,,,,,,,,,,,,,,,,,,,,
195,2001007,Kolbnitz a. d. Tauernbahn VHP,1013,AT,13.302641,46.875108,607,1043.8,Moll,Danube,Danube,-,900,4567500.0,2647500.0,1053.1,13.30833,46.875,True,True,True,False,1,1,1,1,1,1,1,0,1,0,NRT_6h,oscillations moved upstream,1,,3,,1,0,03/01/1990,31/12/2021,10230.0,31/10/2008 00:00,31/12/2021 18:00,16338.0,True,True,31/10/2008 00:00,31/12/2021 18:00,4084.5,6.0,1095.0,1460.0,1.0,0.0,1053.10976,,,,2008-10-31 00:00:00,2021-12-31 18:00:00,16338.0,0.4506628371828342,0.7646418782446293,0.8093586622671661,1.4582943959107868,0.33635067482627645,-1.9112323417246557,10.621621648777067,14.023694473671382,0.7646418782446293,-4.732214547753238,-19.064133773283572,-19.06413377328339,42.79011738756239,19.06413377328339,0.8146467487038345,0.5417056040892132
196,2001008,Möllbrücke,1013,AT,13.370414,46.837335,555,1096,Moell,Danube,Danube,-,1025,4572500.0,2647500.0,1107.3,13.375,46.84167,True,True,True,False,1,1,1,1,1,1,1,0,0,0,NRT_6h,same location as 195  low quality data,0,low quality data or wrong location,0,,0,0,31/10/2008,02/10/2020,3929.0,31/10/2008 00:00,01/10/2020 12:00,13970.0,True,True,,,,,,,,,,,,,,,,,,,,,,,,,,,,,,,
197,6001079,Bruck un der Mur unter Mür,1013,AT,15.28143,47.409966,468.14,6214,Mur,Danube,Danube,C012,6325,4717500.0,2712500.0,6214.8,15.275,47.40833,True,True,True,True,1,1,1,1,1,1,1,0,1,0,HIST_24h,-,3,,3,,1,1,03/01/1990,31/12/2021,9384.0,24/12/2020 12:00,31/12/2021 18:00,1300.0,True,False,03/01/1990 00:00,31/12/2021 00:00,9384.0,24.0,1095.0,1460.0,0.0,,2493.490432,,,,1991-01-03 00:00:00,2022-01-01 00:00:00,9022.0,0.8080894005151464,0.8455995253952636,1.0438248704357516,1.1052119402337854,0.6147113803006559,0.63563482833383,26.275234526020185,40.80227100486755,0.8455995253952636,4.845412929585493,4.382487043575151,4.382487043575147,23.764925002383947,4.382487043575147,0.6207162151090809,0.8947880597662146
198,6001059,Gestüthof,1013,AT,14.209475,47.110664,776.3,1700.3,Mur,Danube,Danube,-,1725,4642500.0,2677500.0,1717.9,14.20833,47.10833,True,True,True,True,1,1,1,1,1,1,1,0,1,0,HIST_24h,-,3,,3,,1,1,03/01/1990,31/12/2021,8617.0,24/12/2020 12:00,31/12/2021 18:00,1296.0,True,False,03/01/1990 00:00,31/12/2021 00:00,8617.0,24.0,1095.0,1460.0,1.0,0.0,1717.926784,,,,1991-01-03 00:00:00,2022-01-01 00:00:00,8255.0,0.7122127154331654,0.7191978562679694,1.0500906388723532,1.0382440208556543,0.37469549630907706,0.45607771879278713,11.068236773934713,20.18611726574954,0.7191978562679694,1.781463885929499,5.009063887235301,5.009063887235317,31.12131857265172,5.009063887235317,0.7907619766345121,0.9617559791443457
199,6001082,Graz,1013,AT,15.450745,47.032312,328.67,7042.8,Mur,Danube,Danube,-,7100,4732500.0,2677500.0,7105.8,15.45833,47.025,True,True,True,False,1,1,1,1,1,1,1,0,0,0,NRT_24h,outliers,1,outliers and zeros,0,,0,0,31/10/2008,31/12/2021,2889.0,19/01/2021 12:00,31/12/2021 18:00,1199.0,True,False,,,,,,,,,,,,,,,,,,,,,,,,,,,,,,,
200,6001132,Mellach,1013,AT,15.492877,46.902063,290.8,7295.5,Mur,Danube,Danube,-,7275,4742500.0,2662500.0,7321.9,15.49167,46.90833,True,True,True,True,1,1,1,1,1,1,1,0,0,0,NRT_6h,-,3,,3,,1,1,10/02/2010,31/12/2021,3988.0,10/02/2010 00:00,31/12/2021 18:00,16020.0,True,True,10/02/2010 00:00,31/12/2021 18:00,4005.0,6.0,1095.0,1460.0,0.0,,476.282624,,,,2010-02-10 00:00:00,2021-12-31 18:00:00,16020.0,0.580579916149201,0.8388488793987822,1.2603650106338622,1.2866244656410402,-0.1383364394327793,0.32480855407719755,39.15942790640882,62.12657604480542,0.8388488793987822,27.88200812232481,26.036501063386254,26.03650106338622,36.567469669103616,26.03650106338622,1.0669285071797352,0.7133755343589598
201,6001099,Mureck (Schreibpegel),1013,AT,15.792175,46.711443,224.23,9769.9,Mur,Danube,Danube,-,9700,4762500.0,2637500.0,9776.7,15.79167,46.70833,True,True,True,False,1,1,1,1,1,1,1,0,1,0,NRT_6h,oscillations,1,,3,,1,0,03/01/1990,31/12/2021,10120.0,10/02/2010 00:00,31/12/2021 18:00,16049.0,True,True,10/02/2010 00:00,31/12/2021 18:00,4012.25,6.0,1095.0,1460.0,0.0,,242.772496,,,,2010-02-10 00:00:00,2021-12-31 18:00:00,16049.0,0.6186785058861053,0.8246411498421141,1.2225904334913467,1.2551643675411823,0.013756474862320345,0.26262845186997974,47.89804696009403,77.2090882336936,0.8246411498421141,31.32130837146346,22.259043349134473,22.259043349134664,34.039596653471534,22.259043349134664,0.99309794337602,0.7448356324588177
202,6001060,St.Georgen ob Judenburt,1013,AT,14.499123,47.211775,700.15,2367.5,Mur,Danube,Danube,-,2375,4662500.0,2687500.0,2356.9,14.49167,47.20833,True,True,True,False,1,1,1,1,1,1,1,0,1,0,HIST_24h,close to 198,2,close to 198,3,,1,1,03/01/1990,31/12/2021,8497.0,24/12/2020 12:00,31/12/2021 18:00,1285.0,True,False,03/01/1990 00:00,31/12/2021 00:00,8497.0,24.0,1095.0,1460.0,0.0,,638.93952,,,,1991-01-03 00:00:00,2022-01-01 00:00:00,8135.0,0.7712907258980783,0.7750765352767458,0.9774273017955016,0.9652460020589917,0.5713359694033177,0.64947029252198,12.544051975347955,22.09818605415997,0.7750765352767458,-1.0965040147061755,-2.2572698204498125,-2.257269820449842,25.82326153880471,2.257269820449842,0.6547243928529631,0.9652460020589917
203,6001063,Zeltweg,1013,AT,14.752621,47.185059,646.34,2957.5,Mur,Danube,Danube,-,3000,4677500.0,2687500.0,2994.8,14.75833,47.19167,True,True,True,True,1,1,1,1,1,1,1,0,1,0,NRT_6h,-,3,,3,,1,1,03/01/1990,31/12/2021,9995.0,10/02/2010 00:00,31/12/2021 18:00,15418.0,True,True,10/02/2010 00:00,31/12/2021 18:00,3854.5,6.0,1095.0,1460.0,0.0,,637.913088,,,,2010-02-10 00:00:00,2021-12-31 18:00:00,15418.0,0.7446962285861929,0.793875267226909,1.093599627710039,1.1180327070344376,0.4236583429653059,0.6270727289329752,17.071694680525635,28.338137630206955,0.793875267226909,5.624725162072687,9.359962771003884,9.359962771003902,28.40857500471768,9.359962771003902,0.7591716914076108,0.8819672929655624
204,5001056,Obertrum,1013,AT,13.073021,47.942463,501.4,2143,Obertrumer See,Danube,Danube,-,25,4552500.0,2762500.0,34.6,13.075,47.95833,False,False,False,False,0,0,0,0,0,0,0,1,0,0,-,No discharge data available for calibration period,-,,-,,0,0,,,,,,,False,False,,,,,,,,,,,,,,,,,,,,,,,,,,,,,,,
205,2001082,St.Andrä-OWF,1013,AT,13.897576,46.650714,500.29,165.4,Lake Ossiach,Danube,Danube,-,475,4622500.0,2622500.0,379.6,13.90833,46.65833,False,False,False,False,1,0,1,0,1,1,0,1,0,0,-,No discharge data available for calibration period,-,,-,,0,0,,,,,,,False,False,,,,,,,,,,,,,,,,,,,,,,,,,,,,,,,
206,2001037,Presseggen,1013,AT,13.435141,46.628475,558.78,29.6,Lake Pressegg,Danube,Danube,-,775,4582500.0,2617500.0,28.4,13.44167,46.625,False,False,False,False,1,0,1,0,1,1,0,1,0,0,-,No discharge data available for calibration period,-,on small river,-,,0,0,,,,,,,False,False,,,,,,,,,,,,,,,,,,,,,,,,,,,,,,,
207,5001052,Siezenheim,1013,AT,12.974216,47.811555,415.77,1139.1,Saalach,Danube,Danube,-,950,4542500.0,2742500.0,1132.5,12.975,47.80833,True,True,True,True,1,1,1,1,1,1,1,0,1,0,NRT_6h,Moved South to avoid conflict in inflow point,3,,3,,1,1,03/01/1990,31/12/2021,10431.0,31/10/2008 00:00,31/12/2021 18:00,17214.0,True,True,31/10/2008 00:00,31/12/2021 18:00,4303.5,6.0,1095.0,1460.0,1.0,0.0,1132.540544,,,,2008-10-31 00:00:00,2021-12-31 18:00:00,17214.0,0.7887132118683768,0.8556411665870507,0.9459979060097862,1.1445213060392891,0.6763561127322654,0.5769336372437057,11.050312460097151,17.577336584340692,0.8556411665870507,-2.0031495103275563,-5.400209399021396,-5.4002093990213815,29.790088508861096,5.4002093990213815,0.5688970796793873,0.8554786939607109
208,5001028,Golling,1013,AT,13.16345,47.595786,463.19,3555.7,Saalach,Danube,Danube,-,3675,4562500.0,2722500.0,3541.3,13.15833,47.59167,True,True,True,True,1,1,1,1,1,1,1,0,1,0,NRT_6h,-,3,,3,,1,1,03/01/1990,31/12/2021,10454.0,31/10/2008 00:00,31/12/2021 18:00,17332.0,True,True,31/10/2008 00:00,31/12/2021 18:00,4333.0,6.0,1095.0,1460.0,0.0,,578.825728,,,,2008-10-31 00:00:00,2021-12-31 18:00:00,17332.0,0.8896171118386607,0.8960054291228945,1.0357494824564064,1.0095648173544776,0.7768027774826478,0.8094545866674975,26.168390649230012,38.57753634088706,0.8960054291228945,4.918118936882372,3.574948245640627,3.5749482456406456,19.021630717618688,3.5749482456406456,0.4724375329261568,0.9904351826455224
209,5001048,Oberndorf,1013,AT,12.926735,47.939645,387.23,6120,Saalach,Danube,Danube,-,6150,4537500.0,2762500.0,6128.5,12.925,47.94167,True,True,True,False,1,1,1,1,1,1,1,0,1,0,NRT_6h,almost same location as 475 and same data use 475,2,close to 475,3,close,0,1,03/01/1990,31/12/2021,10267.0,31/10/2008 00:00,31/12/2021 18:00,16587.0,True,True,,,,,,,,,,,,,,,,,,,,,,,,,,,,,,,
210,5001034,Salzburg,1013,AT,13.036802,47.816323,408.06,4425.7,Saalach,Danube,Danube,-,4625,4552500.0,2747500.0,4420.7,13.04167,47.80833,False,False,True,False,0,0,0,0,0,1,1,0,1,0,NRT_6h,Outliear oscillations missing data better could use hist24,1,some issues with recent data  use 1021,1,close,0,0,03/01/1990,21/08/2013,7593.0,31/10/2008 00:00,20/08/2013 12:00,5707.0,True,True,,,,,,,,,,,,,,,,,,,,,,,,,,,,,,,
211,5001085,Wallnerau,1013,AT,13.12021,47.310132,597.9,2143,Saalach,Danube,Danube,-,2275,4552500.0,2692500.0,2157.2,13.125,47.30833,True,True,True,False,1,1,1,1,1,1,1,0,0,0,NRT_6h,oscillations,1,zeros,1,,1,0,31/10/2008,31/12/2021,3997.0,31/10/2008 00:00,31/12/2021 18:00,15548.0,True,True,31/10/2008 00:00,31/12/2021 18:00,3887.0,6.0,1095.0,1460.0,1.0,0.0,2157.152,1.0,,,2008-10-31 00:00:00,2021-12-31 18:00:00,15548.0,-0.2821751008011666,0.7507452833549394,2.180650731458295,0.5665153686096058,-0.970843347548195,-0.4233380415843335,54.172894123033885,63.014086138134736,0.7507452833549394,51.17009356020729,118.06507314582957,118.06507314582946,124.99345344428089,118.06507314582946,1.4038672827401435,0.5665153686096058
212,5001098,Werfen,1013,AT,13.191103,47.479884,512.13,2953.2,Saalach,Danube,Danube,-,3050,4562500.0,2707500.0,2962.5,13.19167,47.475,True,True,True,True,1,1,1,1,1,1,1,0,1,0,NRT_6h,-,3,,3,,1,1,02/01/1995,31/12/2021,8600.0,31/10/2008 00:00,31/12/2021 18:00,16824.0,True,True,31/10/2008 00:00,31/12/2021 18:00,4206.0,6.0,1095.0,1460.0,0.0,,805.307008,,,,2008-10-31 00:00:00,2021-12-31 18:00:00,16824.0,0.851850019714997,0.8649084486998341,1.0113645779229392,0.9402544077408647,0.7403052007503018,0.6982273275711096,26.259112968069974,36.96081292705001,0.8649084486998341,1.3761270545466024,1.1364577922939465,1.136457792293929,21.68576909573377,1.136457792293929,0.509602589524129,0.9402544077408647
213,6001095,Leibnitz,1013,AT,15.534549,46.771039,262.98,1102.5,Sulm,Danube,Danube,-,1125,4742500.0,2642500.0,1112.7,15.54167,46.775,True,True,True,True,1,1,1,1,1,1,1,0,1,0,NRT_6h,large outliers removed with qc,3,,3,,1,1,03/01/1990,31/12/2021,10062.0,11/02/2010 00:00,31/12/2021 18:00,15364.0,True,True,11/02/2010 00:00,31/12/2021 18:00,3841.0,6.0,1095.0,1460.0,1.0,0.0,1112.716416,,,,2010-02-11 00:00:00,2021-12-31 18:00:00,15364.0,0.32817216784267156,0.6953676864155376,1.0393820388107524,1.5974954766360174,-0.4488046504965302,-1.7794507677790814,12.217546707122853,23.164721654178816,0.6953676864155376,0.6199996164822658,3.938203881075216,3.9382038810752515,77.60519293899478,3.9382038810752515,1.2036630136780484,0.40250452336398257
214,3001089,Raabs an der Thaya,1013,AT,15.499183,48.844976,395.44,1405.8,Thaya,Danube,Danube,-,1375,4722500.0,2872500.0,1423.2,15.49167,48.84167,True,True,True,True,1,1,1,1,1,1,1,0,1,0,NRT_6h,-,3,,3,,1,1,03/01/1990,31/12/2021,10391.0,31/10/2008 00:00,31/12/2021 18:00,17095.0,True,True,31/10/2008 00:00,31/12/2021 18:00,4273.75,6.0,1095.0,1460.0,0.0,,900.183104,,,,2008-10-31 00:00:00,2021-12-31 18:00:00,17095.0,0.6360487292327426,0.6966400356827521,1.1964094668008347,1.0430880597561725,0.16224709849499164,0.11501988741554925,4.5325683831068995,8.239854806169234,0.6966400356827521,1.2443633349784877,19.640946680083506,19.640946680083477,71.54175266500751,19.640946680083477,0.915288425309208,0.9569119402438275
215,4001154,Theresienthal,1013,AT,13.799809,47.936669,410,1397.7,Traun,Danube,Danube,-,1425,4602500.0,2762500.0,1405.4,13.79167,47.94167,True,True,True,False,1,1,1,1,1,1,1,0,0,0,-,Not enough discarge data available for calibration period,-,,-,,0,0,06/04/2018,31/12/2021,1239.0,05/04/2018 18:00,31/12/2021 18:00,5209.0,False,False,,,,,,,,,,,,,,,,,,,,,,,,,,,,,,,
216,4001181,Wels-Lichtenegg,1013,AT,13.995787,48.141089,309,3387.1,Traun,Danube,Danube,-,3425,4612500.0,2782500.0,3479.7,13.99167,48.14167,True,True,True,False,1,1,1,1,1,1,1,0,0,0,NRT_6h,low quality data outliers in low flow,0,some issues with low flow that goes to zero,3,,1,0,27/11/2009,31/12/2021,3915.0,27/11/2009 00:00,31/12/2021 18:00,15390.0,True,True,27/11/2009 00:00,31/12/2021 18:00,3847.5,6.0,1095.0,1460.0,0.0,,2245.175552,1.0,,,2009-11-27 00:00:00,2021-12-31 18:00:00,15390.0,0.8060689110342777,0.8583897092774764,1.1305259178462492,0.9772233101766866,0.6450162890002855,0.5946210920203866,29.484175734897256,48.482768133239105,0.8583897092774764,14.35274698822696,13.052591784624898,13.052591784624932,26.813327810309104,13.052591784624932,0.5958050948084572,0.9772233101766866
217,5001053,Wallersee (SP),1013,AT,13.157707,47.91587,504.25,109.8,Wallersee,Danube,Danube,-,75,4557500.0,2762500.0,103.9,13.15833,47.90833,False,False,False,False,0,0,0,0,0,0,0,1,0,0,-,No discharge data available for calibration period,-,,-,,0,0,,,,,,,False,False,,,,,,,,,,,,,,,,,,,,,,,,,,,,,,,
218,2001022,Techendorf,1013,AT,13.29488,46.71318,927.92,48.4,Weissensee Lake,Danube,Danube,-,50,4577500.0,2627500.0,14.2,13.29167,46.70833,False,False,False,False,1,0,1,0,1,1,0,1,0,0,-,No discharge data available for calibration period,-,,-,,0,0,,,,,,,False,False,,,,,,,,,,,,,,,,,,,,,,,,,,,,,,,
219,2001056,Pörtschach am Wörther See,1013,AT,14.138935,46.634327,439.01,162.1,Lake Worth,Danube,Danube,-,100,4637500.0,2622500.0,82.8,14.14167,46.625,False,False,False,False,1,0,1,0,1,1,0,1,0,0,-,No discharge data available for calibration period,-,,-,,0,0,,,,,,,False,False,,,,,,,,,,,,,,,,,,,,,,,,,,,,,,,
220,5001059,St.Gilgen,1013,AT,13.368793,47.765893,537.3,124.8,Wolfgangsee,Danube,Danube,-,100,4577500.0,2742500.0,108.9,13.44167,47.74167,False,False,False,False,0,0,0,0,0,0,0,0,0,0,-,No discharge data available for calibration period,-,,-,,0,0,,,,,,,False,False,,,,,,,,,,,,,,,,,,,,,,,,,,,,,,,
221,3001008,Greimpersdorf,1013,AT,14.891028,48.110874,261.73,1116.6,Ybbs,Danube,Danube,-,1100,4682500.0,2787500.0,1124.2,14.89167,48.10833,True,True,True,True,1,1,1,1,1,1,1,0,1,0,NRT_6h,-,3,,3,,1,1,03/01/1990,10/09/2021,10145.0,31/10/2008 00:00,14/09/2021 12:00,16198.0,True,True,31/10/2008 00:00,14/09/2021 12:00,4049.5,6.0,1095.0,1460.0,1.0,0.0,1124.203264,,,,2008-10-31 00:00:00,2021-09-14 12:00:00,16198.0,0.8283979017558607,0.8417630878879878,1.0224933853856666,1.0624692514837375,0.6483551060641712,0.4581346853845313,10.813101457329884,19.554386266334607,0.8417630878879878,0.6415704451212842,2.2493385385666707,2.2493385385666564,37.91060828060052,2.2493385385666564,0.5929965378784527,0.9375307485162625
222,5001011,Zell am See,1013,AT,12.800167,47.322755,747.72,53.3,Lake Zell,Danube,Danube,-,225,4532500.0,2692500.0,39.7,12.80833,47.325,False,False,False,False,0,0,0,0,0,0,0,1,0,0,-,No discharge data available for calibration period,-,,-,,0,0,,,,,,,False,False,,,,,,,,,,,,,,,,,,,,,,,,,,,,,,,
223,7001071,Hart im Zillertal,1013,AT,11.862502,47.346304,530.95,1094.7,Ziller,Danube,Danube,-,1175,4462500.0,2692500.0,1093.6,11.85833,47.34167,True,True,True,False,0,1,0,1,1,0,1,0,1,0,NRT_6h,large oscillations low quality  same for daily data,0,Regulated  negative value,1,,1,0,03/01/1990,31/12/2021,10539.0,31/10/2008 00:00,31/12/2021 18:00,17778.0,True,True,31/10/2008 00:00,31/12/2021 18:00,4444.5,6.0,1095.0,1460.0,1.0,0.0,1093.619456,1.0,,,2008-10-31 00:00:00,2021-12-31 18:00:00,17778.0,0.6404528929291676,0.6467983081738822,0.9406324703494612,1.0315940424346914,0.3058152290426779,0.30636864800638464,18.910216261193476,25.69685551874161,0.6467983081738822,-2.732011128415101,-5.936752965053843,-5.936752965053884,41.092542153580844,5.936752965053884,0.8331775146733883,0.9684059575653086
224,8001033,Bregenz-Hafen,1013,AT,9.747829,47.506054,392.13,10907,Lake Constance,Rhine,Rhine,-,150,4302500.0,2712500.0,871.5,9.74167,47.49167,False,False,False,False,1,0,1,0,1,1,0,1,0,0,-,No discharge data available for calibration period,-,possibly measuring lake WL,-,no_calib,0,0,,,,,,,False,False,,,,,,,,,,,,,,,,,,,,,,,,,,,,,,,
225,8001014,Gisingen,1013,AT,9.578855,47.260356,434.3,1281,Ill,Rhine,Rhine,-,1300,4292500.0,2677500.0,1284.6,9.59167,47.275,True,True,True,False,1,1,1,1,1,1,1,0,1,0,NRT_6h,large ascillationslow quality data,0,,3,,1,0,03/01/1990,31/12/2021,9571.0,07/02/2010 00:00,31/12/2021 18:00,13933.0,True,True,07/02/2010 00:00,31/12/2021 18:00,3483.25,6.0,1095.0,1460.0,1.0,0.0,1284.624384,,,,2010-02-07 00:00:00,2021-12-31 18:00:00,13933.0,0.7229550478401416,0.7511491056268181,0.9228057429105344,0.9058289611434006,0.5406972958269047,0.44952568118868363,20.708319950021608,26.038609979778606,0.7511491056268181,-4.911916330942752,-7.719425708946579,-7.719425708946563,32.54459698433141,7.719425708946563,0.6777187500527738,0.9058289611434006
226,8001001,Bangs,1013,AT,9.533689,47.272002,419.93,4647.9,Rhine,Rhine,Rhine,-,4650,4282500.0,2677500.0,4883.7,9.54167,47.275,True,True,True,False,1,1,1,1,1,1,1,0,1,0,NRT_6h,oscillations,1,close to 227,3,close,0,0,02/01/1996,31/12/2021,8008.0,10/02/2010 00:00,31/12/2021 18:00,16340.0,True,True,,,,,,,,,,,,,,,,,,,,,,,,,,,,,,,
227,8001019,Lustenau (Eisenbahnbrücke),1013,AT,9.658374,47.447569,394.04,6301.1,Rhine,Rhine,Rhine,-,6350,4292500.0,2697500.0,6513.8,9.65833,47.44167,True,True,True,True,1,1,1,1,1,1,1,0,1,0,NRT_6h,oscillations,3,,3,,1,1,03/01/1990,31/12/2021,9630.0,10/02/2010 00:00,31/12/2021 18:00,15629.0,True,True,10/02/2010 00:00,31/12/2021 18:00,3907.25,6.0,1095.0,1460.0,0.0,,1953.303808,,,,2010-02-10 00:00:00,2021-12-31 18:00:00,15629.0,0.8444980756963232,0.8731310030396625,0.9149100005044183,0.9709345900034729,0.7400654736888139,0.6492394714880716,50.176836852948995,70.64573614373916,0.8731310030396625,-20.581301630494217,-8.508999949558177,-8.508999949558175,20.744786210126623,8.508999949558175,0.5098377450828717,0.9709345900034729
228,42010,Bezdan,1020,RS,18.859776,45.854141,80.64,210250,Danube,Danube,Danube,-,209100,5002500.0,2577500.0,209318.9,18.825,45.875,True,True,True,False,1,1,1,1,1,1,1,1,1,0,NRT_6h,zeros  same location as 866,2,close to 866  CHECK WITH DP,3,,1,1,02/01/1991,31/12/2021,9593.0,31/10/2008 12:00,31/12/2021 18:00,18304.0,True,True,31/10/2008 12:00,31/12/2021 18:00,4576.0,6.0,1095.0,1460.0,0.0,,12739.25018,1.0,,recommended,2008-10-31 12:00:00,2021-12-31 18:00:00,18304.0,0.716068225166417,0.7912619382602806,1.1107207665829348,1.1574375628259685,0.2977387459132179,0.45601711924654986,497.8632867210969,724.8152782987838,0.7912619382602806,250.67364742517105,11.072076658293463,11.072076658293488,21.990267156309027,11.072076658293488,0.8380102947379457,0.8425624371740315
229,42060,Banatska Palanka,1020,RS,21.340262,44.826209,62.85,568648,Danube,Danube,Danube,-,564150,5217500.0,2482500.0,560918.0,21.34167,44.825,False,False,True,False,1,0,1,0,1,1,1,1,0,0,NRT_6h,no data all zeros,0,no data all zeros,0,,0,0,,,,,,,True,True,,,,,,,,,,,,,,,,,,,,,,,,,,,,,,,
230,42401,Jasa Tomic,1020,RS,20.856642,45.431594,73.46,5334,Tamis,Danube,Danube,-,4550,5167500.0,2547500.0,5434.9,20.85833,45.425,True,True,True,False,1,1,1,1,1,1,1,1,1,0,NRT_6h,Removed because of error in LDD,0,wrong LDD,3,no_calib,0,1,02/01/2008,31/12/2021,3442.0,31/10/2008 12:00,31/12/2021 18:00,16396.0,True,True,,,,,,,,,,,,recommended,,,,,,,,,,,,,,,,,,,
231,42660,Kusic,1020,RS,21.485225,44.870834,91,1337,Nera,Danube,Danube,-,1425,5232500.0,2487500.0,1350.2,21.49167,44.875,True,True,True,True,1,1,1,1,1,1,1,1,1,0,NRT_6h,-,3,,3,,1,1,02/01/2008,31/12/2021,3513.0,31/10/2008 12:00,31/12/2021 18:00,17688.0,True,True,31/10/2008 12:00,31/12/2021 18:00,4422.0,6.0,1095.0,1460.0,1.0,0.0,1350.156032,,,recommended,2008-10-31 12:00:00,2021-12-31 18:00:00,17688.0,0.819388811251345,0.8580489425363738,0.9804394403075554,0.890055999296556,0.7357813153796673,0.6819991101439378,4.465131372712805,7.906593117735642,0.8580489425363738,-0.24495181941105046,-1.9560559692443837,-1.9560559692444663,35.6561829018254,1.9560559692444663,0.5140220662776224,0.890055999296556
232,42929,Zajecar,1020,RS,22.293443,43.892142,124.41,2150,Beli Timok,Danube,Danube,-,2125,5307500.0,2387500.0,2129.4,22.29167,43.89167,True,True,True,True,1,1,1,1,1,1,1,1,1,0,NRT_6h,-,3,,3,,1,1,02/01/2008,31/12/2021,3494.0,31/10/2008 12:00,31/12/2021 18:00,17935.0,True,True,31/10/2008 12:00,31/12/2021 18:00,4483.75,6.0,1095.0,1460.0,0.0,,892.884736,1.0,,recommended,2008-10-31 12:00:00,2021-12-31 18:00:00,17935.0,0.7569955786116256,0.7701923165618514,1.0458093405996414,1.0643512374466597,0.47441651375841565,0.22474441922751387,5.7023240789402205,11.677857676339618,0.7701923165618514,0.5552493634165765,4.58093405996421,4.5809340599641475,47.04547598836811,4.5809340599641475,0.724971369256462,0.9356487625533403
233,42901,Cokonjar,1020,RS,22.355994,44.011722,97.05,3945,Veliki Timok,Danube,Danube,-,3950,5307500.0,2402500.0,3962.4,22.35833,44.00833,True,True,True,True,1,1,1,1,1,1,1,1,1,0,NRT_6h,-,3,,3,,1,1,30/09/2006,31/12/2021,1821.0,31/10/2008 12:00,31/12/2021 18:00,8147.0,True,True,31/10/2008 12:00,31/12/2021 18:00,2036.75,6.0,1095.0,1460.0,0.0,,660.71136,,,recommended,2008-10-31 12:00:00,2021-12-31 18:00:00,8147.0,0.811216916644779,0.8540015549373313,1.0424166709430112,0.8880878352166327,0.7233074325147679,0.49635685161248666,10.363704199946277,18.067324164192435,0.8540015549373313,1.008611408977388,4.24166709430111,4.241667094301106,43.58406288954446,4.241667094301106,0.5260157483243557,0.8880878352166327
234,45084,Jamena,1020,RS,19.084006,44.877743,72.44,64073,Sava,Danube,Danube,-,63375,5032500.0,2457500.0,61444.9,19.09167,44.875,True,True,True,True,1,1,1,1,1,1,1,1,1,0,NRT_6h,zeros,3,,3,,1,1,02/01/2006,31/12/2021,4118.0,21/08/2009 12:00,31/12/2021 18:00,14233.0,True,True,21/08/2009 12:00,31/12/2021 18:00,3558.25,6.0,1095.0,1460.0,0.0,,940.721792,,,recommended,2009-08-21 12:00:00,2021-12-31 18:00:00,14233.0,0.900264491538449,0.9028884986228283,0.9783331757080489,1.0068612443082425,0.8075504688914222,0.8070767743456275,252.86035800063192,351.7127015818188,0.9028884986228283,-24.15008392536678,-2.1666824291951294,-2.1666824291951152,22.685970633190646,2.1666824291951152,0.4386907009597744,0.9931387556917575
235,45090,Sremaska Mitrovica,1020,RS,19.60019,44.965672,72.22,87996,Sava,Danube,Danube,C810,87100,5072500.0,2477500.0,84873.4,19.59167,44.975,True,True,True,True,1,1,1,1,1,1,1,1,1,0,NRT_6h,-,3,,3,,1,1,01/01/1991,31/12/2021,10766.0,31/10/2008 12:00,31/12/2021 18:00,17831.0,True,True,31/10/2008 12:00,31/12/2021 18:00,4457.75,6.0,1095.0,1460.0,0.0,,4720.497152,,,recommended,2008-10-31 12:00:00,2021-12-31 18:00:00,17831.0,0.8996104760087401,0.9037443936150029,1.014745949951488,0.9755977106263272,0.8088404274340706,0.8135641285656744,317.8281139646827,438.24110823312134,0.9037443936150029,21.874494075517994,1.4745949951488018,1.4745949951487947,21.425306777469107,1.4745949951487947,0.43721799204278883,0.9755977106263272
236,45882,Radalj,1020,RS,19.14799,44.41907,129.47,17490,Drina,Danube,Danube,C871,17850,5047500.0,2412500.0,17739.8,19.14167,44.425,True,True,True,True,1,1,1,1,1,1,1,1,1,0,NRT_6h,dam  moved station downstream,3,,3,,1,1,02/01/1991,31/12/2021,10019.0,31/10/2008 12:00,31/12/2021 18:00,18095.0,True,True,31/10/2008 12:00,31/12/2021 18:00,4523.75,6.0,1095.0,1460.0,0.0,,2842.669824,,,recommended,2008-10-31 12:00:00,2021-12-31 18:00:00,18095.0,0.7390552214767987,0.7452928780736744,1.0301918325788895,0.9519904933991319,0.49859626688205905,0.3911999577610096,143.16262951077806,195.14438138820924,0.7452928780736744,10.433285531532153,3.0191832578888986,3.019183257888941,41.428389251686085,3.019183257888941,0.7080986747042629,0.9519904933991319
237,45910,Beli Brod,1020,RS,20.199508,44.371198,99.32,1896,Kolubara,Danube,Danube,-,1825,5132500.0,2417500.0,1829.5,20.19167,44.375,True,True,True,True,1,1,1,1,1,1,1,1,1,0,NRT_6h,-,3,,3,,1,1,02/01/2008,31/12/2021,3504.0,10/02/2009 18:00,31/12/2021 18:00,17936.0,True,True,10/02/2009 18:00,31/12/2021 18:00,4484.0,6.0,1095.0,1460.0,0.0,,830.905984,,,recommended,2009-02-10 18:00:00,2021-12-31 18:00:00,17936.0,0.5854244997416325,0.7048375468793904,1.021234989013699,1.2903464257122648,0.1209402981209815,-2.085773599771463,8.896396634882503,19.12551536014383,0.7048375468793904,0.28687103164711913,2.1234989013698526,2.1234989013698957,65.85359411110603,2.1234989013698957,0.9375818374302018,0.7096535742877352
238,47010,Varvarin,1020,RS,21.373063,43.724576,126.13,31548,Velika Morava,Danube,Danube,-,31400,5237500.0,2357500.0,31504.6,21.39167,43.70833,True,True,True,True,1,1,1,1,1,1,1,1,1,0,NRT_6h,zeros,3,,3,,1,1,02/01/2008,31/12/2021,3506.0,31/10/2008 12:00,31/12/2021 18:00,18220.0,True,True,31/10/2008 12:00,31/12/2021 18:00,4555.0,6.0,1095.0,1460.0,0.0,,1293.419008,1.0,,recommended,2008-10-31 12:00:00,2021-12-31 18:00:00,18220.0,0.7449198718975674,0.8496232173093521,1.1944212148374165,0.9317864661411954,0.6221486419016695,0.6478695392001115,69.93628334519254,122.75335700172302,0.8496232173093521,34.80262161042449,19.44212148374167,19.44212148374164,39.0691750793662,19.44212148374164,0.6146961510358866,0.9317864661411954
239,47040,Bagrdan,1020,RS,21.195798,44.070498,100.94,33446,Velika Morava,Danube,Danube,-,33500,5222500.0,2392500.0,33657.8,21.20833,44.05833,True,True,True,True,1,1,1,1,1,1,1,1,1,0,NRT_6h,zeros,3,,3,,1,1,02/01/2008,31/12/2021,3518.0,31/10/2008 12:00,31/12/2021 18:00,17838.0,True,True,31/10/2008 12:00,31/12/2021 18:00,4459.5,6.0,1095.0,1460.0,0.0,,2153.167616,,,recommended,2008-10-31 12:00:00,2021-12-31 18:00:00,17838.0,0.8433617304005926,0.8546973084000934,1.0574062049927755,0.9887215716854475,0.6912201684706399,0.7576227316093588,65.73261994740075,125.78746461408075,0.8546973084000934,12.167427915823474,5.740620499277551,5.740620499277556,31.01280140320704,5.740620499277556,0.5556796123031328,0.9887215716854475
240,47101,Kratovska stena,1020,RS,20.118569,43.87126,290.44,3077,Zapadna Morava,Danube,Danube,-,3075,5132500.0,2362500.0,3090.3,20.125,43.875,True,True,True,True,1,1,1,1,1,1,1,1,1,0,NRT_6h,-,3,,3,,1,1,02/01/2008,31/12/2021,3469.0,21/11/2008 00:00,31/12/2021 18:00,17906.0,True,True,21/11/2008 00:00,31/12/2021 18:00,4476.5,6.0,1095.0,1460.0,1.0,0.0,3090.257664,1.0,,recommended,2008-11-21 00:00:00,2021-12-31 18:00:00,17906.0,0.8145584735826733,0.8176769800879543,0.9838609412906416,0.9702274133788183,0.6496816041752836,0.42403760594223194,13.57581277090489,24.654956221810515,0.8176769800879543,-0.5505057277249567,-1.6139058709358456,-1.613905870935839,39.79992001942617,1.613905870935839,0.5918770107249615,0.9702274133788183
241,47120,Milocaj,1020,RS,20.627096,43.775839,194.27,4658,Zapadna Morava,Danube,Danube,-,4675,5177500.0,2357500.0,4609.0,20.625,43.775,True,True,True,False,1,1,1,1,1,1,1,1,1,0,NRT_6h,Small oscillations   zeros removed with qc close to 240,2,close to 240,2,,1,1,02/01/2008,13/04/2021,3256.0,31/10/2008 12:00,12/04/2021 12:00,17100.0,True,True,31/10/2008 12:00,12/04/2021 12:00,4275.0,6.0,1095.0,1460.0,0.0,,1518.765824,1.0,,recommended,2008-10-31 12:00:00,2021-04-12 12:00:00,17100.0,0.609351567984498,0.814911616429386,1.2770554949387094,0.7960668236219168,0.585368153699911,0.5646610494615935,17.356863342407756,29.347291063884093,0.814911616429386,8.88743593777145,27.705549493871104,27.705549493870944,54.10800592639935,27.705549493870944,0.6439191302485799,0.7960668236219168
242,47195,Jasika,1020,RS,21.295077,43.608124,138.56,14721,Zapadna Morava,Danube,Danube,C867,14600,5232500.0,2347500.0,14554.1,21.29167,43.60833,True,True,True,True,1,1,1,1,1,1,1,1,1,0,NRT_6h,-,3,,3,,1,1,01/01/1991,31/12/2021,10536.0,31/10/2008 12:00,31/12/2021 18:00,18363.0,True,True,31/10/2008 12:00,31/12/2021 18:00,4590.75,6.0,1095.0,1460.0,0.0,,2228.775424,1.0,,recommended,2008-10-31 12:00:00,2021-12-31 18:00:00,18363.0,0.7161834081317315,0.8403396854662993,1.2322303323831847,0.9663917494666181,0.5363265864554295,0.6517326022678435,37.445466114235295,68.66549567812413,0.8403396854662993,21.86382650919262,23.22303323831824,23.223033238318468,39.773335368792274,23.223033238318468,0.6809356897274295,0.9663917494666181
243,47528,Vranjski Priboj,1020,RS,22.012318,42.600342,349.98,2775,Juzna Morava,Danube,Danube,-,2825,5307500.0,2247500.0,2806.2,22.00833,42.60833,True,True,True,True,1,1,1,1,1,1,1,1,1,0,NRT_6h,-,3,,3,,1,1,02/01/2008,31/12/2021,3498.0,31/10/2008 12:00,31/12/2021 18:00,18204.0,True,True,31/10/2008 12:00,31/12/2021 18:00,4551.0,6.0,1095.0,1460.0,1.0,0.0,2806.15168,,,recommended,2008-10-31 12:00:00,2021-12-31 18:00:00,18204.0,0.7685314417417951,0.8284679796546527,0.8542549447906763,1.0539707174346102,0.6723022101458789,-1.4549191233273975,4.709887845320694,8.613817588487736,0.8284679796546527,-1.418648227555346,-14.574505520932307,-14.574505520932375,48.38710898958241,14.574505520932375,0.572448940827141,0.9460292825653898
244,47540,Grdelica,1020,RS,22.061887,42.890972,251.63,3782,Juzna Morava,Danube,Danube,C864,3775,5302500.0,2282500.0,3743.7,22.05833,42.89167,True,True,True,False,1,1,1,1,1,1,1,1,1,0,NRT_6h,oscillations  outliers removed with qc close to 243,2,close to 243,3,,1,1,01/01/1991,31/12/2021,10611.0,31/10/2008 12:00,31/12/2021 18:00,17715.0,True,True,31/10/2008 12:00,31/12/2021 18:00,4428.75,6.0,1095.0,1460.0,0.0,,937.529472,,,recommended,2008-10-31 12:00:00,2021-12-31 18:00:00,17715.0,0.468046807470627,0.8080855031623548,0.5068343534247851,1.0541356627722978,0.43643461790093574,-0.13664714631009356,16.448825937101542,29.775963010449797,0.8080855031623548,-14.925050551583984,-49.31656465752149,-49.31656465752149,54.35154708948644,49.31656465752149,0.7507099187429602,0.9458643372277022
245,47550,Korvingrad,1020,RS,21.838303,43.219521,188.09,9396,Juzna Morava,Danube,Danube,-,9450,5282500.0,2312500.0,9516.2,21.84167,43.225,True,True,True,True,1,1,1,1,1,1,1,1,1,0,NRT_6h,oscillations   08-2010 to 11-2010  zeros removed with qc,3,,3,,1,1,02/01/2008,31/12/2021,3523.0,31/10/2008 12:00,31/12/2021 18:00,18149.0,True,True,31/10/2008 12:00,31/12/2021 18:00,4537.25,6.0,1095.0,1460.0,0.0,,3566.822656,1.0,,recommended,2008-10-31 12:00:00,2021-12-31 18:00:00,18149.0,0.8238620476923559,0.82559293314562,0.99123245695677,0.9769808022866391,0.6611549099159262,0.647866819504936,22.32065231697963,40.16239384773507,0.82559293314562,-0.490863093747151,-0.8767543043230149,-0.8767543043229975,39.867996277369116,0.8767543043229975,0.5821040199861831,0.9769808022866391
246,47590,Mojsinje,1020,RS,21.485787,43.63055,136.28,15390,Juzna Morava,Danube,Danube,C863,15400,5252500.0,2347500.0,15657.2,21.49167,43.625,True,True,True,True,1,1,1,1,1,1,1,1,1,0,NRT_6h,small oscillations  outliers  zeros  removed with qc ,3,,3,,1,1,01/01/1991,31/12/2021,10672.0,31/10/2008 12:00,31/12/2021 18:00,17906.0,True,True,31/10/2008 12:00,31/12/2021 18:00,4476.5,6.0,1095.0,1460.0,0.0,,2123.40416,1.0,,recommended,2008-10-31 12:00:00,2021-12-31 18:00:00,17906.0,0.8267631001625135,0.8314310299289991,0.968724452122986,1.0248468488846758,0.6644849612462518,0.7178059185099548,31.490015743858848,64.17546249636413,0.8314310299289991,-3.043331278245828,-3.127554787701404,-3.1275547877014085,32.361494855488154,3.1275547877014085,0.5792365999777193,0.9751531511153242
247,47890,Doljevac,1020,RS,21.830671,43.20241,190.41,2052,Toplica,Danube,Danube,-,2075,5277500.0,2307500.0,2205.7,21.825,43.20833,True,True,True,True,1,1,1,1,1,1,1,1,1,0,NRT_6h,-,3,,3,,1,1,02/01/2008,31/12/2021,3517.0,31/10/2008 12:00,31/12/2021 18:00,18052.0,True,True,31/10/2008 12:00,31/12/2021 18:00,4513.0,6.0,1095.0,1460.0,1.0,0.0,2205.688832,,,recommended,2008-10-31 12:00:00,2021-12-31 18:00:00,18052.0,0.7312326402413093,0.7319205524321896,1.0033338641198015,1.0189258768205263,0.4513687684660773,-0.9802796828998932,5.824170847710129,11.003791011259239,0.7319205524321896,0.03464853741475023,0.33338641198012436,0.3333864119801539,56.03986680404205,0.3333864119801539,0.7406964503316706,0.9810741231794737
248,47920,Pirot,1020,RS,22.588755,43.159234,364.27,1745,Nisava,Danube,Danube,-,1700,5347500.0,2307500.0,1793.6,22.60833,43.14167,True,True,True,True,1,1,1,1,1,1,1,1,1,0,NRT_6h,-,3,,3,,1,1,02/01/2008,31/12/2021,3488.0,31/10/2008 12:00,31/12/2021 18:00,18065.0,True,True,31/10/2008 12:00,31/12/2021 18:00,4516.25,6.0,1095.0,1460.0,1.0,0.0,1793.577856,,,recommended,2008-10-31 12:00:00,2021-12-31 18:00:00,18065.0,-0.13275884752402667,0.307338768659945,0.7866989925128248,1.8705548262156704,-1.3043184949831104,-0.07642309166161732,10.124777040862517,28.781392333463234,0.307338768659945,-3.947898361955762,-21.33010074871675,-21.330100748717523,54.703159640843424,21.330100748717523,1.517998186752248,0.12944517378432963
249,47990,Nis,1020,RS,21.90196,43.326211,187.88,3870,Nisava,Danube,Danube,C865,4050,5287500.0,2322500.0,4017.6,21.90833,43.325,True,True,True,True,1,1,1,1,1,1,1,1,1,0,NRT_6h,-,3,,3,,1,1,01/01/1991,31/12/2021,10298.0,31/10/2008 12:00,31/12/2021 18:00,18279.0,True,True,31/10/2008 12:00,31/12/2021 18:00,4569.75,6.0,1095.0,1460.0,0.0,,2223.972864,1.0,,recommended,2008-10-31 12:00:00,2021-12-31 18:00:00,18279.0,0.43332185352861763,0.5542948847481697,1.0612091776076107,1.3445642298660645,-0.4571244186128405,0.5381623313201325,12.332103856272685,35.74936293559382,0.5542948847481697,1.6195544476032762,6.120917760761096,6.1209177607610625,46.60775291199133,6.1209177607610625,1.2071140868256236,0.6554357701339355
250,42035,Novi Sad,1020,RS,19.855473,45.254979,71.73,254085,Danube,Danube,Danube,-,256375,5087500.0,2507500.0,255275.2,19.85833,45.25833,True,True,True,False,1,1,1,1,1,1,1,1,1,0,NRT_6h,no data,0,all zeros apart few outliers,0,,0,1,02/01/2008,31/12/2021,2970.0,31/05/2011 12:00,31/12/2021 18:00,371.0,True,True,,,,,,,,,,,,recommended,,,,,,,,,,,,,,,,,,,
251,42045,Zemun,1020,RS,20.412392,44.849016,67.87,412762,Danube,Danube,Danube,-,406800,5142500.0,2472500.0,413365.1,20.40833,44.85833,False,False,True,False,1,0,1,0,1,1,1,1,0,0,NRT_6h,no data,0,all zeros,0,,0,1,,,,,,,True,True,,,,,,,,,,,,recommended,,,,,,,,,,,,,,,,,,,
252,44010,Novi Knezevac,1020,RS,20.088536,46.048984,73.57,140130,Tisza,Danube,Danube,-,140675,5097500.0,2607500.0,141358.8,20.09167,46.04167,False,False,True,False,1,0,1,0,1,1,1,1,0,0,NRT_6h,only few low quality data,0,almost all zeros,0,,0,0,01/06/2011,28/06/2011,28.0,31/05/2011 12:00,27/06/2011 12:00,103.0,True,True,,,,,,,,,,,,,,,,,,,,,,,,,,,,,,,
253,44020,Senta,1020,RS,20.094575,45.931324,72.8,141715,Tisza,Danube,Danube,C817,141250,5102500.0,2582500.0,141543.1,20.09167,45.94167,False,False,True,False,1,0,1,0,1,1,1,1,1,0,NRT_6h,extremely low quality data  could use Hist24,1,low quality data,0,,0,0,01/01/1991,01/01/2020,9988.0,09/03/2010 06:00,15/08/2011 06:00,165.0,True,True,,,,,,,,,,,,,,,,,,,,,,,,,,,,,,,
254,44035,N.Becej brana gv,1020,RS,20.120245,45.576443,71,145415,Tisza,Danube,Danube,-,147050,5107500.0,2542500.0,150492.1,20.125,45.575,False,False,True,False,1,0,1,0,1,1,1,1,0,0,NRT_6h,no data,0,all zeros,0,,0,1,,,,,,,True,True,,,,,,,,,,,,exclude,,,,,,,,,,,,,,,,,,,
255,44040,Titel,1020,RS,20.315521,45.205855,69.7,157174,Tisza,Danube,Danube,-,149025,5127500.0,2507500.0,156806.4,20.30833,45.20833,False,False,True,False,1,0,1,0,1,1,1,1,0,0,NRT_6h,no data,0,all zeros,0,,0,1,,,,,,,True,True,,,,,,,,,,,,exclude,,,,,,,,,,,,,,,,,,,
256,45099,Beograd,1020,RS,20.449554,44.815276,68.28,95719,Sava,Danube,Danube,-,95300,5147500.0,2467500.0,92889.3,20.44167,44.80833,False,False,True,False,1,0,1,0,1,1,1,1,0,0,-,No discharge data available for calibration period,-,,-,,0,0,,,,,,,False,False,,,,,,,,,,,,,,,,,,,,,,,,,,,,,,,
257,47295,Lopatnica lakat,1020,RS,20.563451,43.659922,224.68,7818,Ibar,Danube,Danube,C862,7825,5172500.0,2347500.0,7716.3,20.55833,43.65833,True,True,True,True,1,1,1,1,1,1,1,1,1,0,NRT_6h,-,3,Discontinued but keeping it for because no alternative  new station Mataruska Banja immediately downstream is now operational,3,,1,1,01/01/1991,31/12/2021,10664.0,03/12/2009 12:00,31/12/2021 18:00,16834.0,True,True,03/12/2009 12:00,31/12/2021 18:00,4208.5,6.0,1095.0,1460.0,0.0,,910.987392,,,exclude,2009-12-03 12:00:00,2021-12-31 18:00:00,16834.0,0.682182223851648,0.7999462344512206,1.058865270482206,1.2398364227065912,0.3720935087627375,0.4903064815865935,25.66085780748839,43.986745515302474,0.7999462344512206,3.838353492500591,5.886527048220488,5.886527048220586,39.35367960753267,5.886527048220586,0.7924055093430735,0.7601635772934088
258,42921,Knjazevac,1020,RS,22.259299,43.576355,211.63,1242,Beli Timok,Danube,Danube,-,1175,5307500.0,2352500.0,1236.5,22.25833,43.575,True,True,True,True,1,1,1,1,1,1,1,1,1,0,NRT_6h,-,3,,3,,1,1,02/01/2008,31/12/2021,3479.0,22/03/2010 12:00,31/12/2021 18:00,15368.0,True,True,22/03/2010 12:00,31/12/2021 18:00,3842.0,6.0,1095.0,1460.0,1.0,0.0,1236.492288,,,recommended,2010-03-22 12:00:00,2021-12-31 18:00:00,15368.0,0.6028545024767858,0.627923921356796,1.1182122229213636,1.0728684311375467,0.06087471375834397,-1.3174188702996807,3.9568589467244415,9.139946064245523,0.627923921356796,0.7599277867412461,11.821222292136264,11.821222292136358,61.55178163498917,11.821222292136358,0.9690847673148347,0.9271315688624533
259,45920,Drazevac,1020,RS,20.215636,44.596265,71.24,3588,Kolubara,Danube,Danube,-,3650,5127500.0,2442500.0,3570.9,20.20833,44.59167,True,True,True,False,1,1,1,1,1,1,1,1,1,0,NRT_6h,no data,0,a lot of zeros with some recent data from 2020,0,,0,1,02/01/2014,31/12/2021,2432.0,04/09/2019 12:00,31/12/2021 18:00,3201.0,True,True,,,,,,,,,,,,recommended,,,,,,,,,,,,,,,,,,,
260,42015,Apatin,1020,RS,18.969079,45.67535,78.84,211139,Danube,Danube,Danube,-,211925,5012500.0,2552500.0,211164.2,18.95833,45.675,False,False,True,False,1,0,1,0,1,1,1,1,0,0,NRT_24h,extremely low quality data  unusable,0,data are all zeros,0,,0,0,,,,,,,True,False,,,,,,,,,,,,,,,,,,,,,,,,,,,,,,,
261,42020,Bogojevo,1020,RS,19.078749,45.53004,77.46,251593,Danube,Danube,Danube,C860,253300,5032500.0,2532500.0,252207.0,19.075,45.525,True,True,True,True,1,1,1,1,1,1,1,1,1,0,NRT_6h,moved downstream of meander  outliers  zeros,3,,3,,1,1,01/01/1991,31/12/2021,10207.0,01/11/2008 06:00,31/12/2021 18:00,15390.0,True,True,01/11/2008 06:00,31/12/2021 18:00,3847.5,6.0,1095.0,1460.0,0.0,,4754.017792,,,recommended,2008-11-01 06:00:00,2021-12-31 18:00:00,15390.0,0.6014375206199303,0.7056830616391813,1.1756634814573914,1.203400912106537,-0.2611368032287642,-0.08101572425104853,698.3644846745534,1031.8023045043096,0.7056830616391813,465.1340451224754,17.566348145739063,17.566348145739145,26.374576961320344,17.566348145739145,1.123003474272791,0.796599087893463
262,42055,Smederevo,1020,RS,20.921219,44.66692,65.36,525820,Danube,Danube,Danube,C781,520500,5187500.0,2462500.0,517899.3,20.925,44.675,False,False,True,False,1,0,1,0,1,1,1,1,1,0,NRT_6h,few data could  use hist24,1,low quality data and zeros,0,,0,1,02/01/1991,01/01/2020,7242.0,01/11/2008 06:00,28/09/2010 06:00,630.0,True,True,,,,,,,,,,,,recommended,,,,,,,,,,,,,,,,,,,
263,42480,Markovicevo,1020,RS,21.03038,45.326954,76.9,1111,Brzava,Danube,Danube,-,1000,5182500.0,2532500.0,1216.6,21.025,45.325,True,True,True,True,1,1,1,1,1,1,1,1,1,0,NRT_6h,-,3,,3,,1,1,02/01/2008,31/12/2021,3521.0,31/10/2008 12:00,31/12/2021 18:00,18159.0,True,True,31/10/2008 12:00,31/12/2021 18:00,4539.75,6.0,1095.0,1460.0,0.0,,497.919008,,,recommended,2008-10-31 12:00:00,2021-12-31 18:00:00,18159.0,0.7174493604241126,0.7465152288641965,0.9803766955883803,0.8767309420375847,0.5442828524171937,-1.7972863047765806,2.843411919401677,5.4056189130504135,0.7465152288641965,-0.12158987036936508,-1.9623304411619857,-1.9623304411619709,45.889626736624685,1.9623304411619709,0.6750682540179161,0.8767309420375847
264,47090,Ljubicevski most,1020,RS,21.131837,44.585387,73.42,37320,Velika Morava,Danube,Danube,C061,37650,5197500.0,2457500.0,37276.6,21.125,44.59167,True,True,True,True,1,1,1,1,1,1,1,1,1,0,NRT_6h,-,3,,3,,1,1,01/01/1991,31/12/2021,10769.0,01/11/2008 06:00,31/12/2021 18:00,17486.0,True,True,01/11/2008 06:00,31/12/2021 18:00,4371.5,6.0,1095.0,1460.0,0.0,,3618.822656,,,recommended,2008-11-01 06:00:00,2021-12-31 18:00:00,17486.0,0.8621592221653707,0.8719644784979601,1.0293311566109706,0.9582068364487799,0.746541476667409,0.7257136658192473,72.97648686026416,128.60925236345827,0.8719644784979601,6.783756417068728,2.9331156610970663,2.933115661097062,31.55308996105947,2.933115661097062,0.5034466439778797,0.9582068364487799
265,981,Sint-Joris-Weert,1022,BE,4.642503,50.8029,28.5,-,Dyle,Scheldt,Scheldt,-,750,3942500.0,3092500.0,650.9,4.64167,50.80833,False,False,True,True,0,0,0,0,0,1,1,1,1,0,HIST_24h,-,3,,2,,1,1,02/01/1997,01/01/2008,3923.0,,,,True,False,02/01/1997 00:00,01/01/2008 00:00,3923.0,24.0,1095.0,1460.0,1.0,1.0,650.940928,,,recommended,1997-01-02 00:00:00,2008-01-01 00:00:00,3923.0,0.5386435972251341,0.7445860206655164,1.0678114309996107,1.37817329277419,0.0014093824235807961,0.4210525991155427,1.1738797779074825,2.2927073080826013,0.7445860206655164,0.35843770347377396,6.781143099961073,6.781143099961076,22.20817363518117,6.781143099961076,0.9992950603182298,0.6218267072258099
266,1261,Diest,1022,BE,5.041367,50.991268,20.5,1950,Demer,Scheldt,Scheldt,-,1950,3972500.0,3107500.0,1965.0,5.04167,50.99167,False,False,True,False,0,0,0,0,0,1,1,1,1,0,NRT_6h,Close to 830,2,highly impacted by upstream controlled floodcompartment areas  Hydrodynamics are very important,0,DP,0,1,31/10/2001,27/12/2012,3745.0,31/10/2008 00:00,26/12/2012 12:00,4908.0,True,False,,,,,,,,,,,,exclude,,,,,,,,,,,,,,,,,,,
267,1931,Lot,1022,BE,4.279647,50.765746,26,659.24,Dyle,Scheldt,Scheldt,-,675,3917500.0,3087500.0,688.7,4.275,50.775,False,False,True,True,0,0,0,0,0,1,1,1,1,0,HIST_24h,-,3,,2,,1,1,03/01/1990,02/04/2009,6956.0,,,,True,False,03/01/1990 00:00,02/04/2009 00:00,6956.0,24.0,1095.0,1460.0,1.0,1.0,688.716864,,,recommended,1991-01-03 00:00:00,2009-04-02 00:00:00,6592.0,0.7743438684909795,0.8226783291173319,1.1172622585653744,1.0756787779971528,0.5141650997091449,0.6352116040423934,1.3431876364428248,2.3338549653858776,0.8226783291173319,0.46019503098465925,11.72622585653746,11.726225856537432,34.2257532832038,11.726225856537432,0.6970185795879842,0.9243212220028472
268,15387,Overboelare,1022,BE,3.867334,50.762012,17.5,785,Dender,Scheldt,Scheldt,-,775,3887500.0,3087500.0,802.1,3.875,50.75833,True,True,True,True,1,1,1,1,1,1,1,1,1,0,NRT_6h,-,3,Affected by upstream watermanagement,3,,1,1,02/01/2001,31/12/2021,5466.0,01/01/2015 06:00,31/12/2021 18:00,10009.0,True,True,01/01/2015 06:00,31/12/2021 18:00,2502.25,6.0,1095.0,1460.0,1.0,1.0,802.083968,,,recommended,2015-01-01 06:00:00,2021-12-31 18:00:00,10009.0,0.7333961820023035,0.7943081690750885,0.8307070123663058,0.9895908309762794,0.6178389264124293,-0.891459942978772,2.4509306159555444,5.026592633026071,0.7943081690750885,-0.9023850885929796,-16.92929876336945,-16.929298763369417,45.98096441342652,16.929298763369417,0.6181917773535749,0.9895908309762794
269,3258,Bossuit,1022,BE,3.402525,50.741192,12,5227,Scheldt,Scheldt,Scheldt,-,5250,3857500.0,3092500.0,5338.5,3.40833,50.74167,False,False,True,False,0,0,0,0,0,1,1,1,1,0,NRT_6h,negative values  removed with qc  oscillations regulated close to 1361,2,close to 1361,2,,1,1,13/09/2001,04/02/2014,4309.0,31/10/2008 00:00,03/02/2014 12:00,7369.0,True,True,31/10/2008 00:00,03/02/2014 12:00,1842.25,6.0,1095.0,1460.0,0.0,,301.312832,,,recommended,2008-10-31 00:00:00,2014-02-03 12:00:00,7369.0,0.6934911418260576,0.7016919114844936,1.0702883274627546,1.0044176337339465,0.3422444551263131,0.3759640935629074,10.645473619410241,15.300439040819887,0.7016919114844936,1.9565644811286467,7.028832746275473,7.02883274627546,38.243183037115955,7.02883274627546,0.8110212974230003,0.9955823662660535
270,21958,Menen,1022,BE,3.126709,50.791197,12,2986.2,Leie,Scheldt,Scheldt,-,3050,3832500.0,3097500.0,2870.8,3.125,50.79167,True,True,True,False,1,1,1,1,1,1,1,1,1,0,NRT_6h,large oscillations  negative values could  use hist24,1,,3,,1,0,29/09/1998,31/12/2021,6610.0,01/01/2014 06:00,31/12/2021 18:00,10854.0,True,True,01/01/2014 06:00,31/12/2021 18:00,2713.5,6.0,1095.0,1460.0,1.0,1.0,2870.844416,,,,2014-01-01 06:00:00,2021-12-31 18:00:00,10854.0,0.5512088462117055,0.7999040526937139,1.4002509881801308,0.9657325511446019,0.14951224549767028,0.3413101013357005,12.901206117506659,21.58099639268959,0.7999040526937139,10.071431515286063,40.02509881801302,40.02509881801309,51.270968674217194,40.02509881801309,0.9222189298113181,0.9657325511446019
271,5011,Kopčany,1018,SK,17.106502,48.817054,156.39,9629.32,Morava,Danube,Danube,-,9550,4847500.0,2887500.0,9700.8,17.10833,48.825,False,False,True,True,0,0,0,0,0,1,1,1,1,0,HIST_6h,-,3,excluded by DP,2,DP,0,1,02/11/1995,09/02/2019,7687.0,01/01/2002 06:00,08/02/2019 18:00,21808.0,True,True,,,,,,,,,,,,exclude,,,,,,,,,,,,,,,,,,,
272,5040,Moravský Sv. Ján,1018,SK,16.935429,48.602278,146.24,24129.3,Morava,Danube,Danube,C320,24125,4832500.0,2857500.0,24136.5,16.94167,48.60833,True,True,True,True,1,1,1,1,1,1,1,1,1,0,HIST_6h,-,3,,3,,1,1,01/01/1991,31/12/2021,10431.0,01/01/2002 06:00,31/12/2021 18:00,26108.0,True,True,01/01/2002 06:00,31/12/2021 18:00,6527.0,6.0,1095.0,1460.0,0.0,,2632.743936,,,recommended,2002-01-01 06:00:00,2021-12-31 18:00:00,26108.0,0.7589886388601927,0.8108867992106009,1.1290140970897917,0.9246472546103539,0.5877871561133885,0.3597216501396918,40.930479009230396,61.0939508393568,0.8108867992106009,11.822588757720002,12.901409708979152,12.901409708979175,44.66541889465893,12.901409708979175,0.6420380392831959,0.9246472546103539
273,5127,Devín,1018,SK,16.977317,48.173299,132.87,131244,Danube,Danube,Danube,-,131250,4842500.0,2807500.0,131324.7,16.975,48.175,True,True,True,False,1,1,1,1,1,1,1,1,1,0,HIST_6h,close to 1895,2,close to 1895,3,,1,1,02/01/2002,31/12/2021,6455.0,01/01/2002 06:00,31/12/2021 18:00,26110.0,True,True,01/01/2002 06:00,31/12/2021 18:00,6527.5,6.0,1095.0,1460.0,0.0,,1715.603456,,,recommended,2002-01-01 06:00:00,2021-12-31 18:00:00,26110.0,0.8805371069035377,0.8873002948934902,1.0377278323932655,1.0121148651989267,0.7540065082964473,0.752432028172778,312.96142952458115,446.8798394633374,0.8873002948934902,73.89631931809721,3.7727832393265484,3.7727832393265555,15.978273975776352,3.7727832393265555,0.49597730966602954,0.9878851348010733
274,5550,Liptovský Mikuláš,1018,SK,19.603513,49.086364,567.68,1107.21,Vah,Danube,Danube,C446,1125,5022500.0,2932500.0,1131.4,19.60833,49.09167,True,True,True,True,1,1,1,1,1,1,1,1,1,0,HIST_6h,-,3,,3,,1,1,01/01/1991,31/12/2021,10801.0,01/01/2000 06:00,31/12/2021 18:00,30224.0,True,True,01/01/2000 06:00,31/12/2021 18:00,7556.0,6.0,1095.0,1460.0,1.0,0.0,1131.399168,,,recommended,2000-01-01 06:00:00,2021-12-31 18:00:00,30224.0,0.8107601329406067,0.8195167364936842,1.0480219170182514,1.0305190819760166,0.5998644220660987,0.64721437371906,6.058884761077095,9.824991424788594,0.8195167364936842,0.9685195906221907,4.802191701825133,4.802191701825138,30.041649548118574,4.802191701825138,0.6325627067207606,0.9694809180239834
275,5780,Hubová,1018,SK,19.188057,49.120388,444.7,2133.2,Vah,Danube,Danube,-,2100,4997500.0,2927500.0,2156.6,19.19167,49.125,True,True,True,True,1,1,1,1,1,1,1,1,1,0,HIST_6h,dam oscillations regulated  Moved South-East to avoid conflict in inflow point,3,excluded by DP,3,DP,0,1,01/01/1991,31/12/2021,10807.0,01/01/2000 06:00,31/12/2021 18:00,30251.0,True,True,,,,,,,,,,,,exclude,,,,,,,,,,,,,,,,,,,
276,5880,Dierová,1018,SK,19.172762,49.182981,439.05,1966.75,Orava,Danube,Danube,-,2000,4987500.0,2937500.0,1960.7,19.175,49.175,True,True,True,True,1,1,1,1,1,1,1,1,1,0,HIST_6h,dam,3,excluded by DP,3,DP,0,1,01/01/1991,31/12/2021,10806.0,01/01/2000 06:00,31/12/2021 18:00,30250.0,True,True,,,,,,,,,,,,exclude,,,,,,,,,,,,,,,,,,,
277,6146,Strečno,1018,SK,18.864047,49.172511,353.4,5453.25,Vah,Danube,Danube,-,5475,4967500.0,2932500.0,5476.3,18.85833,49.175,True,True,True,False,1,1,1,1,1,1,1,1,1,0,HIST_6h,large oscillations,0,Regulated,1,,1,0,02/11/1996,31/12/2021,8696.0,01/01/2000 06:00,31/12/2021 18:00,30124.0,True,True,01/01/2000 06:00,31/12/2021 18:00,7531.0,6.0,1095.0,1460.0,0.0,,3511.611136,1.0,,,2000-01-01 06:00:00,2021-12-31 18:00:00,30124.0,0.6912168885547577,0.7106434957384983,1.0134887794728682,0.8930519930821487,0.46682652750980314,0.24482183436518157,30.938383927717737,43.46326563365187,0.7106434957384983,1.1527103456781251,1.3488779472867902,1.3488779472868113,36.20346079243391,1.3488779472868113,0.7301872859001265,0.8930519930821487
278,6480,Šaľa,1018,SK,17.881949,48.161217,109.23,11217.61,Vah,Danube,Danube,C060,10675,4912500.0,2807500.0,10808.0,17.875,48.15833,True,True,True,False,1,1,1,1,1,1,1,1,1,0,HIST_6h,low quality data  same for daily data  large oscillations,0,Regulated,1,,1,0,01/01/1991,31/12/2021,10788.0,01/01/2000 06:00,31/12/2021 18:00,25752.0,True,True,01/01/2000 06:00,31/12/2021 18:00,6438.0,6.0,1095.0,1460.0,0.0,,4365.203456,1.0,,,2000-01-01 06:00:00,2021-12-31 18:00:00,25752.0,0.5999737295727983,0.6828994010293037,0.97853611544193,0.7570853466256096,0.4624765155862597,0.21733198561020395,70.39014116059153,97.41715535785771,0.6828994010293037,-3.0256020416308727,-2.1463884558070037,-2.146388455807,49.93537957433431,2.146388455807,0.7331599309930561,0.7570853466256096
279,6730,Nitrianska Streda,1018,SK,18.172555,48.523948,158.25,2093.71,Nitra,Danube,Danube,-,2025,4922500.0,2862500.0,2129.4,18.175,48.525,True,True,True,True,1,1,1,1,1,1,1,1,1,0,HIST_6h,-,3,,3,,1,1,01/01/1991,31/12/2021,10796.0,01/01/2002 06:00,31/12/2021 18:00,27564.0,True,True,01/01/2002 06:00,31/12/2021 18:00,6891.0,6.0,1095.0,1460.0,1.0,0.0,2129.407488,,,recommended,2002-01-01 06:00:00,2021-12-31 18:00:00,27564.0,0.7962920384756117,0.7979355622586305,1.0257521675326589,0.9980706332500705,0.5851674632781636,0.5743285531145287,4.778592457561093,9.439329735298532,0.7979355622586305,0.3377473990096081,2.5752167532658925,2.5752167532658827,36.43525128491428,2.5752167532658827,0.644074946509981,0.9980706332500705
280,6772,Nové Zámky,1018,SK,18.174321,47.978552,108.73,4063.66,Nitra,Danube,Danube,-,3700,4927500.0,2792500.0,3156.8,18.175,47.975,True,True,True,False,1,1,1,1,1,1,1,1,1,0,HIST_6h,oscillations,1,,3,,1,0,01/01/1991,31/12/2021,10792.0,01/01/2002 06:00,31/12/2021 18:00,27571.0,True,True,01/01/2002 06:00,31/12/2021 18:00,6892.75,6.0,1095.0,1460.0,0.0,,1027.385216,,,recommended,2002-01-01 06:00:00,2021-12-31 18:00:00,27571.0,0.7999750742146448,0.8057335471061424,1.0448554549733333,0.9839219287658394,0.5982538024596064,0.5645831671578028,6.473610503692463,12.8124266940012,0.8057335471061424,0.7894879648454528,4.485545497333298,4.485545497333332,36.780388985425205,4.485545497333332,0.6338345190508319,0.9839219287658394
281,6849,Komárno,1018,SK,18.127812,47.754313,103.4,151961.6,Danube,Danube,Danube,-,150775,4927500.0,2772500.0,151483.5,18.125,47.75833,True,True,True,True,1,1,1,1,1,1,1,1,1,0,HIST_6h,-,3,,3,,1,1,02/11/1995,31/12/2021,8860.0,01/01/2002 06:00,31/12/2021 18:00,26814.0,True,True,01/01/2002 06:00,31/12/2021 18:00,6703.5,6.0,1095.0,1460.0,0.0,,2299.977472,1.0,,recommended,2002-01-01 06:00:00,2021-12-31 18:00:00,26814.0,0.8431129205320328,0.8710705658114775,1.0772781163109038,1.044931608509535,0.6627584779630973,0.6971190485398171,344.2460585706593,498.9080670880051,0.8710705658114775,151.6972009334826,7.727811631090422,7.727811631090365,17.536702582573614,7.727811631090365,0.5807249969106759,0.955068391490465
282,7160,Banská Bystrica,1018,SK,19.140372,48.731088,334.29,1766.48,Hron,Danube,Danube,C448,1825,4992500.0,2887500.0,1858.4,19.14167,48.725,True,True,True,True,1,1,1,1,1,1,1,1,1,0,HIST_6h,-,3,,3,,1,1,01/01/1991,31/12/2021,10440.0,01/01/2000 06:00,31/12/2021 18:00,28789.0,True,True,01/01/2000 06:00,31/12/2021 18:00,7197.25,6.0,1095.0,1460.0,1.0,0.0,1858.439424,,,recommended,2000-01-01 06:00:00,2021-12-31 18:00:00,28789.0,0.7782021541284098,0.7817554272040126,1.0333134712766743,1.0213026643843641,0.5346859371082482,0.6241396232541578,7.551089703124913,12.871400604345265,0.7817554272040126,0.7582638009245625,3.331347127667464,3.331347127667435,33.17486732531938,3.331347127667435,0.6821393280641049,0.9786973356156359
283,7290,Brehy,1018,SK,18.64624,48.406726,194.27,3821.38,Hron,Danube,Danube,C015,3825,4962500.0,2847500.0,3900.8,18.64167,48.40833,True,True,True,True,1,1,1,1,1,1,1,1,1,0,HIST_6h,-,3,,3,,1,1,01/01/1991,31/12/2021,10442.0,01/01/2000 06:00,31/12/2021 18:00,28789.0,True,True,01/01/2000 06:00,31/12/2021 18:00,7197.25,6.0,1095.0,1460.0,0.0,,2042.404608,,,recommended,2000-01-01 06:00:00,2021-12-31 18:00:00,28789.0,0.8545922880095177,0.8619601347566718,0.9649395710805796,0.9706884897370145,0.736371874517066,0.6050606952150361,13.08776004564103,22.820209937079245,0.8619601347566718,-1.4222196756433196,-3.506042891941982,-3.506042891942038,32.263825951294024,3.506042891942038,0.5134472957207346,0.9706884897370145
284,7540,Slovenské Ďarmoty,1018,SK,19.297626,48.087161,136.11,2768,Ipel,Danube,Danube,-,2750,5012500.0,2817500.0,2762.7,19.29167,48.09167,True,True,True,True,1,1,1,1,1,1,1,1,1,0,HIST_6h,-,3,,3,,1,1,01/01/1991,31/12/2021,10433.0,01/01/2000 06:00,31/12/2021 18:00,28773.0,True,True,01/01/2000 06:00,31/12/2021 18:00,7193.25,6.0,1095.0,1460.0,0.0,,920.012672,,,recommended,2000-01-01 06:00:00,2021-12-31 18:00:00,28773.0,0.74530464121811,0.779053036477285,1.0026004398904282,1.126670449622254,0.4840371651334894,0.577201790305946,4.195492725677832,9.161884223608087,0.779053036477285,0.02243070749919183,0.2600439890428571,0.26004398904283166,48.63924441192293,0.26004398904283166,0.7183055303048268,0.8733295503777461
285,7820,Lenártovce,1018,SK,20.313416,48.30507,150.41,1829.65,Slana,Danube,Danube,C754,1700,5082500.0,2862500.0,1769.2,20.30833,48.30833,True,True,True,True,1,1,1,1,1,1,1,1,1,0,HIST_6h,Moved North to avoid conflict in inflow point,3,,3,,1,1,01/01/1991,31/12/2021,10434.0,01/01/2000 06:00,31/12/2021 18:00,27323.0,True,True,01/01/2000 06:00,31/12/2021 18:00,6830.75,6.0,1095.0,1460.0,1.0,0.0,1769.2096,,,recommended,2000-01-01 06:00:00,2021-12-31 18:00:00,27323.0,0.7697877782079989,0.7831023855505753,1.0430100885476041,1.0640564141338356,0.5052253233048083,-0.36409749840925154,5.891125532739934,10.581881296370094,0.7831023855505753,0.5379297313660295,4.301008854760425,4.301008854760423,47.10240316421286,4.301008854760423,0.7034022154466072,0.9359435858661644
286,7900,Vlkyňa,1018,SK,20.301721,48.285404,150.63,1377.41,Rimava,Danube,Danube,-,1325,5077500.0,2852500.0,1371.1,20.30833,48.29167,True,True,True,True,1,1,1,1,1,1,1,1,1,0,HIST_6h,-,3,,3,,1,1,01/01/1991,31/12/2021,10409.0,01/01/2000 06:00,31/12/2021 18:00,27253.0,True,True,01/01/2000 06:00,31/12/2021 18:00,6813.25,6.0,1095.0,1460.0,1.0,0.0,1371.065344,,,recommended,2000-01-01 06:00:00,2021-12-31 18:00:00,27253.0,0.7634569159843447,0.7906685756244172,1.0327638378387933,1.1051642348643314,0.5016984397603852,-0.4164949435516896,3.2042354648208042,6.524810553877236,0.7906685756244172,0.19916933195199804,3.276383783879369,3.276383783879324,52.7104500164722,3.276383783879324,0.7059047812840031,0.8948357651356686
287,8320,Chmelnica,1018,SK,20.730146,49.289177,507.37,1262.41,Poprad,Vistula,Vistula,-,1325,5097500.0,2967500.0,1272.6,20.725,49.29167,True,True,True,True,1,1,1,1,1,1,1,1,1,0,HIST_6h,-,3,,3,,2,1,01/01/1991,31/12/2021,10400.0,01/01/2002 06:00,31/12/2021 18:00,26043.0,True,True,01/01/2002 06:00,31/12/2021 18:00,6510.75,6.0,1095.0,1460.0,1.0,0.0,1272.604928,,,recommended,2002-01-01 06:00:00,2021-12-31 18:00:00,26043.0,0.6829063598280604,0.7113048059586669,1.1031799768380208,1.0809774904194618,0.2651678659451132,0.3020999360071439,7.8203610841880975,14.859862224713488,0.7113048059586669,1.6650146719742573,10.317997683801892,10.317997683802094,48.46231622540022,10.317997683802094,0.857223502976255,0.9190225095805382
288,8510,Margecany,1018,SK,20.972338,48.909548,329.35,1132.78,Hornad,Danube,Danube,-,1050,5122500.0,2927500.0,1113.0,20.975,48.90833,True,True,True,True,1,1,1,1,1,1,1,1,1,0,HIST_6h,-,3,,3,,1,1,01/01/1991,31/12/2021,10422.0,01/01/2002 06:00,31/12/2021 18:00,26094.0,True,True,01/01/2002 06:00,31/12/2021 18:00,6523.5,6.0,1095.0,1460.0,1.0,0.0,1112.991872,,,recommended,2002-01-01 06:00:00,2021-12-31 18:00:00,26094.0,0.7846873631157254,0.8450276566360265,0.9915732528607843,1.1492383808776747,0.6272639389638335,0.09406953869329215,3.0939443796714188,5.350821628425952,0.8450276566360265,-0.06901681987818964,-0.8426747139215416,-0.8426747139215625,37.77613485568225,0.8426747139215625,0.6105211388937772,0.8507616191223253
289,8870,Košické Olšany,1018,SK,21.336383,48.733426,185.7,1298.3,Torysa,Danube,Danube,-,1200,5152500.0,2907500.0,1291.4,21.34167,48.725,True,True,True,True,1,1,1,1,1,1,1,1,1,0,HIST_6h,-,3,,3,,1,1,01/01/1991,31/12/2021,10414.0,01/01/2002 06:00,31/12/2021 18:00,26059.0,True,True,01/01/2002 06:00,31/12/2021 18:00,6514.75,6.0,1095.0,1460.0,1.0,0.0,1291.356544,,,recommended,2002-01-01 06:00:00,2021-12-31 18:00:00,26059.0,0.5681868915342577,0.7758148453760241,0.8989934931923347,1.3549665655686236,0.3995507242961198,-0.4606361604389513,3.67839995303648,7.072991062668696,0.7758148453760241,-0.748052975881695,-10.100650680766579,-10.100650680766536,49.66791682898935,10.100650680766536,0.7748866211929881,0.6450334344313764
290,9230,Humenné,1018,SK,21.912382,48.928054,143.6,1272.4,Laborec,Danube,Danube,-,1275,5192500.0,2937500.0,1272.6,21.90833,48.925,True,True,True,True,1,1,1,1,1,1,1,1,1,0,HIST_6h,-,3,,3,,1,1,01/01/1991,31/12/2021,10401.0,01/01/2002 06:00,31/12/2021 18:00,26071.0,True,True,01/01/2002 06:00,31/12/2021 18:00,6517.75,6.0,1095.0,1460.0,1.0,0.0,1272.619392,1.0,,recommended,2002-01-01 06:00:00,2021-12-31 18:00:00,26071.0,0.7536755472859014,0.7823919484962598,0.9333165309645064,1.0942113946560508,0.5529399373599424,-0.0474986013736296,6.514953020861328,11.678646655243433,0.7823919484962598,-0.8091725378107846,-6.66834690354943,-6.668346903549358,53.689373740943026,6.668346903549358,0.668625502534904,0.9057886053439492
291,9320,Lekárovce,1018,SK,22.156619,48.605475,98.92,1989.41,Uzh,Danube,Danube,-,2050,5222500.0,2902500.0,2008.4,22.15833,48.60833,True,True,True,False,1,1,1,1,1,1,1,1,1,0,HIST_6h,moved but LDD is wrong,0,,3,,1,1,01/01/1991,31/12/2021,10410.0,01/01/2002 06:00,31/12/2021 18:00,26100.0,True,True,01/01/2002 06:00,31/12/2021 18:00,6525.0,6.0,1095.0,1460.0,0.0,,725.139072,,,recommended,2002-01-01 06:00:00,2021-12-31 18:00:00,26100.0,0.8016545565326136,0.8105987877826761,0.9453009701566327,0.9781800117076838,0.6427723881690868,0.5811937785102896,13.638832891681858,26.913512142841245,0.8105987877826761,-1.6140043008402738,-5.469902984336724,-5.469902984336729,46.22236303722428,5.469902984336729,0.5976852113202303,0.9781800117076838
292,9410,Veľké Kapušany,1018,SK,22.051758,48.500766,93.7,2915.46,Latorica,Danube,Danube,C770,2350,5212500.0,2892500.0,3813.6,22.05833,48.49167,True,True,True,False,1,1,1,1,1,1,1,1,1,0,HIST_6h,wrong LDD,0,,3,,1,1,01/01/1991,31/12/2021,10426.0,01/01/2002 06:00,31/12/2021 06:00,26106.0,True,True,01/01/2002 06:00,31/12/2021 06:00,6526.5,6.0,1095.0,1460.0,0.0,,248.77592,,,recommended,2002-01-01 06:00:00,2021-12-31 06:00:00,26106.0,0.7140178299318554,0.7155457288516828,0.9706779995931298,1.0034335862453572,0.4445286589542109,0.45941316020376033,15.617208512526457,28.079559054037965,0.7155457288516828,-0.9772305330216553,-2.932200040687066,-2.9322000406870212,46.85975098859659,2.9322000406870212,0.7452994975483297,0.9965664137546428
293,9500,Hanušovce nad Toplou,1018,SK,21.519206,49.032598,160.4,1050.05,Topla,Danube,Danube,-,1075,5157500.0,2947500.0,1079.6,21.525,49.025,True,True,True,True,1,1,1,1,1,1,1,1,1,0,HIST_6h,-,3,,3,,1,1,01/01/1991,31/12/2021,10408.0,01/01/2002 06:00,31/12/2021 18:00,26074.0,True,True,01/01/2002 06:00,31/12/2021 18:00,6518.5,6.0,1095.0,1460.0,1.0,0.0,1079.601408,,,recommended,2002-01-01 06:00:00,2021-12-31 18:00:00,26074.0,0.780350816814929,0.8064105498454236,1.0259821622437493,1.1004679834965205,0.5458231891194167,0.45616230732835483,3.60953784995678,6.712664799227666,0.8064105498454236,0.19205540378143537,2.59821622437494,2.59821622437493,48.83153308680638,2.59821622437493,0.6739264135501701,0.8995320165034795
294,9670,Streda nad Bodrogom,1018,SK,21.748243,48.395088,91.48,11474.25,Bodrog,Danube,Danube,C034,10750,5187500.0,2877500.0,12092.0,21.74167,48.39167,True,True,True,False,1,1,1,1,1,1,1,1,1,0,HIST_6h,Same location as 670,2,close to 670,3,,1,1,01/01/1991,31/12/2021,10435.0,01/01/2002 06:00,31/12/2021 18:00,26109.0,True,True,01/01/2002 06:00,31/12/2021 18:00,6527.25,6.0,1095.0,1460.0,0.0,,3917.837568,1.0,,recommended,2002-01-01 06:00:00,2021-12-31 18:00:00,26109.0,0.7512132636642079,0.7822454876767716,1.0270685368213366,1.1172395276936913,0.4777177190142774,0.6124007942664039,44.56458718305586,74.42349372807688,0.7822454876767716,2.8997728053801475,2.706853682133674,2.706853682133668,41.59974763726627,2.706853682133668,0.7226909996573381,0.8827604723063087
295,2.268.0,Akslen,1002,NO,8.44987,61.802936,475,796.26,Bovri,Glomma,Glomma,-,825,4237500.0,4297500.0,785.6,8.45833,61.79167,True,True,True,True,0,1,0,1,1,0,1,0,1,0,NRT_6h,-,3,,3,,1,1,01/01/1991,31/12/2021,11204.0,25/07/2008 18:00,31/12/2021 18:00,19171.0,True,True,25/07/2008 18:00,31/12/2021 18:00,4792.75,6.0,1095.0,1460.0,0.0,,519.938112,,,,2008-07-25 18:00:00,2021-12-31 18:00:00,19171.0,0.5435304473012535,0.7433914462076687,0.6315506543537199,0.9177711586216253,0.44474690879889944,0.18592736324855053,13.634806145261734,26.786798885293596,0.7433914462076687,-10.234941196521339,-36.84493456462804,-36.84493456462801,49.08416478194351,36.84493456462801,0.7451530656188035,0.9177711586216253
296,2.32.0,Atnasjoe,1002,NO,10.222119,61.851939,701,463.2,Atna,Glomma,Glomma,-,375,4332500.0,4307500.0,486.1,10.225,61.85833,True,True,True,False,0,1,0,1,1,0,1,0,1,0,-,Provider upArea too small to be included in calibration,-,,3,,1,1,01/01/1991,31/12/2021,11210.0,25/07/2008 18:00,31/12/2021 18:00,19058.0,True,True,25/07/2008 18:00,31/12/2021 18:00,4764.5,6.0,1095.0,1460.0,1.0,0.0,486.069216,,,recommended,2008-07-25 18:00:00,2021-12-31 18:00:00,19058.0,-0.4200456079218975,0.617201315762053,0.44613293199579845,2.2502903530398037,-0.12013603095069025,-25.34192768816881,8.231315748140732,11.005779823784955,0.617201315762053,-6.1653489564104795,-55.386706800420484,-55.38670680042015,73.94641814230441,55.38670680042015,1.0583647910577363,-0.25029035303980374
297,12.290.0,Bagn,1002,NO,9.567188,60.801327,210,2976.54,Begna,Drammen,Drammen,-,2975,4292500.0,4192500.0,2995.8,9.575,60.80833,False,False,True,False,0,0,0,0,0,0,1,0,1,0,NRT_6h,oscillations many outliers difficult to remove use after 05-2011,1,some zeros,2,,1,0,01/01/1991,16/10/2013,7342.0,10/02/2008 12:00,15/10/2013 06:00,8148.0,True,True,10/02/2008 12:00,15/10/2013 06:00,2037.0,6.0,1095.0,1460.0,0.0,,2726.313216,,,,2008-02-10 12:00:00,2013-10-15 06:00:00,8148.0,0.7023577576332547,0.7093497382400017,0.9365143453419654,0.9908949776172948,0.44670092538277395,-0.2364413271382788,26.1185658063052,33.47602662248292,0.7093497382400017,-4.19137501851186,-6.348565465803454,-6.348565465803459,39.561104449464494,6.348565465803459,0.7438407589109557,0.9908949776172948
298,12.97.0,Bergheim,1002,NO,9.231315,60.471919,152,4248.54,Hallingdalselva,Drammen,Drammen,-,4275,4282500.0,4147500.0,4209.9,9.225,60.475,True,True,True,True,0,1,0,1,1,0,1,0,1,0,NRT_6h,-,3,,3,,1,1,01/01/1991,31/12/2021,11210.0,10/02/2008 12:00,31/12/2021 18:00,18666.0,True,True,10/02/2008 12:00,31/12/2021 18:00,4666.5,6.0,1095.0,1460.0,1.0,0.0,4209.906944,1.0,,recommended,2008-02-10 12:00:00,2021-12-31 18:00:00,18666.0,0.5062281238159512,0.614058239556186,0.8188813233334274,1.2491097112085252,0.1048321499511985,-0.7174905044802937,49.343692709519246,61.09537777810172,0.614058239556186,-20.93486870368951,-18.11186766665723,-18.11186766665726,42.68985132834889,18.11186766665726,0.9461331037696583,0.7508902887914748
299,2.129.0,Dølplass,1002,NO,10.451065,62.19223,529,2012.95,Folla,Glomma,Glomma,-,2125,4342500.0,4342500.0,1984.1,10.45833,62.19167,True,True,True,True,0,1,0,1,1,0,1,0,1,0,NRT_6h,-,3,,3,,1,1,01/01/1991,31/12/2021,11200.0,10/02/2008 12:00,31/12/2021 18:00,18864.0,True,True,10/02/2008 12:00,31/12/2021 18:00,4716.0,6.0,1095.0,1460.0,1.0,0.0,1984.06656,,,,2008-02-10 12:00:00,2021-12-31 18:00:00,18864.0,0.5283759588156021,0.6026763003901284,0.7579813571379391,1.077395674676518,0.19743968459102668,-0.15236075886610645,13.919462780261366,21.26694994033468,0.6026763003901284,-8.223371135677427,-24.201864286206284,-24.201864286206085,40.96579657985179,24.201864286206085,0.8958573075043658,0.9226043253234819
300,12.178.0,Eggedal,1002,NO,9.434388,60.151761,170,309.77,Simoa,Drammen,Drammen,-,300,4287500.0,4117500.0,315.3,9.44167,60.15833,True,True,True,False,0,1,0,1,1,0,1,0,1,0,-,Provider upArea too small to be included in calibration,-,,3,,1,1,01/01/1991,31/12/2021,11193.0,25/07/2008 18:00,31/12/2021 18:00,19187.0,True,True,25/07/2008 18:00,31/12/2021 18:00,4796.75,6.0,1095.0,1460.0,1.0,0.0,315.31248,,,recommended,2008-07-25 18:00:00,2021-12-31 18:00:00,19187.0,0.43851732368853624,0.5769874152680194,0.7061878348724246,0.7763986570270667,0.29680688890948514,0.3312470023059789,5.061727409968253,10.293311904119768,0.5769874152680194,-2.3057098364771322,-29.381216512757444,-29.38121651275754,64.50061781757641,29.38121651275754,0.8385661041864978,0.7763986570270667
301,2.460.0,Eide,1002,NO,9.722482,61.613981,241,7969.43,Lagen,Glomma,Glomma,-,7925,4307500.0,4282500.0,7875.1,9.725,61.60833,False,False,True,True,0,0,0,0,0,0,1,0,1,0,NRT_6h,-,3,,2,,1,1,01/01/1991,16/10/2013,7324.0,10/02/2008 12:00,15/10/2013 06:00,7787.0,True,True,10/02/2008 12:00,15/10/2013 06:00,1946.75,6.0,1095.0,1460.0,0.0,,658.692288,,,recommended,2008-02-10 12:00:00,2013-10-15 06:00:00,7787.0,0.5990181210814678,0.8823126059936106,0.616686374712572,1.0026094409421347,0.5559285296699172,-0.21585213279076387,95.57681136879107,148.32703543691804,0.8823126059936106,-87.01923455533455,-38.33136252874289,-38.3313625287428,42.100915098130024,38.3313625287428,0.66638687736936,0.9973905590578653
302,2.604.0,Elverum,1002,NO,11.560652,60.874212,180,15447.49,Glomma,Glomma,Glomma,C234,15450,4407500.0,4202500.0,15483.9,11.55833,60.875,True,True,True,True,0,1,0,1,1,0,1,0,1,0,NRT_6h,-,3,,3,,1,1,01/01/1991,31/12/2021,11210.0,10/02/2008 12:00,31/12/2021 18:00,19824.0,True,True,10/02/2008 12:00,31/12/2021 18:00,4956.0,6.0,1095.0,1460.0,0.0,,5466.502144,,,recommended,2008-02-10 12:00:00,2021-12-31 18:00:00,19824.0,0.7564793918731074,0.8419022296984947,0.8186580190031381,0.9622843860408207,0.6450824243435457,0.4231191944423638,86.20265012847953,132.3319542181244,0.8419022296984947,-54.765823522232566,-18.134198099686255,-18.134198099686188,28.543639693707604,18.134198099686188,0.5957495914026737,0.9622843860408207
303,12.70.0,Etna,1002,NO,9.626174,60.951902,399,570.17,Etna,Drammen,Drammen,-,575,4302500.0,4207500.0,565.8,9.625,60.95833,True,True,True,True,0,1,0,1,1,0,1,0,1,0,NRT_6h,-,3,,3,,1,1,01/01/1991,31/12/2021,11207.0,25/07/2008 18:00,31/12/2021 18:00,19298.0,True,True,25/07/2008 18:00,31/12/2021 18:00,4824.5,6.0,1095.0,1460.0,1.0,0.0,565.849216,,,recommended,2008-07-25 18:00:00,2021-12-31 18:00:00,19298.0,0.6954511379919915,0.7275300280577763,0.955511872158505,0.8714273348594826,0.5174567012043298,-0.6810285970667722,5.944757219869633,11.685418764007622,0.7275300280577763,-0.4731439290758475,-4.448812784149496,-4.448812784149499,55.89654710370645,4.448812784149499,0.69465336592841,0.8714273348594826
304,2.595.0,Faukstad,1002,NO,9.424945,61.709489,353.3,1480.08,Sjoa,Glomma,Glomma,-,1475,4287500.0,4292500.0,1467.6,9.425,61.70833,False,False,True,True,0,0,0,0,0,0,1,0,1,0,NRT_6h,-,3,,2,,1,1,02/01/1993,16/10/2013,6868.0,10/02/2008 12:00,15/10/2013 06:00,7823.0,True,True,10/02/2008 12:00,15/10/2013 06:00,1955.75,6.0,1095.0,1460.0,0.0,,982.59584,,,,2008-02-10 12:00:00,2013-10-15 06:00:00,7823.0,0.6407538814069766,0.7380552384806777,0.7851130052313059,1.119441597092542,0.4880935244520537,-0.36319129390275173,19.687494024706705,30.817960027292752,0.7380552384806777,-8.262686445323613,-21.488699476869378,-21.488699476869407,51.20110091906241,21.488699476869407,0.7154763976176619,0.880558402907458
305,12.193.0,Fiskum,1002,NO,9.78916,59.697542,84,51.6,Fiskum,Drammen,Drammen,-,75,4307500.0,4067500.0,62.7,9.79167,59.69167,True,True,True,False,0,1,0,1,1,0,1,0,1,0,-,Provider upArea too small to be included in calibration,-,,3,basin_area,0,0,01/01/1991,31/12/2021,11146.0,25/07/2008 18:00,31/12/2021 18:00,19306.0,True,True,,,,,,,,,,,,,,,,,,,,,,,,,,,,,,,
306,2.323.0,Fura,1002,NO,11.326164,60.886225,349,39.69,Fura,Glomma,Glomma,-,50,4392500.0,4197500.0,40.3,11.325,60.89167,True,True,True,False,0,1,0,1,1,0,1,0,1,0,-,Provider upArea too small to be included in calibration,-,,3,basin_area,0,0,01/01/1991,31/12/2021,11063.0,25/07/2008 18:00,31/12/2021 18:00,19214.0,True,True,,,,,,,,,,,,,,,,,,,,,,,,,,,,,,,
307,2.269.0,Hummelvoll,1002,NO,11.120534,62.448055,592,2421.08,Glomma,Glomma,Glomma,-,2450,4377500.0,4367500.0,2459.1,11.125,62.44167,True,True,True,True,0,1,0,1,1,0,1,0,1,0,NRT_6h,-,3,,3,,1,1,01/01/1991,31/12/2021,11189.0,10/02/2008 12:00,31/12/2021 18:00,19773.0,True,True,10/02/2008 12:00,31/12/2021 18:00,4943.25,6.0,1095.0,1460.0,1.0,0.0,2459.142656,,,,2008-02-10 12:00:00,2021-12-31 18:00:00,19773.0,0.575554887735257,0.6597390363207138,0.7464582520573105,0.9903712943943905,0.27429358777423707,-0.0682706000256812,24.45410846155966,33.23314725942597,0.6597390363207138,-15.340774363364304,-25.354174794269003,-25.35417479426895,40.4160654271185,25.35417479426895,0.85188403684173,0.9903712943943905
308,12.228.0,Kistefoss,1002,NO,10.361305,60.221812,120,3704.53,Randselva,Drammen,Drammen,C644,3675,4337500.0,4122500.0,3734.6,10.35833,60.225,True,True,True,True,0,1,0,1,1,0,1,0,1,0,NRT_6h,lake strongly regulated,3,,3,,1,1,01/01/1991,31/12/2021,11161.0,10/02/2008 12:00,31/12/2021 18:00,17319.0,True,True,10/02/2008 12:00,31/12/2021 18:00,4329.75,6.0,1095.0,1460.0,0.0,,3168.794624,1.0,1.0,recommended,2008-02-10 12:00:00,2021-12-31 18:00:00,17319.0,0.43693758453140685,0.43821586723235145,0.9675215134049174,1.0195708914544217,-0.11229727574575166,-0.39450884964524224,28.25858409803212,34.3383029005518,0.43821586723235145,-1.997086957592523,-3.247848659508287,-3.2478486595082603,45.95673920630662,3.2478486595082603,1.0546550505951016,0.9804291085455783
309,2.142.0,Knappom,1002,NO,12.047125,60.64117,170,1646,Flisa,Glomma,Glomma,-,1650,4437500.0,4177500.0,1761.6,12.04167,60.64167,True,True,True,True,0,1,0,1,1,0,1,0,1,0,NRT_6h,-,3,,3,,1,1,01/01/1991,31/12/2021,10845.0,10/02/2008 12:00,31/12/2021 18:00,19869.0,True,True,10/02/2008 12:00,31/12/2021 18:00,4967.25,6.0,1095.0,1460.0,1.0,0.0,1761.618944,1.0,,,2008-02-10 12:00:00,2021-12-31 18:00:00,19869.0,0.6482846245754746,0.751520197977133,0.8386967339028358,0.8104142683557671,0.5356354722472256,0.6247503851295308,10.884798370554465,19.65705460540563,0.751520197977133,-4.46770293759545,-16.130326609716402,-16.130326609716413,39.298797447004866,16.130326609716413,0.6814429746888387,0.8104142683557671
310,2.25.0,Lalm,1002,NO,9.274604,61.817372,355,3982.36,Otta,Glomma,Glomma,C395,4025,4277500.0,4307500.0,4018.4,9.275,61.825,True,True,True,True,0,1,0,1,1,0,1,0,1,0,NRT_6h,-,3,remove Q data from 13-10-2018  27-03-2019,3,,1,1,01/01/1991,31/12/2021,10076.0,10/02/2008 12:00,31/12/2021 18:00,19820.0,True,True,10/02/2008 12:00,31/12/2021 18:00,4797.5,6.0,1095.0,1460.0,0.0,,1656.718592,,,,2008-02-10 12:00:00,2021-12-31 18:00:00,19190.0,0.623262190418157,0.8491087275096443,0.6554603969171107,0.9786537365740219,0.5466893790056805,0.023806381859341363,49.48024083332032,77.16468385968443,0.8491087275096443,-41.51046422784994,-34.453960308288856,-34.453960308288934,41.06892768913004,34.453960308288934,0.6732834625878744,0.9786537365740219
311,2.145.0,Losna,1002,NO,10.277532,61.333385,179,11212.94,Lagen,Glomma,Glomma,C235,11200,4337500.0,4242500.0,11095.8,10.275,61.34167,True,True,True,True,0,1,0,1,1,0,1,0,1,0,NRT_6h,-,3,,3,,1,1,01/01/1991,31/12/2021,11210.0,10/02/2008 12:00,31/12/2021 18:00,19794.0,True,True,10/02/2008 12:00,31/12/2021 18:00,4948.5,6.0,1095.0,1460.0,0.0,,2844.306176,,,recommended,2008-02-10 12:00:00,2021-12-31 18:00:00,19794.0,0.7810707911291526,0.882889681293008,0.8150408828918041,1.002301466427871,0.7350894705956539,0.38214014762857873,83.70129027970341,128.02672484589718,0.882889681293008,-49.781118635868154,-18.49591171081968,-18.49591171081959,31.098772336136836,18.49591171081959,0.5146945981884283,0.9976985335721289
312,12.534.0,Mjøndalen bru,1002,NO,10.007267,59.752922,20,16992.02,Drammen,Drammen,Drammen,-,17050,4317500.0,4072500.0,17017.0,10.00833,59.75833,False,False,True,False,0,0,0,0,0,0,1,0,0,0,NRT_6h,oscillations,1,,2,,1,0,11/02/2008,03/01/2013,1709.0,10/02/2008 12:00,03/01/2013 00:00,6666.0,True,True,10/02/2008 12:00,03/01/2013 00:00,1666.5,6.0,1095.0,1460.0,0.0,,891.609792,,,,2008-02-10 12:00:00,2013-01-03 00:00:00,6666.0,0.8451900795247584,0.865475030083179,0.9318214956441454,1.0349404563540285,0.7205090623312245,0.4180676454186434,78.82013502314028,95.09062107461335,0.865475030083179,-24.633256833164054,-6.8178504355854805,-6.8178504355854574,21.81538135781282,6.8178504355854574,0.528669024691986,0.9650595436459715
313,2.11.0,Narsjø,1002,NO,11.478783,62.361318,737,119.13,Nora,Glomma,Glomma,-,125,4397500.0,4362500.0,123.7,11.475,62.35833,True,True,True,False,0,1,0,1,1,0,1,0,1,0,-,Provider upArea too small to be included in calibration,-,negative values,3,basin_area,0,1,01/01/1991,31/12/2021,11102.0,27/12/2009 12:00,31/12/2021 18:00,14223.0,True,True,,,,,,,,,,,,recommended,,,,,,,,,,,,,,,,,,,
314,2.393.0,Norsfoss,1002,NO,12.035517,60.339025,165.3,18932.64,Glomma,Glomma,Glomma,-,18800,4432500.0,4137500.0,19083.3,12.04167,60.34167,False,False,True,True,0,0,0,0,0,0,1,0,1,0,NRT_6h,-,3,,2,,1,1,03/01/1996,15/10/2013,5798.0,10/02/2008 12:00,14/10/2013 06:00,7264.0,True,True,10/02/2008 12:00,14/10/2013 06:00,1816.0,6.0,1095.0,1460.0,0.0,,1837.737856,,,,2008-02-10 12:00:00,2013-10-14 06:00:00,7264.0,0.8018392602939173,0.8702025742458042,0.865412072877249,0.9343768569691536,0.7159534800993683,0.5765543160374511,91.78907170324257,140.58966867892258,0.8702025742458042,-51.08735240458788,-13.458792712275146,-13.458792712275098,24.181524999035922,13.458792712275098,0.5329601485107779,0.9343768569691536
315,2.112.0,Nye Stai,1002,NO,11.042726,61.466519,240,8950,Glomma,Glomma,Glomma,-,8925,4377500.0,4267500.0,8959.4,11.04167,61.475,False,False,True,True,0,0,0,0,0,0,1,0,1,0,NRT_6h,Large outliers maybe left after qc,3,,2,,1,1,22/10/2000,18/10/2013,4375.0,10/02/2008 12:00,17/10/2013 06:00,7452.0,True,True,10/02/2008 12:00,17/10/2013 06:00,1863.0,6.0,1095.0,1460.0,0.0,,1870.022016,,,,2008-02-10 12:00:00,2013-10-17 06:00:00,7452.0,0.7112995923917947,0.8561537481023238,0.9784221354542258,0.7506196139834201,0.7178788196345718,0.5918154720062918,48.790828592876075,80.95659949258008,0.8561537481023238,-2.648766861261266,-2.1577864545774097,-2.1577864545774132,39.74686884869304,2.1577864545774132,0.5311508075541512,0.7506196139834201
316,2.434.0,Ofossen,1002,NO,8.313763,61.882597,400,1584.73,Otta,Glomma,Glomma,-,1600,4227500.0,4312500.0,1576.2,8.29167,61.875,False,False,True,True,0,0,0,0,0,0,1,0,1,0,NRT_6h,-,3,,2,,1,1,01/01/1991,15/10/2013,7156.0,10/02/2008 12:00,14/10/2013 06:00,6705.0,True,True,10/02/2008 12:00,14/10/2013 06:00,1676.25,6.0,1095.0,1460.0,1.0,0.0,1576.163328,1.0,,,2008-02-10 12:00:00,2013-10-14 06:00:00,6705.0,0.4989505040616887,0.7874181807419808,0.5470619963885017,1.0265844387831866,0.31399885328784494,0.07811004355040185,30.69809319215462,46.72177479845005,0.7874181807419808,-28.487778763862732,-45.29380036114969,-45.29380036114983,48.80806313608444,45.29380036114983,0.8282518618826957,0.9734155612168134
317,2.614.0,Rosten,1002,NO,9.405153,61.858567,319,1833.91,Lagen,Glomma,Glomma,-,1825,4292500.0,4302500.0,1730.3,9.425,61.85833,True,True,True,True,0,1,0,1,1,0,1,0,1,0,NRT_6h,-,3,,3,,1,1,01/01/1991,31/12/2021,11011.0,27/12/2009 12:00,31/12/2021 18:00,12875.0,True,True,27/12/2009 12:00,31/12/2021 18:00,3218.75,6.0,1095.0,1460.0,1.0,0.0,1730.34048,,,,2009-12-27 12:00:00,2021-12-31 18:00:00,12875.0,0.499418730583965,0.6407937389114244,1.256792812213253,0.7641824415346811,0.28459292091042754,-0.22550156740958727,18.52684379970156,31.914891820480182,0.6407937389114244,5.828849033800189,25.679281221325137,25.679281221325308,81.62092195514,25.679281221325308,0.8458174029242767,0.7641824415346811
318,2.63.0,Rudi,1002,NO,10.057384,61.55955,246,369.96,Frya,Glomma,Glomma,-,300,4322500.0,4277500.0,376.4,10.05833,61.55833,False,False,True,False,0,0,0,0,0,0,1,0,1,0,-,Provider upArea too small to be included in calibration,-,some zeros,1,,1,1,11/05/1996,23/05/2013,6184.0,25/07/2008 18:00,22/05/2013 12:00,6509.0,True,True,25/07/2008 18:00,22/05/2013 12:00,1627.25,6.0,1095.0,1460.0,1.0,0.0,376.44128,,,,2008-07-25 18:00:00,2013-05-22 12:00:00,6509.0,0.621536817011386,0.8137058283402335,0.939625845805311,0.6761422781702581,0.6280954735652214,0.43591924807751603,2.3404935833563583,5.161407720927945,0.8137058283402335,-0.3970178682791865,-6.037415419468869,-6.037415419468889,35.591677801732914,6.037415419468889,0.60983975471822,0.6761422781702581
319,12.99.0,Skålfoss,1002,NO,9.833348,60.078672,120.3,5126.72,Snarum,Drammen,Drammen,C643,5100,4307500.0,4112500.0,5104.0,9.825,60.075,False,False,True,True,0,0,0,0,0,0,1,0,1,0,NRT_6h,-,3,,2,,1,1,01/01/1991,01/01/2020,8165.0,10/02/2008 12:00,15/10/2013 12:00,7495.0,True,True,10/02/2008 12:00,15/10/2013 12:00,1873.75,6.0,1095.0,1460.0,0.0,,894.09856,,,recommended,2008-02-10 12:00:00,2013-10-15 12:00:00,7495.0,0.7151661058947455,0.76144945953565,0.8443594602995051,0.9999036824598492,0.5095790220892806,-0.14652354799496337,44.331168593921994,58.039360660636305,0.76144945953565,-20.862440415823862,-15.564053970049436,-15.564053970049489,33.07248273925941,15.564053970049489,0.7003006339499626,0.9999036824598492
320,2.122.0,Skarnes,1002,NO,11.67747,60.254316,129.4,20296.2,Glomma,Glomma,Glomma,C394,20375,4412500.0,4127500.0,20440.6,11.675,60.25833,False,False,True,True,0,0,0,0,0,0,1,0,1,0,NRT_6h,-,3,,2,,1,1,01/01/1991,03/10/2013,6872.0,10/02/2008 12:00,02/10/2013 12:00,7078.0,True,True,10/02/2008 12:00,02/10/2013 12:00,1769.5,6.0,1095.0,1460.0,0.0,,1357.33376,,,,2008-02-10 12:00:00,2013-10-02 12:00:00,7078.0,0.7585012501429874,0.9062857271420609,1.0487748467435714,0.7828357866259986,0.8104748204654504,0.7813910560267605,72.53067009846552,115.43433469288632,0.9062857271420609,15.92812448067534,4.877484674357142,4.8774846743571425,22.21022520607005,4.8774846743571425,0.43534489721891684,0.7828357866259986
322,12.215.0,Storeskar,1002,NO,8.335151,60.891562,895,119.43,Hemsil,Drammen,Drammen,-,100,4227500.0,4202500.0,109.2,8.34167,60.89167,True,True,True,False,0,1,0,1,1,0,1,0,1,0,-,Provider upArea too small to be included in calibration,-,,3,basin_area,0,1,01/01/1991,31/12/2021,11168.0,25/07/2008 18:00,31/12/2021 18:00,18978.0,True,True,,,,,,,,,,,,,,,,,,,,,,,,,,,,,,,
323,12.15.0,Strømstøa,1002,NO,10.138882,60.314604,150,4631.48,Adalselva,Drammen,Drammen,C645,4750,4327500.0,4137500.0,4640.0,10.14167,60.30833,True,True,True,True,0,1,0,1,1,0,1,0,1,0,NRT_6h,dam but not in lsf,3,,3,,1,1,01/01/1991,31/12/2021,11208.0,10/02/2008 12:00,31/12/2021 18:00,19979.0,True,True,10/02/2008 12:00,31/12/2021 18:00,4994.75,6.0,1095.0,1460.0,0.0,,1644.13312,,,recommended,2008-02-10 12:00:00,2021-12-31 18:00:00,19979.0,0.7279180762117549,0.7355452045130824,0.9898678414198226,0.936836927253409,0.5039727951233072,0.101644486759634,32.65431412490897,43.02771622740808,0.7355452045130824,-0.9980683900028648,-1.0132158580177504,-1.013215858017736,33.149901585357036,1.013215858017736,0.7042919883661104,0.936836927253409
324,12.192.0,Sundbyfoss,1002,NO,10.123378,59.517291,54,74.68,Lianelva,Drammen,Drammen,-,125,4327500.0,4047500.0,73.6,10.125,59.50833,True,True,True,False,0,1,0,1,1,0,1,0,1,0,-,Provider upArea too small to be included in calibration,-,outliers,0,,0,0,01/01/1991,31/12/2021,11127.0,25/07/2008 18:00,31/12/2021 18:00,18675.0,True,True,,,,,,,,,,,,,,,,,,,,,,,,,,,,,,,
325,12.207.0,Vinde-elv,1002,NO,9.075593,61.151746,560,269.34,Vinda,Drammen,Drammen,-,300,4272500.0,4232500.0,269.5,9.075,61.15833,False,False,True,False,0,0,0,0,0,0,1,0,1,0,-,Provider upArea too small to be included in calibration,-,,2,,1,1,01/01/1991,16/10/2013,7337.0,25/07/2008 18:00,15/10/2013 06:00,7481.0,True,True,25/07/2008 18:00,15/10/2013 06:00,1870.25,6.0,1095.0,1460.0,1.0,0.0,269.5272,,,,2008-07-25 18:00:00,2013-10-15 06:00:00,7481.0,0.23834344098870286,0.6070551380597848,1.3137518465427414,0.4279206102727219,0.33483007453781166,0.06810352170252443,4.203936139456281,7.176786597193372,0.6070551380597848,1.566040525552396,31.375184654274133,31.37518465427413,84.22468671664276,31.37518465427413,0.8155795028457903,0.4279206102727219
326,2.463.0,Vismunda,1002,NO,10.562095,60.958454,190,190.73,Vismunda,Glomma,Glomma,-,200,4347500.0,4207500.0,192.5,10.55833,60.95833,False,False,True,False,0,0,0,0,0,0,1,0,1,0,-,Provider upArea too small to be included in calibration,-,outliers,0,,0,1,01/01/1991,16/10/2013,7093.0,25/07/2008 18:00,15/10/2013 06:00,7400.0,True,True,,,,,,,,,,,,,,,,,,,,,,,,,,,,,,,
327,42527,Veliko Selo,1020,RS,21.299877,44.49455,92.55,1124,Mlava,Danube,Danube,-,1050,5222500.0,2437500.0,1296.2,21.30833,44.49167,True,True,True,True,1,1,1,1,1,1,1,1,1,0,NRT_6h,-,3,,3,,1,1,02/01/2008,31/12/2021,3520.0,31/10/2008 12:00,31/12/2021 18:00,17720.0,True,True,31/10/2008 12:00,31/12/2021 18:00,4430.0,6.0,1095.0,1460.0,1.0,0.0,1296.246528,,,recommended,2008-10-31 12:00:00,2021-12-31 18:00:00,17720.0,0.741365356160283,0.7450242408241539,0.9800484633596815,1.0384860677711847,0.4805024998953752,-1.0970224601411411,3.9926802793296754,8.792989733056654,0.7450242408241539,-0.1591491758063091,-1.9951536640318455,-1.9951536640318446,50.05373510892153,1.9951536640318446,0.7207617498900967,0.9615139322288153
328,21O/01H,Monte Da Vinha,1023,PT,-7.085033,38.8321,154.3,49865,Guadiana,Guadiana,Guadiana,-,49825,2842500.0,1917500.0,49747.2,-7.09167,38.825,False,False,True,True,0,0,0,0,0,0,0,0,1,0,HIST_24h,Outliers and missing data  use after 05-2000,3,,2,,1,1,09/11/1990,20/05/2016,7193.0,,,,True,False,09/11/1990 00:00,20/05/2016 00:00,7193.0,24.0,1095.0,1460.0,0.0,,1005.811712,1.0,,,1991-01-03 00:00:00,2016-05-20 00:00:00,7138.0,0.28387868172198905,0.7891315828211043,1.5325431851561393,0.5701604845149094,0.577362726810533,-0.08557347547829042,36.41928974970902,72.14229994538354,0.7891315828211043,21.688326747230917,53.25431851561372,53.25431851561393,89.42526913428472,53.25431851561393,0.6501055861854033,0.5701604845149094
329,06K/05H,Ermida Corgo (Inag),1023,PT,-7.74667,41.23103,-999,309,Corgo,Douro,Duero,-,300,2842500.0,2192500.0,307.3,-7.75833,41.225,False,False,True,False,0,0,0,0,0,0,0,0,1,0,-,Provider upArea too small to be included in calibration,-,,2,,1,1,03/01/1990,01/10/2011,7867.0,,,,True,False,03/01/1990 00:00,01/10/2011 00:00,7867.0,24.0,1095.0,1460.0,1.0,1.0,307.25408,,,,1991-01-03 00:00:00,2011-10-01 00:00:00,7522.0,0.6898981637697723,0.8551235076434789,0.848706489641505,0.7713425607612256,0.6840305754621427,0.6816189014454275,2.7660834904030436,7.375162211839065,0.8551235076434789,-1.0987849604410627,-15.129351035849579,-15.129351035849503,38.08665901649864,15.129351035849503,0.5621115765912107,0.7713425607612256
330,17G/02H,Almourol,1023,PT,-8.375,39.461,12.2,67482,Tagus,Tagus,Tajo,-,67500,2742500.0,2012500.0,67053.5,-8.375,39.45833,False,False,True,True,0,0,0,0,0,0,0,0,1,0,HIST_24h,-,3,,2,,1,1,03/01/1990,20/05/2016,8940.0,,,,True,False,03/01/1990 00:00,20/05/2016 00:00,8940.0,24.0,1095.0,1460.0,0.0,,4311.68512,1.0,,,1991-01-03 00:00:00,2016-05-20 00:00:00,8575.0,0.7671143812077188,0.8123358889454336,1.0078301771230966,0.8623170991423261,0.6566519668499587,0.33758878599256703,157.15462568474547,290.52158798938336,0.8123358889454336,2.1589816786213594,0.7830177123096872,0.7830177123096741,56.99671132046519,0.7830177123096741,0.5859590712243008,0.8623170991423261
331,17H/02H,Tramagal,1023,PT,-8.226,39.452,17.54,62148,Tagus,Tagus,Tajo,-,62200,2757500.0,2007500.0,61689.3,-8.225,39.45833,False,False,True,True,0,0,0,0,0,0,0,0,1,0,HIST_24h,-,3,,2,,1,1,03/01/1990,20/05/2016,7940.0,,,,True,False,03/01/1990 00:00,20/05/2016 00:00,7940.0,24.0,1095.0,1460.0,0.0,,3914.1888,1.0,,,1991-01-03 00:00:00,2016-05-20 00:00:00,7575.0,0.6891983783518593,0.7499927146128581,1.0704897862487464,0.8293389461327738,0.5420634639814885,0.1972690468216468,131.2178100105298,241.43876336410437,0.7499927146128581,13.515778810509811,7.048978624874595,7.048978624874639,68.43494192490364,7.048978624874639,0.6767100826931073,0.8293389461327738
332,2067,Martina,1003,CH,10.465434,46.885786,1030,1945,Inn,Danube,Danube,C425,2025,4352500.0,2637500.0,1934.4,10.475,46.89167,True,True,True,False,1,1,1,1,1,1,1,1,1,0,NRT_6h,oscillations strongly regulated  close to 184,2,close to 184,3,close,0,1,09/08/1998,31/12/2021,7709.0,19/08/2011 00:00,31/12/2021 18:00,12516.0,True,True,,,,,,,,,,,,recommended,,,,,,,,,,,,,,,,,,,
333,2022,Locarno,1003,CH,8.804286,46.163631,193,6562,Lago Maggiore,Po,Po,C427,2850,4222500.0,2557500.0,2902.4,8.775,46.14167,False,False,True,False,1,0,1,0,1,1,0,1,1,0,HIST_24h,End 06-2004  close to 334,2,close to 334,2,,1,1,03/01/1990,01/01/2012,5323.0,,,,True,False,03/01/1990 00:00,01/01/2012 00:00,5323.0,24.0,1095.0,1460.0,0.0,,1371.000448,1.0,,recommended,1991-01-03 00:00:00,2012-01-01 00:00:00,4980.0,-5.140686581837705,0.6793573803784406,7.097168660176237,0.3444434912163859,-9.874802253568506,-5.483653256939739,109.43733687774527,134.10697064199476,0.6793573803784406,109.27467150801812,609.7168660176236,609.7168660176236,610.6244854876335,609.7168660176236,3.2976965071953694,0.34444349121638584
334,2020,Bellinzona,1003,CH,9.03202,46.20877,220,1515,Ticino,Po,Po,C426,1525,4242500.0,2562500.0,1531.4,9.025,46.20833,True,True,True,True,1,1,1,1,1,1,1,1,1,0,NRT_6h,oscillation in low flow,3,,3,,1,1,01/01/1991,31/12/2021,11089.0,19/08/2011 00:00,31/12/2021 18:00,13797.0,True,True,19/08/2011 00:00,31/12/2021 18:00,3449.25,6.0,1095.0,1460.0,1.0,0.0,1531.399296,1.0,,recommended,2011-08-19 00:00:00,2021-12-31 18:00:00,13797.0,0.8393158391936442,0.8592833388157284,0.9323966172073362,1.0380526403050077,0.7204206525514367,0.5467745171171787,19.023757741397596,29.730955578429633,0.8592833388157284,-4.411220088609066,-6.760338279266368,-6.760338279266378,29.15452756636579,6.760338279266378,0.5287526335145397,0.9619473596949923
335,2135,"Bern, Schönau",1003,CH,7.447957,46.933093,502,2945,Aare,Rhine,Rhine,C416,2975,4132500.0,2647500.0,2974.3,7.475,46.925,True,True,True,True,1,1,1,1,1,1,1,1,1,0,NRT_6h,-,3,,3,,1,1,01/01/1991,31/12/2021,11104.0,19/08/2011 00:00,31/12/2021 18:00,13771.0,True,True,19/08/2011 00:00,31/12/2021 18:00,3442.75,6.0,1095.0,1460.0,0.0,,461.917248,,,recommended,2011-08-19 00:00:00,2021-12-31 18:00:00,13771.0,0.7863015717484334,0.9366132983465487,0.7966002256881757,1.016663616071707,0.74353703901614,0.643548723192386,27.617807713926794,37.24715854356629,0.9366132983465487,-25.22708118205714,-20.339977431182433,-20.339977431182433,22.267561655113344,20.339977431182433,0.5064217224644512,0.9833363839282929
336,2029,"Brügg, Aegerten",1003,CH,7.283394,47.122066,428,8293,Aare,Rhine,Rhine,-,8300,4117500.0,2672500.0,8244.8,7.29167,47.125,True,True,True,True,1,1,1,1,1,1,1,1,1,0,NRT_6h,outliers  negative values removed with qc,3,,3,,1,1,01/01/1991,31/12/2021,9650.0,19/08/2011 00:00,31/12/2021 18:00,13842.0,True,True,19/08/2011 00:00,31/12/2021 18:00,3460.5,6.0,1095.0,1460.0,0.0,,3419.170816,1.0,1.0,recommended,2011-08-19 00:00:00,2021-12-31 18:00:00,13842.0,0.8112054869704118,0.8140764569969501,0.995051794861433,0.967575941444985,0.6405230775579984,0.6664299475385685,54.38858678624389,79.51118060402385,0.8140764569969501,-1.2025231765093578,-0.49482051385669135,-0.49482051385669573,22.380099599934393,0.49482051385669573,0.5995639435806693,0.967575941444985
337,2016,Brugg,1003,CH,8.194892,47.482538,332,11726,Aare,Rhine,Rhine,-,11550,4182500.0,2707500.0,11643.0,8.19167,47.475,True,True,True,True,1,1,1,1,1,1,1,1,1,0,NRT_6h,-,3,,3,,1,1,01/01/1991,31/12/2021,11103.0,19/08/2011 00:00,31/12/2021 18:00,13830.0,True,True,19/08/2011 00:00,31/12/2021 18:00,3457.5,6.0,1095.0,1460.0,0.0,,1601.085824,,,recommended,2011-08-19 00:00:00,2021-12-31 18:00:00,13830.0,0.8811115654858209,0.8845334129190774,0.9868819483756557,1.025096690034684,0.7655617400446859,0.7451917532526073,55.70359404732744,75.3137682922796,0.8845334129190774,-4.053588485287584,-1.3118051624344311,-1.3118051624344358,18.026561527557753,1.3118051624344358,0.4841882484688305,0.9749033099653159
338,2063,Murgenthal,1003,CH,7.830621,47.266591,399,10119,Aare,Rhine,Rhine,C213,9950,4157500.0,2687500.0,10041.9,7.825,47.275,True,True,True,True,1,1,1,1,1,1,1,1,1,0,NRT_6h,-,3,,3,,1,1,01/01/1991,31/12/2021,11108.0,19/08/2011 00:00,31/12/2021 18:00,13850.0,True,True,19/08/2011 00:00,31/12/2021 18:00,3462.5,6.0,1095.0,1460.0,0.0,,1349.854848,,,recommended,2011-08-19 00:00:00,2021-12-31 18:00:00,13850.0,0.8617541253641317,0.8713211150099077,0.9644351413927937,1.0358999616126852,0.7379180269660587,0.6880517939741146,54.180220691143,73.61337384676901,0.8713211150099077,-10.132737415972805,-3.556485860720611,-3.5564858607206244,19.016696170871107,3.5564858607206244,0.5119394232074164,0.9641000383873148
339,2030,Thun,1003,CH,7.611825,46.764569,548,2466,Aare,Rhine,Rhine,-,2650,4137500.0,2632500.0,2512.4,7.625,46.75833,True,True,True,False,1,1,1,1,1,1,1,1,1,0,NRT_6h,lake moved station downstream  close to 335,2,close to 335,3,,1,1,01/01/1991,31/12/2021,10744.0,19/08/2011 00:00,31/12/2021 18:00,13829.0,True,True,19/08/2011 00:00,31/12/2021 18:00,3457.25,6.0,1095.0,1460.0,1.0,0.0,2512.400896,1.0,1.0,recommended,2011-08-19 00:00:00,2021-12-31 18:00:00,13829.0,0.7870076129339757,0.9377661050174805,0.7978813139415261,0.9746872362357664,0.7524020151632569,0.7058314284652589,25.533242156651276,35.74813930098011,0.9377661050174805,-22.874417805647134,-20.211868605847336,-20.211868605847396,22.56120964198319,20.211868605847396,0.4975921872746256,0.9746872362357664
340,2205,"Untersiggenthal, Stilli",1003,CH,8.234809,47.516629,326,17601,Aare,Rhine,Rhine,C212,17525,4187500.0,2712500.0,17501.0,8.24167,47.50833,True,True,True,True,1,1,1,1,1,1,1,1,1,0,NRT_6h,Moved South to avoid conflict in inflow point,3,use 337  351  347,3,close,0,1,01/01/1991,31/12/2021,11106.0,19/08/2011 00:00,31/12/2021 18:00,13843.0,True,True,,,,,,,,,,,,recommended,,,,,,,,,,,,,,,,,,,
341,2208,"Ligerz, Klein Twann",1003,CH,7.153092,47.091683,429,8281,Bielersee,Rhine,Rhine,-,7825,4102500.0,2667500.0,7961.4,7.175,47.09167,False,False,False,False,1,0,1,0,1,1,0,1,0,0,-,No discharge data available for calibration period,-,possibly measuring lake WL,-,no_calib,0,0,,,,,,,False,False,,,,,,,,,,,,,,,,,,,,,,,,,,,,,,,
342,2032,Romanshorn,1003,CH,9.381006,47.564785,396,10922,Obersee,Rhine,Rhine,-,75,4272500.0,2717500.0,104.6,9.425,47.55833,False,False,False,False,1,0,1,0,1,1,0,1,0,0,-,No discharge data available for calibration period,-,possibly measuring lake WL,-,no_calib,0,0,,,,,,,False,False,,,,,,,,,,,,,,,,,,,,,,,,,,,,,,,
343,2043,Berlingen,1003,CH,9.017593,47.675461,395,11487,Untersee,Rhine,Rhine,-,11325,4242500.0,2727500.0,11404.5,9.00833,47.675,True,True,True,True,1,1,1,1,1,1,1,1,0,0,NRT_6h,two small outliers after qs,3,,2,,1,1,28/02/2013,31/12/2021,3057.0,28/02/2013 00:00,31/12/2021 18:00,12449.0,True,True,28/02/2013 00:00,31/12/2021 18:00,3112.25,6.0,1095.0,1460.0,0.0,,3210.051328,,1.0,recommended,2013-02-28 00:00:00,2021-12-31 18:00:00,12449.0,0.4981880881122588,0.7568003563712312,0.9724963236377151,1.4380783902885745,0.15386569492804458,0.24693850860967337,77.17576090464375,113.27915543935741,0.7568003563712312,-10.354284451212754,-2.750367636228452,-2.7503676362284954,20.499892203422707,2.7503676362284954,0.919855589248636,0.5619216097114255
344,2023,Ringgenberg,1003,CH,7.89824,46.701346,564,1127,Brienzersee,Rhine,Rhine,-,750,4162500.0,2622500.0,1132.3,7.89167,46.69167,False,False,False,False,1,0,1,0,1,1,0,1,0,0,-,No discharge data available for calibration period,-,possibly measuring lake WL,-,no_calib,0,0,,,,,,,False,False,,,,,,,,,,,,,,,,,,,,,,,,,,,,,,,
345,2387,Fürstenau,1003,CH,9.447353,46.715082,650,1575,Hinterrhein,Rhine,Rhine,-,1550,4277500.0,2622500.0,1644.4,9.44167,46.725,True,True,True,False,1,1,1,1,1,1,1,1,1,0,NRT_6h,low quality data  dam regulated,0,Regulated,1,,1,0,01/01/1991,31/12/2021,10745.0,19/08/2011 00:00,31/12/2021 18:00,13445.0,True,True,19/08/2011 00:00,31/12/2021 18:00,3361.25,6.0,1095.0,1460.0,1.0,0.0,1644.367232,1.0,,,2011-08-19 00:00:00,2021-12-31 18:00:00,13445.0,0.3579825179630064,0.5621670080759767,1.059894619893212,0.5342733066144617,0.3137709756199333,0.33284521279520984,21.43439305869112,44.45181030969099,0.5621670080759767,2.5418933498359473,5.9894619893212155,5.989461989321191,50.50584931011616,5.989461989321191,0.8283894159029704,0.5342733066144617
346,2149,"Neuchatel, Port",1003,CH,6.933559,46.991077,429,2671,Lac de Neuchatel,Rhine,Rhine,-,1575,4087500.0,2657500.0,2593.2,7.00833,46.99167,False,False,False,False,0,0,0,0,0,1,0,1,0,0,-,No discharge data available for calibration period,-,possibly measuring lake WL,-,no_calib,0,0,,,,,,,False,False,,,,,,,,,,,,,,,,,,,,,,,,,,,,,,,
347,2243,"Baden, Limmatpromenade",1003,CH,8.309418,47.475706,351,2396,Limmat,Rhine,Rhine,-,2425,4192500.0,2707500.0,2376.2,8.30833,47.475,True,True,True,True,1,1,1,1,1,1,1,1,1,0,NRT_6h,-,3,,3,,1,1,01/01/1991,31/12/2021,10745.0,19/08/2011 00:00,31/12/2021 18:00,13843.0,True,True,19/08/2011 00:00,31/12/2021 18:00,3460.75,6.0,1095.0,1460.0,0.0,,207.479056,,,recommended,2011-08-19 00:00:00,2021-12-31 18:00:00,13843.0,0.8555377617858106,0.8859715062500465,0.9255936511653756,0.9517243732710783,0.7645908808627926,0.6544324575822196,18.831374563585452,25.37697824805676,0.8859715062500465,-7.457381946188209,-7.440634883462418,-7.440634883462441,18.789084894998695,7.440634883462441,0.4851897764145571,0.9517243732710783
348,2099,"Zuerich,Unterhard",1003,CH,8.525453,47.390585,400,2176,Limmat,Rhine,Rhine,-,2225,4207500.0,2697500.0,2168.8,8.525,47.39167,True,True,True,False,1,1,1,1,1,1,1,1,1,0,NRT_6h,lake  close to 347,2,close to 347,3,,1,1,01/01/1991,31/12/2021,10741.0,19/08/2011 00:00,31/12/2021 18:00,13834.0,True,True,19/08/2011 00:00,31/12/2021 18:00,3458.5,6.0,1095.0,1460.0,0.0,,1107.13856,1.0,1.0,recommended,2011-08-19 00:00:00,2021-12-31 18:00:00,13834.0,0.8582791992223613,0.8888465312899331,0.9288232491052067,0.9483902925910651,0.7708084077259402,0.6750727375942074,17.21978421757486,23.180172929801778,0.8888465312899331,-6.7050311208303155,-7.117675089479374,-7.117675089479323,18.279531737127062,7.117675089479323,0.47873958711815173,0.9483902925910651
349,2104,"Weesen, Biäsche",1003,CH,9.088424,47.131563,419,1061,Linth,Rhine,Rhine,-,1150,4252500.0,2667500.0,1061.6,9.075,47.125,True,True,True,True,1,1,1,1,1,1,1,1,1,0,NRT_6h,-,3,,3,,1,1,01/01/1991,31/12/2021,10736.0,19/08/2011 00:00,31/12/2021 18:00,13844.0,True,True,19/08/2011 00:00,31/12/2021 18:00,3461.0,6.0,1095.0,1460.0,1.0,0.0,1061.617472,1.0,,recommended,2011-08-19 00:00:00,2021-12-31 18:00:00,13844.0,0.8755845430587061,0.9167740490358023,0.907546894082228,1.0022517144963639,0.8104537964028256,0.7399211719927172,9.058663366536267,12.18223319669229,0.9167740490358023,-4.844035817708173,-9.245310591777185,-9.245310591777207,17.28933466260086,9.245310591777207,0.43536904299361406,0.9977482855036361
350,2152,"Luzern, Geissmattbrücke",1003,CH,8.298489,47.054009,432,2251,Reuss,Rhine,Rhine,-,2800,4192500.0,2662500.0,2253.9,8.29167,47.05833,True,True,True,True,1,1,1,1,1,1,1,1,1,0,NRT_6h,after 06-2012  outliers removed with qc,3,,3,,1,1,01/01/1991,31/12/2021,10741.0,19/08/2011 00:00,31/12/2021 18:00,13837.0,True,True,19/08/2011 00:00,31/12/2021 18:00,3459.25,6.0,1095.0,1460.0,1.0,0.0,2253.871872,1.0,,recommended,2011-08-19 00:00:00,2021-12-31 18:00:00,13837.0,0.8834044854445464,0.8850933514145886,1.001925518264822,0.9803208611791171,0.7739479718711805,0.6924152331453666,21.323844852409138,30.67457617036235,0.8850933514145886,0.21319248424407283,0.19255182648218275,0.19255182648218422,19.259334063828362,0.19255182648218422,0.4754492908069375,0.9803208611791171
351,2018,Mellingen,1003,CH,8.271283,47.42103,345,3382,Reuss,Rhine,Rhine,C421,3425,4192500.0,2697500.0,3391.0,8.275,47.425,True,True,True,True,1,1,1,1,1,1,1,1,1,0,NRT_6h,after 06-2012,3,,3,,1,1,01/01/1991,31/12/2021,11106.0,19/08/2011 00:00,31/12/2021 18:00,13843.0,True,True,19/08/2011 00:00,31/12/2021 18:00,3460.75,6.0,1095.0,1460.0,0.0,,477.29632,,1.0,recommended,2011-08-19 00:00:00,2021-12-31 18:00:00,13843.0,0.8904615836484806,0.937999400104305,0.9133173623465928,0.9746877381725602,0.8545190184694287,0.7771467051220745,22.231014684995,31.12021707042157,0.937999400104305,-12.384295930903956,-8.668263765340692,-8.66826376534072,15.560375828860945,8.66826376534072,0.38141969211168336,0.9746877381725602
352,2110,"Mühlau, Hünenberg",1003,CH,8.396131,47.222351,390,2904,Reuss,Rhine,Rhine,-,3250,4197500.0,2677500.0,2913.7,8.39167,47.225,True,True,True,False,1,1,1,1,1,1,1,1,1,0,NRT_6h,after 06-2012    lake  close to 351,2,close to 351,3,,1,1,01/01/1991,31/12/2021,10746.0,19/08/2011 00:00,31/12/2021 18:00,13790.0,True,True,19/08/2011 00:00,31/12/2021 18:00,3447.5,6.0,1095.0,1460.0,0.0,,659.868288,,,recommended,2011-08-19 00:00:00,2021-12-31 18:00:00,13790.0,0.9100849463076836,0.9339851504927371,0.9592975045874823,0.9545020506811619,0.8670359505134071,0.8330562099987826,19.083439099654957,27.494740541694398,0.9339851504927371,-5.308310215968861,-4.0702495412517985,-4.070249541251771,14.632596076847662,4.070249541251771,0.3646423583274335,0.9545020506811619
353,2289,"Basel, Rheinhalle",1003,CH,7.61667,47.559432,246,35897,Rhine,Rhine,Rhine,C417,35800,4142500.0,2717500.0,35857.2,7.625,47.55833,True,True,True,True,1,1,1,1,1,1,1,1,1,0,NRT_6h,-,3,,3,,1,1,01/01/1991,31/12/2021,11107.0,19/08/2011 00:00,31/12/2021 18:00,13780.0,True,True,19/08/2011 00:00,31/12/2021 18:00,3445.0,6.0,1095.0,1460.0,0.0,,1364.430976,,,recommended,2011-08-19 00:00:00,2021-12-31 18:00:00,13780.0,0.9265832020335737,0.9272744101390148,0.991070726822226,0.9953866624303533,0.8558981926771101,0.822268040892086,127.82311365743793,170.08571845260263,0.9272744101390148,-9.314156797366145,-0.8929273177774042,-0.8929273177774051,12.254115161596618,0.8929273177774051,0.37960743844515266,0.9953866624303533
354,2473,"Diepoldsau, Rietbrücke",1003,CH,9.640909,47.383068,410,6119,Rhine,Rhine,Rhine,C201,6275,4292500.0,2692500.0,6427.5,9.64167,47.375,True,True,True,False,1,1,1,1,1,1,1,1,1,0,NRT_6h,oscillations  in low flow close to 227,2,close to 227,3,close,0,1,01/01/1991,31/12/2021,11111.0,14/03/2011 00:00,31/12/2021 18:00,13209.0,True,True,,,,,,,,,,,,recommended,,,,,,,,,,,,,,,,,,,
355,2602,Domat/Ems,1003,CH,9.456125,46.837667,575,3229,Rhine,Rhine,Rhine,C419,3250,4282500.0,2637500.0,3275.9,9.45833,46.84167,True,True,True,True,1,1,1,1,1,1,1,1,1,0,NRT_6h,oscillations in low flow,3,,3,,1,1,01/01/1991,31/12/2021,11100.0,19/08/2011 00:00,31/12/2021 18:00,13835.0,True,True,19/08/2011 00:00,31/12/2021 18:00,3458.75,6.0,1095.0,1460.0,0.0,,1631.513472,1.0,,recommended,2011-08-19 00:00:00,2021-12-31 18:00:00,13835.0,0.7495214508590358,0.8219023199914844,0.8373203718744547,0.9325014181757786,0.6214686310405548,0.3797011457877042,35.12494430562724,51.82824848516769,0.8219023199914844,-19.276962531880187,-16.267962812554583,-16.267962812554526,29.642184903975146,16.267962812554526,0.6152490300353554,0.9325014181757786
356,2288,"Neuhausen, Flurlingerbrücke",1003,CH,8.625871,47.682331,383,11887,Rhine,Rhine,Rhine,C418,11775,4217500.0,2727500.0,11877.3,8.625,47.675,True,True,True,True,1,1,1,1,1,1,1,1,1,0,NRT_6h,Outliers  zeros  negative values removed with qc,3,,3,,1,1,01/01/1991,31/12/2021,11106.0,19/08/2011 00:00,31/12/2021 18:00,13803.0,True,True,19/08/2011 00:00,31/12/2021 18:00,3450.75,6.0,1095.0,1460.0,0.0,,472.709696,,,recommended,2011-08-19 00:00:00,2021-12-31 18:00:00,13803.0,0.9294551501374929,0.9313806005008454,1.0158084938856868,1.0042479848828925,0.8577961148483959,0.8203682855213247,40.65916846711998,52.11608334083017,0.9313806005008454,5.860802024312402,1.5808493885686716,1.5808493885686763,10.967103366454102,1.5808493885686763,0.37709930409854003,0.9957520151171075
357,2143,Rekingen,1003,CH,8.329848,47.570622,323,14718,Rhine,Rhine,Rhine,C200,14625,4192500.0,2722500.0,14775.4,8.325,47.575,True,True,True,True,1,1,1,1,1,1,1,1,1,0,NRT_6h,-,3,,3,,1,1,01/01/1991,31/12/2021,11104.0,19/08/2011 00:00,31/12/2021 18:00,13847.0,True,True,19/08/2011 00:00,31/12/2021 18:00,3461.75,6.0,1095.0,1460.0,0.0,,1152.5504,,,recommended,2011-08-19 00:00:00,2021-12-31 18:00:00,13847.0,0.9200164920380549,0.9249024667224082,0.9919539374823609,1.02632456874256,0.8462924628720258,0.8090028984628371,49.43386413600382,64.68004782360828,0.9249024667224082,-3.5862479926300046,-0.8046062517639027,-0.8046062517639085,11.090921825377418,0.8046062517639085,0.39205552811811545,0.97367543125744
358,2091,Rheinfelden (Messstation),1003,CH,7.799905,47.560715,262,34526,Rhine,Rhine,Rhine,-,34350,4152500.0,2717500.0,34492.8,7.79167,47.55833,True,True,True,False,1,1,1,1,1,1,1,1,1,0,NRT_6h,Close to 353,2,close to 353,3,,1,1,01/01/1991,31/12/2021,11109.0,15/01/2009 00:00,31/12/2021 18:00,11114.0,True,True,15/01/2009 00:00,31/12/2021 18:00,2778.5,6.0,1095.0,1460.0,0.0,,2307.16928,1.0,,recommended,2009-01-15 00:00:00,2021-12-31 18:00:00,11114.0,0.9278585797377047,0.9298606209729168,0.9887100478175107,1.0125454775466451,0.858875672773445,0.8158229574301038,123.24951406321311,162.37558464407712,0.9298606209729168,-11.338020940728498,-1.1289952182489371,-1.1289952182489271,12.272698450311063,1.1289952182489271,0.37566517968339036,0.9874545224533549
359,2215,Laupen,1003,CH,7.234397,46.908623,480,1861,Saane,Rhine,Rhine,-,1925,4112500.0,2647500.0,1851.3,7.24167,46.90833,True,True,True,False,1,1,1,1,1,1,1,1,1,0,NRT_6h,dams strongly regulated very large oscillations,0,Regulated,1,,1,0,01/01/1991,31/12/2021,10673.0,19/08/2011 00:00,31/12/2021 18:00,12702.0,True,True,19/08/2011 00:00,31/12/2021 18:00,3175.5,6.0,1095.0,1460.0,1.0,0.0,1851.275264,1.0,,,2011-08-19 00:00:00,2021-12-31 18:00:00,12702.0,0.44232049829488285,0.5384530343375968,1.2015580390472858,0.7605105805984134,0.10345114510772668,-0.0787779708102827,32.606992734324834,42.47337849986303,0.5384530343375968,9.578508095410662,20.155803904728582,20.15580390472858,68.61404144877801,20.15580390472858,0.9468626378162102,0.7605105805984134
360,2093,"Spiez, Kraftwerk BKW",1003,CH,7.664559,46.69674,558,2454,Thunersee,Rhine,Rhine,-,1350,4142500.0,2622500.0,1325.9,7.675,46.70833,False,False,False,False,1,0,1,0,1,1,0,1,0,0,-,No discharge data available for calibration period,-,possibly measuring lake WL,-,no_calib,0,0,,,,,,,False,False,,,,,,,,,,,,,,,,,,,,,,,,,,,,,,,
361,2044,Andelfingen,1003,CH,8.681994,47.596521,356,1696,Thur,Rhine,Rhine,C422,1750,4227500.0,2722500.0,1745.6,8.69167,47.59167,True,True,True,True,1,1,1,1,1,1,1,1,1,0,NRT_6h,-,3,,3,,1,1,01/01/1991,31/12/2021,11068.0,19/08/2011 00:00,31/12/2021 18:00,13823.0,True,True,19/08/2011 00:00,31/12/2021 18:00,3455.75,6.0,1095.0,1460.0,0.0,,609.079104,,,recommended,2011-08-19 00:00:00,2021-12-31 18:00:00,13823.0,0.8680375301378359,0.8708578031866357,0.9922232975265051,1.0259982567296269,0.7366920389664888,0.5466127175690542,15.060225232621836,26.555384650937317,0.8708578031866357,-0.34617897368941464,-0.7776702473494816,-0.7776702473494908,33.83189035709482,0.7776702473494908,0.5131354217294997,0.9740017432703731
362,2181,Halden,1003,CH,9.21156,47.505789,456,1085,Thur,Rhine,Rhine,-,1125,4262500.0,2707500.0,1136.5,9.20833,47.50833,True,True,True,True,1,1,1,1,1,1,1,1,1,0,NRT_6h,-,3,,3,,1,1,01/01/1991,31/12/2021,11049.0,19/08/2011 00:00,31/12/2021 18:00,13783.0,True,True,19/08/2011 00:00,31/12/2021 18:00,3445.75,6.0,1095.0,1460.0,0.0,,347.047104,,,recommended,2011-08-19 00:00:00,2021-12-31 18:00:00,13783.0,0.8027071974124023,0.8067681306669596,1.035706990238401,0.9823674881244232,0.6056669317747143,0.45101243190251883,14.830339896292847,27.606944597124446,0.8067681306669596,1.261356879924563,3.5706990238400813,3.570699023840112,41.98231367642518,3.570699023840112,0.6279594479146615,0.9823674881244232
363,2207,Luzern,1003,CH,8.319827,47.054881,434,2238,Vierwaldstattersee,Rhine,Rhine,-,2175,4197500.0,2657500.0,2246.8,8.325,47.05833,False,False,False,False,1,0,1,0,1,1,0,1,0,0,-,No discharge data available for calibration period,-,possibly measuring lake WL,-,no_calib,0,0,,,,,,,False,False,,,,,,,,,,,,,,,,,,,,,,,,,,,,,,,
364,2118,Murg,1003,CH,9.210032,47.113377,419,1061,Walensee,Rhine,Rhine,-,325,4262500.0,2667500.0,347.3,9.20833,47.125,False,False,False,False,1,0,1,0,1,1,0,1,0,0,-,No discharge data available for calibration period,-,possibly measuring lake WL,-,no_calib,0,0,,,,,,,False,False,,,,,,,,,,,,,,,,,,,,,,,,,,,,,,,
365,2209,"Zürich, Zürichhorn",1003,CH,8.550468,47.354771,406,1829,Zurichsee,Rhine,Rhine,-,2050,4212500.0,2692500.0,2161.8,8.54167,47.35833,False,False,False,False,1,0,1,0,1,1,0,1,0,0,-,No discharge data available for calibration period,-,possibly measuring lake WL,-,no_calib,0,0,,,,,,,False,False,,,,,,,,,,,,,,,,,,,,,,,,,,,,,,,
366,2170,"Geneve, Bout Du Monde",1003,CH,6.159361,46.180286,380,1976,Arve,Rhone,Rhone,-,1925,4027500.0,2572500.0,2043.8,6.15833,46.175,True,True,True,True,1,1,1,1,1,1,1,1,1,0,NRT_6h,-,3,,3,,1,1,01/01/1991,31/12/2021,10750.0,19/08/2011 00:00,31/12/2021 18:00,13845.0,True,True,19/08/2011 00:00,31/12/2021 18:00,3461.25,6.0,1095.0,1460.0,1.0,0.0,2043.78112,,,recommended,2011-08-19 00:00:00,2021-12-31 18:00:00,13845.0,0.8599928487662558,0.8803285041537865,0.9302734125739567,1.020467986819337,0.7608084724113862,0.7015864160429197,17.038021754349014,25.881275006335322,0.8803285041537865,-5.133639720351383,-6.972658742604339,-6.9726587426043345,23.141536573200213,6.9726587426043345,0.48907210878214347,0.9795320131806631
367,2210,Ocourt,1003,CH,7.075075,47.35042,417,1230,Doubs,Rhone,Rhone,-,1250,4097500.0,2692500.0,1214.8,7.075,47.35833,True,True,True,True,1,1,1,1,1,1,1,1,1,0,NRT_6h,after 06-2012   zeros removed with qc,3,use 3235,3,close,0,1,01/01/1991,31/12/2021,10742.0,19/08/2011 00:00,31/12/2021 18:00,13626.0,True,True,,,,,,,,,,,,recommended,,,,,,,,,,,,,,,,,,,
368,2027,St. Prex,1003,CH,6.461138,46.482796,372,7999,Lac Leman,Rhone,Rhone,-,50,4047500.0,2602500.0,2.4,6.45833,46.475,False,False,False,False,1,0,1,0,1,1,0,1,0,0,-,No discharge data available for calibration period,-,possibly measuring lake WL,-,exclude,0,0,,,,,,,False,False,,,,,,,,,,,,,,,,,,,,,,,,,,,,,,,
369,2024,Branson,1003,CH,7.091272,46.125659,457,3752,Rhône,Rhone,Rhone,-,3725,4097500.0,2562500.0,3807.3,7.09167,46.125,True,True,True,False,1,1,1,1,1,1,1,1,1,0,NRT_6h,after 06-2012 Large oscillations,0,,3,,1,0,01/01/1991,31/12/2021,11103.0,19/08/2011 00:00,31/12/2021 18:00,13848.0,True,True,19/08/2011 00:00,31/12/2021 18:00,3462.0,6.0,1095.0,1460.0,0.0,,495.650464,,,,2011-08-19 00:00:00,2021-12-31 18:00:00,13848.0,-0.10903222838910365,0.5940023011900496,0.3944523941024507,1.835721514117276,-0.6153626437282564,-3.9585727549512644,88.99260560067802,110.0708892015873,0.5940023011900496,-84.4676550414148,-60.554760589755,-60.55476058975494,63.79869221852242,60.55476058975494,1.2709691749717087,0.16427848588272398
370,2174,"Chancy, Aux Ripes",1003,CH,5.970734,46.152975,336,10323,Rhone,Rhone,Rhone,-,10375,4007500.0,2567500.0,10321.5,5.975,46.15833,True,True,True,False,1,1,1,1,1,1,1,1,1,0,NRT_6h,large obscillations   low quality data,0,Regulated,1,,1,0,01/01/1991,31/12/2021,11105.0,19/08/2011 00:00,31/12/2021 18:00,13594.0,True,True,19/08/2011 00:00,31/12/2021 18:00,3398.5,6.0,1095.0,1460.0,0.0,,2971.461888,,1.0,,2011-08-19 00:00:00,2021-12-31 18:00:00,13594.0,0.49041215430645047,0.6461996920504866,0.633433491423581,1.011580559723798,-0.11904342156354941,-0.22931597547485993,143.51110866421928,178.18796822783315,0.6461996920504866,-123.38869556383057,-36.656650857641694,-36.6566508576419,42.634672329248964,36.6566508576419,1.0578484870545244,0.9884194402762021
371,2009,Porte du Scex,1003,CH,6.88861,46.349566,377,5244,Rhone,Rhone,Rhone,C423,5300,4082500.0,2587500.0,5306.2,6.89167,46.34167,True,True,True,False,1,1,1,1,1,1,1,1,1,0,NRT_6h,Large obscillations,0,,3,,1,0,01/01/1991,31/12/2021,11099.0,19/08/2011 00:00,31/12/2021 18:00,13383.0,True,True,19/08/2011 00:00,31/12/2021 18:00,3345.75,6.0,1095.0,1460.0,0.0,,1498.90816,1.0,,,2011-08-19 00:00:00,2021-12-31 18:00:00,13383.0,-0.09990575063002805,0.6342583767515574,0.48311040270850664,1.8993613675850425,-0.6321302133530848,-4.3745542669781745,105.67587366284134,127.50227486424252,0.6342583767515574,-97.48649859474058,-51.688959729149154,-51.68895972914933,56.031102325342324,51.68895972914933,1.277548517025117,0.10063863241495752
372,2011,Sion,1003,CH,7.3579,46.21909,484,3373,Rhone,Rhone,Rhone,-,3400,4112500.0,2572500.0,3311.6,7.35833,46.225,True,True,True,False,1,1,1,1,1,1,1,1,1,0,NRT_6h,Low flow is wrong  could use hist24,1,issues with low flow,1,,1,0,01/01/1991,31/12/2021,10736.0,19/08/2011 00:00,31/12/2021 18:00,13842.0,True,True,19/08/2011 00:00,31/12/2021 18:00,3460.5,6.0,1095.0,1460.0,1.0,0.0,3311.648256,1.0,,,2011-08-19 00:00:00,2021-12-31 18:00:00,13842.0,0.24031455034518234,0.6345416241570547,0.5251307018235991,1.4669703498006395,0.035840692923600925,-0.9126914697783111,55.44982977506685,77.56003283387219,0.6345416241570547,-46.62046182944613,-47.48692981763989,-47.486929817640096,56.48039662416113,47.486929817640096,0.9819161405519296,0.5330296501993605
374,3074,Ca' Dolfin,1016,IT,12.435183,44.935962,9,-,Po di Tolle,Po,Po,-,71600,4512500.0,2427500.0,71525.0,12.425,44.95833,False,False,False,False,0,0,0,0,0,0,0,0,0,0,-,No discharge data available for calibration period,-,,-,,0,0,,,,,,,False,False,,,,,,,,,,,,,,,,,,,,,,,,,,,,,,,
375,3075,Ca' Venier,1016,IT,12.331097,44.957861,9,-,Po di Maistra,Po,Po,-,71550,4507500.0,2432500.0,71512.8,12.34167,44.95833,False,False,False,False,0,0,0,0,0,0,0,0,0,0,-,No discharge data available for calibration period,-,,-,,0,0,,,,,,,False,False,,,,,,,,,,,,,,,,,,,,,,,,,,,,,,,
376,3076,Cavanella,1016,IT,12.151948,45.027844,7,-,Po di Venezia,Po,Po,-,71450,4492500.0,2437500.0,71473.9,12.15833,45.025,False,False,False,False,0,0,0,0,0,0,0,0,0,0,-,No discharge data available for calibration period,-,,-,,0,0,,,,,,,False,False,,,,,,,,,,,,,,,,,,,,,,,,,,,,,,,
377,3079,Porto Tolle,1016,IT,12.303133,44.948231,14,-,Po di Gnocca,Po,Po,-,71525,4502500.0,2427500.0,71507.9,12.30833,44.95833,False,False,False,False,0,0,0,0,0,0,0,0,0,0,-,No discharge data available for calibration period,-,,-,,0,0,,,,,,,False,False,,,,,,,,,,,,,,,,,,,,,,,,,,,,,,,
378,3169,Parma idro,1016,IT,10.325665,44.809955,57,-,Parma,Po,Po,-,725,4347500.0,2412500.0,662.0,10.325,44.825,False,False,False,False,0,0,0,0,0,0,0,0,0,0,-,No discharge data available for calibration period,-,,-,,0,0,,,,,,,False,False,,,,,,,,,,,,,,,,,,,,,,,,,,,,,,,
379,3170,Vigoleno,1016,IT,9.916907,44.82072,189,-,Stirone,Po,Po,-,100,4312500.0,2412500.0,97.8,9.925,44.825,False,False,True,False,1,0,1,0,1,1,1,0,0,0,-,No discharge data available for calibration period,-,,-,,0,0,,,,,,,False,False,,,,,,,,,,,,,,,,,,,,,,,,,,,,,,,
380,3172,Borgotaro,1016,IT,9.84219,44.514057,354,-,Taro,Po,Po,-,400,4307500.0,2377500.0,412.6,9.84167,44.525,False,False,True,True,1,0,1,0,1,1,1,1,1,0,NRT_6h,-,3,,2,,2,1,21/09/2006,08/11/2017,2375.0,20/09/2006 18:00,07/11/2017 12:00,9441.0,True,True,20/09/2006 18:00,07/11/2017 12:00,2360.25,6.0,1095.0,1460.0,1.0,0.0,412.623424,,,,2006-09-20 18:00:00,2017-11-07 12:00:00,9441.0,0.6682556049024784,0.7381252091372882,1.0904430976706136,1.1824718709088482,0.23807811306643867,0.33683292317694813,6.785550848266557,15.31046870705084,0.7381252091372882,0.9325439681082857,9.044309767061351,9.04430976706136,65.8098984183689,9.04430976706136,0.872881370481444,0.8175281290911518
381,3173,Farini,1016,IT,9.569663,44.712114,436,-,Nure,Po,Po,-,250,4287500.0,2402500.0,208.1,9.575,44.70833,False,False,True,False,1,0,1,0,1,1,1,1,1,0,NRT_6h,Missing data  small LDD uparea,0,,2,,1,1,21/09/2006,08/11/2017,2039.0,20/09/2006 18:00,07/11/2017 12:00,8084.0,True,True,20/09/2006 18:00,07/11/2017 12:00,2021.0,6.0,1095.0,1460.0,1.0,0.0,208.100272,,,,2006-09-20 18:00:00,2017-11-07 12:00:00,8084.0,0.6542486181595586,0.6639777449499621,1.0813329904321483,0.9957565552877274,0.2675708400491733,0.42725529069862034,2.782926871593642,5.594730143662911,0.6639777449499621,0.3532111660583653,8.133299043214825,8.13329904321483,64.08171268948267,8.13329904321483,0.8558207522319294,0.9957565552877274
382,3174,Corniglio,1016,IT,10.099499,44.487276,544,-,Parma,Po,Po,-,150,4332500.0,2377500.0,90.9,10.09167,44.49167,False,False,True,False,1,0,1,0,1,1,1,1,1,0,-,Not enough discarge data available for calibration period,-,low quality,0,,0,1,08/03/2007,04/06/2015,1596.0,07/03/2007 12:00,03/06/2015 18:00,6308.0,True,True,,,,,,,,,,,,,,,,,,,,,,,,,,,,,,,
383,3177,Ferriere idro,1016,IT,9.498643,44.643676,629,-,Nure,Po,Po,-,100,4282500.0,2392500.0,26.9,9.49167,44.64167,False,False,True,False,1,0,1,0,1,1,1,1,1,0,NRT_6h,low data quality  small LDD uparea,0,low quality,0,,0,0,21/09/2006,08/11/2017,1986.0,20/09/2006 18:00,07/11/2017 12:00,7941.0,True,True,,,,,,,,,,,,,,,,,,,,,,,,,,,,,,,
384,3179,Compiano,1016,IT,10.352731,44.524367,296,-,Tassobio,Po,Po,-,125,4352500.0,2377500.0,100.7,10.35833,44.525,False,False,True,False,1,0,1,0,1,1,1,1,1,0,NRT_6h,Low quality data Moved on affluent,0,low quality,0,,0,0,21/09/2006,07/11/2017,2307.0,20/09/2006 18:00,07/11/2017 12:00,9093.0,True,True,,,,,,,,,,,,,,,,,,,,,,,,,,,,,,,
385,3205,Rivalta RE,1016,IT,10.599173,44.655464,94,-,Crostolo,Po,Po,-,125,4367500.0,2392500.0,103.0,10.60833,44.65833,False,False,False,False,1,0,1,0,1,1,0,0,0,0,-,No discharge data available for calibration period,-,,-,,0,0,,,,,,,False,False,,,,,,,,,,,,,,,,,,,,,,,,,,,,,,,
386,3776,Berceto Baganza,1016,IT,9.993069,44.503582,803,-,Baganza,Po,Po,-,25,4322500.0,2377500.0,29.5,9.99167,44.50833,False,False,True,False,1,0,1,0,1,1,1,0,0,0,NRT_6h,few Low quality data small LDD uparea,0,,-,,0,0,09/05/2012,08/11/2017,814.0,08/05/2012 12:00,07/11/2017 12:00,2952.0,False,False,,,,,,,,,,,,,,,,,,,,,,,,,,,,,,,
387,3794,Ponte dell'Olio,1016,IT,9.643822,44.873783,207,-,Nure,Po,Po,-,350,4292500.0,2417500.0,342.5,9.64167,44.875,False,False,False,False,1,0,1,0,1,1,0,0,0,0,-,No discharge data available for calibration period,-,,-,,0,0,,,,,,,False,False,,,,,,,,,,,,,,,,,,,,,,,,,,,,,,,
388,3795,Ponte Lamberti,1016,IT,9.812113,44.650996,341,-,Ceno,Po,Po,-,350,4307500.0,2392500.0,340.7,9.80833,44.64167,False,False,True,False,1,0,1,0,1,1,1,0,0,0,NRT_6h,Low quality data,0,,-,,0,0,09/05/2012,08/11/2017,1258.0,08/05/2012 12:00,07/11/2017 12:00,5006.0,False,False,,,,,,,,,,,,,,,,,,,,,,,,,,,,,,,
389,3798,Pradella,1016,IT,9.737732,44.474762,422,-,Taro,Po,Po,-,325,4302500.0,2372500.0,297.2,9.74167,44.475,False,False,True,False,1,0,1,0,1,1,1,0,0,0,NRT_6h,Large change in rating curve  use 380  small LDD uparea,0,Large change in rating curve  use 380  small LDD uparea,0,,0,0,09/05/2012,08/11/2017,1741.0,08/05/2012 12:00,07/11/2017 12:00,6967.0,True,True,,,,,,,,,,,,,,,,,,,,,,,,,,,,,,,
390,5301,Bobbio,1016,IT,9.383694,44.755103,272,-,Trebbia,Po,Po,-,700,4272500.0,2407500.0,693.5,9.39167,44.75833,False,False,True,True,1,0,1,0,1,1,1,1,1,0,NRT_6h,-,3,,2,,1,1,21/09/2006,08/11/2017,2465.0,20/09/2006 18:00,07/11/2017 12:00,9791.0,True,True,20/09/2006 18:00,07/11/2017 12:00,2447.75,6.0,1095.0,1460.0,0.0,,271.581728,,,,2006-09-20 18:00:00,2017-11-07 12:00:00,9791.0,0.5896627289653106,0.8007791170370847,1.2603159144368503,1.2468265392590088,0.016543167269393866,0.3757987358100434,8.073997832146372,19.66117720262064,0.8007791170370847,3.482510105703473,26.031591443684984,26.031591443685024,60.35273595887432,26.031591443685024,0.9916939208902155,0.7531734607409912
391,5340,Ponte Bacchello,1016,IT,10.98734,44.747546,38,-,Secchia,Po,Po,-,1575,4397500.0,2402500.0,1435.5,10.99167,44.74167,False,False,True,False,1,0,1,0,1,1,1,1,1,0,NRT_6h,close to 410,2,close to 410,2,close,0,1,21/09/2006,08/11/2017,2442.0,20/09/2006 18:00,07/11/2017 12:00,9639.0,True,True,,,,,,,,,,,,,,,,,,,,,,,,,,,,,,,
392,5381,Varano,1016,IT,9.905313,44.682705,259,-,Ceno,Po,Po,-,400,4312500.0,2397500.0,416.5,9.90833,44.69167,False,False,False,False,0,0,0,0,0,1,0,0,0,0,-,No discharge data available for calibration period,-,,-,,0,0,,,,,,,False,False,,,,,,,,,,,,,,,,,,,,,,,,,,,,,,,
393,5393,Pontelagoscuro,1016,IT,11.608072,44.888296,8,70091,Po,Po,Po,C140,71175,4447500.0,2422500.0,71361.9,11.60833,44.89167,True,True,True,True,1,1,1,1,1,1,1,1,1,0,NRT_6h,-,3,,3,,1,1,03/01/1990,31/12/2021,9960.0,20/09/2006 18:00,31/12/2021 18:00,15389.0,True,True,20/09/2006 18:00,31/12/2021 18:00,3847.25,6.0,1095.0,1460.0,0.0,,3119.399936,,,,2006-09-20 18:00:00,2021-12-31 18:00:00,15389.0,0.8907792122099547,0.8976736769504653,0.9792548942432084,0.9679353047140643,0.8023741994663294,0.626756073894482,319.31040880920386,432.0114279458068,0.8976736769504653,-29.565922516046868,-2.074510575679172,-2.0745105756791506,22.404605154451318,2.0745105756791506,0.4445512349928518,0.9679353047140643
394,5411,Lugo,1016,IT,10.653639,44.433441,247,-,Secchia,Po,Po,-,925,4372500.0,2367500.0,694.2,10.64167,44.425,False,False,True,True,1,0,1,0,1,1,1,0,0,0,NRT_6h,-,3,,2,,1,1,09/05/2012,08/11/2017,1997.0,08/05/2012 12:00,07/11/2017 12:00,8000.0,True,True,08/05/2012 12:00,07/11/2017 12:00,2000.0,6.0,1095.0,1460.0,1.0,0.0,694.17184,,,,2012-05-08 12:00:00,2017-11-07 12:00:00,8000.0,0.8010993911655903,0.8096982447706249,1.0509908907726178,0.972675593153138,0.609371632422461,0.5655394485643633,7.792509451760193,16.203092849775718,0.8096982447706249,0.8406640076411854,5.099089077261752,5.09908907726177,47.26585112335321,5.09908907726177,0.6250026940562241,0.972675593153138
395,5414,Ponte Samone,1016,IT,10.922664,44.356595,226,-,Panaro,Po,Po,-,600,4392500.0,2362500.0,594.3,10.925,44.35833,False,False,True,True,1,0,1,0,1,1,1,0,0,0,NRT_6h,-,3,,2,,1,1,09/05/2012,08/11/2017,1981.0,08/05/2012 12:00,07/11/2017 12:00,7930.0,True,True,08/05/2012 12:00,07/11/2017 12:00,1982.5,6.0,1095.0,1460.0,1.0,0.0,594.285632,,,,2012-05-08 12:00:00,2017-11-07 12:00:00,7930.0,0.7176324619843818,0.725170788129698,0.9352764797766882,0.9966538443471944,0.48103167549509707,-0.08248054244807612,8.210825213914267,14.49745329184658,0.725170788129698,-0.9004113449946922,-6.472352022331168,-6.472352022331184,59.0211923402625,6.472352022331184,0.72039456168471,0.9966538443471944
396,5415,Bomporto,1016,IT,11.045084,44.727163,32,-,Panaro,Po,Po,C689,1100,4402500.0,2402500.0,1139.1,11.04167,44.725,False,False,True,True,1,0,1,0,1,1,1,1,1,0,NRT_6h,-,3,,2,,1,1,03/02/1993,08/11/2017,7149.0,20/09/2006 18:00,07/11/2017 12:00,9646.0,True,True,20/09/2006 18:00,07/11/2017 12:00,2411.5,6.0,1095.0,1460.0,0.0,,544.819648,,,,2006-09-20 18:00:00,2017-11-07 12:00:00,9646.0,0.7668800229574084,0.8083842006282924,0.9482419003432437,0.8777322272739,0.6520877885300845,0.4088162888029838,9.255044425314983,19.138615282870624,0.8083842006282924,-0.9320525550653594,-5.175809965675646,-5.175809965675629,51.394474387720486,5.175809965675629,0.5898408357090196,0.8777322272739
397,5416,Trebbia Valsigiara,1016,IT,9.330116,44.640245,462,-,Trebbia,Po,Po,-,250,4267500.0,2392500.0,228.0,9.325,44.64167,False,False,True,False,1,0,1,0,1,1,1,1,1,0,NRT_6h,small LDD uparea,0,,2,,1,1,21/09/2006,08/11/2017,2468.0,20/09/2006 18:00,07/11/2017 12:00,9832.0,True,True,20/09/2006 18:00,07/11/2017 12:00,2458.0,6.0,1095.0,1460.0,1.0,0.0,228.045712,1.0,,,2006-09-20 18:00:00,2017-11-07 12:00:00,9832.0,0.6905597538056292,0.7928975687925387,0.9883799278055877,1.2296232193724934,0.45018561341124863,0.1924577643104689,4.275198242119701,9.446787462763572,0.7928975687925387,-0.08793039002206697,-1.1620072194412503,-1.162007219441229,56.497090717314954,1.162007219441229,0.7414946976133724,0.7703767806275066
398,5417,Piacenza,1016,IT,9.705535,45.060519,55,42030,Po,Po,Po,C468,41950,4302500.0,2442500.0,41773.6,9.70833,45.05833,True,True,True,True,1,1,1,1,1,1,1,1,1,0,NRT_6h,-,3,,3,,1,1,03/01/1990,31/12/2021,9987.0,20/09/2006 18:00,31/12/2021 18:00,15768.0,True,True,20/09/2006 18:00,31/12/2021 18:00,3942.0,6.0,1095.0,1460.0,0.0,,1687.368576,,,,2006-09-20 18:00:00,2021-12-31 18:00:00,15768.0,0.8440439615114897,0.887640379550249,0.9688796239726304,0.89641851599184,0.786047159699701,0.6416247607762514,216.6865899095601,329.3071824936709,0.887640379550249,-27.506591475470138,-3.112037602736962,-3.1120376027369634,24.51546264497215,3.1120376027369634,0.46255036514989023,0.89641851599184
399,5418,Cremona,1016,IT,9.995033,45.128596,38,-,Po,Po,Po,C138,51075,4322500.0,2447500.0,50898.2,10.00833,45.125,False,False,True,True,0,0,0,0,0,0,0,0,1,0,HIST_24h,Located manually,3,,2,,1,1,03/01/1990,31/12/2007,6299.0,,,,True,False,03/01/1990 00:00,31/12/2007 00:00,6299.0,24.0,1095.0,1460.0,0.0,,2324.434688,,,,1991-01-03 00:00:00,2007-12-31 00:00:00,5948.0,0.8702146513778306,0.9066822330726189,1.0351877636610671,1.0830533104770539,0.7742270108635527,0.603714557931718,258.84443161930074,394.8308663549405,0.9066822330726189,35.677030551131494,3.5187763661066858,3.518776366106714,25.529469645041047,3.518776366106714,0.47515575250274195,0.9169466895229461
400,5419,Polesella,1016,IT,11.756259,44.959259,9,-,Po,Po,Po,-,71225,4457500.0,2427500.0,71388.7,11.75833,44.95833,False,False,False,False,0,0,0,0,0,1,0,0,0,0,-,No discharge data available for calibration period,-,,-,,0,0,,,,,,,False,False,,,,,,,,,,,,,,,,,,,,,,,,,,,,,,,
401,5420,Ariano,1016,IT,12.122145,44.942901,4,-,Po,Po,Po,-,71375,4487500.0,2432500.0,195.0,12.125,44.94167,False,False,False,False,1,0,1,0,1,1,0,0,0,0,-,No discharge data available for calibration period,-,on Po delta cannot be modelled,-,exclude,0,0,,,,,,,False,False,,,,,,,,,,,,,,,,,,,,,,,,,,,,,,,
402,5422,Ponte Cavola,1016,IT,10.52302,44.409339,367,-,Secchia,Po,Po,-,375,4362500.0,2367500.0,344.6,10.525,44.40833,False,False,True,False,1,0,1,0,1,1,1,0,0,0,NRT_6h,Exclude from 02-2017 for change to hydro zero,1,issues with rating curve,0,,0,0,09/05/2012,08/11/2017,1985.0,08/05/2012 12:00,07/11/2017 12:00,7960.0,True,True,,,,,,,,,,,,,,,,,,,,,,,,,,,,,,,
403,5426,Solignano,1016,IT,9.985977,44.615581,235,-,Taro,Po,Po,-,600,4317500.0,2387500.0,601.5,9.99167,44.60833,False,False,False,False,0,0,0,0,0,1,0,0,0,0,-,No discharge data available for calibration period,-,,-,,0,0,,,,,,,False,False,,,,,,,,,,,,,,,,,,,,,,,,,,,,,,,
404,5427,Bardi idro,1016,IT,9.733152,44.620757,381,-,Ceno,Po,Po,-,200,4297500.0,2392500.0,220.6,9.725,44.60833,False,False,False,False,0,0,0,0,0,0,0,0,0,0,-,No discharge data available for calibration period,-,,-,,0,0,,,,,,,False,False,,,,,,,,,,,,,,,,,,,,,,,,,,,,,,,
405,5433,Ponte Veggia,1016,IT,10.770793,44.548592,122,-,Secchia,Po,Po,-,1075,4382500.0,2382500.0,1008.8,10.775,44.54167,False,False,True,False,1,0,1,0,1,1,1,0,0,0,-,Not enough discarge data available for calibration period,-,,-,,0,0,22/06/2017,07/11/2017,137.0,21/06/2017 18:00,07/11/2017 06:00,508.0,False,False,,,,,,,,,,,,,,,,,,,,,,,,,,,,,,,
406,5434,Ponte Val di Sasso,1016,IT,10.818805,44.272581,367,-,Scoltenna,Po,Po,-,275,4387500.0,2352500.0,281.2,10.825,44.275,False,False,False,False,1,0,1,0,1,1,0,0,0,0,-,No discharge data available for calibration period,-,,-,,0,0,,,,,,,False,False,,,,,,,,,,,,,,,,,,,,,,,,,,,,,,,
407,5435,Ponte Dolo,1016,IT,10.613663,44.373776,339,-,Dolo,Po,Po,-,300,4372500.0,2362500.0,133.0,10.60833,44.375,False,False,True,False,1,0,1,0,1,1,1,0,0,0,-,No discharge data available for calibration period,-,,-,,0,0,,,,,,,False,False,,,,,,,,,,,,,,,,,,,,,,,,,,,,,,,
408,5436,San Donnino,1016,IT,10.962309,44.588553,44,-,Tiepido,Po,Po,-,875,4397500.0,2387500.0,105.5,10.95833,44.59167,False,False,True,False,1,0,1,0,1,1,1,0,0,0,NRT_6h,Wrong LDD,0,mapped on tiepido before confluence,-,,0,0,16/06/2012,08/11/2017,1010.0,15/06/2012 18:00,07/11/2017 06:00,4003.0,False,False,,,,,,,,,,,,,,,,,,,,,,,,,,,,,,,
409,5437,Camposanto,1016,IT,11.135092,44.786696,28,-,Panaro,Po,Po,-,1150,4412500.0,2407500.0,1153.8,11.14167,44.79167,False,False,False,False,1,0,1,0,1,1,0,0,0,0,-,No discharge data available for calibration period,-,,-,,0,0,,,,,,,False,False,,,,,,,,,,,,,,,,,,,,,,,,,,,,,,,
410,5438,Pioppa,1016,IT,10.964897,44.856755,32,-,Secchia,Po,Po,-,1675,4397500.0,2417500.0,1455.0,10.95833,44.85833,False,False,True,True,1,0,1,0,1,1,1,0,0,0,NRT_6h,-,3,,2,,1,1,09/05/2012,08/11/2017,2001.0,08/05/2012 12:00,07/11/2017 12:00,7984.0,True,True,08/05/2012 12:00,07/11/2017 12:00,1996.0,6.0,1095.0,1460.0,0.0,,583.673536,,,,2012-05-08 12:00:00,2017-11-07 12:00:00,7984.0,0.8239083616097714,0.8440415385322037,0.9964745547387295,0.9183128244871774,0.707356023173148,0.5016561594985604,10.968839916577236,21.9306852466826,0.8440415385322037,-0.08398108405394251,-0.3525445261270761,-0.35254452612704945,46.04613662845215,0.35254452612704945,0.5409657815674218,0.9183128244871774
411,5448,Navicello,1016,IT,10.995307,44.66995,36,-,Panaro,Po,Po,-,1075,4402500.0,2397500.0,1087.7,10.99167,44.675,False,False,False,False,1,0,1,0,1,1,0,0,0,0,-,No discharge data available for calibration period,-,,-,,0,0,,,,,,,False,False,,,,,,,,,,,,,,,,,,,,,,,,,,,,,,,
412,5473,Gatta,1016,IT,10.464939,44.402599,397,-,Secchia,Po,Po,-,225,4347500.0,2362500.0,228.9,10.45833,44.39167,False,False,True,False,1,0,1,0,1,1,1,0,0,0,NRT_6h,Moved upstream of concluence  low quality data  small LDD uparea,0,,-,,0,0,09/05/2012,08/11/2017,911.0,08/05/2012 12:00,07/11/2017 12:00,3637.0,False,False,,,,,,,,,,,,,,,,,,,,,,,,,,,,,,,
413,5475,Selvanizza,1016,IT,10.235787,44.439781,474,-,Cedra,Po,Po,-,100,4337500.0,2372500.0,78.7,10.225,44.44167,False,False,True,False,1,0,1,0,1,1,1,0,0,0,NRT_6h,Moved on right affluent   low quality data small LDD uparea,0,,-,,0,0,09/05/2012,08/11/2017,180.0,08/05/2012 12:00,07/11/2017 12:00,649.0,False,False,,,,,,,,,,,,,,,,,,,,,,,,,,,,,,,
414,5476,Currada,1016,IT,10.385704,44.545713,243,-,Enza,Po,Po,-,450,4352500.0,2382500.0,422.6,10.39167,44.54167,False,False,False,False,0,0,0,0,0,0,0,0,0,0,-,No discharge data available for calibration period,-,,-,,0,0,,,,,,,False,False,,,,,,,,,,,,,,,,,,,,,,,,,,,,,,,
415,5477,Langhirano idro,1016,IT,10.273863,44.612393,263,-,Parma,Po,Po,-,325,4342500.0,2387500.0,311.8,10.275,44.60833,False,False,False,False,1,0,1,0,1,1,0,0,0,0,-,No discharge data available for calibration period,-,,-,,0,0,,,,,,,False,False,,,,,,,,,,,,,,,,,,,,,,,,,,,,,,,
416,5478,Parma Ponte Nuovo,1016,IT,10.31883,44.790114,65,-,Baganza,Po,Po,-,250,4342500.0,2407500.0,218.1,10.30833,44.775,False,False,True,False,1,0,1,0,1,1,1,0,0,0,NRT_6h,Moved on affluent   low quality data slamm LDD uparea,0,low quality,0,,0,0,17/07/2012,08/11/2017,339.0,13/07/2012 18:00,07/11/2017 12:00,1039.0,True,True,,,,,,,,,,,,,,,,,,,,,,,,,,,,,,,
417,5480,San Giorgio Piacentino,1016,IT,9.73786,44.96474,94,-,Nure,Po,Po,-,425,4302500.0,2427500.0,388.8,9.74167,44.95833,False,False,False,False,0,0,0,0,0,1,0,0,0,0,-,No discharge data available for calibration period,-,,-,,0,0,,,,,,,False,False,,,,,,,,,,,,,,,,,,,,,,,,,,,,,,,
418,5481,Marzolara,1016,IT,10.171386,44.634852,309,-,Baganza,Po,Po,-,150,4332500.0,2392500.0,152.0,10.175,44.64167,False,False,True,False,1,0,1,0,1,1,1,0,0,0,NRT_6h, small LDD upareaLow quality  few data,0,,-,,0,0,09/05/2012,08/11/2017,1136.0,08/05/2012 12:00,07/11/2017 12:00,4545.0,False,False,,,,,,,,,,,,,,,,,,,,,,,,,,,,,,,
419,5485,Pianello Val Tidone idro,1016,IT,9.440624,44.964274,154,-,Tidone,Po,Po,-,225,4277500.0,2427500.0,217.0,9.44167,44.95833,False,False,False,False,1,0,1,0,1,1,0,0,0,0,-,No discharge data available for calibration period,-,,-,,0,0,,,,,,,False,False,,,,,,,,,,,,,,,,,,,,,,,,,,,,,,,
420,5486,Rottofreno,1016,IT,9.529765,45.056681,65,-,Tidone,Po,Po,-,375,4282500.0,2437500.0,365.6,9.525,45.05833,False,False,True,False,1,0,1,0,1,1,1,0,0,0,NRT_6h,Change in hydrometric zero,0,low quality,0,,0,0,09/05/2012,07/11/2017,1430.0,08/05/2012 18:00,06/11/2017 18:00,4958.0,True,True,,,,,,,,,,,,,,,,,,,,,,,,,,,,,,,
421,5487,Salsominore,1016,IT,9.405315,44.632711,408,-,Aveto,Po,Po,-,225,4272500.0,2392500.0,193.8,9.40833,44.625,False,False,True,False,1,0,1,0,1,1,1,0,0,0,NRT_6h,Exclude from 10-2015 to 05-2016 for change in hydrometric zero  small LDD uparea,0,,2,,1,0,09/05/2012,08/11/2017,1571.0,08/05/2012 12:00,07/11/2017 12:00,6256.0,True,True,08/05/2012 12:00,07/11/2017 12:00,1564.0,6.0,1095.0,1460.0,1.0,0.0,193.847424,,,,2012-05-08 12:00:00,2017-11-07 12:00:00,6256.0,0.06678931124753684,0.6477827334973895,1.7592611105710845,1.4127320592753114,-3.2700996650681686,-0.07306004758137719,6.520710176794631,13.830594271131988,0.6477827334973895,3.74459192052965,75.92611105710834,75.92611105710844,132.21525217212417,75.92611105710844,2.0664219474899514,0.5872679407246886
422,5488,Saliceto,1016,IT,9.866951,44.992099,57,-,Chiavenna,Po,Po,-,300,4312500.0,2432500.0,170.8,9.85833,44.99167,False,False,True,False,1,0,1,0,1,1,1,0,0,0,NRT_6h,Error in LDD  draining also Riglio,0,issues with rating curve,0,,0,1,09/05/2012,08/11/2017,1721.0,08/05/2012 12:00,07/11/2017 12:00,6820.0,True,True,,,,,,,,,,,,,,,,,,,,,,,,,,,,,,,
423,5489,Ciriano,1016,IT,9.813531,44.908826,116,-,Torrente Chero,Po,Po,-,150,4307500.0,2422500.0,61.1,9.80833,44.90833,False,False,True,False,1,0,1,0,1,1,1,0,0,0,NRT_6h,Very low quality data small LDD uparea,0,,-,,0,0,09/05/2012,08/08/2015,37.0,08/05/2012 12:00,07/08/2015 18:00,123.0,False,False,,,,,,,,,,,,,,,,,,,,,,,,,,,,,,,
424,5490,Rivergaro,1016,IT,9.582107,44.900392,148,-,Trebbia,Po,Po,-,900,4287500.0,2422500.0,913.2,9.575,44.89167,False,False,True,False,1,0,1,0,1,1,1,0,0,0,NRT_6h,Exclude from 10-2015 to 05-2016 for change in hydrometric zero,1,issues with rating curve,0,,0,0,09/05/2012,08/11/2017,1432.0,08/05/2012 12:00,07/11/2017 12:00,5697.0,True,True,,,,,,,,,,,,,,,,,,,,,,,,,,,,,,,
425,5491,Tornolo,1016,IT,9.630549,44.49151,491,-,Taro,Po,Po,-,150,4292500.0,2377500.0,108.1,9.625,44.49167,False,False,True,False,1,0,1,0,1,1,1,0,0,0,NRT_6h,Close to 380  small LDD uparea,0,,2,basin_area,0,1,09/05/2012,08/11/2017,1939.0,08/05/2012 12:00,07/11/2017 12:00,7652.0,True,True,,,,,,,,,,,,,,,,,,,,,,,,,,,,,,,
426,5492,Parma Ovest,1016,IT,10.224643,44.822626,64,-,Taro,Po,Po,-,1375,4337500.0,2412500.0,1436.4,10.225,44.825,False,False,True,False,1,0,1,0,1,1,1,0,0,0,NRT_6h,Low quality data and wrong LDD  use 428,0,,-,,0,0,03/06/2012,08/11/2017,1215.0,02/06/2012 12:00,07/11/2017 12:00,4879.0,False,False,,,,,,,,,,,,,,,,,,,,,,,,,,,,,,,
427,5493,Noceto,1016,IT,10.169464,44.80862,80,-,Recchio,Po,Po,-,25,4332500.0,2407500.0,61.1,10.175,44.80833,False,False,False,False,1,0,1,0,1,1,0,0,0,0,-,No discharge data available for calibration period,-,,-,,0,0,,,,,,,False,False,,,,,,,,,,,,,,,,,,,,,,,,,,,,,,,
428,5494,San Secondo,1016,IT,10.254303,44.916891,42,-,Taro,Po,Po,-,1450,4342500.0,2422500.0,1492.5,10.25833,44.925,False,False,True,True,1,0,1,0,1,1,1,0,0,0,NRT_6h,-,3,,2,,2,1,12/06/2012,08/11/2017,1850.0,11/06/2012 18:00,07/11/2017 12:00,7290.0,True,True,11/06/2012 18:00,07/11/2017 12:00,1822.5,6.0,1095.0,1460.0,0.0,,1079.883008,,,,2012-06-11 18:00:00,2017-11-07 12:00:00,7290.0,0.7074043343582078,0.736335274694465,0.8731519955855702,1.001649229516181,0.5179890268526701,0.3677898426295355,29.64300477716902,59.619114347147566,0.736335274694465,-6.1239498757538575,-12.684800441442972,-12.684800441442974,61.40082915633647,12.684800441442974,0.6942701010034413,0.998350770483819
429,5498,Ponte Alto,1016,IT,10.899344,44.669669,43,-,Secchia,Po,Po,-,1525,4392500.0,2397500.0,1398.8,10.89167,44.675,False,False,True,False,1,0,1,0,1,1,1,0,0,0,NRT_6h,Closr to 391,2,close to 410,2,close,0,1,09/05/2012,07/11/2017,1986.0,08/05/2012 12:00,07/11/2017 06:00,7871.0,True,True,,,,,,,,,,,,,,,,,,,,,,,,,,,,,,,
430,5500,Rossenna,1016,IT,10.66763,44.43004,250,-,Rosenna,Po,Po,-,200,4377500.0,2367500.0,177.2,10.675,44.425,False,False,False,False,1,0,1,0,1,1,1,0,0,1,NRT_6h,DO NOT USE  Same as 4242 (mistake)  small LDD uparea,0,Wrong coords in HYDRO DB  TO CORRECT,2,,1,0,09/05/2012,08/11/2017,1671.0,08/05/2012 12:00,07/11/2017 12:00,6453.0,True,True,08/05/2012 12:00,07/11/2017 12:00,1613.25,6.0,1095.0,1460.0,1.0,0.0,177.167152,,,,2012-05-08 12:00:00,2017-11-07 12:00:00,6453.0,0.5006674489815635,0.6024604131432721,0.7779193828809399,0.7951208334447374,0.35428061835220936,0.19240728559972287,1.5163299032864401,3.8844614479765625,0.6024604131432721,-0.4435565361163676,-22.208061711905795,-22.20806171190601,75.9198553641848,22.20806171190601,0.8035666628524253,0.7951208334447374
431,5502,Pievepelago idro,1016,IT,10.630172,44.215298,737,-,Scoltenna,Po,Po,-,150,4372500.0,2347500.0,130.8,10.625,44.20833,False,False,True,False,1,0,1,0,1,1,1,0,0,0,NRT_6h,small LDD uparea,0,,2,basin_area,0,1,09/05/2012,08/11/2017,1994.0,08/05/2012 12:00,07/11/2017 12:00,7843.0,True,True,,,,,,,,,,,,,,,,,,,,,,,,,,,,,,,
432,5503,Fanano,1016,IT,10.799092,44.203858,512,-,Leo,Po,Po,-,75,4382500.0,2342500.0,66.6,10.79167,44.20833,False,False,True,False,1,0,1,0,1,1,1,0,0,0,NRT_6h,Exclude after 06-2015  small LDD uparea,0,low quality data,0,,0,0,09/05/2012,07/11/2017,1367.0,08/05/2012 12:00,07/11/2017 12:00,5425.0,True,True,,,,,,,,,,,,,,,,,,,,,,,,,,,,,,,
433,5504,Modena Naviglio,1016,IT,10.947561,44.679461,32,-,Naviglio,Po,Po,-,25,4392500.0,2392500.0,9.8,10.94167,44.675,False,False,True,False,1,0,1,0,1,1,1,0,0,0,NRT_6h,Wrong LDD,0,This is on lateral channel,0,exclude,0,0,09/05/2012,08/11/2017,2006.0,08/05/2012 12:00,07/11/2017 12:00,8000.0,True,True,,,,,,,,,,,,,,,,,,,,,,,,,,,,,,,
434,5505,Rubiera SS9,1016,IT,10.795542,44.650392,57,-,Secchia,Po,Po,-,1425,4382500.0,2392500.0,1318.0,10.80833,44.65833,False,False,True,False,1,0,1,0,1,1,1,1,1,0,NRT_6h,Low quality data,0,Low quality data,0,,0,0,21/09/2006,07/11/2017,1319.0,20/09/2006 18:00,07/11/2017 12:00,5054.0,True,True,,,,,,,,,,,,,,,,,,,,,,,,,,,,,,,
435,5506,Gorzano,1016,IT,10.880881,44.512882,150,-,Panaro,Po,Po,-,50,4392500.0,2377500.0,44.2,10.875,44.50833,False,False,True,False,1,0,1,0,1,1,1,0,0,0,NRT_6h,Low quality data small LDD uparea,0,,-,,0,0,09/05/2012,05/10/2016,42.0,08/05/2012 12:00,04/10/2016 06:00,127.0,False,False,,,,,,,,,,,,,,,,,,,,,,,,,,,,,,,
436,5507,Spilamberto,1016,IT,11.029999,44.533978,72,-,Panaro,Po,Po,-,775,4402500.0,2382500.0,783.5,11.025,44.54167,False,False,True,False,1,0,1,0,1,1,1,0,0,0,NRT_6h,Low quality data  use 395,0,low data quality,0,,0,0,09/05/2012,08/11/2017,1774.0,08/05/2012 12:00,07/11/2017 12:00,7096.0,True,True,,,,,,,,,,,,,,,,,,,,,,,,,,,,,,,
437,5508,Fiumalbo,1016,IT,10.649172,44.179338,944,-,Acquicciola,Po,Po,-,125,4372500.0,2342500.0,19.7,10.65833,44.175,False,False,True,False,1,0,1,0,1,1,1,0,0,0,NRT_6h,Low quality data small LDD uparea,0,low data quality,0,,0,0,09/05/2012,08/11/2017,1753.0,08/05/2012 12:00,07/11/2017 12:00,6950.0,True,True,,,,,,,,,,,,,,,,,,,,,,,,,,,,,,,
438,5511,Cadelbosco,1016,IT,10.58119,44.778796,38,-,Crostolo,Po,Po,-,350,4367500.0,2407500.0,191.1,10.59167,44.775,False,False,True,False,1,0,1,0,1,1,1,0,0,0,NRT_6h,oscillations small LDD area,0,low data quality,0,,0,0,09/05/2012,08/11/2017,1937.0,08/05/2012 12:00,07/11/2017 12:00,7495.0,True,True,,,,,,,,,,,,,,,,,,,,,,,,,,,,,,,
439,5514,Puianello,1016,IT,10.567929,44.624019,136,-,Crostolo,Po,Po,-,100,4367500.0,2387500.0,93.2,10.575,44.625,False,False,True,False,1,0,1,0,1,1,1,0,0,0,NRT_6h,small LDD uparea,0,quality of data is low,1,basin_area,0,0,09/05/2012,08/11/2017,1941.0,08/05/2012 12:00,07/11/2017 12:00,7712.0,True,True,,,,,,,,,,,,,,,,,,,,,,,,,,,,,,,
440,5516,Rubiera Tresinaro,1016,IT,10.789997,44.648039,54,-,Tresinaro,Po,Po,-,225,4377500.0,2387500.0,208.5,10.775,44.64167,False,False,False,False,1,0,1,0,1,1,0,0,0,0,-,No discharge data available for calibration period,-,,-,,0,0,,,,,,,False,False,,,,,,,,,,,,,,,,,,,,,,,,,,,,,,,
441,5517,Selvanizza Enza,1016,IT,10.237433,44.437944,483,-,Enza,Po,Po,-,75,4337500.0,2367500.0,76.3,10.225,44.425,False,False,False,False,0,0,0,0,0,1,0,0,0,0,-,No discharge data available for calibration period,-,,-,,0,0,,,,,,,False,False,,,,,,,,,,,,,,,,,,,,,,,,,,,,,,,
442,5518,Lonza,1016,IT,10.325267,44.466965,381,-,Lonza,Po,Po,-,50,4347500.0,2367500.0,63.9,10.325,44.45833,False,False,True,False,0,0,0,0,0,1,1,0,0,0,NRT_6h,Few data low quality,0,,-,,0,0,09/05/2012,26/05/2017,592.0,08/05/2012 12:00,25/05/2017 12:00,2172.0,False,False,,,,,,,,,,,,,,,,,,,,,,,,,,,,,,,
443,5519,Vetto,1016,IT,10.329979,44.493422,342,-,Enza,Po,Po,-,425,4347500.0,2377500.0,290.1,10.325,44.49167,False,False,True,True,1,0,1,0,1,1,1,0,0,0,NRT_6h,-,3,,2,,1,1,09/05/2012,08/11/2017,1992.0,08/05/2012 12:00,07/11/2017 12:00,7962.0,True,True,08/05/2012 12:00,07/11/2017 12:00,1990.5,6.0,1095.0,1460.0,1.0,0.0,290.059648,,,,2012-05-08 12:00:00,2017-11-07 12:00:00,7962.0,0.7271970039835725,0.7277580255244228,0.9904746040505489,0.9853354576892301,0.46799960737078516,0.09789433466868391,5.715923905290389,11.576808756632333,0.7277580255244228,-0.09118566539716542,-0.952539594945106,-0.95253959494511,59.709427109708656,0.95253959494511,0.729383570303866,0.9853354576892301
444,5521,Gatta Secchiello,1016,IT,10.47181,44.400736,396,-,Secchiello,Po,Po,-,350,4357500.0,2367500.0,71.4,10.475,44.39167,False,False,False,False,0,0,0,0,0,0,0,0,0,0,-,No discharge data available for calibration period,-,,-,,0,0,,,,,,,False,False,,,,,,,,,,,,,,,,,,,,,,,,,,,,,,,
445,5525,Ponte Nibbiano,1016,IT,9.33253,44.905152,278,-,Tidone,Po,Po,-,150,4267500.0,2422500.0,97.6,9.325,44.90833,False,False,True,False,1,0,1,0,1,1,1,0,0,0,-,No discharge data available for calibration period,-,,-,,0,0,,,,,,,False,False,,,,,,,,,,,,,,,,,,,,,,,,,,,,,,,
446,5526,Veggiola,1016,IT,9.722441,44.869712,202,-,Riglio,Po,Po,-,75,4297500.0,2417500.0,26.9,9.725,44.875,False,False,True,False,1,0,1,0,1,1,1,0,0,0,-,No discharge data available for calibration period,-,,-,,0,0,,,,,,,False,False,,,,,,,,,,,,,,,,,,,,,,,,,,,,,,,
447,5527,Lugagnano,1016,IT,9.831999,44.819875,216,-,Arda,Po,Po,-,150,4307500.0,2412500.0,105.1,9.84167,44.825,False,False,False,False,1,0,1,0,1,1,0,0,0,0,-,No discharge data available for calibration period,-,,-,,0,0,,,,,,,False,False,,,,,,,,,,,,,,,,,,,,,,,,,,,,,,,
448,5530,Montanaro,1016,IT,9.797352,44.942519,87,-,Riglio,Po,Po,-,100,4302500.0,2422500.0,46.4,9.775,44.925,False,False,True,False,1,0,1,0,1,1,1,0,0,0,NRT_6h,Use until 07-2015    small LDD uparea ,0,low data quality,0,,0,0,09/05/2012,08/11/2017,1518.0,08/05/2012 12:00,07/11/2017 06:00,5758.0,True,True,,,,,,,,,,,,,,,,,,,,,,,,,,,,,,,
449,5531,Case Bonini,1016,IT,9.775866,44.751978,349,-,Arda,Po,Po,-,100,4302500.0,2402500.0,70.9,9.775,44.74167,False,False,True,False,1,0,1,0,1,1,1,0,0,0,NRT_6h,Exclude 01-2016 02-2016    small LDD uparea ,0,quality of data is low,1,basin_area,0,0,09/05/2012,08/11/2017,1756.0,08/05/2012 12:00,07/11/2017 12:00,6786.0,True,True,,,,,,,,,,,,,,,,,,,,,,,,,,,,,,,
450,5532,Castellina di Soragna,1016,IT,10.110137,44.916141,53,-,Stirone,Po,Po,-,250,4327500.0,2422500.0,183.2,10.10833,44.90833,False,False,True,False,1,0,1,0,1,1,1,0,0,0,NRT_6h,small LDD uparea ,0,,2,,1,1,09/05/2012,08/11/2017,1992.0,08/05/2012 12:00,07/11/2017 12:00,7958.0,True,True,08/05/2012 12:00,07/11/2017 12:00,1989.5,6.0,1095.0,1460.0,1.0,0.0,183.196352,,,,2012-05-08 12:00:00,2017-11-07 12:00:00,7958.0,-1.1567141761962225,0.603353841836693,3.023752732572189,0.3687213448669139,-0.9310305756007515,-1.7287462504952416,4.567006727236391,5.685577738203263,0.603353841836693,4.159170733741198,202.3752732572164,202.37527325721894,222.21959461631545,202.37527325721894,1.3896152617184223,0.3687213448669139
451,5533,Toccalmatto,1016,IT,10.10614,44.882871,61,-,Rovacchia,Po,Po,-,225,4327500.0,2417500.0,95.2,10.10833,44.875,False,False,True,False,1,0,1,0,1,1,1,0,0,0,NRT_6h,Wrong LDD,0,,2,basin_area,0,1,09/05/2012,08/11/2017,1909.0,08/05/2012 12:00,07/11/2017 12:00,7562.0,True,True,,,,,,,,,,,,,,,,,,,,,,,,,,,,,,,
452,5534,Fornovo,1016,IT,10.095785,44.695469,142,-,Taro,Po,Po,-,1175,4327500.0,2397500.0,1250.6,10.09167,44.69167,False,False,False,False,1,0,1,0,1,1,0,0,0,0,-,No discharge data available for calibration period,-,,-,,0,0,,,,,,,False,False,,,,,,,,,,,,,,,,,,,,,,,,,,,,,,,
453,5539,Salsomaggiore sul Ghiara,1016,IT,9.98511,44.814967,154,-,Ghiara,Po,Po,-,50,4322500.0,2412500.0,29.3,9.99167,44.80833,False,False,True,False,1,0,1,0,1,1,1,0,0,0,NRT_6h,Low quality data small LDD uparea,0,,-,,0,0,09/05/2012,08/11/2017,1009.0,08/05/2012 12:00,07/11/2017 12:00,3796.0,False,False,,,,,,,,,,,,,,,,,,,,,,,,,,,,,,,
454,5551,Parma Ponte Verdi,1016,IT,10.324681,44.805476,58,-,Parma,Po,Po,-,700,4347500.0,2407500.0,654.6,10.325,44.80833,False,False,True,True,1,0,1,0,1,1,1,0,0,0,NRT_6h,-,3,,2,,1,1,09/05/2012,08/11/2017,1778.0,08/05/2012 12:00,07/11/2017 12:00,7024.0,True,True,08/05/2012 12:00,07/11/2017 12:00,1756.0,6.0,1095.0,1460.0,1.0,0.0,654.644736,,,,2012-05-08 12:00:00,2017-11-07 12:00:00,7024.0,0.8437382632068515,0.8484034947613391,0.9654373386265741,1.0155451736504217,0.7018561442891154,0.2199981806734812,6.1492379379911295,13.54026140735476,0.8484034947613391,-0.553012109714016,-3.4562661373425763,-3.456266137342587,38.4320749622137,3.456266137342587,0.5460255082968956,0.9844548263495783
455,5561,Cabanne,1016,IT,9.346466,44.4952,848,-,Aveto,Po,Po,-,50,4267500.0,2377500.0,49.1,9.34167,44.49167,False,False,True,False,1,0,1,0,1,1,1,0,0,0,NRT_6h,small LDD uparea ,0,,2,basin_area,0,0,09/05/2012,08/11/2017,1539.0,08/05/2012 12:00,07/11/2017 12:00,6154.0,True,True,,,,,,,,,,,,,,,,,,,,,,,,,,,,,,,
456,5570,Ca' de' Caroli,1016,IT,10.67689,44.595499,98,-,Tresinaro,Po,Po,-,200,4372500.0,2387500.0,157.1,10.675,44.59167,False,False,True,False,1,0,1,0,1,1,1,0,0,0,NRT_6h,Low quality data small LDD uparea,0,low quality data,0,,0,0,09/05/2012,08/11/2017,1770.0,08/05/2012 12:00,07/11/2017 12:00,7089.0,True,True,,,,,,,,,,,,,,,,,,,,,,,,,,,,,,,
457,16606009,Ampermoching,1025,DE,11.4916,48.297,464.07,2188.55,Amper,Danube,Danube,-,2225,4427500.0,2797500.0,2238.3,11.49167,48.29167,True,True,True,True,1,1,1,1,1,1,1,1,1,0,NRT_6h,-,3,,3,,1,1,03/01/1990,31/12/2021,10004.0,14/01/2013 00:00,31/12/2021 18:00,12890.0,True,True,14/01/2013 00:00,31/12/2021 18:00,3222.5,6.0,1095.0,1460.0,0.0,,966.704,,1.0,,2013-01-14 00:00:00,2021-12-31 18:00:00,12890.0,0.8012888776312036,0.8169296168842762,1.0752230043593871,0.9823125865634194,0.5767444505803594,0.5934823381342778,5.924791286573574,8.372787141231273,0.8169296168842762,2.351207955420207,7.522300435938681,7.522300435938707,18.95538843133637,7.522300435938707,0.6505809322594995,0.9823125865634194
458,12407000,Augsburg Oberhausen,1025,DE,10.881891,48.378353,464.09,1256.9,Wertach,Danube,Danube,-,1275,4382500.0,2802500.0,1256.4,10.875,48.375,True,True,True,True,1,1,1,1,1,1,1,1,1,0,HIST_6h,-,3,,3,,1,1,24/02/1999,02/09/2021,2863.0,24/02/1999 00:00,01/09/2021 12:00,2943.0,True,False,24/02/1999 00:00,02/09/2021 00:00,2863.0,24.0,1095.0,1460.0,1.0,0.0,1256.383232,1.0,,,1999-02-24 00:00:00,2021-09-02 00:00:00,2863.0,0.6479348766452077,0.802040680057653,1.2911282394028738,1.002511364762766,0.3501972592951865,0.46905064692446874,9.750892093693837,18.251040663527288,0.802040680057653,5.097162730787203,29.112823940287402,29.112823940287385,55.69294522810084,29.112823940287385,0.8061034305253975,0.9974886352372341
459,24406005,Bad Kissingen,1025,DE,10.073379,50.180128,192.2,1576.22,Franconian Saale,Rhine,Rhine,-,1575,4327500.0,3017500.0,1605.7,10.075,50.175,True,True,True,False,1,1,1,1,1,1,1,1,1,0,NRT_6h,close to 490,2,close to 391,3,,1,1,03/01/1990,31/12/2021,10286.0,03/06/2013 00:00,31/12/2021 18:00,12338.0,True,True,03/06/2013 00:00,31/12/2021 18:00,3084.5,6.0,1095.0,1460.0,0.0,,264.319392,,,,2013-06-03 00:00:00,2021-12-31 18:00:00,12338.0,0.7849695398039696,0.9006561991513966,1.0882952740456249,0.8309649366957327,0.8022773108424137,0.6340374425207087,2.8089309749013562,3.91381004786279,0.9006561991513966,0.8299281965056557,8.829527404562455,8.82952740456249,29.883950352380552,8.82952740456249,0.44466019515759103,0.8309649366957327
460,13407902,Beilngries oberh. der Sulz,1025,DE,11.4783,49.0285,362.66,2251.2,Altmuhl,Danube,Danube,-,2200,4427500.0,2877500.0,2266.5,11.45833,49.025,True,True,True,False,1,1,1,1,1,1,1,1,1,0,NRT_6h,outlier? close to 465 ,2,close to 465,3,,1,1,03/01/1990,31/12/2021,10740.0,14/01/2013 00:00,31/12/2021 18:00,12895.0,True,True,14/01/2013 00:00,31/12/2021 18:00,3223.75,6.0,1095.0,1460.0,0.0,,862.956224,,,recommended,2013-01-14 00:00:00,2021-12-31 18:00:00,12895.0,0.8086507318820118,0.8397742329154891,0.8962187603133371,1.013103444607021,0.6868870680825192,0.646134051668069,4.003223133442078,6.248166272508529,0.8397742329154891,-1.3062005923074196,-10.378123968666255,-10.378123968666285,31.806711922938906,10.378123968666285,0.5595649487927917,0.9868965553929789
461,18606000,Burghausen,1025,DE,12.8341,48.1585,351.62,6649,Salzach,Danube,Danube,C057,6650,4527500.0,2782500.0,6658.5,12.84167,48.15833,True,True,True,True,1,1,1,1,1,1,1,1,1,0,NRT_6h,-,3,,3,,1,1,03/01/1990,31/12/2021,10731.0,14/01/2013 00:00,31/12/2021 18:00,12872.0,True,True,14/01/2013 00:00,31/12/2021 18:00,3218.0,6.0,1095.0,1460.0,0.0,,532.360512,,,recommended,2013-01-14 00:00:00,2021-12-31 18:00:00,12872.0,0.8847561473715846,0.8902959169568363,0.9936527733630008,1.0347256741664885,0.7735229050179667,0.7629426704259974,47.846825838146906,76.31327194741027,0.8902959169568363,-1.5870557695229115,-0.6347226636999184,-0.6347226636999199,19.1357262477952,0.6347226636999199,0.47589609683420686,0.9652743258335115
462,15202300,Chamerau,1025,DE,12.746633,49.181157,371.28,1356.53,Regen,Danube,Danube,-,1350,4527500.0,2897500.0,1365.8,12.75833,49.175,True,True,True,True,1,1,1,1,1,1,1,1,1,0,HIST_6h,-,3,,3,,1,1,03/01/1990,31/12/2021,9140.0,03/01/1990 00:00,31/12/2021 18:00,18380.0,True,True,03/01/1990 00:00,31/12/2021 18:00,4595.0,6.0,1095.0,1460.0,1.0,0.0,1365.815552,1.0,,recommended,1991-01-03 00:00:00,2021-12-31 18:00:00,18019.0,0.7695099612160985,0.7767960486066653,1.0267968025425167,1.0508683146418638,0.5111703432235619,0.6019435670522977,7.014434916230788,14.032969679105632,0.7767960486066653,0.6012853178532479,2.679680254251694,2.6796802542516662,31.260438566611892,2.6796802542516662,0.6991635407945946,0.9491316853581362
463,10035801,Dillingen,1025,DE,10.5005,48.5684,415,11349.87,Danube,Danube,Danube,-,11400,4352500.0,2827500.0,11740.3,10.50833,48.575,True,True,True,True,1,1,1,1,1,1,1,1,1,0,NRT_6h,-,3,flows impacted by river barrages along the Donau complex retention effects in high flow conditions,3,,1,1,03/01/1990,31/12/2021,10735.0,14/01/2013 00:00,31/12/2021 18:00,12901.0,True,True,14/01/2013 00:00,31/12/2021 18:00,3225.25,6.0,1095.0,1460.0,0.0,,4153.699328,,,recommended,2013-01-14 00:00:00,2021-12-31 18:00:00,12901.0,0.8791993137389561,0.8876370547195321,1.0302710733634424,0.967580307736457,0.7736174689873523,0.7331547404830077,30.94853477816854,45.128759627747236,0.8876370547195321,4.598197234597033,3.0271073363442333,3.02710733634423,20.37418838217998,3.02710733634423,0.47579673287303015,0.967580307736457
464,10039802,Donauwörth,1025,DE,10.8014,48.7107,394.78,15091.96,Danube,Danube,Danube,-,15175,4377500.0,2842500.0,15091.7,10.80833,48.70833,True,True,True,True,1,1,1,1,1,1,1,1,1,0,NRT_6h,-,3,flows impacted by river barrages along the Donau complex retention effects in high flow conditions,3,,1,1,03/01/1990,31/12/2021,10742.0,14/01/2013 00:00,31/12/2021 18:00,12901.0,True,True,14/01/2013 00:00,31/12/2021 18:00,3225.25,6.0,1095.0,1460.0,0.0,,1778.1664,,,recommended,2013-01-14 00:00:00,2021-12-31 18:00:00,12901.0,0.8845904831743219,0.894421960263185,1.0332216669627596,0.9673051235897199,0.7859329122772142,0.7715993931474638,32.523914989300096,48.499007917774705,0.894421960263185,5.768915366332551,3.32216669627596,3.3221666962759695,18.72966759757707,3.3221666962759695,0.46267384594635047,0.9673051235897199
465,13407200,Eichstätt,1025,DE,11.200333,48.883072,382.19,1396.81,Altmuhl,Danube,Danube,C358,1425,4407500.0,2862500.0,1403.5,11.20833,48.875,True,True,True,True,1,1,1,1,1,1,1,1,1,0,NRT_6h,-,3,,3,,1,1,03/01/1990,31/12/2021,10572.0,03/06/2013 00:00,31/12/2021 18:00,12221.0,True,True,03/06/2013 00:00,31/12/2021 18:00,3055.25,6.0,1095.0,1460.0,1.0,0.0,1403.548672,1.0,,recommended,2013-06-03 00:00:00,2021-12-31 18:00:00,12221.0,0.7873423809964455,0.8493628155404388,0.9225190435176236,0.8714371633755184,0.7106847933637341,0.6731138928156434,2.14271164589742,3.3701975673885864,0.8493628155404388,-0.5833200672768869,-7.748095648237667,-7.748095648237644,28.46110687826813,7.748095648237644,0.5378802902470646,0.8714371633755184
466,16605006,Fürstenfeldbruck,1025,DE,11.261473,48.177101,514.23,1230.25,Amper,Danube,Danube,-,1350,4412500.0,2782500.0,1271.6,11.25833,48.175,True,True,True,False,1,1,1,1,1,1,1,1,1,0,HIST_6h,close to 457,2,close to 457,3,,1,1,03/01/1990,31/12/2021,9156.0,03/01/1990 00:00,31/12/2021 18:00,18437.0,True,True,03/01/1990 00:00,31/12/2021 18:00,4609.25,6.0,1095.0,1460.0,1.0,0.0,1271.58528,,1.0,,1991-01-03 00:00:00,2021-12-31 18:00:00,18077.0,0.7743736431569056,0.8724774689368348,1.0139739709853395,0.8143929281831311,0.7583057971006888,0.6760215588637379,4.502136872336265,5.760731705666967,0.8724774689368348,0.3165640575212901,1.3973970985339326,1.397397098533939,19.873617528996448,1.397397098533939,0.49162404629890866,0.8143929281831311
467,11809009,Harburg,1025,DE,10.692216,48.783017,400.65,1568.62,Wornitz,Danube,Danube,C442,1625,4367500.0,2857500.0,1573.3,10.69167,48.79167,True,True,True,True,1,1,1,1,1,1,1,1,1,0,NRT_6h,-,3,,3,,1,1,03/01/1990,31/12/2021,10590.0,03/06/2013 00:00,31/12/2021 18:00,12341.0,True,True,03/06/2013 00:00,31/12/2021 18:00,3085.25,6.0,1095.0,1460.0,1.0,0.0,1573.30368,,,recommended,2013-06-03 00:00:00,2021-12-31 18:00:00,12341.0,0.7928761660361316,0.8752857008848837,1.0109286430366078,0.8349933608805519,0.7650827141703023,0.6727502994685366,3.226720795627114,5.785085715251545,0.8752857008848837,0.10054637520569598,1.092864303660796,1.0928643036607706,35.072054742964575,1.0928643036607706,0.4846826650806657,0.8349933608805519
468,24201501,Hüttendorf,1025,DE,10.9736,49.5461,273.72,3864.37,Regnitz,Rhine,Rhine,C706,3875,4392500.0,2932500.0,3881.7,10.975,49.54167,True,True,True,True,1,1,1,1,1,1,1,1,1,0,NRT_6h,-,3,,3,,1,1,03/01/1990,31/12/2021,10732.0,14/01/2013 00:00,31/12/2021 18:00,12901.0,True,True,14/01/2013 00:00,31/12/2021 18:00,3225.25,6.0,1095.0,1460.0,0.0,,873.678592,,,,2013-01-14 00:00:00,2021-12-31 18:00:00,12901.0,0.7378964344149809,0.7538014409524976,0.9124487343659141,0.9795225855835364,0.5190330414027798,0.2949003260087302,6.673758341903449,10.769752152895851,0.7538014409524976,-2.6714682494894038,-8.755126563408515,-8.755126563408586,21.871717527668846,8.755126563408586,0.6935178141888055,0.9795225855835364
469,10046105,Ingolstadt Luitpoldstraße,1025,DE,11.426,48.7574,360.35,20001,Danube,Danube,Danube,C357,20225,4422500.0,2847500.0,20025.7,11.39167,48.74167,True,True,True,True,1,1,1,1,1,1,1,1,1,0,NRT_6h,-,3,keeping it for routing,3,,1,1,03/01/1990,31/12/2021,10734.0,14/01/2013 00:00,31/12/2021 18:00,12900.0,True,True,14/01/2013 00:00,31/12/2021 18:00,3225.0,6.0,1095.0,1460.0,0.0,,931.115328,,,recommended,2013-01-14 00:00:00,2021-12-31 18:00:00,12900.0,0.86120803453571,0.8690499039527515,1.0449015437226479,1.0099565754142776,0.7133537596214694,0.717897769042776,53.978168926620704,81.28283552147158,0.8690499039527515,12.884892792851721,4.490154372264768,4.490154372264796,18.81042513191687,4.490154372264796,0.5353935378565278,0.9900434245857224
470,16607001,Inkofen,1025,DE,11.8652,48.4607,415.58,3075.62,Amper,Danube,Danube,-,3175,4452500.0,2817500.0,3207.2,11.85833,48.45833,True,True,True,True,1,1,1,1,1,1,1,1,1,0,NRT_6h,-,3,,3,,1,1,03/01/1990,31/12/2021,10725.0,14/01/2013 00:00,31/12/2021 18:00,12897.0,True,True,14/01/2013 00:00,31/12/2021 18:00,3224.25,6.0,1095.0,1460.0,0.0,,968.9264,,,,2013-01-14 00:00:00,2021-12-31 18:00:00,12897.0,0.7413471452076366,0.760373170823965,1.0901090170530925,0.9631130500447068,0.4433201144218136,0.47737245005420303,8.90283876926317,12.90854146524905,0.760373170823965,3.9080061188851256,9.01090170530928,9.010901705309253,20.527758301190357,9.010901705309253,0.7461098347952443,0.9631130500447068
471,10053009,Kelheim,1025,DE,11.8643,48.9166,337.1,23019.24,Danube,Danube,Danube,-,23075,4452500.0,2862500.0,23009.3,11.85833,48.90833,True,True,True,True,1,1,1,1,1,1,1,1,1,0,NRT_6h,-,3,,3,,1,1,03/01/1990,31/12/2021,10724.0,14/01/2013 00:00,31/12/2021 18:00,12898.0,True,True,14/01/2013 00:00,31/12/2021 18:00,3224.5,6.0,1095.0,1460.0,0.0,,2983.629312,,,recommended,2013-01-14 00:00:00,2021-12-31 18:00:00,12898.0,0.8656483705374524,0.8837406677312064,1.065009692709623,0.9824538365032028,0.7382412589569367,0.6989582614992258,58.296843920839436,80.63104593742622,0.8837406677312064,20.135212219792376,6.5009692709623135,6.500969270962319,18.822050981460695,6.500969270962319,0.5116236322171456,0.9824538365032028
472,24010004,Kemmern,1025,DE,10.8741,49.951,230.22,4223.84,Main,Rhine,Rhine,C707,4150,4382500.0,2987500.0,4241.6,10.85833,49.95833,True,True,True,True,1,1,1,1,1,1,1,1,1,0,NRT_6h,-,3,,3,,1,1,03/01/1990,31/12/2021,10728.0,14/01/2013 00:00,31/12/2021 18:00,12901.0,True,True,14/01/2013 00:00,31/12/2021 18:00,3225.25,6.0,1095.0,1460.0,0.0,,1821.877632,,,,2013-01-14 00:00:00,2021-12-31 18:00:00,12901.0,0.8795620090424592,0.89727144549612,0.9378898645999764,0.9902796689345079,0.8007599132660972,0.6483643829825002,10.635196531083492,17.11921132153961,0.89727144549612,-2.2177547971575464,-6.211013540002338,-6.21101354000236,29.784784927444377,6.21101354000236,0.4463631780668112,0.9902796689345079
473,15205501,Kienhof,1025,DE,12.4951,49.1903,354.12,2174.12,Regen,Danube,Danube,C445,2150,4507500.0,2902500.0,2177.6,12.49167,49.19167,True,True,True,False,1,1,1,1,1,1,1,1,1,0,NRT_6h,close to 903,2,close to 903,3,,1,1,03/01/1990,31/12/2021,10730.0,14/01/2013 00:00,31/12/2021 18:00,12901.0,True,True,14/01/2013 00:00,31/12/2021 18:00,3225.25,6.0,1095.0,1460.0,0.0,,811.792192,,,recommended,2013-01-14 00:00:00,2021-12-31 18:00:00,12901.0,0.7630536931689799,0.7799885342188769,1.0601502872121564,1.064190732929269,0.48213380027938124,0.6368530447616008,7.513076505598423,16.102313605924696,0.7799885342188769,1.581517898134747,6.015028721215632,6.01502872121565,28.57468196797767,6.01502872121565,0.7196292098856335,0.935809267070731
474,16008007,Landau,1025,DE,12.692566,48.675294,333.65,8391.54,Isar,Danube,Danube,C363,8625,4512500.0,2842500.0,8618.1,12.69167,48.675,True,True,True,False,1,1,1,1,1,1,1,1,1,0,NRT_6h,close to 483,2,close to 483,3,,1,1,03/01/1990,31/12/2021,10568.0,03/06/2013 00:00,31/12/2021 18:00,12241.0,True,True,03/06/2013 00:00,31/12/2021 18:00,3060.25,6.0,1095.0,1460.0,0.0,,647.031232,,,,2013-06-03 00:00:00,2021-12-31 18:00:00,12241.0,0.7360945017508058,0.8529280216506737,1.1178676415277113,1.1847245632591012,0.42778895726740707,0.4148315928629781,35.852237511859904,51.945075922311155,0.8529280216506737,19.11000000432802,11.78676415277115,11.786764152771141,22.113127567018356,11.786764152771141,0.7564463250836719,0.8152754367408988
475,18602009,Laufen Siegerstetter Keller,1025,DE,12.933,47.9397,387.05,6112.11,Salzach,Danube,Danube,-,6100,4542500.0,2762500.0,6126.2,12.94167,47.94167,True,True,True,False,1,1,1,1,1,1,1,1,1,0,NRT_6h,close to 461,2,close to 461,3,,1,1,03/01/1990,31/12/2021,10734.0,14/01/2013 00:00,31/12/2021 18:00,12894.0,True,True,14/01/2013 00:00,31/12/2021 18:00,3223.5,6.0,1095.0,1460.0,0.0,,575.234816,,,recommended,2013-01-14 00:00:00,2021-12-31 18:00:00,12894.0,0.8843199763500219,0.8919165080633161,0.9676893466455365,1.0256095357677562,0.7828819605504529,0.7764052134563953,46.403973937072855,74.07936565187391,0.8919165080633161,-7.983717333080914,-3.2310653354463477,-3.231065335446344,18.780007527793064,3.231065335446344,0.4659592680155065,0.9743904642322438
476,24003009,Mainleus,1025,DE,11.373051,50.099504,284.56,1165.55,Main,Rhine,Rhine,-,1175,4417500.0,2997500.0,1164.3,11.375,50.09167,True,True,True,False,1,1,1,1,1,1,1,1,1,0,NRT_6h,Close to 486,2,close to 486,3,,1,1,03/01/1990,31/12/2021,10585.0,03/06/2013 00:00,31/12/2021 18:00,12332.0,True,True,03/06/2013 00:00,31/12/2021 18:00,3083.0,6.0,1095.0,1460.0,1.0,0.0,1164.33536,,,,2013-06-03 00:00:00,2021-12-31 18:00:00,12332.0,0.6467708418548661,0.8883278138332158,0.8313955495668526,1.289607838800657,0.7292366708049904,-0.5078661114266021,3.9715620928405877,5.990560867083094,0.8883278138332158,-1.8595622243840761,-16.860445043314744,-16.860445043314744,36.00971428887244,16.860445043314744,0.5203492377192549,0.7103921611993429
477,14006000,Münchshofen,1025,DE,12.084,49.234,344.01,4007.77,Naab,Danube,Danube,-,4025,4467500.0,2902500.0,4014.3,12.09167,49.24167,True,True,True,True,1,1,1,1,1,1,1,1,1,0,NRT_6h,-,3,,3,,1,1,03/01/1990,31/12/2021,10733.0,14/01/2013 00:00,31/12/2021 18:00,12897.0,True,True,14/01/2013 00:00,31/12/2021 18:00,3224.25,6.0,1095.0,1460.0,0.0,,2004.224512,1.0,,recommended,2013-01-14 00:00:00,2021-12-31 18:00:00,12897.0,0.8551747328266306,0.8841493495004129,0.9717163083417473,0.9178232540383763,0.7805931319632871,0.6442135284780013,8.435332920502786,12.046445425650985,0.8841493495004129,-0.8402391803930827,-2.8283691658252597,-2.8283691658252756,28.39457632130346,2.8283691658252756,0.46840886844370516,0.9178232540383763
478,24211200,Neumühle,1025,DE,10.99117,49.436077,28747,1846.64,Rednitz,Rhine,Rhine,-,1825,4392500.0,2922500.0,1805.6,11.00833,49.425,True,True,True,True,1,1,1,1,1,1,1,1,1,0,NRT_6h,lake,3,,3,,1,1,03/01/1990,31/12/2021,10228.0,12/06/2013 00:00,31/12/2021 18:00,12306.0,True,True,12/06/2013 00:00,31/12/2021 18:00,3076.5,6.0,1095.0,1460.0,1.0,0.0,1805.646848,1.0,,,2013-06-12 00:00:00,2021-12-31 18:00:00,12306.0,0.5362353419284647,0.5406380498163992,0.9895208801217658,0.937115623193796,0.14193178004766926,0.15392795429662642,3.4497620320000033,4.97091412411779,0.5406380498163992,-0.15679856990712482,-1.047911987823422,-1.04791198782342,23.055356886304324,1.04791198782342,0.9263197179982361,0.937115623193796
479,10026301,"Neu Ulm, Bad Held",1025,DE,9.9867,48.3892,464.92,7587.88,Danube,Danube,Danube,-,7600,4317500.0,2807500.0,7586.6,9.975,48.375,True,True,True,True,1,1,1,1,1,1,1,1,1,0,NRT_6h,-,3,backwater effect during low flow conditions ,3,,1,1,03/01/1990,31/12/2021,10738.0,14/01/2013 00:00,31/12/2021 18:00,12901.0,True,True,14/01/2013 00:00,31/12/2021 18:00,3225.25,6.0,1095.0,1460.0,0.0,,1328.202368,,,recommended,2013-01-14 00:00:00,2021-12-31 18:00:00,12901.0,0.8440924418275334,0.90032066536339,1.0954697513508909,1.0725032655726818,0.7117086412168873,0.7355512969604794,25.075465066693603,38.47381823399301,0.90032066536339,10.979355601295469,9.546975135089124,9.546975135089081,21.80408852631317,9.546975135089081,0.536927703497512,0.9274967344273182
480,24225000,Nürnberg,1025,DE,11.052531,49.45582,288.8,1197.58,Pegnitz,Rhine,Rhine,-,1225,4397500.0,2927500.0,1202.3,11.05833,49.45833,True,True,True,True,1,1,1,1,1,1,1,1,1,0,NRT_6h,-,3,,3,,1,1,03/01/1990,31/12/2021,10594.0,03/06/2013 00:00,31/12/2021 18:00,12341.0,True,True,03/06/2013 00:00,31/12/2021 18:00,3085.25,6.0,1095.0,1460.0,1.0,0.0,1202.342016,,,,2013-06-03 00:00:00,2021-12-31 18:00:00,12341.0,0.6525791396518215,0.6748911117061545,1.121917418240768,0.9881000803820328,0.2122233262406792,0.15139535776766488,2.9143335864283455,4.189638223887412,0.6748911117061545,1.1088339485268404,12.191741824076754,12.191741824076802,32.0433936228008,12.191741824076802,0.8875678417784827,0.9881000803820328
481,18000403,Oberaudorf,1025,DE,12.1961,47.644,464,9714.85,Inn,Danube,Danube,C058,9725,4482500.0,2722500.0,9727.5,12.19167,47.64167,True,True,True,False,1,1,1,1,1,1,1,1,1,0,NRT_6h,oscillations close to 484,2,close to 484 excluded by DP,3,DP,0,1,03/01/1990,31/12/2021,10725.0,14/01/2013 00:00,31/12/2021 18:00,12877.0,True,True,,,,,,,,,,,,exclude,,,,,,,,,,,,,,,,,,,
482,18008008,Passau Ingling,1025,DE,13.444142,48.561512,289.19,26062.72,Inn,Danube,Danube,C056,26100,4577500.0,2827500.0,26048.9,13.44167,48.55833,True,True,True,False,1,1,1,1,1,1,1,1,1,0,NRT_6h,exclude peak in 06-2013 for problems to the river gauge  close to 1967,2,close to 1967  excluded by DP,3,DP,0,1,03/01/1990,31/12/2021,10738.0,14/01/2013 00:00,31/12/2021 18:00,12897.0,True,True,,,,,,,,,,,,exclude,,,,,,,,,,,,,,,,,,,
483,16008506,Plattling,1025,DE,12.8835,48.771,316.31,8435.03,Isar,Danube,Danube,-,9000,4532500.0,2852500.0,8947.7,12.89167,48.775,True,True,True,True,1,1,1,1,1,1,1,1,1,0,NRT_6h,-,3,,3,,1,1,03/01/1990,31/12/2021,10734.0,14/01/2013 00:00,31/12/2021 18:00,12902.0,True,True,14/01/2013 00:00,31/12/2021 18:00,3225.5,6.0,1095.0,1460.0,0.0,,329.632608,,,,2013-01-14 00:00:00,2021-12-31 18:00:00,12902.0,0.7621019678741442,0.8503206158266663,1.1376451383745194,1.1234721487814385,0.4397418676281841,0.43314754320673077,37.25331535813206,53.10247212348205,0.8503206158266663,22.468041873807,13.764513837452006,13.764513837451936,22.822361539915025,13.764513837451936,0.748503929429773,0.8765278512185615
484,18001508,Rosenheim o.d. Mangfallmündung,1025,DE,12.143314,47.854474,440,10180.59,Inn,Danube,Danube,-,10225,4482500.0,2747500.0,10151.1,12.15833,47.84167,True,True,True,False,1,1,1,1,1,1,1,1,1,0,NRT_6h,close to 489,2,close to 489  excluded by DP,3,DP,0,1,03/01/1990,31/12/2021,10591.0,03/06/2013 00:00,31/12/2021 18:00,12336.0,True,True,,,,,,,,,,,,exclude,,,,,,,,,,,,,,,,,,,
485,24403007,Salz,1025,DE,10.192633,50.31,221.62,1041.76,Franconian Saale,Rhine,Rhine,-,1025,4337500.0,3022500.0,1341.4,10.19167,50.30833,True,True,True,False,1,1,1,1,1,1,1,1,1,0,NRT_6h,Close to 459,2,Close to 459,3,,1,1,03/01/1990,31/12/2021,10595.0,03/06/2013 00:00,31/12/2021 18:00,12339.0,True,True,03/06/2013 00:00,31/12/2021 18:00,3084.75,6.0,1095.0,1460.0,1.0,0.0,1341.424768,,,,2013-06-03 00:00:00,2021-12-31 18:00:00,12339.0,0.7123854294738069,0.8700985675673689,1.1211433300262126,0.7737875940159841,0.7433405237739608,0.5895759699668262,2.078845159571809,3.218552275858601,0.8700985675673689,0.7442661633515768,12.114333002621343,12.114333002621263,33.83711871373117,12.114333002621263,0.5066157086254225,0.7737875940159841
486,24006007,Schwürbitz,1025,DE,11.1512,50.165,263.5,2418.68,Main,Rhine,Rhine,-,2500,4402500.0,3007500.0,2419.7,11.15833,50.15833,True,True,True,True,1,1,1,1,1,1,1,1,1,0,NRT_6h,-,3,,3,,1,1,03/01/1990,31/12/2021,10727.0,14/01/2013 00:00,31/12/2021 18:00,12899.0,True,True,14/01/2013 00:00,31/12/2021 18:00,3224.75,6.0,1095.0,1460.0,0.0,,1255.359616,1.0,,,2013-01-14 00:00:00,2021-12-31 18:00:00,12899.0,0.8469881260681897,0.9044773353545306,0.8893115498317035,1.045123398614177,0.8080349975161829,0.5395632349014348,7.814174654394531,12.580412050541446,0.9044773353545306,-2.7869854591523873,-11.068845016829728,-11.068845016829654,31.034926249754125,11.068845016829654,0.43813810891523375,0.954876601385823
487,18403002,Seebruck,1025,DE,12.480662,47.934545,517.34,1399.32,Alz,Danube,Danube,-,1500,4507500.0,2762500.0,1476.2,12.475,47.94167,True,True,True,True,1,1,1,1,1,1,1,1,1,0,NRT_6h,lake moved station downstream,3,keep it because downstream of lake,3,,1,1,03/01/1990,31/12/2021,10592.0,03/06/2013 00:00,31/12/2021 18:00,12334.0,True,True,03/06/2013 00:00,31/12/2021 18:00,3083.5,6.0,1095.0,1460.0,1.0,0.0,1476.16384,,1.0,exclude,2013-06-03 00:00:00,2021-12-31 18:00:00,12334.0,0.847035168227745,0.8832406227827821,1.0981294892961448,1.0116658013629363,0.6869750725894619,0.6841521798290795,9.373367620836833,13.091746247101314,0.8832406227827821,4.75489060937615,9.812948929614482,9.81294892961449,19.344373050433223,9.81294892961449,0.5594863067229952,0.9883341986370637
488,14002305,Unterköblitz,1025,DE,12.154,49.5356,369.63,2010.38,Naab,Danube,Danube,-,1975,4477500.0,2937500.0,2010.0,12.15833,49.54167,True,True,True,True,1,1,1,1,1,1,1,1,1,0,NRT_6h,-,3,,3,,1,1,03/01/1990,31/12/2021,10716.0,14/01/2013 00:00,31/12/2021 18:00,12807.0,True,True,14/01/2013 00:00,31/12/2021 18:00,3201.75,6.0,1095.0,1460.0,1.0,0.0,2010.02496,,,recommended,2013-01-14 00:00:00,2021-12-31 18:00:00,12807.0,0.8677043276217369,0.881771119313554,1.0093938563000306,0.9413840280686123,0.7727405454089944,0.5488156158729569,4.822427687949672,6.921631751157005,0.881771119313554,0.1404098219160772,0.9393856300030938,0.9393856300030684,32.26354972871121,0.9393856300030684,0.476717373913522,0.9413840280686123
489,18003004,Wasserburg,1025,DE,12.2343,48.0593,420.45,11980.37,Inn,Danube,Danube,C364,12100,4482500.0,2767500.0,11969.7,12.225,48.075,True,True,True,True,1,1,1,1,1,1,1,1,1,0,NRT_6h,Oscillations,3,,3,,1,1,03/01/1990,31/12/2021,10732.0,14/01/2013 00:00,31/12/2021 18:00,12899.0,True,True,14/01/2013 00:00,31/12/2021 18:00,3224.75,6.0,1095.0,1460.0,0.0,,2665.128448,,,recommended,2013-01-14 00:00:00,2021-12-31 18:00:00,12899.0,0.9070752555909176,0.9147790734094897,0.9771638088898384,0.9708296354131746,0.8338787688627511,0.8227659210875657,55.9735776604173,79.6974234342229,0.9147790734094897,-8.282366810750824,-2.283619111016154,-2.28361911101615,15.433068177004351,2.28361911101615,0.4075797236581435,0.9708296354131746
490,24409003,Wolfsmünster,1025,DE,9.7356,50.0877,155.38,2120.89,Franconian Saale,Rhine,Rhine,C709,2125,4302500.0,2997500.0,2122.1,9.74167,50.09167,True,True,True,True,1,1,1,1,1,1,1,1,1,0,NRT_6h,-,3,,3,,1,1,03/01/1990,31/12/2021,10736.0,14/01/2013 00:00,31/12/2021 18:00,12899.0,True,True,14/01/2013 00:00,31/12/2021 18:00,3224.75,6.0,1095.0,1460.0,0.0,,516.385536,,,,2013-01-14 00:00:00,2021-12-31 18:00:00,12899.0,0.773196616866719,0.9039188730169014,1.0968287287510994,0.8188029003355585,0.8069930507699107,0.6657363626475697,3.7490860751388206,5.537936291712408,0.9039188730169014,1.2632149585971333,9.682872875109918,9.68287287510994,28.73772481583764,9.68287287510994,0.4393255617763299,0.8188029003355585
491,150200040,Tokarnia,1024,PL,20.4531,50.7742,213.1,-,Czarna Nida,Vistula,Vistula,-,1225,5057500.0,3127500.0,1217.1,20.45833,50.775,False,False,True,True,0,0,0,0,0,0,0,1,1,0,HIST_24h,-,3,,2,,1,1,03/01/1990,01/01/2020,10821.0,,,,True,False,03/01/1990 00:00,01/01/2020 00:00,10821.0,24.0,1095.0,1460.0,1.0,0.0,1217.081216,,,,1991-01-03 00:00:00,2020-01-01 00:00:00,10458.0,0.5339581550555088,0.5851917759939572,0.9142162534609676,1.1943457932808037,0.07943960747391732,-0.6723040486338341,3.8754795160135695,6.688315444159879,0.5851917759939572,-0.5518217716635214,-8.578374653903271,-8.578374653903241,60.24647260957258,8.578374653903241,0.9594583849891977,0.8056542067191963
492,150200170,ŻABNO,1024,PL,20.863611,50.131944,172.43,6740.66,Dunajec,Vistula,Vistula,C225,6900,5097500.0,3052500.0,6753.0,20.85833,50.125,True,True,True,True,1,1,1,1,1,1,1,1,1,0,HIST_24h,-,3,,3,,2,1,01/01/1991,31/12/2021,11142.0,17/03/2018 18:00,31/12/2021 18:00,5141.0,True,False,01/01/1991 00:00,31/12/2021 00:00,11142.0,24.0,1095.0,1460.0,0.0,,4665.915392,1.0,,,1991-01-03 00:00:00,2022-01-01 00:00:00,11141.0,0.8335398424413596,0.8345292354599859,0.9948569043423973,0.9826230410011602,0.6759585150800367,0.412095164430344,36.3420793328049,59.61253591900554,0.8345292354599859,-0.4690897545272875,-0.5143095657602453,-0.5143095657602728,39.84542160660725,0.5143095657602728,0.5692464184515919,0.9826230410011602
493,150200080,Pinczow,1024,PL,20.5208,50.5139,185.58,-,Nida,Vistula,Vistula,C564,3400,5062500.0,3097500.0,3355.4,20.525,50.50833,False,False,True,True,0,0,0,0,0,0,0,1,1,0,HIST_24h,-,3,,2,,1,1,03/01/1990,01/01/2020,10900.0,,,,True,False,03/01/1990 00:00,01/01/2020 00:00,10900.0,24.0,1095.0,1460.0,0.0,,2138.320896,,,,1991-01-03 00:00:00,2020-01-01 00:00:00,10538.0,0.5165435823057848,0.6608635407207003,0.9323075814884746,1.3378376922033477,0.08702667057425517,-0.7815306532203554,8.04536890583139,14.385420464085199,0.6608635407207003,-1.1499553943921905,-6.769241851152527,-6.769241851152538,47.359269908117255,6.769241851152538,0.9554963785518735,0.6621623077966523
494,149200220,Stary Sacz,1024,PL,20.66,49.5686,297.57,-,Poprad,Vistula,Vistula,C549,2100,5087500.0,2992500.0,2087.1,20.65833,49.575,False,False,True,False,0,0,0,0,0,0,0,1,1,0,HIST_24h,Large outliers Moved on affluent,1,,2,,1,0,03/01/1990,01/01/2020,10896.0,,,,True,False,03/01/1990 00:00,01/01/2020 00:00,10896.0,24.0,1095.0,1460.0,0.0,,814.49344,,,,1991-01-03 00:00:00,2020-01-01 00:00:00,10534.0,0.7635107602900787,0.7852677278900471,0.9414531735074444,1.0799342287178924,0.5601924370760534,0.3194400983828173,10.666425530687661,18.521988604658283,0.7852677278900471,-1.5010656204057908,-5.85468264925564,-5.85468264925556,41.602802459237,5.85468264925556,0.6631798873035484,0.9200657712821076
495,149200170,Proszowki,1024,PL,20.4336,49.9961,187.16,1470,Raba,Vistula,Vistula,C539,1475,5062500.0,3037500.0,1497.5,20.44167,49.99167,False,False,True,True,0,0,0,0,0,0,0,1,1,0,HIST_24h,dam,3,,2,,1,1,03/01/1990,01/01/2020,10762.0,,,,True,False,03/01/1990 00:00,01/01/2020 00:00,10762.0,24.0,1095.0,1460.0,1.0,0.0,1497.54496,1.0,,,1991-01-03 00:00:00,2020-01-01 00:00:00,10399.0,0.7203071105151235,0.7238711696456022,0.9579810910917487,0.9853237344780231,0.4747004745572264,0.3002541446869804,7.997717466342372,15.91814428838753,0.7238711696456022,-0.6466356892612998,-4.2018908908251,-4.201890890825132,51.96981349360284,4.201890890825132,0.7247755000293374,0.9853237344780231
496,150220100,JAROSŁAW,1024,PL,22.702778,50.021111,172.21,7028.16,San,Vistula,Vistula,-,6975,5222500.0,3072500.0,7098.2,22.70833,50.025,True,True,True,True,1,1,1,1,1,1,1,1,1,0,HIST_24h,-,3,,3,,1,1,01/01/1991,31/12/2021,11108.0,01/04/2018 12:00,31/12/2021 18:00,5008.0,True,False,01/01/1991 00:00,31/12/2021 00:00,11108.0,24.0,1095.0,1460.0,1.0,0.0,7098.199552,1.0,,,1991-01-03 00:00:00,2022-01-01 00:00:00,11107.0,0.7637639605295456,0.8098968393196523,0.9401168126818894,1.1268158449116357,0.5897680044118397,-0.16655365783259057,27.119324350474848,41.5179203759117,0.8098968393196523,-4.070751676683182,-5.988318731811019,-5.988318731811057,39.894145086818114,5.988318731811057,0.640493556242497,0.8731841550883643
497,150220030,NISKO,1024,PL,22.192778,50.52,149.67,15578.39,San,Vistula,Vistula,C223,15575,5177500.0,3117500.0,15620.1,22.19167,50.525,True,True,True,True,1,1,1,1,1,1,1,1,1,0,HIST_24h,-,3,,3,,1,1,01/01/1991,31/12/2021,11151.0,01/04/2018 12:00,31/12/2021 18:00,5219.0,True,False,01/01/1991 00:00,31/12/2021 00:00,11151.0,24.0,1095.0,1460.0,0.0,,6422.956544,,,,1991-01-03 00:00:00,2022-01-01 00:00:00,11150.0,0.810143402822224,0.8224522264620199,0.961539627656554,1.0551644392959263,0.6375274178494089,0.42266327134287596,39.47195294702425,62.779588849373035,0.8224522264620199,-4.647251648694242,-3.8460372343445703,-3.846037234344601,32.66674848331203,3.846037234344601,0.6020569592244503,0.9448355607040737
498,149190170,Zator,1024,PL,19.4456,49.9992,221.67,-,Skawa,Vistula,Vistula,C538,1125,4997500.0,3027500.0,1137.7,19.44167,50.00833,False,False,True,True,0,0,0,0,0,0,0,1,1,0,HIST_24h,Moved on affluent,3,,2,,1,1,03/01/1990,01/01/2020,10450.0,,,,True,False,03/01/1990 00:00,01/01/2020 00:00,10450.0,24.0,1095.0,1460.0,1.0,0.0,1137.700224,1.0,,,1991-01-03 00:00:00,2020-01-01 00:00:00,10087.0,0.7946499267250694,0.7969053963449386,0.9921235442020031,0.9706879546214342,0.6074257545892747,0.44335393665994327,7.273485344238244,13.52795844581186,0.7969053963449386,-0.12013725858318863,-0.7876455797997086,-0.7876455797996946,47.686526633700986,0.7876455797996946,0.6265574557937399,0.9706879546214342
499,150190170,PUSTYNIA,1024,PL,19.236389,50.063611,223.42,3945.78,Vistula,Vistula,Vistula,-,2925,4977500.0,3032500.0,5315.8,19.24167,50.05833,True,True,True,True,1,1,1,1,1,1,1,1,1,0,HIST_24h,-,3,it cannot be mapped on the LDD,2,exclude,0,1,01/01/1991,04/09/2021,10556.0,23/05/2019 06:00,03/09/2021 06:00,64.0,True,False,,,,,,,,,,,,,,,,,,,,,,,,,,,,,,,
500,150190260,SMOLICE,1024,PL,19.460278,50.031111,214.1,6796.18,Vistula,Vistula,Vistula,C544,6750,4997500.0,3032500.0,6785.3,19.45833,50.025,False,False,True,True,1,0,1,0,1,1,1,1,1,0,HIST_24h,-,3,,2,,1,1,03/01/1990,06/09/2021,10914.0,03/09/2021 12:00,05/09/2021 06:00,3.0,True,False,03/01/1990 00:00,06/09/2021 00:00,10914.0,24.0,1095.0,1460.0,0.0,,5647.643648,1.0,,,1991-01-03 00:00:00,2021-09-06 00:00:00,10551.0,0.8229865212399762,0.8522819636920974,0.9503915745394969,0.9160228749277979,0.7236592466728609,0.5770286603817021,22.72290520046811,40.22648498775697,0.8522819636920974,-3.741371598170047,-4.960842546050319,-4.960842546050313,30.129259265100835,4.960842546050313,0.5256812278626084,0.9160228749277979
501,150200100,POPĘDZYNKA,1024,PL,20.549444,50.141389,173.44,10691.14,Vistula,Vistula,Vistula,-,10650,5072500.0,3057500.0,10674.4,20.54167,50.14167,True,True,True,True,1,1,1,1,1,1,1,1,1,0,HIST_24h,-,3,,3,,1,1,01/01/1991,31/12/2021,11160.0,30/03/2018 06:00,31/12/2021 18:00,5172.0,True,False,01/01/1991 00:00,31/12/2021 00:00,11160.0,24.0,1095.0,1460.0,0.0,,2391.486464,,,,1991-01-03 00:00:00,2022-01-01 00:00:00,11159.0,0.8603735294628438,0.8785701782622922,0.9329824198649893,0.9839067212706899,0.765990766562209,0.5803398202678648,31.521315849294364,54.32699085178538,0.8785701782622922,-7.400746244983769,-6.701758013501101,-6.701758013501072,28.54417974839926,6.701758013501072,0.48374500869548087,0.9839067212706899
502,150210020,SZCZUCIN,1024,PL,21.077222,50.326944,159.15,23876.38,Vistula,Vistula,Vistula,-,24125,5102500.0,3082500.0,23882.2,21.075,50.325,True,True,True,True,1,1,1,1,1,1,1,1,1,0,HIST_24h,-,3,,3,,1,1,01/01/1991,31/12/2021,11144.0,23/03/2018 06:00,31/12/2021 18:00,5172.0,True,False,01/01/1991 00:00,31/12/2021 00:00,11144.0,24.0,1095.0,1460.0,0.0,,3099.39968,,,,1991-01-03 00:00:00,2022-01-01 00:00:00,11143.0,0.8754011663518426,0.8831526237105978,1.0094135761603513,0.9577750715259657,0.7728711011022221,0.5684746049982925,66.42518780136079,109.41721234964392,0.8831526237105978,2.2027410952180557,0.9413576160351581,0.9413576160351397,28.387292800376496,0.9413576160351397,0.476580422277058,0.9577750715259657
503,150210170,SANDOMIERZ,1024,PL,21.746111,50.6725,139.15,31809.9,Vistula,Vistula,Vistula,C217,32125,5147500.0,3127500.0,31845.4,21.74167,50.675,True,True,True,True,1,1,1,1,1,1,1,1,1,0,HIST_24h,-,3,,3,,1,1,01/01/1991,31/12/2021,11172.0,01/04/2018 12:00,31/12/2021 18:00,5253.0,True,False,01/01/1991 00:00,31/12/2021 00:00,11172.0,24.0,1095.0,1460.0,0.0,,4099.400704,1.0,,,1991-01-03 00:00:00,2022-01-01 00:00:00,11171.0,0.8794538339546968,0.8852279630182704,0.9642770477726426,0.9909099857289296,0.7773358847748462,0.5904862981797622,80.7240360854098,133.33538965338354,0.8852279630182704,-10.393101732772536,-3.572295222735757,-3.572295222735748,27.746297099983135,3.572295222735748,0.47187298632699326,0.9909099857289296
504,150210190,ZAWICHOST,1024,PL,21.862778,50.805833,133.38,50654.57,Vistula,Vistula,Vistula,-,50650,5152500.0,3142500.0,50727.2,21.85833,50.80833,True,True,True,True,1,1,1,1,1,1,1,1,1,0,HIST_24h,-,3,,3,,1,1,01/01/1991,31/12/2021,11166.0,13/03/2018 12:00,31/12/2021 18:00,4832.0,True,False,01/01/1991 00:00,31/12/2021 00:00,11166.0,24.0,1095.0,1460.0,0.0,,3261.637632,,,,1991-01-03 00:00:00,2022-01-01 00:00:00,11165.0,0.869624065922238,0.8713000173596371,0.9797278615405345,1.0048206905417687,0.7458486016637136,0.5753006450684135,116.63747993360424,186.1228987310242,0.8713000173596371,-8.353991950862095,-2.0272138459465636,-2.0272138459465547,28.303727806837983,2.0272138459465547,0.5041343058514114,0.9951793094582313
505,150220010,Rzeszow,1024,PL,22.0156,50.0397,193.21,-,Wislok,Vistula,Vistula,C563,2125,5177500.0,3062500.0,2098.9,22.025,50.04167,False,False,True,True,0,0,0,0,0,0,0,1,1,0,HIST_24h,-,3,,2,,1,1,21/02/1990,01/01/2020,10649.0,,,,True,False,21/02/1990 00:00,01/01/2020 00:00,10649.0,24.0,1095.0,1460.0,1.0,0.0,2098.948992,,,,1991-03-14 00:00:00,2020-01-01 00:00:00,10383.0,0.7511818214682343,0.7576577020510277,1.025220599226185,0.9495557935204716,0.5271383864839482,0.3825474160189246,9.469857339425483,17.723744275003725,0.7576577020510277,0.4589823416579818,2.5220599226184963,2.5220599226185016,52.035874806000315,2.5220599226185016,0.6876493390646521,0.9495557935204716
506,150210120,MIELEC 2,1024,PL,21.430556,50.278889,161.41,3891.69,WISLOKA,Vistula,Vistula,C224,3900,5127500.0,3087500.0,3863.8,21.425,50.275,True,True,True,True,1,1,1,1,1,1,1,1,1,0,HIST_24h,-,3,,3,,1,1,02/01/1993,31/12/2021,10403.0,01/04/2018 12:00,31/12/2021 18:00,5251.0,True,False,02/01/1993 00:00,31/12/2021 00:00,10403.0,24.0,1095.0,1460.0,1.0,0.0,3863.80672,,,,1993-01-02 00:00:00,2022-01-01 00:00:00,10404.0,0.783522330476381,0.8098700523623249,0.8971361486848277,1.0114983697228024,0.6400083067027247,0.4778177182271033,15.085812550473765,27.754595402148404,0.8098700523623249,-3.6887847217054466,-10.286385131517262,-10.286385131517232,42.067642766722884,10.286385131517232,0.5999930777077993,0.9885016302771976
507,150210090,Kunow,1024,PL,21.2789,50.9619,176.11,-,Kamienna,Vistula,Vistula,-,1125,5107500.0,3157500.0,1119.0,21.275,50.95833,False,False,True,True,0,0,0,0,0,0,0,1,1,0,HIST_24h,-,3,,2,,1,1,03/01/1990,01/01/2020,8727.0,,,,True,False,03/01/1990 00:00,01/01/2020 00:00,8727.0,24.0,1095.0,1460.0,1.0,0.0,1119.018624,1.0,,,1991-01-03 00:00:00,2020-01-01 00:00:00,8363.0,0.6082574589793226,0.6489246179760984,0.845351155270232,0.9206776865827987,0.3854614013181531,0.30827684694507107,2.3996249293864316,4.581376552081235,0.6489246179760984,-0.8035402874208323,-15.464884472976763,-15.464884472976797,46.18302640499824,15.464884472976797,0.7839251231347582,0.9206776865827987
508,152210120,Lochow,1024,PL,21.6783,52.51,95.01,2462,Liwiec,Vistula,Vistula,C555,2475,5112500.0,3327500.0,2516.6,21.675,52.50833,False,False,True,True,0,0,0,0,0,0,0,1,1,0,HIST_24h,-,3,,2,,1,1,03/01/1990,01/01/2020,10908.0,,,,True,False,03/01/1990 00:00,01/01/2020 00:00,10908.0,24.0,1095.0,1460.0,1.0,0.0,2516.574208,,,,1991-01-03 00:00:00,2020-01-01 00:00:00,10545.0,0.5340976410890939,0.5399377073369723,1.067146656942593,0.9700163149393,0.042012177588106825,-1.7864032462665644,6.506409142788461,10.195097226329313,0.5399377073369723,0.6818996468224616,6.714665694259281,6.714665694259283,64.06860960769947,6.714665694259283,0.9787685234067778,0.9700163149393
509,151190100,SULEJÓW (KOPALNIA),1024,PL,19.88611,51.34361,166.32,3927.69,Pilica,Vistula,Vistula,-,4075,5007500.0,3182500.0,3924.8,19.89167,51.34167,True,True,True,True,1,1,1,1,1,1,1,1,1,0,HIST_24h,-,3,,3,,1,1,01/01/1991,05/11/2021,11114.0,01/04/2018 12:00,19/11/2021 12:00,5122.0,True,False,01/01/1991 00:00,05/11/2021 00:00,11114.0,24.0,1095.0,1460.0,1.0,0.0,3924.84096,,,,1991-01-03 00:00:00,2021-11-05 00:00:00,11112.0,0.5842289751973391,0.6353895003346475,0.9231269656692223,1.1844322780643777,0.18103828621705165,0.3447764941801549,7.6789525921563655,13.411942826664758,0.6353895003346475,-1.6849023223876318,-7.6873034330778225,-7.6873034330777745,35.03493219741954,7.6873034330777745,0.9049650345637442,0.8155677219356223
510,151220010,KOŚMIN,1024,PL,22.001389,51.573056,115,10292.67,Wieprz,Vistula,Vistula,C222,10200,5142500.0,3227500.0,10231.8,22.00833,51.575,True,True,True,True,1,1,1,1,1,1,1,1,1,0,HIST_24h,-,3,,3,,1,1,01/01/1991,31/12/2021,11095.0,11/04/2018 12:00,31/12/2021 18:00,4319.0,True,False,01/01/1991 00:00,31/12/2021 00:00,11095.0,24.0,1095.0,1460.0,1.0,0.0,10231.81414,1.0,,,1991-01-03 00:00:00,2022-01-01 00:00:00,11094.0,0.009007306836673723,0.4151062301117317,0.9303560877702474,1.7969413537634538,-1.4233949723841062,-0.8837165363736235,18.773889553733465,31.55118762079862,0.4151062301117317,-2.5987429090197267,-6.964391222975282,-6.964391222975262,50.31229182976335,6.964391222975262,1.5567257216298913,0.20305864623654624
511,152200120,BORKOWO,1024,PL,20.665556,52.561667,75.31,5133.19,Wkra,Vistula,Vistula,C546,5175,5042500.0,3327500.0,5069.1,20.65833,52.55833,True,True,True,True,1,1,1,1,1,1,1,1,1,0,HIST_24h,-,3,,3,,1,1,02/01/1999,31/12/2021,8249.0,11/04/2018 12:00,31/12/2021 18:00,5217.0,True,False,02/01/1999 00:00,31/12/2021 00:00,8249.0,24.0,1095.0,1460.0,1.0,0.0,5069.086208,,,,1999-01-02 00:00:00,2022-01-01 00:00:00,8250.0,0.5830848523495473,0.5833153163611795,1.0100309900422384,0.9904347503959758,0.16622309793882895,-0.2553171729173842,11.609694008719591,17.780675791901427,0.5833153163611795,0.19396981138620129,1.0030990042238201,1.003099004223839,60.038582376630764,1.003099004223839,0.9131138494520684,0.9904347503959758
512,153220100,BURZYN,1024,PL,22.459444,53.273889,98.84,6928.92,Biebrza,Vistula,Vistula,C550,6975,5147500.0,3422500.0,7023.3,22.45833,53.275,True,True,True,True,1,1,1,1,1,1,1,1,1,0,HIST_24h,-,3,,3,,1,1,01/01/1991,31/12/2021,11162.0,11/04/2018 12:00,31/12/2021 18:00,5250.0,True,False,01/01/1991 00:00,31/12/2021 00:00,11162.0,24.0,1095.0,1460.0,1.0,0.0,7023.278592,,,,1991-01-03 00:00:00,2022-01-01 00:00:00,11161.0,0.6432442103854508,0.6525124645822563,1.0405556617992484,1.069873775115045,0.21093854945166957,-0.2502165763300426,15.600958231026663,25.625177165747285,0.6525124645822563,1.454655666795823,4.0555661799248535,4.05556617992484,43.495323340360414,4.05556617992484,0.8882913095085062,0.9301262248849551
513,154210020,Prosna,1024,PL,21.086667,54.2336,29.37,-,Guber,Pregolya,Pregolya,C536,1625,5042500.0,3512500.0,1514.1,21.09167,54.24167,False,False,True,True,0,0,0,0,0,0,0,1,1,0,HIST_24h,-,3,,2,,1,1,03/01/1990,01/01/2020,10903.0,,,,True,False,03/01/1990 00:00,01/01/2020 00:00,10903.0,24.0,1095.0,1460.0,1.0,1.0,1514.130304,,,,1991-01-03 00:00:00,2020-01-01 00:00:00,10541.0,0.6301972319060458,0.6798018993890071,1.1774802630080212,1.0522304499087163,0.12399888585556529,0.24899633285211875,4.471246212606883,8.482465761498386,0.6798018993890071,1.4458446464683101,17.74802630080195,17.748026300802113,54.88542325245449,17.748026300802113,0.9359493117388558,0.9477695500912837
514,154210010,Sepopol,1024,PL,21.005278,54.2664,26.98,-,Lyna,Pregolya,Pregolya,C554,3675,5032500.0,3512500.0,3685.0,21.00833,54.275,False,False,True,True,0,0,0,0,0,0,0,1,1,0,HIST_24h,Moved upstream of confluence,3,,2,,1,1,03/01/1990,01/01/2020,10901.0,,,,True,False,03/01/1990 00:00,01/01/2020 00:00,10901.0,24.0,1095.0,1460.0,1.0,1.0,3685.029632,,,,1991-01-03 00:00:00,2020-01-01 00:00:00,10538.0,0.6819017208082664,0.7222504922494026,1.0705703853912505,1.138063560995555,0.2639810197751927,0.44371998032221693,7.54412772951817,13.216828283692758,0.7222504922494026,1.6537405309512254,7.057038539125008,7.057038539125042,32.19320028436888,7.057038539125042,0.8579154854790816,0.861936439004445
515,153220130,STRĘKOWA GÓRA,1024,PL,22.538889,53.219722,99.17,7205.5,Narew,Vistula,Vistula,C543,6800,5157500.0,3417500.0,7246.4,22.54167,53.225,True,True,True,True,1,1,1,1,1,1,1,1,1,0,HIST_24h,Moved on the other affluent  Moved East to avoid conflict in inclow point,3,,3,,1,1,01/01/1991,31/12/2021,11152.0,11/04/2018 12:00,31/12/2021 18:00,5211.0,True,False,01/01/1991 00:00,31/12/2021 00:00,11152.0,24.0,1095.0,1460.0,0.0,,4989.326336,,,,1991-01-03 00:00:00,2022-01-01 00:00:00,11151.0,0.0736182017457544,0.28632057270935907,1.0883097095013263,1.5839917006316648,-2.0016243646595826,-0.132312386916698,16.063836007512627,36.0769065242058,0.28632057270935907,2.7186492715132355,8.830970950132675,8.830970950132635,52.180055226865875,8.830970950132635,1.7325196577988864,0.41600829936833517
516,153220010,PIĄTNICA-ŁOMŻA,1024,PL,22.093333,53.193333,95.34,15347.46,Narew,Vistula,Vistula,-,15050,5122500.0,3412500.0,15360.5,22.09167,53.19167,True,True,True,True,1,1,1,1,1,1,1,1,1,0,HIST_24h,-,3,,3,,1,1,01/01/1991,31/12/2021,11153.0,01/04/2018 12:00,31/12/2021 18:00,5253.0,True,False,01/01/1991 00:00,31/12/2021 00:00,11153.0,24.0,1095.0,1460.0,0.0,,1090.861184,,,,1991-01-03 00:00:00,2022-01-01 00:00:00,11152.0,0.45041852826295226,0.4988349210797907,1.1052221273173797,1.1995035379895926,-0.45903968019660546,0.16662510366038785,30.448304299142467,58.72912488359052,0.4988349210797907,7.554292619947761,10.522212731738035,10.52221273173797,42.41079228388245,10.52221273173797,1.207907148830821,0.8004964620104074
517,152210060,ZAMBSKI KOŚCIELNE,1024,PL,21.206111,52.756111,79.02,27807.5,Narew,Vistula,Vistula,C218,25925,5077500.0,3352500.0,28473.7,21.20833,52.75833,True,True,True,True,1,1,1,1,1,1,1,1,1,0,HIST_24h,-,3,,3,,1,1,01/01/1991,31/12/2021,11155.0,01/04/2018 12:00,31/12/2021 18:00,5252.0,True,False,01/01/1991 00:00,31/12/2021 00:00,11155.0,24.0,1095.0,1460.0,0.0,,4753.9968,,,,1991-01-03 00:00:00,2022-01-01 00:00:00,11154.0,0.4196505934457697,0.4331989491093944,1.083939368628712,1.0921747513767497,-0.39673514164761614,0.24623458898113604,49.88381863685767,89.85716334569521,0.4331989491093944,10.996441268003872,8.39393686287117,8.393936862871195,38.07792120302102,8.393936862871195,1.1818354968639395,0.9078252486232503
518,153210070,Bialobrzeg Blizszy,1024,PL,21.478889,53.1083,94.41,-,Omulew,Vistula,Vistula,C545,2100,5087500.0,3392500.0,1861.6,21.475,53.10833,False,False,True,True,0,0,0,0,0,0,0,1,1,0,HIST_24h,-,3,,2,,1,1,03/01/1990,01/01/2020,10908.0,,,,True,False,03/01/1990 00:00,01/01/2020 00:00,10908.0,24.0,1095.0,1460.0,1.0,0.0,1861.586048,,,,1991-01-03 00:00:00,2020-01-01 00:00:00,10544.0,0.038113123562895534,0.14267179944898864,1.081990515830618,1.428359982859888,-1.969254028405771,-0.1348201579720083,4.41531110915999,8.526346261108868,0.14267179944898864,0.7299257192940681,8.199051583061793,8.1990515830618,49.59595556419038,8.1990515830618,1.7231523520587886,0.5716400171401119
519,152210030,Makow Mazowiecki,1024,PL,21.106944,52.8592,90.87,-,Orzyc,Vistula,Vistula,C565,1925,5067500.0,3362500.0,1884.2,21.10833,52.85833,False,False,True,False,0,0,0,0,0,0,0,1,1,0,HIST_24h,Large outliers,1,,2,,1,0,03/01/1990,01/01/2020,10904.0,,,,True,False,03/01/1990 00:00,01/01/2020 00:00,10904.0,24.0,1095.0,1460.0,1.0,0.0,1884.223104,,,,1991-01-03 00:00:00,2020-01-01 00:00:00,10540.0,-0.5749697637260116,0.4260269484609763,0.9940900094679459,2.4666457529922012,-3.9233872392568196,-5.939808332581778,6.823674225221085,15.014438065283846,0.4260269484609763,-0.045019160813044544,-0.5909990532053955,-0.5909990532054145,89.57930209395266,0.5909990532054145,2.2188707126051233,-0.46664575299220123
520,153210220,DOBRYLAS,1024,PL,21.866944,53.284722,98.1,4082.38,Pisa,Vistula,Vistula,C556,4525,5102500.0,3422500.0,4613.3,21.85833,53.29167,True,True,True,True,1,1,1,1,1,1,1,1,1,0,HIST_24h,-,3,,3,,1,1,01/01/1991,31/12/2021,11132.0,01/04/2018 12:00,31/12/2021 18:00,5145.0,True,False,01/01/1991 00:00,31/12/2021 00:00,11132.0,24.0,1095.0,1460.0,1.0,0.0,4613.341696,,1.0,,1991-01-03 00:00:00,2022-01-01 00:00:00,11131.0,0.4791865789267946,0.48901598203657165,1.0595122307148177,0.9187580936260543,-0.019129710346455164,0.09877911783567517,6.344859915025051,8.436336485090415,0.48901598203657165,1.283905866640165,5.951223071481768,5.951223071481777,29.410004029679847,5.951223071481777,1.0095195443112774,0.9187580936260543
521,153230010,Fasty,1024,PL,23.025833,53.1786,109.51,-,Suprasl,Vistula,Vistula,-,1925,5187500.0,3417500.0,1808.9,23.025,53.175,False,False,True,True,0,0,0,0,0,0,0,1,1,0,HIST_24h,-,3,,2,,1,1,03/01/1990,01/01/2020,10904.0,,,,True,False,03/01/1990 00:00,01/01/2020 00:00,10904.0,24.0,1095.0,1460.0,1.0,0.0,1808.856704,,,,1991-01-03 00:00:00,2020-01-01 00:00:00,10542.0,0.4681115518231611,0.4724391106085462,1.056505797466129,0.9626915004163817,-0.08354501659092839,0.05490553095818218,3.587819871878783,5.292341402132996,0.4724391106085462,0.5109594228017563,5.650579746612908,5.65057974661289,39.67685377317946,5.65057974661289,1.040934684113715,0.9626915004163817
522,154210100,Mieduniszki,1024,PL,21.980278,54.3264,86.72,-,Angrapa,Pregolya,Pregolya,-,1000,5097500.0,3532500.0,961.0,21.975,54.342,False,False,True,True,0,0,0,0,0,0,0,1,1,0,HIST_24h,-,3,Moved downstream,2,,1,1,03/01/1990,01/01/2020,10899.0,,,,True,False,03/01/1990 00:00,01/01/2020 00:00,10899.0,24.0,1095.0,1460.0,1.0,1.0,961.005632,,,,1991-01-03 00:00:00,2020-01-01 00:00:00,10537.0,0.4736473272555831,0.58282531324074,0.7297417497397782,1.173126817676488,0.16018657527051372,-0.35377464713965967,4.840451653266136,7.685546399216932,0.58282531324074,-2.7153630809234155,-27.025825026022225,-27.02582502602218,48.176687805449376,27.02582502602218,0.9164133481838277,0.826873182323512
523,151170010,Krzyzanowice,1024,PL,17.048333,51.171111,115,-,Widawa,Oder,Oder,-,2000,4812500.0,3142500.0,1696.2,17.05833,51.175,False,False,True,False,0,0,0,0,0,0,0,1,1,0,HIST_24h,Large outliers,1,outliers,0,,0,0,02/01/1995,01/01/2020,9081.0,01/11/2007 06:00,31/12/2007 06:00,59.0,True,False,,,,,,,,,,,,,,,,,,,,,,,,,,,,,,,
524,151160100,Piatnica,1024,PL,16.198611,51.227778,117,-,Kaczawa,Oder,Oder,-,2050,4752500.0,3142500.0,1805.5,16.20833,51.225,False,False,True,False,0,0,0,0,0,0,0,1,1,0,HIST_24h,Difficolt to locate,1,outliers,0,,0,1,02/01/1995,01/01/2020,9078.0,01/11/2007 06:00,31/12/2007 06:00,59.0,True,False,,,,,,,,,,,,,,,,,,,,,,,,,,,,,,,
526,150170030,Olawa,1024,PL,17.292778,50.947778,129,-,Osława,Oder,Oder,-,800,4832500.0,3112500.0,790.2,17.29167,50.95833,False,False,True,True,0,0,0,0,0,0,0,1,1,0,HIST_24h,Moved on affluent,3,,2,,1,1,03/01/1990,01/01/2020,10931.0,01/11/2007 06:00,31/12/2007 06:00,60.0,True,False,03/01/1990 00:00,01/01/2020 00:00,10931.0,24.0,1095.0,1460.0,1.0,0.0,790.19392,,,,1991-01-03 00:00:00,2020-01-01 00:00:00,10570.0,0.6178702774165498,0.6459197469812387,0.9047275382017966,1.10758000430742,0.27587922743860605,-0.014662179220800597,1.4309646052350953,2.3709026853388577,0.6459197469812387,-0.3354829224343123,-9.527246179820292,-9.527246179820336,40.637395101247,9.527246179820336,0.8509528615389833,0.89241999569258
527,150170230,Opole,1024,PL,17.920278,50.669444,157,-,Oder,Oder,Oder,-,11050,4877500.0,3092500.0,10993.1,17.90833,50.675,False,False,True,False,0,0,0,0,0,0,0,1,1,0,-,No discharge data available for calibration period,-,,-,,0,0,,,,,,,False,False,,,,,,,,,,,,,,,,,,,,,,,,,,,,,,,
528,150170290,OPOLE-GROSZOWICE,1024,PL,17.939444,50.634444,147.12,10934.98,Oder,Oder,Oder,-,10975,4882500.0,3082500.0,10945.0,17.94167,50.64167,False,False,True,False,1,0,1,0,1,1,0,1,1,0,-,No discharge data available for calibration period,-,,-,,0,0,,,,,,,False,False,,,,,,,,,,,,,,,,,,,,,,,,,,,,,,,
529,151150050,DOBROSZÓW WIELKI,1024,PL,15.256667,51.774444,74.05,5364.52,Bobr,Oder,Oder,-,5375,4687500.0,3192500.0,5553.7,15.24167,51.75833,True,True,True,False,1,1,1,1,1,1,1,1,1,0,-,Not enough discarge data available for calibration period,-,Consistent with downstream 1809  larger peaks before 2014,3,,1,1,02/01/2008,31/12/2021,4796.0,01/04/2018 12:00,31/12/2021 18:00,5253.0,True,False,02/01/2008 00:00,31/12/2021 00:00,4796.0,24.0,1095.0,1460.0,1.0,0.0,5553.72288,1.0,,,2008-01-02 00:00:00,2022-01-01 00:00:00,4797.0,0.7678105960986114,0.7794934819672032,0.9764262287277616,1.068797326235387,0.5365514789284819,0.20154940135130983,11.363488413929085,17.092794989522233,0.7794934819672032,-0.9071730915869649,-2.3573771272238258,-2.357377127223836,29.52912505992403,2.357377127223836,0.6807705348144243,0.9312026737646131
530,150170040,OŁAWA (MOST),1024,PL,17.306389,50.946389,121.98,19791.25,Oder,Oder,Oder,C182,20025,4842500.0,3117500.0,20022.4,17.30833,50.94167,True,True,True,True,1,1,1,1,1,1,1,1,1,0,HIST_24h,Moved East to avoid conflict in inflow point,3,removed Q data before 2008,3,,1,1,02/01/1995,06/09/2021,5590.0,01/11/2007 06:00,05/09/2021 12:00,840.0,True,False,02/01/2008 00:00,06/09/2021 00:00,935.0,24.0,1095.0,730.0,0.0,,8728.3968,,,,2008-01-02 00:00:00,2021-09-06 00:00:00,935.0,0.6932949102066905,0.7887435108194862,1.1150527853793677,1.1902670871714145,0.3085020935371918,0.4124018978141911,57.76439218731491,99.4349792776576,0.7887435108194862,18.39581202722081,11.505278537936794,11.505278537936778,36.127539284825104,11.505278537936778,0.8315635312246489,0.8097329128285855
531,150170140,SKOROGOSZCZ,1024,PL,17.675,50.761944,139.85,4489.48,Eastern Neisse ,Oder,Oder,C190,4625,4857500.0,3102500.0,4538.1,17.675,50.75833,True,True,True,True,1,1,1,1,1,1,1,1,1,0,HIST_24h,-,3,,3,,1,1,01/01/1991,31/12/2021,11185.0,01/11/2007 06:00,31/12/2021 18:00,5315.0,True,False,01/01/1991 00:00,31/12/2021 00:00,11185.0,24.0,1095.0,1460.0,0.0,,2785.38624,1.0,,,1991-01-03 00:00:00,2022-01-01 00:00:00,11184.0,0.6469961727540872,0.654197826449633,0.9757610657733482,0.9333289201702853,0.36156606966359106,0.08870934933495322,15.344024717962832,25.178312189860605,0.654197826449633,-0.7797239750994571,-2.4238934226651976,-2.4238934226651776,47.699290747521864,2.4238934226651776,0.7990206069535389,0.9333289201702853
532,151150150,NOWA SÓL,1024,PL,15.721667,51.802222,58.82,36839.82,Oder,Oder,Oder,-,37150,4722500.0,3197500.0,37435.0,15.725,51.80833,True,True,True,True,1,1,1,1,1,1,1,1,1,0,HIST_24h,-,3,,3,,1,1,01/01/1991,31/12/2021,11189.0,02/11/2007 06:00,31/12/2021 18:00,5312.0,True,False,01/01/1991 00:00,31/12/2021 00:00,11189.0,24.0,1095.0,1460.0,0.0,,3294.745856,,,,1991-01-03 00:00:00,2022-01-01 00:00:00,11188.0,0.6892137594160467,0.6935509445486212,1.0144013604341653,1.0496957198047272,0.3428259538177906,0.34918021473747785,68.23128394179763,116.44050856930971,0.6935509445486212,2.6933936873025357,1.4401360434165276,1.4401360434165265,36.48272131787044,1.4401360434165265,0.8106627203604581,0.9503042801952728
533,152150130,CIGACICE,1024,PL,15.6075,52.033056,47.4,39900.85,Oder,Oder,Oder,-,39025,4707500.0,3227500.0,39962.2,15.60833,52.025,True,True,True,True,1,1,1,1,1,1,1,1,1,0,HIST_24h,-,3,,3,,1,1,01/01/1991,31/12/2021,11188.0,01/11/2007 06:00,31/12/2021 18:00,5314.0,True,False,01/01/1991 00:00,31/12/2021 00:00,11188.0,24.0,1095.0,1460.0,0.0,,2527.232256,,,,1991-01-03 00:00:00,2022-01-01 00:00:00,11187.0,0.6855435498504003,0.6901127227430709,0.9491827582308457,1.0164420915321066,0.3965425058084332,0.3215051412256601,74.78983597545319,123.71577594410977,0.6901127227430709,-10.401690063789708,-5.081724176915462,-5.081724176915428,36.53841975037015,5.081724176915428,0.7768252661902563,0.9835579084678934
534,150160220,Bardo,1024,PL,16.741111,50.503611,256,-,Nysa Klodzka,Oder,Oder,-,1750,4797500.0,3067500.0,1752.7,16.74167,50.50833,False,False,True,True,0,0,0,0,0,0,0,1,1,0,HIST_24h,-,3,removed Q data before 2008,2,,1,1,02/01/1995,01/01/2020,6444.0,01/11/2007 06:00,31/12/2007 06:00,60.0,True,False,02/01/2008 00:00,01/01/2020 00:00,1819.0,24.0,1095.0,1460.0,1.0,0.0,1752.689024,,,,2008-01-02 00:00:00,2020-01-01 00:00:00,1819.0,0.6436701261657272,0.6904175641311624,1.1758191277780907,0.9852579277027521,0.23002166289587966,0.17950668423450533,10.102727454584992,17.710096699985204,0.6904175641311624,3.351046812520325,17.58191277780905,17.581912777809073,53.005906172614296,17.581912777809073,0.8774840950718822,0.9852579277027521
535,151160140,OSETNO,1024,PL,16.4625,51.631667,77.5,4579.55,Barycz,Oder,Oder,C547,4575,4762500.0,3192500.0,4476.0,16.45833,51.625,True,True,True,False,1,1,1,1,1,1,1,1,1,0,HIST_24h,low discharge maybe wrong LDD,0,low discharge but seems OK,3,,1,0,01/01/1991,31/12/2021,11173.0,01/11/2007 06:00,31/12/2021 18:00,5274.0,True,False,01/01/1991 00:00,31/12/2021 00:00,11173.0,24.0,1095.0,1460.0,0.0,,3311.37664,,,,1991-01-03 00:00:00,2022-01-01 00:00:00,11172.0,-0.11812689841451607,0.278394185655174,1.4675873317490176,0.28525886025104163,-0.10796476808274003,-0.5506201477680595,12.522778115355107,16.32078073303568,0.278394185655174,6.313473065837876,46.75873317490183,46.75873317490176,92.74597901950227,46.75873317490176,1.0525990538104912,0.28525886025104163
536,152140130,POŁĘCKO,1024,PL,14.892222,52.052778,32.62,47164.75,Oder,Oder,Oder,C180,46350,4652500.0,3227500.0,47330.3,14.89167,52.05833,True,True,True,True,1,1,1,1,1,1,1,1,1,0,HIST_24h,-,3,,3,,1,1,01/01/1991,18/12/2021,11173.0,01/11/2007 06:00,17/12/2021 12:00,5035.0,True,False,01/01/1991 00:00,18/12/2021 00:00,11173.0,24.0,1095.0,1460.0,0.0,,1814.291584,,,,1991-01-03 00:00:00,2021-12-18 00:00:00,11171.0,0.7231260075394192,0.7248149838902034,1.0081178908590849,0.970563382366299,0.46091311748497665,0.37755528509997704,76.65609898245945,129.36816818891393,0.7248149838902034,1.9044165355914784,0.8117890859084724,0.8117890859084856,32.67593163538386,0.8117890859084856,0.7342253622117844,0.970563382366299
537,151160200,Korzensko,1024,PL,16.8725,51.539167,89,-,Orla,Oder,Oder,-,1150,4797500.0,3182500.0,1164.6,16.875,51.54167,False,False,False,False,0,0,0,0,0,0,0,1,1,1,HIST_24h,DO NOT USE Wrong LDD,0,Low discharge but seems OK,2,,1,1,03/01/1990,01/01/2020,10906.0,01/11/2007 06:00,31/12/2007 06:00,60.0,True,False,03/01/1990 00:00,01/01/2020 00:00,10906.0,24.0,1095.0,1460.0,1.0,0.0,1164.587648,,,,1991-01-03 00:00:00,2020-01-01 00:00:00,10542.0,-0.16697817248658753,0.2164852885853955,1.2849364855915384,0.18344997015751202,0.014155405757380835,-0.575758817665827,4.458170467600764,6.661270178764667,0.2164852885853955,1.2064957132966063,28.493648559153858,28.493648559153847,105.28801811779493,28.493648559153847,0.9928970713234131,0.18344997015751208
538,150180060,RACIBÓRZ-MIEDONIA,1024,PL,18.230833,50.122778,176.28,6728.54,Oder,Oder,Oder,C183,6725,4907500.0,3037500.0,6755.9,18.225,50.125,True,True,True,True,1,1,1,1,1,1,1,1,1,0,HIST_24h,-,3,,3,,1,1,01/01/1991,31/12/2021,11196.0,01/11/2006 06:00,31/12/2021 18:00,5679.0,True,False,01/01/1991 00:00,31/12/2021 00:00,11196.0,24.0,1095.0,1460.0,0.0,,2097.377536,1.0,,,1991-01-03 00:00:00,2022-01-01 00:00:00,11195.0,0.7800413071131138,0.7978351951612406,0.9926017487734122,1.086350935952091,0.5578259646727607,0.4141683879247363,25.19831849086829,44.95975495767673,0.7978351951612406,-0.4623651679795961,-0.7398251226587689,-0.7398251226587719,40.31953607094442,0.7398251226587719,0.6649616795930712,0.9136490640479089
539,151160130,ŚCINAWA,1024,PL,16.443333,51.408889,86.72,29611.72,Oder,Oder,Oder,C181,29650,4767500.0,3157500.0,29664.3,16.44167,51.40833,True,True,True,True,1,1,1,1,1,1,1,1,1,0,HIST_24h,-,3,,3,,1,1,01/01/1991,31/12/2021,11190.0,01/11/2007 06:00,31/12/2021 18:00,5314.0,True,False,01/01/1991 00:00,31/12/2021 00:00,11190.0,24.0,1095.0,1460.0,0.0,,7117.80608,1.0,,,1991-01-03 00:00:00,2022-01-01 00:00:00,11189.0,0.6818161138153762,0.73898698063241,0.943691196711638,1.1730390355393725,0.4059754354736892,0.15703163559154953,61.609937869095305,103.94438962168712,0.73898698063241,-9.248421000612938,-5.630880328836196,-5.630880328836199,37.51107212624917,5.630880328836199,0.7707298907699822,0.8269609644606275
540,150170130,UJŚCIE NYSY KŁODZKIEJ,1024,PL,17.661944,50.818889,135.54,13436.07,Oder,Oder,Oder,-,18375,4857500.0,3107500.0,13715.0,17.675,50.80833,False,False,True,False,1,0,1,0,1,1,0,1,1,0,-,No discharge data available for calibration period,-,,-,,0,0,,,,,,,False,False,,,,,,,,,,,,,,,,,,,,,,,,,,,,,,,
541,150180020,Turawa,1024,PL,18.079167,50.738889,166,-,Mala Panew,Oder,Oder,C189,1475,4892500.0,3102500.0,1410.6,18.09167,50.74167,False,False,True,False,0,0,0,0,0,0,0,1,1,0,HIST_24h,Low quality data,0,regulated  but no res in the model  low quality data,0,,0,0,03/01/1990,01/01/2020,10917.0,01/11/2006 06:00,31/12/2007 06:00,425.0,True,False,,,,,,,,,,,,,,,,,,,,,,,,,,,,,,,
542,151160190,Jarnoltow,1024,PL,16.842778,51.121944,95,-,Bystrzyca,Oder,Oder,C191,1675,4797500.0,3132500.0,1733.9,16.84167,51.125,False,False,True,True,0,0,0,0,0,0,0,1,1,0,HIST_24h,-,3,,2,,1,1,03/01/1990,01/01/2020,10920.0,01/11/2007 06:00,31/12/2007 06:00,60.0,True,False,03/01/1990 00:00,01/01/2020 00:00,10920.0,24.0,1095.0,1460.0,1.0,0.0,1733.907968,1.0,,,1991-01-03 00:00:00,2020-01-01 00:00:00,10559.0,0.5322862204263002,0.5884686072110541,1.1912475138622562,0.8867636065842266,0.09444685676090003,-0.2078159587439734,5.567644470304823,8.241004056308764,0.5884686072110541,1.5715364132436347,19.12475138622559,19.12475138622563,67.75523328899553,19.12475138622563,0.9516055607440974,0.8867636065842266
543,152140050,SŁUBICE,1024,PL,14.556111,52.348333,17.45,53511.26,Oder,Oder,Oder,C179,52000,4627500.0,3262500.0,53658.8,14.55833,52.34167,True,True,True,False,1,1,1,1,1,1,1,1,1,0,HIST_24h,Close to 21,2,Close to 21,3,,1,1,01/01/1991,31/12/2021,11188.0,11/04/2018 12:00,31/12/2021 18:00,4295.0,True,False,01/01/1991 00:00,31/12/2021 00:00,11188.0,24.0,1095.0,1460.0,0.0,,1533.934336,,,,1991-01-03 00:00:00,2022-01-01 00:00:00,11187.0,0.7051295293537624,0.7147489289272607,0.9472784040769464,1.0529230973613126,0.42458989065059305,0.36133803392879593,90.10933171814334,138.81238411231948,0.7147489289272607,-14.61456039491389,-5.272159592305342,-5.27215959230536,32.50667585864352,5.27215959230536,0.7585579143014787,0.9470769026386874
544,152140020,GOZDOWICE,1024,PL,14.317778,52.764167,3.02,109795.07,Oder,Oder,Oder,-,109775,4607500.0,3307500.0,109975.1,14.325,52.75833,True,True,True,False,1,1,1,1,1,1,1,1,1,0,HIST_24h,Close to 26,2,Close to 26,3,,1,1,01/01/1991,31/12/2021,11168.0,10/03/2018 00:00,31/12/2021 18:00,5211.0,True,False,01/01/1991 00:00,31/12/2021 00:00,11168.0,24.0,1095.0,1460.0,0.0,,3973.458688,,,,1991-01-03 00:00:00,2022-01-01 00:00:00,11167.0,0.680630134757251,0.684588381840482,0.975249675320387,1.0435894870745206,0.3556129448501465,0.40843345417578003,139.82133110274015,210.49256436431068,0.684588381840482,-11.85730856349265,-2.4750324679613014,-2.475032467961302,29.185572116959086,2.475032467961302,0.8027372267123635,0.9564105129254794
545,151180130,DZIAŁOSZYN,1024,PL,18.873333,51.11,172.58,4093.63,Warta,Oder,Oder,C540,4050,4937500.0,3147500.0,4084.1,18.875,51.10833,True,True,True,True,1,1,1,1,1,1,1,1,1,0,HIST_24h,-,3,,3,,1,1,01/01/1991,31/12/2021,11175.0,01/04/2018 12:00,31/12/2021 18:00,5253.0,True,False,01/01/1991 00:00,31/12/2021 00:00,11175.0,24.0,1095.0,1460.0,1.0,0.0,4084.086784,,,,1991-01-03 00:00:00,2022-01-01 00:00:00,11174.0,0.628836993105331,0.6302371034143717,1.0239528505893642,1.0215322768034794,0.22304712759436518,0.335623005744221,7.250031944367921,13.162683858567666,0.6302371034143717,0.5367900746996469,2.3952850589364574,2.395285058936422,32.351367902756444,2.395285058936422,0.8814493022322033,0.9784677231965206
546,151180080,SIERADZ,1024,PL,18.7425,51.599444,125.09,8156.15,Zeglina,Oder,Oder,-,8225,4922500.0,3202500.0,8136.7,18.74167,51.59167,True,True,True,True,1,1,1,1,1,1,1,1,1,0,HIST_24h,-,3,,3,,1,1,01/01/1991,31/12/2021,11170.0,01/04/2018 12:00,31/12/2021 18:00,5216.0,True,False,01/01/1991 00:00,31/12/2021 00:00,11170.0,24.0,1095.0,1460.0,0.0,,1687.517184,,,,1991-01-03 00:00:00,2022-01-01 00:00:00,11169.0,0.685197060789208,0.692782272474017,1.0491475463804218,1.0479862179621273,0.30795872248298295,0.3157168422550781,13.437868952158007,21.090227329183346,0.692782272474017,2.055812168849939,4.914754638042208,4.914754638042178,32.12541970454805,4.914754638042178,0.8318901835681157,0.9520137820378727
547,152180050,SŁAWSK,1024,PL,18.134722,52.198611,75.77,13759.46,Warta,Oder,Oder,C197,13750,4872500.0,3262500.0,13742.6,18.125,52.19167,True,True,True,True,1,1,1,1,1,1,1,1,1,0,HIST_24h,-,3,,3,,1,1,02/01/1994,31/12/2021,10076.0,01/04/2018 12:00,31/12/2021 18:00,5209.0,True,False,02/01/1994 00:00,31/12/2021 00:00,10076.0,24.0,1095.0,1460.0,0.0,,3863.537152,1.0,,,1994-01-02 00:00:00,2022-01-01 00:00:00,10077.0,0.7093356637906721,0.7183574391327487,0.9682901872893624,0.9355196771875158,0.4776576240403315,0.43019413846011667,17.908818172989893,26.148663896529364,0.7183574391327487,-2.054526736212468,-3.1709812710637473,-3.1709812710637513,27.640685327914976,3.1709812710637513,0.7227325756873452,0.9355196771875158
548,152160140,POZNAŃ (MOST ROCHA),1024,PL,16.942778,52.398611,49.46,25908.89,Warta,Oder,Oder,C196,25575,4792500.0,3282500.0,25346.4,16.94167,52.39167,True,True,True,True,1,1,1,1,1,1,1,1,1,0,HIST_24h,use data after 1997,3,,3,,1,1,01/01/1991,31/12/2021,11177.0,01/04/2018 12:00,31/12/2021 18:00,5252.0,True,False,01/01/1991 00:00,31/12/2021 00:00,11177.0,24.0,1095.0,1460.0,0.0,,7338.044416,,,,1991-01-03 00:00:00,2022-01-01 00:00:00,11176.0,0.6659983082031891,0.6771493960213715,0.9737958748826648,1.0814736856942273,0.31523159589265937,0.3954583841342293,29.2282717496917,46.84499332206163,0.6771493960213715,-2.4900732356078983,-2.6204125117335506,-2.620412511733519,30.75818329116032,2.620412511733519,0.8275073438389212,0.9185263143057727
549,152150040,GORZÓW WIELKOPOLSKI,1024,PL,15.253056,52.73,15.51,52362.12,Warta,Oder,Oder,C194,53275,4682500.0,3302500.0,52342.9,15.25833,52.725,True,True,True,True,1,1,1,1,1,1,1,1,1,0,HIST_24h,use data after 1997,3,,3,,1,1,01/01/1991,31/12/2021,11177.0,11/04/2018 12:00,31/12/2021 18:00,5230.0,True,False,01/01/1991 00:00,31/12/2021 00:00,11177.0,24.0,1095.0,1460.0,0.0,,10825.17094,,,,1991-01-03 00:00:00,2022-01-01 00:00:00,11176.0,0.6362825352767065,0.6603740911640616,0.9613729068728403,1.124308422356045,0.25344200459267663,0.4109879622774274,52.30292411307359,83.65416309209321,0.6603740911640616,-7.390579535581504,-3.862709312715978,-3.862709312715973,27.336285480885607,3.862709312715973,0.8640358762269796,0.8756915776439551
550,152180150,Dabie,1024,PL,18.825278,52.085278,93,-,Ner,Oder,Oder,C542,1825,4922500.0,3257500.0,1742.4,18.825,52.09167,False,False,True,True,0,0,0,0,0,0,0,1,1,0,HIST_24h,-,3,,2,,1,1,03/01/1990,01/01/2020,10918.0,,,,True,False,03/01/1990 00:00,01/01/2020 00:00,10918.0,24.0,1095.0,1460.0,1.0,0.0,1742.357504,,,,1991-01-03 00:00:00,2020-01-01 00:00:00,10554.0,0.5559512479268256,0.596058311519361,0.8746857601188193,1.135302430902611,0.17127683983859587,0.1278269030175999,4.090732816161797,6.541574431141566,0.596058311519361,-1.1680001423156376,-12.53142398811804,-12.531423988118076,43.889298882960745,12.531423988118076,0.9103423313025703,0.864697569097389
551,152150190,NOWE DREZDENKO,1024,PL,15.837778,52.850833,24.21,15916.27,Notec,Oder,Oder,C199,16850,4717500.0,3322500.0,16171.3,15.84167,52.85833,True,True,True,True,1,1,1,1,1,1,1,1,1,0,HIST_24h,-,3,,3,,1,1,01/01/1991,31/12/2021,11171.0,17/03/2018 00:00,31/12/2021 18:00,5119.0,True,False,01/01/1991 00:00,31/12/2021 00:00,11171.0,24.0,1095.0,1460.0,0.0,,8231.837696,,,,1991-01-03 00:00:00,2022-01-01 00:00:00,11170.0,0.4394552506409325,0.49584743419090627,0.8822915131021498,1.2149076977084485,-0.17578555124220463,0.006510566571017784,19.748241574207512,28.71260370229616,0.49584743419090627,-7.935459465608859,-11.770848689785023,-11.770848689785021,29.293018818474202,11.770848689785021,1.0843364566601106,0.7850923022915515
552,151170110,BOGUSŁAW,1024,PL,17.954722,51.898889,87.9,4282.38,Prosna,Oder,Oder,-,4300,4867500.0,3227500.0,4265.8,17.95833,51.89167,True,True,True,True,1,1,1,1,1,1,1,1,1,0,HIST_24h,-,3,,3,,1,1,01/01/1991,08/12/2021,11000.0,11/04/2018 12:00,06/12/2021 12:00,4429.0,True,False,01/01/1991 00:00,08/12/2021 00:00,11000.0,24.0,1095.0,1460.0,1.0,0.0,4265.812736,,,,1991-01-03 00:00:00,2021-12-08 00:00:00,10998.0,0.606613543467918,0.6513165279890188,0.8606493502307754,1.1172780326324154,0.3061733774040105,-0.13803009531665755,7.06744002745523,11.478695999068888,0.6513165279890188,-2.0334419235494354,-13.935064976922389,-13.935064976922465,48.432775415184445,13.935064976922465,0.8329625577395317,0.8827219673675846
553,153160180,PIŁA,1024,PL,16.740278,53.151389,54.38,4712.57,Gwda,Oder,Oder,C557,4725,4772500.0,3362500.0,4600.5,16.74167,53.15833,True,True,True,False,1,1,1,1,1,1,1,1,1,0,HIST_24h,low quality data  flow is too small compared to catchment size possibly wrong location,0,Flow is very low compared to catchment size but is consistent with nearby 1816,3,,1,1,01/01/1991,31/12/2021,11159.0,01/04/2018 12:00,31/12/2021 18:00,5231.0,True,False,01/01/1991 00:00,31/12/2021 00:00,11159.0,24.0,1095.0,1460.0,1.0,0.0,4600.545792,,,,1991-01-03 00:00:00,2022-01-01 00:00:00,11158.0,0.2890645982355139,0.459472652217007,0.8505338490072524,1.436943018582661,-0.5454924624773974,-0.4675494857607587,8.6063397715783,11.644378129096447,0.459472652217007,-3.9172445336384563,-14.946615099274759,-14.946615099274759,32.83829918574968,14.946615099274759,1.2431783711428486,0.563056981417339
554,152150240,Drawiny,1024,PL,15.977778,52.885556,30,-,Drawa,Oder,Oder,-,3000,4722500.0,3327500.0,3338.9,15.975,52.89167,False,False,True,True,0,0,0,0,0,0,0,1,1,0,HIST_24h,-,3,,2,,1,1,03/01/1990,01/01/2020,10907.0,,,,True,False,03/01/1990 00:00,01/01/2020 00:00,10907.0,24.0,1095.0,1460.0,1.0,0.0,3338.886656,,,,1991-01-03 00:00:00,2020-01-01 00:00:00,10545.0,0.28918297985564256,0.4413973768735138,0.898097618735373,1.4275977668974795,-0.634873614168761,-0.45420873893391844,5.56783124467805,7.685717074064651,0.4413973768735138,-2.107150032620268,-10.190238126462814,-10.190238126462704,26.926191943093553,10.190238126462704,1.278621763528517,0.5724022331025205
555,151180140,Podgorze,1024,PL,18.943333,51.465,140,-,Widawka,Oder,Oder,C541,2425,4942500.0,3187500.0,2365.1,18.94167,51.45833,False,False,True,True,0,0,0,0,0,0,0,1,1,0,HIST_24h,-,3,,2,,1,1,03/01/1990,01/01/2020,10918.0,,,,True,False,03/01/1990 00:00,01/01/2020 00:00,10918.0,24.0,1095.0,1460.0,1.0,0.0,2365.088,,,,1991-01-03 00:00:00,2020-01-01 00:00:00,10554.0,0.6560240991869062,0.6672783871762548,1.061452474543197,1.061962424683536,0.22498610548811993,0.1829421874244319,4.78356359153952,7.6202410685505075,0.6672783871762548,0.8085598128316441,6.145247454319657,6.145247454319699,36.35622438436126,6.145247454319699,0.8803487346000279,0.938037575316464
556,42000,Nemcice,1019,CZ,15.808156,50.09454,216.91,4300.51,Labe,Elbe,Elbe,C559,4275,4737500.0,3022500.0,4320.7,15.80833,50.09167,False,False,True,True,0,0,0,0,0,0,0,0,1,0,HIST_24h,Moved North to avoid conflict in inflow point,3,,2,,1,1,02/01/1991,01/01/2010,6879.0,,,,True,False,02/01/1991 00:00,01/01/2010 00:00,6879.0,24.0,1095.0,1460.0,0.0,,4144.22272,1.0,,recommended,1991-01-03 00:00:00,2010-01-01 00:00:00,6878.0,0.6775454136056303,0.7732343088727234,0.7708087872097923,1.0050665169580624,0.5461294699431636,0.3053110945507381,17.62929622792612,30.824114867125214,0.7732343088727234,-10.40926899444343,-22.91912127902077,-22.91912127902078,38.81617225256701,22.91912127902078,0.6736991391243095,0.9949334830419376
557,61000,Prelouc,1019,CZ,15.573471,50.044538,204.57,6435.02,Labe,Elbe,Elbe,-,6475,4712500.0,3007500.0,6457.8,15.575,50.04167,False,False,True,True,0,0,0,0,0,0,0,0,1,0,HIST_24h,-,3,,2,,1,1,02/01/1991,01/01/2010,6876.0,,,,True,False,02/01/1991 00:00,01/01/2010 00:00,6876.0,24.0,1095.0,1460.0,0.0,,1479.916416,1.0,,recommended,1991-01-03 00:00:00,2010-01-01 00:00:00,6875.0,0.6667034305508024,0.7768244348156961,0.7724084285447526,1.0973722081181345,0.541338209846724,0.18962312492914357,22.426206474273197,36.848006936569,0.7768244348156961,-13.001958170090822,-22.759157145524675,-22.759157145524746,39.2557452230599,22.759157145524746,0.6772457383795607,0.9026277918818655
558,101800,Predmerice,1019,CZ,14.776067,50.248377,174,2158.71,Jizera,Elbe,Elbe,-,2175,4667500.0,3032500.0,2166.7,14.775,50.25833,False,False,True,True,0,0,0,0,0,0,0,0,1,0,HIST_24h,Same as 2089  different time period,3,,2,,1,1,02/11/1999,01/01/2010,3683.0,,,,True,False,02/11/1999 00:00,01/01/2010 00:00,3683.0,24.0,1095.0,1460.0,0.0,,1358.67008,,,recommended,1999-11-02 00:00:00,2010-01-01 00:00:00,3683.0,0.7711186626900944,0.7791870711763735,0.9520405963736984,0.9635553483085334,0.5856387940472008,0.35989684415897305,8.84117537935934,15.819661069022189,0.7791870711763735,-1.2055709770403555,-4.795940362630156,-4.795940362630158,35.17150849057148,4.795940362630158,0.6437089450619741,0.9635553483085334
559,115100,Ceske Budejovice,1019,CZ,14.463986,48.980737,377.95,2849.82,Vltava,Elbe,Elbe,C560,1775,4647500.0,2877500.0,2862.4,14.475,48.975,False,False,True,True,0,0,0,0,0,0,0,0,1,0,HIST_24h,-,3,,2,,1,1,02/01/1991,01/01/2011,7223.0,,,,True,False,02/01/1991 00:00,01/01/2011 00:00,7223.0,24.0,1095.0,1460.0,0.0,,858.064576,,,recommended,1991-01-03 00:00:00,2011-01-01 00:00:00,7222.0,0.7189516719186435,0.7482200460411467,0.9871063992583061,1.1242126103168162,0.4289156747053984,0.29658171499336894,10.441123720754796,17.041535603779128,0.7482200460411467,-0.3472950283584221,-1.2893600741693843,-1.2893600741693885,38.763492004586254,1.2893600741693885,0.7557012143000756,0.8757873896831838
560,133000,Bechyne,1019,CZ,14.471184,49.288757,354.07,4055.13,Luznice,Elbe,Elbe,C159,3875,4647500.0,2922500.0,4044.8,14.475,49.29167,True,True,True,True,0,1,0,1,1,1,1,0,1,0,HIST_24h,-,3,,3,,1,1,02/01/1991,31/12/2021,9257.0,01/01/2016 00:00,31/12/2021 18:00,8477.0,True,True,01/01/2016 00:00,31/12/2021 18:00,2119.25,6.0,1095.0,1460.0,1.0,0.0,4044.759808,,,recommended,2016-01-01 00:00:00,2021-12-31 18:00:00,8477.0,0.43861833393871485,0.6775476675994475,1.459529509710196,1.0025491223381404,-0.4151131789636897,-0.002403047701623029,10.71184673985965,15.83643303947868,0.6775476675994475,6.746934383403175,45.95295097101943,45.9529509710196,72.95772273355911,45.9529509710196,1.1895852970525842,0.9974508776618596
561,151000,Pisek,1019,CZ,14.145395,49.31291,353.9,2913.93,Otava,Elbe,Elbe,C315,2925,4622500.0,2922500.0,2858.7,14.14167,49.30833,True,True,True,True,0,1,0,1,1,1,1,0,1,0,HIST_24h,-,3,,3,,1,1,01/01/1991,31/12/2021,8852.0,01/01/2016 00:00,31/12/2021 18:00,8476.0,True,True,01/01/2016 00:00,31/12/2021 18:00,2119.0,6.0,1095.0,1460.0,0.0,,841.990464,,,recommended,2016-01-01 00:00:00,2021-12-31 18:00:00,8476.0,0.27211552693461716,0.5706435699676572,1.4194515415232953,1.4117393185418212,-2.01374287277498,0.29170930735209155,9.324593085110545,23.846323479546562,0.5706435699676572,7.335284895571739,41.94515415232965,41.94515415232954,53.320559450775384,41.94515415232954,1.7360135001707149,0.5882606814581788
562,167200,Nespeky,1019,CZ,14.650837,49.859529,259.38,4038.25,Sazava,Elbe,Elbe,-,4075,4652500.0,2982500.0,4084.3,14.65833,49.85833,True,True,True,True,0,1,0,1,1,1,1,0,1,0,HIST_24h,-,3,,3,,1,1,02/11/1993,31/12/2021,7918.0,01/01/2016 00:00,31/12/2021 18:00,8477.0,True,True,01/01/2016 00:00,31/12/2021 18:00,2119.25,6.0,1095.0,1460.0,0.0,,2646.1952,1.0,,recommended,2016-01-01 00:00:00,2021-12-31 18:00:00,8477.0,-0.10569916126510615,0.4185071335515059,1.868188067195098,1.3615054100174895,-5.126583461995484,-0.5983090323881171,14.125136883715324,29.58338597109877,0.4185071335515059,10.59573958928101,86.8188067195098,86.81880671950981,115.73779429559605,86.81880671950981,2.4751936211123886,0.6384945899825105
563,186000,Bílá Hora,1019,CZ,13.4043,49.76665,297.89,4017.5,Berounka,Elbe,Elbe,-,4775,4567500.0,2967500.0,4808.2,13.40833,49.775,False,False,True,True,0,0,0,0,0,0,0,0,1,0,HIST_24h,-,3,,2,,1,1,02/01/1991,01/01/2010,6882.0,,,,True,False,02/01/1991 00:00,01/01/2010 00:00,6882.0,24.0,1095.0,1460.0,0.0,,345.201024,,,recommended,1991-01-03 00:00:00,2010-01-01 00:00:00,6881.0,0.5900748566096414,0.7389739855498271,1.2323358842560324,1.214299043046934,-0.07137443641101782,0.0036988769022404666,11.15457054571738,20.651464617657492,0.7389739855498271,4.172057162073103,23.233588425603234,23.233588425603227,62.118204774254856,23.233588425603227,1.0350721889853904,0.785700956953066
564,198000,Beroun,1019,CZ,14.06619,49.955888,218.27,628.96,Litavka,Elbe,Elbe,C161,8325,4612500.0,2992500.0,8317.0,14.075,49.95833,True,True,True,True,0,1,0,1,1,1,1,0,1,0,HIST_24h,Wrong upstream area from provider  moved on main stream,3,moved on main stream  river name and uparea from provider are wrong,3,,1,1,01/01/1991,31/12/2021,8948.0,01/01/2016 00:00,31/12/2021 18:00,8477.0,True,True,01/01/2016 00:00,31/12/2021 18:00,2119.25,6.0,1095.0,1460.0,0.0,,3508.865792,1.0,,recommended,2016-01-01 00:00:00,2021-12-31 18:00:00,8477.0,0.3461485886933291,0.6234103062973735,1.1404963949983655,1.5157156519412132,-0.8597372467288562,0.22577769953291194,12.694491601361856,26.561614027701754,0.6234103062973735,3.187533365920739,14.049639499836465,14.049639499836557,55.953306258589215,14.049639499836557,1.3637218362733854,0.48428434805878684
565,200100,Praha-Chuchle,1019,CZ,14.397527,50.026446,186.61,26730.71,Vltava,Elbe,Elbe,C160,26850,4637500.0,2997500.0,26789.4,14.39167,50.025,True,True,True,True,0,1,0,1,1,1,1,0,1,0,HIST_24h,-,3,,3,,1,1,02/01/1991,31/12/2021,9302.0,01/01/2016 00:00,31/12/2021 18:00,8477.0,True,True,01/01/2016 00:00,31/12/2021 18:00,2119.25,6.0,1095.0,1460.0,0.0,,4622.255616,1.0,,recommended,2016-01-01 00:00:00,2021-12-31 18:00:00,8477.0,0.42686233658514827,0.613799004721148,1.4067360172377292,1.1179041337352071,-0.9336889940176378,-0.21561112964265527,54.70349406904008,86.49548253389008,0.613799004721148,38.90181345849979,40.67360172377282,40.67360172377291,57.19497197827312,40.67360172377291,1.3905714631106316,0.8820958662647929
566,204000,Melnik,1019,CZ,14.470824,50.351966,152.73,41837.98,Labe,Elbe,Elbe,-,42025,4637500.0,3037500.0,41862.3,14.475,50.34167,False,False,True,True,0,0,0,0,0,0,0,0,1,0,HIST_24h,-,3,,2,,1,1,02/01/1991,01/01/2010,6876.0,,,,True,False,02/01/1991 00:00,01/01/2010 00:00,6876.0,24.0,1095.0,1460.0,0.0,,1981.118848,,,,1991-01-03 00:00:00,2010-01-01 00:00:00,6875.0,0.7717221636319662,0.83280213302957,0.8992724501271039,1.1183621753518092,0.6497059500743997,0.44833566391012214,78.72425014117547,125.65763122699019,0.83280213302957,-25.081036829695506,-10.072754987289635,-10.07275498728961,31.616319876030772,10.07275498728961,0.5918564436800526,0.8816378246481908
567,214000,Karlovy Vary,1019,CZ,12.883837,50.237485,365.89,2861.17,Ohre,Elbe,Elbe,-,2925,4527500.0,3017500.0,2823.6,12.875,50.24167,False,False,True,True,0,0,0,0,0,0,0,0,1,0,HIST_24h,-,3,,2,,1,1,02/01/1991,01/01/2010,6872.0,,,,True,False,02/01/1991 00:00,01/01/2010 00:00,6872.0,24.0,1095.0,1460.0,1.0,0.0,2823.618816,1.0,,recommended,1991-01-03 00:00:00,2010-01-01 00:00:00,6871.0,0.7050684524652029,0.712076613239195,0.9397903981863598,1.0214369992513201,0.4416292029093558,0.2481042116879273,10.889838890550124,18.819629536318967,0.712076613239195,-1.590732947283922,-6.020960181364042,-6.020960181364024,41.21828648449355,6.020960181364024,0.7472421274865608,0.9785630007486799
568,219000,Louny I.,1019,CZ,13.804808,50.357499,171.45,4962.3,Ohre,Elbe,Elbe,C162,5100,4587500.0,3032500.0,4943.3,13.80833,50.35833,True,True,True,True,0,1,0,1,1,1,1,0,1,0,HIST_24h,Regulated,3,,3,,1,1,02/01/1991,31/12/2021,9231.0,01/01/2016 00:00,31/12/2021 18:00,8179.0,True,True,01/01/2016 00:00,31/12/2021 18:00,2044.75,6.0,1095.0,1460.0,0.0,,2119.63136,1.0,,recommended,2016-01-01 00:00:00,2021-12-31 18:00:00,8179.0,0.5810263200730601,0.6112113593018654,1.05315413921881,0.8531770630333053,0.2866747052131451,0.2650499951144293,13.082589543042438,18.72495571344008,0.6112113593018654,1.462984043543607,5.315413921880967,5.315413921881005,47.53256120477258,5.315413921881005,0.8445858717660705,0.8531770630333053
569,221000,Usti nad Labem,1019,CZ,14.042806,50.653028,130.95,48540.85,Labe,Elbe,Elbe,C156,48700,4607500.0,3062500.0,48554.5,14.04167,50.64167,True,True,True,True,0,1,0,1,1,1,1,0,1,0,HIST_24h,-,3,,3,,1,1,02/01/1991,31/12/2021,8940.0,01/01/2016 00:00,31/12/2021 18:00,8477.0,True,True,01/01/2016 00:00,31/12/2021 18:00,2119.25,6.0,1095.0,1460.0,0.0,,1748.94208,,,recommended,2016-01-01 00:00:00,2021-12-31 18:00:00,8477.0,0.4749395834245633,0.6537335054015543,1.3786695982550463,1.1113431234079476,-0.7384387235371714,-0.04457211427247376,101.74186522230352,158.5977901511995,0.6537335054015543,75.51729762749095,37.86695982550462,37.86695982550464,51.01685632276085,37.86695982550464,1.3184986626982884,0.8886568765920524
570,257000,Svinov,1019,CZ,18.217288,49.819936,204.13,1613.73,Oder,Oder,Oder,C185,1525,4912500.0,2997500.0,1554.1,18.225,49.80833,False,False,True,True,0,0,0,0,0,0,0,0,1,0,HIST_24h,-,3,,2,,1,1,02/01/1991,01/01/2011,7215.0,,,,True,False,02/01/1991 00:00,01/01/2011 00:00,7215.0,24.0,1095.0,1460.0,1.0,0.0,1554.119296,,,recommended,1991-01-03 00:00:00,2011-01-01 00:00:00,7214.0,0.8168674827847938,0.8390098621852421,0.9127366709693032,0.9978077877740967,0.695360233133578,0.5796101767023765,5.696970025930382,10.660652615599558,0.8390098621852421,-1.1316422351474384,-8.726332903069695,-8.726332903069677,43.93054221646366,8.726332903069677,0.551941814747191,0.9978077877740967
571,275000,Dehylov,1019,CZ,18.177844,49.878817,211.2,2038.8,Opava,Oder,Oder,C186,2025,4907500.0,3007500.0,2038.5,18.175,49.875,False,False,True,True,0,0,0,0,0,0,0,0,1,0,HIST_24h,Moved North to avoid conflict in inflow point,3,,2,,1,1,02/01/1991,01/01/2011,7240.0,,,,True,False,02/01/1991 00:00,01/01/2011 00:00,7240.0,24.0,1095.0,1460.0,1.0,0.0,2038.508928,1.0,,recommended,1991-01-03 00:00:00,2011-01-01 00:00:00,7239.0,0.7290911173552796,0.7985082301658327,0.8198767473282244,0.9813371161969676,0.6123031384912031,0.47150372111209393,5.752961767498788,10.193695526505858,0.7985082301658327,-2.602764700923335,-18.012325267177538,-18.01232526717756,39.81313353798897,18.01232526717756,0.6226530827907267,0.9813371161969676
572,294000,Bohumin,1019,CZ,18.327264,49.919651,193.79,4665.47,Oder,Oder,Oder,C184,4675,4917500.0,3012500.0,4658.5,18.325,49.925,True,True,True,True,0,1,0,1,1,1,1,0,1,0,HIST_24h,-,3,,3,,1,1,01/01/1991,31/12/2021,8938.0,01/01/2016 00:00,31/12/2021 18:00,8477.0,True,True,01/01/2016 00:00,31/12/2021 18:00,2119.25,6.0,1095.0,1460.0,0.0,,1065.878848,1.0,,recommended,2016-01-01 00:00:00,2021-12-31 18:00:00,8477.0,0.6599966938372668,0.733174924362399,1.200147058105737,1.0659377156428442,0.21282590383635158,0.38278571317134613,18.986011252054205,40.78918328399793,0.733174924362399,7.482088238153831,20.01470581057377,20.014705810573705,50.78788402793163,20.014705810573705,0.887228322453498,0.9340622843571558
573,303000,Vernovice,1019,CZ,18.419473,49.930486,196.54,1071.19,Olza,Oder,Oder,-,1100,4922500.0,3012500.0,1097.5,18.425,49.925,False,False,True,False,0,0,0,0,0,0,0,0,1,0,-,Not enough discarge data available for calibration period,-,,-,,0,0,02/01/2009,01/01/2010,363.0,,,,False,False,,,,,,,,,,,,,,,,,,,,,,,,,,,,,,,
574,367000,Olomouc,1019,CZ,17.26133,49.576874,204.63,3323.94,Morava,Danube,Danube,-,3450,4847500.0,2962500.0,3324.1,17.25833,49.575,True,True,True,True,0,1,0,1,1,1,1,0,1,0,HIST_24h,-,3,,3,,1,1,02/01/1991,31/12/2021,8942.0,01/01/2016 00:00,31/12/2021 18:00,8477.0,True,True,01/01/2016 00:00,31/12/2021 18:00,2119.25,6.0,1095.0,1460.0,0.0,,1184.345984,,,recommended,2016-01-01 00:00:00,2021-12-31 18:00:00,8477.0,0.4903790353144446,0.6167085011679809,1.3356679743926645,0.98867897808208,-0.2540360264873589,-0.0997160930095784,14.505756861826827,21.17200957383661,0.6167085011679809,7.04820481031155,33.56679743926653,33.56679743926645,69.08309497076998,33.56679743926645,1.1198375000362168,0.98867897808208
575,390000,Dluhonice,1019,CZ,17.408543,49.449116,199.71,1592.69,Becva,Danube,Danube,-,1575,4857500.0,2952500.0,1591.4,17.40833,49.44167,False,False,True,True,0,0,0,0,0,0,0,0,1,0,HIST_24h,-,3,,2,,1,1,02/01/1991,01/01/2010,6858.0,,,,True,False,02/01/1991 00:00,01/01/2010 00:00,6858.0,24.0,1095.0,1460.0,0.0,,333.107424,,,recommended,1991-01-03 00:00:00,2010-01-01 00:00:00,6857.0,0.8719199591608091,0.8920290235465776,0.9378055905764917,1.029641534061589,0.7883888321136567,-0.0544328307528279,5.529235125628834,10.850565865470218,0.8920290235465776,-1.0318663944479511,-6.2194409423508,-6.219440942350832,33.326748022081155,6.219440942350832,0.4600121388467304,0.970358465938411
576,403000,Kromeriz,1019,CZ,17.39939,49.301911,183.17,7030.31,Morava,Danube,Danube,-,7200,4857500.0,2937500.0,6997.1,17.39167,49.30833,True,True,True,True,0,1,0,1,1,1,1,0,1,0,HIST_24h,-,3,,3,,1,1,02/01/1991,31/12/2021,8941.0,01/01/2016 00:00,31/12/2021 18:00,8477.0,True,True,01/01/2016 00:00,31/12/2021 18:00,2119.25,6.0,1095.0,1460.0,0.0,,2081.618688,1.0,,recommended,2016-01-01 00:00:00,2021-12-31 18:00:00,8477.0,0.6675798472560486,0.7185582544148381,1.1737667596617145,0.9668516210206743,0.31389903830527577,0.13970118205245652,22.09594418616073,32.7136860726414,0.7185582544148381,6.739693199769156,17.376675966171632,17.37667596617145,56.96907127800377,17.37667596617145,0.8283121161100612,0.9668516210206743
577,421500,Straznice,1019,CZ,17.298601,48.933061,163.28,9145,Morava,Danube,Danube,C051,9150,4852500.0,2892500.0,9138.6,17.29167,48.925,True,True,True,False,0,1,0,1,1,1,1,0,1,0,HIST_24h,Almost same location as 271 and same data but daily  use 271,2,close to 271,3,,1,1,01/01/1991,31/12/2021,8939.0,01/01/2016 00:00,31/12/2021 18:00,8476.0,True,True,01/01/2016 00:00,31/12/2021 18:00,2119.0,6.0,1095.0,1460.0,0.0,,2141.462144,,,recommended,2016-01-01 00:00:00,2021-12-31 18:00:00,8476.0,0.6850509604789135,0.7269389987696127,1.107232766920725,0.885406279400489,0.45440634959742154,0.21337320992725528,24.101753129802017,35.040976749034876,0.7269389987696127,4.700213186532042,10.723276692072531,10.723276692072494,54.98681811187882,10.723276692072494,0.7386431143675408,0.885406279400489
578,437000,Travni Dvur,1019,CZ,16.437896,48.790547,172.64,3531.36,Thaya,Danube,Danube,C775,3450,4792500.0,2872500.0,3632.9,16.44167,48.79167,True,True,True,True,0,1,0,1,1,1,1,0,1,0,HIST_24h,-,3,,3,,1,1,02/01/1991,31/12/2021,8936.0,01/01/2016 00:00,31/12/2021 18:00,8477.0,True,True,01/01/2016 00:00,31/12/2021 18:00,2119.25,6.0,1095.0,1460.0,0.0,,1374.304128,,,recommended,2016-01-01 00:00:00,2021-12-31 18:00:00,8477.0,-0.6378476894361511,0.33102460762119756,2.4784843452218746,1.2215874976545646,-9.770203094830288,-2.2577083531799063,10.347359157117294,19.242956822820528,0.33102460762119756,9.468845688068098,147.8484345221861,147.84843452218743,161.56571806280272,147.84843452218743,3.28179875903906,0.7784125023454354
579,462000,Zidlochovice,1019,CZ,16.616741,49.035525,177.89,3940,Svratka,Danube,Danube,C055,4150,4802500.0,2902500.0,3958.4,16.60833,49.04167,True,True,True,True,0,1,0,1,1,1,1,0,1,0,HIST_24h,-,3,,3,,1,1,02/01/1991,31/12/2021,9728.0,01/01/2016 00:00,31/12/2021 18:00,8477.0,True,True,01/01/2016 00:00,31/12/2021 18:00,2119.25,6.0,1095.0,1460.0,1.0,0.0,3958.37056,1.0,,recommended,2016-01-01 00:00:00,2021-12-31 18:00:00,8477.0,0.6844976142488148,0.7608198528064127,1.1789106156404665,0.8983850197348205,0.4482830520044987,0.29930652035304417,4.762756185422492,7.341026862937899,0.7608198528064127,2.0153884351855864,17.891061564046634,17.891061564046655,42.280070005507795,17.891061564046655,0.7427765128189648,0.8983850197348205
580,478000,Ivancice,1019,CZ,16.411488,49.083013,194.01,2682.17,Jihlava,Danube,Danube,C444,2800,4787500.0,2907500.0,2678.4,16.40833,49.075,True,True,True,True,0,1,0,1,1,1,1,0,1,0,HIST_24h,dam,3,,3,,1,1,02/01/1991,31/12/2021,8933.0,01/01/2016 00:00,31/12/2021 18:00,8477.0,True,True,01/01/2016 00:00,31/12/2021 18:00,2119.25,6.0,1095.0,1460.0,0.0,,1674.319104,1.0,,recommended,2016-01-01 00:00:00,2021-12-31 18:00:00,8477.0,-0.4257008903758237,0.5030416849408439,2.3337907521607058,0.918405322706929,-4.318349127531962,-1.9415198177804984,10.440840160773622,15.534793636412926,0.5030416849408439,9.238066124542426,133.37907521607036,133.37907521607056,150.744710673065,133.37907521607056,2.306154619172783,0.918405322706929
581,480500,Breclav-Ladna,1019,CZ,16.858672,48.79945,157.38,12279.97,Thaya,Danube,Danube,C319,12325,4822500.0,2877500.0,12365.1,16.85833,48.79167,True,True,True,True,0,1,0,1,1,1,1,0,1,0,HIST_24h,dam,3,,3,,1,1,01/01/1991,31/12/2021,8940.0,01/01/2016 00:00,31/12/2021 18:00,8477.0,True,True,01/01/2016 00:00,31/12/2021 18:00,2119.25,6.0,1095.0,1460.0,0.0,,2095.434368,1.0,,recommended,2016-01-01 00:00:00,2021-12-31 18:00:00,8477.0,-0.07286409826300932,0.5206224220579472,1.9520730480797852,0.8783800089287205,-2.1620467245427344,-1.1796212702489441,27.814092546494642,42.194232073093715,0.5206224220579472,23.815635305873144,95.20730480797859,95.20730480797853,111.19186001216563,95.20730480797853,1.7782144765305279,0.8783800089287205
582,16850,Miziya,1026,BG,23.8258,43.6919,26.32,3112,Ogosta,Danube,Danube,C772,3025,5422500.0,2382500.0,3180.4,23.825,43.69167,True,True,True,True,1,1,1,1,1,1,1,0,1,0,HIST_24h,Moved West to avoid conflict in inflow point,3,,3,,1,1,02/01/1991,31/12/2021,9235.0,,,,True,False,02/01/1991 00:00,31/12/2021 00:00,9235.0,24.0,1095.0,1460.0,1.0,0.0,3180.441856,1.0,,recommended,1991-01-03 00:00:00,2022-01-01 00:00:00,9235.0,0.3137515190177973,0.3635755266502495,0.814459993614655,1.1774141296582645,-0.2523998993038845,-4.585955908466424,13.767630220413915,23.375750115534597,0.3635755266502495,-3.6244096345215215,-18.554000638534514,-18.554000638534497,70.47895951595198,18.554000638534497,1.1191067416935248,0.8225858703417355
583,18700,Novi Iskar,1026,BG,23.3598,42.8292,502.63,3662,Iskar,Danube,Danube,-,3825,5412500.0,2297500.0,3525.2,23.35833,42.825,True,True,True,True,1,1,1,1,1,1,1,0,1,0,NRT_24h,-,3,,3,,1,1,02/01/2015,31/12/2021,2434.0,,,,True,False,02/01/2015 00:00,31/12/2021 00:00,2434.0,24.0,1095.0,1460.0,1.0,0.0,3525.160192,1.0,1.0,recommended,2015-01-02 00:00:00,2022-01-01 00:00:00,2435.0,0.7202241054334856,0.7281776085950582,0.9418360714046845,0.9683125242130104,0.49160267867059815,0.40831238387968083,9.205628286783512,13.665628875068608,0.7281776085950582,-1.3350692477888664,-5.816392859531543,-5.816392859531546,40.105448255532636,5.816392859531546,0.7130198604031992,0.9683125242130104
584,18850,Orehovica,1026,BG,24.3589,43.5878,31.2,8366,Iskar,Danube,Danube,-,8375,5477500.0,2387500.0,8324.0,24.35833,43.59167,True,True,True,True,1,1,1,1,1,1,1,0,1,0,HIST_24h,-,3,,3,,1,1,02/01/1991,31/12/2021,7413.0,,,,True,False,02/01/1991 00:00,31/12/2021 00:00,7413.0,24.0,1095.0,1460.0,0.0,,1690.851584,,,recommended,1991-01-03 00:00:00,2022-01-01 00:00:00,7413.0,0.5424211902302735,0.5877446564266617,0.9759109150906539,1.1970878353266348,0.00780669022607372,-0.2945283922031465,28.514050932510642,45.25844924357266,0.5877446564266617,-1.1578442679261876,-2.4089084909346123,-2.408908490934612,59.32381521851258,2.408908490934612,0.996089006953659,0.8029121646733652
585,21800,Tarnene,1026,BG,24.5192,43.4056,58.24,2236,Vit,Danube,Danube,C774,2275,5492500.0,2367500.0,2364.3,24.50833,43.39167,True,True,True,False,1,1,1,1,1,1,1,0,1,0,HIST_24h,not congruent with 2731 after 12-2001,0,similar to 2731  has recent data,3,,1,0,02/01/1991,31/12/2021,8181.0,,,,True,False,02/01/1991 00:00,31/12/2021 00:00,8181.0,24.0,1095.0,1460.0,0.0,,598.276608,1.0,,,1991-01-03 00:00:00,2022-01-01 00:00:00,8181.0,0.299776526093,0.45167778662171826,1.3585398426952455,1.247193941929,-1.3980785289780768,-0.3560294752945554,13.445051990039076,28.029821628113968,0.45167778662171826,4.352601500207699,35.85398426952541,35.85398426952455,110.75185323784149,35.85398426952455,1.5485730622021274,0.7528060580710001
586,22700,Troian,1026,BG,24.7097,42.9172,353.1,458.1,Osam,Danube,Danube,-,550,5517500.0,2317500.0,482.0,24.70833,42.925,True,True,True,False,1,1,1,1,1,1,1,0,1,0,-,Provider upArea too small to be included in calibration,-,,3,,1,1,02/01/1991,31/12/2021,8187.0,,,,True,False,02/01/1991 00:00,31/12/2021 00:00,8187.0,24.0,1095.0,1460.0,1.0,0.0,482.000448,,,recommended,1991-01-03 00:00:00,2022-01-01 00:00:00,8187.0,0.48797452408747366,0.4997802635153993,1.0107060787449569,1.1087919256775636,-0.13576897183948344,-2.5097074469424547,5.259944676084222,9.748166050063066,0.4997802635153993,0.0673623335787223,1.0706078744956014,1.0706078744956893,83.59773022183789,1.0706078744956893,1.0657246228925565,0.8912080743224364
587,22800,Izgrev,1026,BG,25.0528,43.4555,40.32,2154,Osam,Danube,Danube,C773,2275,5537500.0,2382500.0,2184.9,25.05833,43.45833,True,True,True,True,1,1,1,1,1,1,1,0,1,0,HIST_24h,-,3,,3,,1,1,02/01/1991,31/12/2021,8206.0,,,,True,False,02/01/1991 00:00,31/12/2021 00:00,8206.0,24.0,1095.0,1460.0,0.0,,1260.102784,,,recommended,1991-01-03 00:00:00,2022-01-01 00:00:00,8206.0,0.43840677310063614,0.5140110663946897,1.2043717009227846,1.1934784659189277,-0.6102645165203602,-1.2157881261589334,10.327723173136116,19.612944376155152,0.5140110663946897,2.2841344482079387,20.43717009227875,20.437170092278464,92.406747475373,20.437170092278464,1.2689619838751494,0.8065215340810723
588,23500,Sevlievo,1026,BG,25.1086,42.9958,196.24,958,Rositsa,Danube,Danube,-,1000,5547500.0,2337500.0,998.2,25.10833,42.99167,True,True,True,True,1,1,1,1,1,1,1,0,1,0,HIST_24h,-,3,,3,,1,1,02/01/1991,31/12/2021,8169.0,,,,True,False,02/01/1991 00:00,31/12/2021 00:00,8169.0,24.0,1095.0,1460.0,1.0,0.0,998.192768,,,recommended,1991-01-03 00:00:00,2022-01-01 00:00:00,8169.0,0.444929289769451,0.4473396380645319,0.975537133014071,1.0455146771935413,-0.1279920088176878,0.2347064128499251,7.706762985832618,15.848448870028482,0.4473396380645319,-0.22896220119587576,-2.4462866985928815,-2.446286698592903,82.34089156629771,2.446286698592903,1.0620696817147597,0.9544853228064587
589,23850,Karantsi,1026,BG,25.6672,43.3803,30.9,6860,Yantra,Danube,Danube,C785,6850,5582500.0,2392500.0,6870.9,25.675,43.375,True,True,True,True,1,1,1,1,1,1,1,0,1,0,HIST_24h,-,3,,3,,1,1,02/01/1991,31/12/2021,7123.0,,,,True,False,02/01/1991 00:00,31/12/2021 00:00,7123.0,24.0,1095.0,1460.0,0.0,,4970.952192,1.0,,recommended,1991-01-03 00:00:00,2022-01-01 00:00:00,7123.0,0.35490973839196216,0.4092018749469136,1.253759533569239,0.9479892301729089,-0.47985763732748965,-0.20985400552490518,36.85055932772315,65.38701982850273,0.4092018749469136,10.73925118418658,25.3759533569238,25.3759533569239,87.07479307810665,25.3759533569239,1.2164939939545554,0.9479892301729089
590,23400,Dzhuliunitsa,1026,BG,25.9059,43.133,62.02,882,Dzhulunitsa,Danube,Danube,-,825,5607500.0,2362500.0,901.7,25.90833,43.125,True,True,True,True,1,1,1,1,1,1,1,0,1,0,HIST_24h,-,3,,3,,1,1,02/01/1991,31/12/2021,8168.0,,,,True,False,02/01/1991 00:00,31/12/2021 00:00,8168.0,24.0,1095.0,1460.0,1.0,0.0,901.714816,1.0,,recommended,1991-01-03 00:00:00,2022-01-01 00:00:00,8168.0,0.4421176390296405,0.44973722879604644,0.9314437867518313,0.9388145692678436,0.020121942941808135,0.22069517869682387,6.138025152919327,12.286026736216769,0.44973722879604644,-0.5204189952001853,-6.855621324816797,-6.8556213248168785,80.8578789758228,6.8556213248168785,0.9898879012586186,0.9388145692678436
591,31550,Shirocovo,1026,BG,25.9458,43.5529,92.81,1383,Cherni Lom,Danube,Danube,-,1425,5602500.0,2407500.0,1410.6,25.94167,43.55833,True,True,True,True,1,1,1,1,1,1,1,0,1,0,NRT_24h,negative data,3,,3,,1,1,02/01/2015,31/12/2021,2414.0,,,,True,False,02/01/2015 00:00,31/12/2021 00:00,2414.0,24.0,1095.0,1460.0,1.0,0.0,1410.572672,1.0,,recommended,2015-01-02 00:00:00,2022-01-01 00:00:00,2415.0,0.42063592345280365,0.8068881893669353,0.7121588367439117,1.4642391910672632,0.49941112650472474,-0.6787352616072249,2.097442016198625,2.924727146608076,0.8068881893669353,-1.2809091544166344,-28.784116325608824,-28.78411632560883,47.13294051518917,28.78411632560883,0.7075230550980415,0.5357608089327368
592,72700,Plovdiv,1026,BG,24.7388,42.1545,155.08,7926,Maritsa\Evros,Maritsa\Evros,Evros,-,8025,5532500.0,2237500.0,7947.8,24.74167,42.15833,True,True,True,True,1,1,1,1,1,1,1,0,1,0,NRT_24h,-,3,,3,,1,1,02/01/2015,31/12/2021,2433.0,,,,True,False,02/01/2015 00:00,31/12/2021 00:00,2433.0,24.0,1095.0,1460.0,1.0,0.0,7947.812352,1.0,,recommended,2015-01-02 00:00:00,2022-01-01 00:00:00,2434.0,0.69446846993565,0.714001593005414,0.9411449930684409,1.0899472913383614,0.4051593347022501,0.22565130100641329,20.23217975882841,29.2354203641143,0.714001593005414,-3.2655760587926745,-5.885500693155968,-5.885500693155913,36.46416615347942,5.885500693155913,0.7712591427644458,0.9100527086616386
593,73850,Svilengrad,1026,BG,26.1961,41.7609,46.63,20857,Maritsa\Evros,Maritsa\Evros,Evros,-,20800,5657500.0,2217500.0,20808.5,26.19167,41.75833,True,True,True,False,1,1,1,1,1,1,1,0,1,0,HIST_24h,Few data,0,,3,,1,1,02/01/2015,31/12/2021,2436.0,,,,True,False,02/01/2015 00:00,31/12/2021 00:00,2436.0,24.0,1095.0,1460.0,0.0,,12860.67507,1.0,,recommended,2015-01-02 00:00:00,2022-01-01 00:00:00,2437.0,0.5628327257066652,0.7543102693314224,1.3596543285997476,0.9625761322612102,0.10062992642643587,0.1154046088462185,65.72558696533181,107.70975202097917,0.7543102693314224,45.56181720699376,35.96543285997452,35.96543285997477,51.88224109773218,35.96543285997477,0.9483512395592458,0.9625761322612102
594,A001,Ebro En Miranda Ebro,1012,ES,-2.955462,42.687636,458.84,5481,Ebro,Ebro,Ebro,C531,5275,3257500.0,2272500.0,5466.1,-2.95833,42.69167,True,True,True,True,1,1,1,1,1,1,1,1,1,0,HIST_24h,-,3,,3,,1,1,03/01/1990,31/12/2021,5728.0,20/06/1999 00:00,31/12/2021 18:00,564.0,True,False,03/01/1990 00:00,31/12/2021 00:00,5728.0,24.0,1095.0,1460.0,0.0,,1022.831808,,,recommended,1991-01-03 00:00:00,2022-01-01 00:00:00,5366.0,0.6334186465616702,0.6592994935629367,1.1321433163325285,1.0290378640889364,0.17036870287320327,-0.33316211656018013,29.915563525263195,54.61740087421326,0.6592994935629367,5.546421613365989,13.214331633252868,13.214331633252858,71.2737337648165,13.214331633252858,0.9108409834470558,0.9709621359110636
595,A002,Ebro En Castejon,1012,ES,-1.694672,42.180075,264.83,25194,Ebro,Ebro,Ebro,C114,25375,3352500.0,2197500.0,25116.0,-1.69167,42.175,True,True,True,True,1,1,1,1,1,1,1,1,1,0,NRT_6h,-,3,,3,,1,1,03/01/1990,31/12/2021,10790.0,29/04/2012 00:00,31/12/2021 18:00,13765.0,True,True,29/04/2012 00:00,31/12/2021 18:00,3441.25,6.0,1095.0,1460.0,0.0,,2194.239232,,,recommended,2012-04-29 00:00:00,2021-12-31 18:00:00,13765.0,0.7517140716148525,0.8926441635188405,1.167559360255469,0.8515261390066149,0.772221325263798,0.6484936908654968,79.3497215623528,136.7012418107098,0.8926441635188405,34.224531280184934,16.755936025546923,16.755936025546912,38.84870905196414,16.755936025546912,0.4772616418026938,0.8515261390066149
596,A003,Ega En Andosilla,1012,ES,-1.948857,42.374073,304.13,1445,Ega,Ebro,Ebro,C283,1425,3337500.0,2222500.0,1318.4,-1.94167,42.375,True,True,True,True,1,1,1,1,1,1,1,1,1,0,NRT_6h,-,3,,3,,1,1,03/01/1990,31/12/2021,10596.0,29/04/2012 00:00,31/12/2021 18:00,13758.0,True,True,29/04/2012 00:00,31/12/2021 18:00,3439.5,6.0,1095.0,1460.0,0.0,,494.257984,,,recommended,2012-04-29 00:00:00,2021-12-31 18:00:00,13758.0,0.7967901121723561,0.7998349381173969,1.0127754837024752,1.0326342385942293,0.5791626762214286,0.7228521023531895,4.9199128781761114,13.765358245613404,0.7998349381173969,0.16618138922498069,1.2775483702475134,1.2775483702475163,37.82268705651684,1.2775483702475163,0.6487197575059468,0.9673657614057707
597,A004,Arga En Funes,1012,ES,-1.801186,42.314788,283.66,2759,Arga,Ebro,Ebro,C284,2775,3352500.0,2217500.0,2881.3,-1.79167,42.30833,True,True,True,True,1,1,1,1,1,1,1,1,1,0,NRT_6h,-,3,,3,,1,1,03/01/1990,31/12/2021,10402.0,29/04/2012 00:00,31/12/2021 18:00,12730.0,True,True,29/04/2012 00:00,31/12/2021 18:00,3182.5,6.0,1095.0,1460.0,0.0,,1083.957504,1.0,,recommended,2012-04-29 00:00:00,2021-12-31 18:00:00,12730.0,0.8804547277734056,0.8880023395757941,1.003334891072058,0.9583289708217766,0.7831386136083296,0.6658404844307954,20.643910646819652,41.201945321370935,0.8880023395757941,0.17641061418512424,0.3334891072058272,0.3334891072058095,39.02553915276623,0.3334891072058095,0.4656837836898211,0.9583289708217766
598,A005,Aragon En Caparroso,1012,ES,-1.650487,42.343265,302.33,5469,Aragon,Ebro,Ebro,C285,5550,3362500.0,2212500.0,5539.5,-1.65833,42.34167,True,True,True,True,1,1,1,1,1,1,1,1,1,0,NRT_6h,-,3,,3,,1,1,03/01/1990,31/12/2021,10640.0,29/04/2012 00:00,31/12/2021 18:00,13688.0,True,True,29/04/2012 00:00,31/12/2021 18:00,3422.0,6.0,1095.0,1460.0,0.0,,1745.416832,,,recommended,2012-04-29 00:00:00,2021-12-31 18:00:00,13688.0,0.3829349136793908,0.772801488056687,1.5035872415998826,0.725136311920933,0.41107324425603553,0.31593469887812,34.91436857936747,63.58890052992309,0.772801488056687,24.206216184499887,50.358724159988185,50.35872415998824,72.63601395225065,50.35872415998824,0.7674156342842978,0.725136311920933
599,A010,Jiloca En Daroca,1012,ES,-1.41935,41.106339,750,2202,Jiloca,Ebro,Ebro,-,2675,3362500.0,2067500.0,2208.6,-1.425,41.10833,True,True,True,False,1,1,1,1,1,1,1,1,1,0,NRT_6h,strongly regulated but no dam in lsf,0,Regulated but no dam in model,0,,0,1,03/01/1990,31/12/2021,9520.0,29/04/2012 00:00,31/12/2021 18:00,13593.0,True,True,,,,,,,,,,,,recommended,,,,,,,,,,,,,,,,,,,
600,A011,Ebro En Zaragoza,1012,ES,-0.881001,41.658572,200.62,40434,Ebro,Ebro,Ebro,C115,41075,3407500.0,2132500.0,40354.4,-0.875,41.65833,True,True,True,True,1,1,1,1,1,1,1,1,1,0,NRT_6h,-,3,,3,,1,1,03/01/1990,31/12/2021,10793.0,29/04/2012 00:00,31/12/2021 18:00,13751.0,True,True,29/04/2012 00:00,31/12/2021 18:00,3437.75,6.0,1095.0,1460.0,0.0,,3461.569792,1.0,,recommended,2012-04-29 00:00:00,2021-12-31 18:00:00,13751.0,0.7553757358982572,0.8749335411626662,1.1732670336147912,0.8809288174093349,0.7218748380222091,0.6477004059347833,83.59530465091066,146.88108827401427,0.8749335411626662,37.85116577658147,17.32670336147914,17.326703361479126,38.26648443665519,17.326703361479126,0.5273757313128751,0.8809288174093349
601,A012,Gallego En Ardisa,1012,ES,-0.752565,42.174677,390,2040,Gallego,Ebro,Ebro,C287,2025,3432500.0,2177500.0,2050.0,-0.75833,42.175,True,True,True,False,1,1,1,1,1,1,1,1,1,0,NRT_6h,Wrong LDD station is downstream of dam,0,Regulated  use 614,0,close,0,1,03/01/1990,31/12/2021,10290.0,12/03/2005 00:00,31/12/2021 18:00,13525.0,True,True,,,,,,,,,,,,recommended,,,,,,,,,,,,,,,,,,,
602,A014,Martin En Hijar,1012,ES,-0.453206,41.174519,260.07,1419,Martin,Ebro,Ebro,C289,1350,3442500.0,2067500.0,1408.3,-0.45833,41.175,True,True,True,True,1,1,1,1,1,1,1,1,1,0,NRT_6h,-,3,,3,,1,1,03/01/1990,31/12/2021,10666.0,01/10/2005 00:00,31/12/2021 18:00,13544.0,True,True,01/10/2005 00:00,31/12/2021 18:00,3386.0,6.0,1095.0,1460.0,1.0,0.0,1408.344192,1.0,,recommended,2005-10-01 00:00:00,2021-12-31 18:00:00,13544.0,0.29905854176399815,0.5591329646844609,0.9715092282102336,0.45580935236911385,0.2987032809303396,0.24679020637517546,0.46184040346143224,0.8543731037545542,0.5591329646844609,-0.020363211572619916,-2.8490771789766716,-2.8490771789766436,64.61745727773929,2.8490771789766436,0.8374346058467242,0.4558093523691138
603,A017,Cinca En Fraga,1012,ES,0.323398,41.551916,101.04,9612,Cinca,Ebro,Ebro,C290,9700,3512500.0,2102500.0,9574.4,0.325,41.55833,True,True,True,True,1,1,1,1,1,1,1,1,1,0,NRT_6h,-,3,,3,,1,1,02/10/1990,31/12/2021,7392.0,29/04/2012 00:00,31/12/2021 18:00,13694.0,True,True,29/04/2012 00:00,31/12/2021 18:00,3423.5,6.0,1095.0,1460.0,0.0,,2508.867072,,,recommended,2012-04-29 00:00:00,2021-12-31 18:00:00,13694.0,0.30180522940034327,0.7276429506320643,1.5719538890990807,0.7064589907751635,0.010756580492396584,-0.2532281435454016,32.99767834950828,44.97571111383155,0.7276429506320643,27.58438834311134,57.19538890990792,57.195388909908075,68.41968082991724,57.195388909908075,0.9946071684376621,0.7064589907751635
604,A023,Segre En Seo De Urgel,1012,ES,1.459801,42.352442,672.06,1233,Segre,Ebro,Ebro,-,1200,3622500.0,2177500.0,1234.3,1.45833,42.35833,True,True,True,False,1,1,1,1,1,1,1,1,1,0,NRT_6h,Close to 629,2,close to 629,3,,1,1,09/04/1990,31/12/2021,10014.0,29/04/2012 00:00,31/12/2021 18:00,13704.0,True,True,29/04/2012 00:00,31/12/2021 18:00,3426.0,6.0,1095.0,1460.0,1.0,0.0,1234.255104,1.0,,recommended,2012-04-29 00:00:00,2021-12-31 18:00:00,13704.0,0.6236656691464988,0.6526740820603392,0.9654802253620045,1.1407146775047525,0.22350748816211974,0.4035083485187211,5.596980623885851,11.117511115946444,0.6526740820603392,-0.4328653411489861,-3.451977463799549,-3.4519774637995524,44.63432190642132,3.4519774637995524,0.8811881251116993,0.8592853224952475
605,A025,Segre En Seros,1012,ES,0.416323,41.45158,87.26,12782,Segre,Ebro,Ebro,C117,12900,3522500.0,2092500.0,12922.9,0.425,41.45833,True,True,True,True,1,1,1,1,1,1,1,1,1,0,NRT_6h,-,3,,3,,1,1,03/01/1990,31/12/2021,10471.0,29/04/2012 00:00,31/12/2021 18:00,13734.0,True,True,29/04/2012 00:00,31/12/2021 18:00,3433.5,6.0,1095.0,1460.0,0.0,,3361.210368,,,recommended,2012-04-29 00:00:00,2021-12-31 18:00:00,13734.0,0.4210446542094114,0.5464705147081084,1.3598180714452426,0.99440948555157,-0.6693893111247697,-0.20008327420220562,38.2506540675133,54.8089961820753,0.5464705147081084,23.95122923544207,35.981807144524275,35.98180714452425,57.463758719011366,35.98180714452425,1.2920484941072368,0.99440948555157
606,A027,Ebro En Tortosa,1012,ES,0.520716,40.813296,25,84230,Ebro,Ebro,Ebro,C118,85050,3522500.0,2022500.0,84270.0,0.525,40.80833,True,True,True,True,1,1,1,1,1,1,1,1,1,0,NRT_6h,Dams oscillations,3,,3,,1,1,03/01/1990,31/12/2021,10751.0,29/04/2012 00:00,31/12/2021 18:00,13581.0,True,True,29/04/2012 00:00,31/12/2021 18:00,3395.25,6.0,1095.0,1460.0,0.0,,1690.0928,1.0,,recommended,2012-04-29 00:00:00,2021-12-31 18:00:00,13581.0,0.3776460833582508,0.7507033715492943,1.5006995589045837,0.7270979290749309,0.1783243945995452,0.002368717791463415,194.307770053964,270.5983448691872,0.7507033715492943,154.92162575445016,50.06995589045827,50.06995589045838,62.79937631945348,50.06995589045838,0.9064632399609203,0.7270979290749309
607,A030,Guadalope Cola Santolea,1012,ES,-0.36836,40.739821,584,1002,Guadalope,Ebro,Ebro,-,975,3437500.0,2017500.0,1002.3,-0.375,40.74167,False,False,True,True,0,0,0,0,0,0,0,1,1,0,HIST_24h,Moved upstream of dam,3,Discontinued but keeping it for calib because no alternative,2,,1,1,03/01/1990,01/10/2007,6327.0,,,,True,False,03/01/1990 00:00,01/10/2007 00:00,6327.0,24.0,1095.0,1460.0,1.0,0.0,1002.30848,,,exclude,1991-01-03 00:00:00,2007-10-01 00:00:00,5968.0,0.3436497001066907,0.36894330151864824,0.8376091179608735,1.0786915554707617,-0.16265745317887514,0.27504907717428995,1.4083668703180934,4.274498479793688,0.36894330151864824,-0.45203313162431774,-16.239088203912438,-16.23908820391265,50.59495030459651,16.23908820391265,1.0782659473334546,0.9213084445292383
608,A031,Bergantes En Zorita,1012,ES,-0.155649,40.778878,540.32,1038,Bergantes,Ebro,Ebro,C291,1075,3462500.0,2017500.0,1063.3,-0.15833,40.775,True,True,True,True,1,1,1,1,1,1,1,1,1,0,NRT_6h,-,3,,3,,1,1,05/10/1990,31/12/2021,10357.0,29/04/2012 00:00,31/12/2021 18:00,13183.0,True,True,29/04/2012 00:00,31/12/2021 18:00,3295.75,6.0,1095.0,1460.0,1.0,0.0,1063.294464,,,recommended,2012-04-29 00:00:00,2021-12-31 18:00:00,13183.0,0.12405000574427316,0.5182694451789875,1.5784343245936647,1.4479261067635134,-2.923681432409106,0.560167091538041,0.8957051037294343,3.882492225848493,0.5182694451789875,0.5161087283151463,57.84343245936708,57.843432459366475,100.38709835468568,57.843432459366475,1.9808284712234538,0.5520738932364866
609,A032,Guatizalema P.Alcofea,1012,ES,-0.127798,41.909218,317.06,362,Guatizalema,Ebro,Ebro,-,350,3477500.0,2147500.0,375.0,-0.14167,41.925,True,True,True,False,1,1,1,1,1,1,1,1,1,0,-,Provider upArea too small to be included in calibration,-,,3,,1,1,03/01/1990,31/12/2021,9966.0,29/04/2012 00:00,31/12/2021 18:00,13715.0,True,True,29/04/2012 00:00,31/12/2021 18:00,3428.75,6.0,1095.0,1460.0,1.0,0.0,375.018752,,,recommended,2012-04-29 00:00:00,2021-12-31 18:00:00,13715.0,-1.0599152752722691,0.34209317435969877,0.4937084834405464,2.885226365807528,-1.1615745986578379,-5.632747812743897,0.7431712742234705,1.9177474489379254,0.34209317435969877,-0.42684104093567854,-50.62915165594475,-50.62915165594536,88.15021879461683,50.62915165594536,1.4702294374205125,-0.8852263658075281
610,A033,Rioalcanadre En P.Alcofea,1012,ES,-0.125338,41.912731,316.43,7665,Alcanadre,Ebro,Ebro,-,1300,3477500.0,2142500.0,1234.3,-0.10833,41.89167,True,True,True,True,1,1,1,1,1,1,1,1,1,0,NRT_6h,Wrong area from provider,3,,3,,1,1,03/01/1990,31/12/2021,9958.0,29/04/2012 00:00,31/12/2021 18:00,13667.0,True,True,29/04/2012 00:00,31/12/2021 18:00,3416.75,6.0,1095.0,1460.0,0.0,,347.50272,,,recommended,2012-04-29 00:00:00,2021-12-31 18:00:00,13667.0,0.4792080089947379,0.7587417391898686,1.4354182330997654,0.8469323294409493,0.30611111541285363,0.5061750499730111,2.4496411683438906,5.172699377213552,0.7587417391898686,1.5307331927588572,43.54182330997741,43.541823309976536,69.68023129663689,43.541823309976536,0.8329999307245735,0.8469323294409493
611,A038,Najerilla En Torremontalbo,1012,ES,-2.68401,42.498307,425.35,1090,Najerilla,Ebro,Ebro,C292,1125,3277500.0,2237500.0,1100.1,-2.69167,42.49167,True,True,True,True,1,1,1,1,1,1,1,1,1,0,NRT_6h,-,3,,3,,1,1,03/01/1990,31/12/2021,10695.0,29/04/2012 00:00,31/12/2021 18:00,13467.0,True,True,29/04/2012 00:00,31/12/2021 18:00,3366.75,6.0,1095.0,1460.0,1.0,0.0,1100.062208,1.0,,recommended,2012-04-29 00:00:00,2021-12-31 18:00:00,13467.0,0.49632023234748424,0.5200092765397932,0.9398130310440549,0.8597154944317238,0.1852024651169163,0.11911659005162933,6.407519017361907,10.858980914000044,0.5200092765397932,-0.5750212411222068,-6.018696895594621,-6.018696895594515,67.06693954991268,6.018696895594515,0.9026613622411874,0.8597154944317238
612,A042,Jiloca En Calamocha,1012,ES,-1.300512,40.924081,872.43,1498,Jiloca,Ebro,Ebro,C294,1925,3367500.0,2047500.0,1452.7,-1.30833,40.925,True,True,True,False,1,1,1,1,1,1,1,1,1,0,NRT_6h,strongly regulated but no dam in lsf,0,Regulated but no dam in model,0,,0,1,03/01/1990,31/12/2021,10757.0,29/04/2012 00:00,31/12/2021 18:00,13653.0,True,True,,,,,,,,,,,,recommended,,,,,,,,,,,,,,,,,,,
613,A055,Jiloca En Morata De Jiloca,1012,ES,-1.58451,41.251626,635.79,2502,Jiloca,Ebro,Ebro,C296,2975,3352500.0,2087500.0,2498.5,-1.59167,41.25833,True,True,True,True,1,1,1,1,1,1,1,1,1,0,NRT_6h,Low data quality  dam?,3,,3,,1,1,03/01/1990,31/12/2021,10348.0,29/04/2012 00:00,31/12/2021 18:00,13578.0,True,True,29/04/2012 00:00,31/12/2021 18:00,3394.5,6.0,1095.0,1460.0,0.0,,2100.636288,,,recommended,2012-04-29 00:00:00,2021-12-31 18:00:00,13578.0,0.24166719021393912,0.27398898054487497,1.1772446918556843,1.128689429390046,-1.0922888600951763,-0.042982796011231894,1.2296825632576156,2.501716174798793,0.27398898054487497,0.4050617139904805,17.724469185568633,17.72446918556843,53.80777779704709,17.72446918556843,1.4464746316804824,0.871310570609954
614,A059,Gallego En Sta. Eulalia,1012,ES,-0.750966,42.271258,427,1901,Gallego,Ebro,Ebro,-,1875,3432500.0,2192500.0,1894.6,-0.75833,42.275,True,True,True,True,1,1,1,1,1,1,1,1,1,0,NRT_6h,-,3,,3,,1,1,03/01/1990,31/12/2021,9698.0,29/04/2012 00:00,31/12/2021 18:00,13731.0,True,True,29/04/2012 00:00,31/12/2021 18:00,3432.75,6.0,1095.0,1460.0,0.0,,528.535072,1.0,,recommended,2012-04-29 00:00:00,2021-12-31 18:00:00,13731.0,0.6764585872922493,0.7916310345907474,1.16659251660399,0.8169471294878061,0.5676583418895131,0.29677276626823335,10.083832037359288,15.148321751681058,0.7916310345907474,4.183032066371295,16.65925166039911,16.659251660399004,40.159648060573154,16.659251660399004,0.6575269257684234,0.8169471294878061
615,A065,Irati En Liedena,1012,ES,-1.29483,42.623685,410.77,1546,Irati,Ebro,Ebro,C298,1575,3392500.0,2242500.0,1594.2,-1.29167,42.625,True,True,True,True,1,1,1,1,1,1,1,1,1,0,NRT_6h,-,3,,3,,1,1,03/01/1990,31/12/2021,9912.0,29/04/2012 00:00,31/12/2021 18:00,13699.0,True,True,29/04/2012 00:00,31/12/2021 18:00,3424.75,6.0,1095.0,1460.0,0.0,,1080.445056,,,recommended,2012-04-29 00:00:00,2021-12-31 18:00:00,13699.0,0.7468486261760043,0.777476182043772,1.0780058699871826,1.092107832233218,0.44181175003773576,-0.29376594734407213,17.149268175324575,32.406386243194284,0.777476182043772,2.2949698241311483,7.800586998718256,7.800586998718259,58.29024720035956,7.800586998718259,0.7471199702606337,0.9078921677667819
616,A069,Arga En Echauri,1012,ES,-1.789863,42.790801,377.55,1756,Arga,Ebro,Ebro,-,1775,3357500.0,2262500.0,1797.3,-1.79167,42.79167,True,True,True,True,1,1,1,1,1,1,1,1,1,0,NRT_6h,-,3,,3,,1,1,02/05/1993,31/12/2021,8873.0,29/04/2012 00:00,31/12/2021 18:00,13706.0,True,True,29/04/2012 00:00,31/12/2021 18:00,3426.5,6.0,1095.0,1460.0,1.0,0.0,1797.307264,1.0,,recommended,2012-04-29 00:00:00,2021-12-31 18:00:00,13706.0,0.8650352132669926,0.8657776686531544,1.0038547672002032,0.9863985223032198,0.7340849846705597,0.6152814038757732,18.568473167592977,37.41569637950109,0.8657776686531544,0.15989968487456985,0.3854767200203032,0.38547672002031663,44.76377885324503,0.38547672002031663,0.5156694826431377,0.9863985223032198
617,A083,Segre A/Abajo E.Oliana,1012,ES,1.292847,42.089524,440,2700,Segre,Ebro,Ebro,C519,2675,3597500.0,2147500.0,2680.6,1.29167,42.09167,True,True,True,True,1,1,1,1,1,1,1,1,1,0,NRT_6h,Dam oscillations,3,,3,,1,1,03/01/1990,31/12/2021,10795.0,29/04/2012 00:00,31/12/2021 18:00,13737.0,True,True,29/04/2012 00:00,31/12/2021 18:00,3434.25,6.0,1095.0,1460.0,0.0,,237.139728,1.0,,recommended,2012-04-29 00:00:00,2021-12-31 18:00:00,13737.0,0.5325267149796532,0.539216645971538,1.0336977344866478,0.9287649275394293,0.11222091361496944,0.27554161398366583,12.857274116021582,23.398607346988644,0.539216645971538,0.9366851272342874,3.3697734486647715,3.369773448664791,46.254712153167056,3.369773448664791,0.9422202961011958,0.9287649275394293
618,A087,Jalon En Grisen,1012,ES,-1.175651,41.732907,250,9694,Jalon,Ebro,Ebro,C301,10050,3387500.0,2132500.0,9594.8,-1.175,41.725,True,True,True,True,1,1,1,1,1,1,1,1,1,0,NRT_6h,-,3,,3,,1,1,03/01/1990,31/12/2021,9469.0,29/04/2012 00:00,31/12/2021 18:00,11544.0,True,True,29/04/2012 00:00,31/12/2021 18:00,2886.0,6.0,1095.0,1460.0,0.0,,2047.192192,1.0,,recommended,2012-04-29 00:00:00,2021-12-31 18:00:00,11544.0,-0.27701606098203,0.37661974457678626,2.1049622656535996,0.8543103688102246,-2.61851336322148,-0.7072953569678222,5.95122851483591,10.631419607667656,0.37661974457678626,4.805172943608317,110.49622656536006,110.49622656535998,136.85007845393864,110.49622656535998,1.902239039453622,0.8543103688102246
619,A089,Gallego En Zaragoza,1012,ES,-0.841816,41.669308,194.34,4008,Gallego,Ebro,Ebro,C116,3850,3417500.0,2132500.0,3903.8,-0.84167,41.675,True,True,True,True,1,1,1,1,1,1,1,1,1,0,NRT_6h,-,3,,3,,1,1,02/10/1997,31/12/2021,6111.0,23/07/2014 12:00,31/12/2021 18:00,10451.0,True,True,23/07/2014 12:00,31/12/2021 18:00,2612.75,6.0,1095.0,1460.0,0.0,,338.46704,,,recommended,2014-07-23 12:00:00,2021-12-31 18:00:00,10451.0,-0.7991833251448885,0.7007096995835199,2.6588922508461605,0.37106244058842386,-0.4033412390335793,-1.998193506357147,19.09692292002306,23.243174100793468,0.7007096995835199,17.686848309458966,165.8892250846158,165.88922508461607,179.11465566248,165.88922508461607,1.1846270463878457,0.37106244058842386
620,A092,Nela En Trespaderne,1012,ES,-3.40162,42.802417,545.29,1093,Nela,Ebro,Ebro,C303,1075,3227500.0,2292500.0,1084.4,-3.39167,42.80833,True,True,True,True,1,1,1,1,1,1,1,1,1,0,NRT_6h,-,3,,3,,1,1,03/01/1990,31/12/2021,6308.0,29/04/2012 00:00,31/12/2021 18:00,13197.0,True,True,29/04/2012 00:00,31/12/2021 18:00,3299.25,6.0,1095.0,1460.0,1.0,0.0,1084.428544,,,recommended,2012-04-29 00:00:00,2021-12-31 18:00:00,13197.0,0.7569595348427689,0.7656591288884832,0.9762453947707324,1.0599061145538615,0.5136744853733812,-0.017551488952110006,9.69459070013452,20.680054014998063,0.7656591288884832,-0.37639933559066213,-2.3754605229266894,-2.3754605229267645,61.182673072372005,2.3754605229267645,0.6973704285576118,0.9400938854461385
621,A093,Oca En Oña,1012,ES,-3.41388,42.735292,575.62,1051,Oca,Ebro,Ebro,C304,1125,3227500.0,2277500.0,1018.4,-3.425,42.74167,True,True,True,True,1,1,1,1,1,1,1,1,1,0,NRT_6h,-,3,,3,,1,1,18/09/1990,31/12/2021,10419.0,29/04/2012 00:00,31/12/2021 18:00,13737.0,True,True,29/04/2012 00:00,31/12/2021 18:00,3434.25,6.0,1095.0,1460.0,1.0,0.0,1018.399424,,,recommended,2012-04-29 00:00:00,2021-12-31 18:00:00,13737.0,0.755456239394194,0.7694874036669272,1.0456602334767187,1.067681141109375,0.470316330857372,-4.738078995184637,1.5579889423371482,2.6782594869069927,0.7694874036669272,0.1388759192822778,4.566023347671982,4.566023347671864,51.22424335976298,4.566023347671864,0.7277936995760856,0.932318858890625
622,A094,Flumen En Albalatillo,1012,ES,-0.181336,41.758431,244.47,1499,Flumen,Ebro,Ebro,-,1475,3472500.0,2132500.0,1498.6,-0.19167,41.75833,True,True,True,True,1,1,1,1,1,1,1,1,1,0,NRT_6h,-,3,,3,,1,1,02/10/1992,31/12/2021,9045.0,29/04/2012 00:00,31/12/2021 18:00,13425.0,True,True,29/04/2012 00:00,31/12/2021 18:00,3356.25,6.0,1095.0,1460.0,1.0,0.0,1498.58752,,,recommended,2012-04-29 00:00:00,2021-12-31 18:00:00,13425.0,0.6097828913792986,0.6681870988586855,1.0784127214489685,1.1897920852181434,0.057874421499980344,-0.11856930979959412,1.9449539832831486,3.7797825447875057,0.6681870988586855,0.3989893398852568,7.841272144896584,7.841272144896839,38.22386206260473,7.841272144896839,0.9706315359084478,0.8102079147818566
623,A096,Segre En Balaguer,1012,ES,0.807173,41.793029,210,7796,Segre,Ebro,Ebro,-,7725,3557500.0,2122500.0,7769.6,0.80833,41.79167,True,True,True,True,1,1,1,1,1,1,1,1,1,0,NRT_6h,-,3,,3,,1,1,03/01/1990,31/12/2021,9968.0,29/04/2012 00:00,31/12/2021 18:00,13716.0,True,True,29/04/2012 00:00,31/12/2021 18:00,3429.0,6.0,1095.0,1460.0,0.0,,625.831808,1.0,,recommended,2012-04-29 00:00:00,2021-12-31 18:00:00,13716.0,-2.7210730606804256,0.5886173042208831,4.630187021649719,0.2936777021918115,-3.678388268818445,-4.410405628683125,54.82536260441841,63.08897407017747,0.5886173042208831,54.021008172198336,363.01870216497093,363.01870216497184,368.4239271310504,363.01870216497184,2.1629582216997574,0.29367770219181155
624,A097,N. Ribagorzana A.A.Sta.Ana,1012,ES,0.578476,41.877014,300,1757,Noguera Ribagorzana,Ebro,Ebro,C518,1775,3542500.0,2137500.0,1792.0,0.575,41.875,True,True,True,True,1,1,1,1,1,1,1,1,1,0,NRT_6h,Dam oscillations,3,,3,,1,1,03/01/1990,31/12/2021,10792.0,29/04/2012 00:00,31/12/2021 18:00,13722.0,True,True,29/04/2012 00:00,31/12/2021 18:00,3430.5,6.0,1095.0,1460.0,0.0,,707.54208,1.0,,recommended,2012-04-29 00:00:00,2021-12-31 18:00:00,13722.0,-0.09339285148141974,0.03648025822211269,1.516651379640877,1.0144563754143934,-3.300153522440336,-1.1875607874439846,8.142761548629915,11.131790427976537,0.03648025822211269,5.488084823135306,51.66513796408915,51.6651379640877,76.65641337123154,51.6651379640877,2.073681152549798,0.9855436245856066
625,A099,Guadalope En Caspe,1012,ES,0.012879,41.21049,147,3845,Guadalope,Ebro,Ebro,C306,3850,3482500.0,2067500.0,3783.6,0.00833,41.20833,True,True,True,True,1,1,1,1,1,1,1,1,1,0,NRT_6h,-,3,,3,,1,1,06/01/1990,31/12/2021,10235.0,29/04/2012 00:00,31/12/2021 18:00,13652.0,True,True,29/04/2012 00:00,31/12/2021 18:00,3413.0,6.0,1095.0,1460.0,0.0,,1485.966976,1.0,,recommended,2012-04-29 00:00:00,2021-12-31 18:00:00,13652.0,-1.207692425287156,0.472810630309632,3.0895441477380614,0.5206436943051915,-1.6730791153767943,-3.045237323386349,4.118801229789233,7.55801947441888,0.472810630309632,3.6007810418747637,208.9544147738066,208.95441477380615,239.015283220927,208.95441477380615,1.634955386356718,0.5206436943051915
626,A101,Aragon A.A. Yesa,1012,ES,-1.210999,42.61594,423,2191,Aragon,Ebro,Ebro,C516,2225,3402500.0,2237500.0,2199.9,-1.20833,42.60833,True,True,True,True,1,1,1,1,1,1,1,1,1,0,NRT_6h,-,3,,3,,1,1,03/01/1990,31/12/2021,10553.0,29/04/2012 00:00,31/12/2021 18:00,13674.0,True,True,29/04/2012 00:00,31/12/2021 18:00,3418.5,6.0,1095.0,1460.0,0.0,,222.903968,1.0,,recommended,2012-04-29 00:00:00,2021-12-31 18:00:00,13674.0,-0.314281698408839,0.5575603857061804,2.1311082068226668,0.4978269273105436,-0.20607255892108745,-1.1402606790061522,25.8694522423651,43.39709843565157,0.5575603857061804,20.287276647444187,113.11082068227505,113.11082068226668,144.23399574942306,113.11082068226668,1.0982133485443168,0.49782692731054357
627,A102,N. Pallaresa En Collegats,1012,ES,1.034106,42.274679,540.04,1518,Noguera Pallaresa,Ebro,Ebro,-,1525,3582500.0,2172500.0,1515.7,1.04167,42.275,True,True,True,False,1,1,1,1,1,1,1,1,1,0,HIST_24h,Few old data,0,low quality data,0,,0,1,03/01/1990,31/12/2021,2763.0,21/03/2015 00:00,31/12/2021 18:00,7370.0,True,True,,,,,,,,,,,,recommended,,,,,,,,,,,,,,,,,,,
628,A106,Guadalope A.A. Santolea,1012,ES,-0.313887,40.777755,540,1236,Guadalope,Ebro,Ebro,C521,1225,3447500.0,2022500.0,1234.3,-0.30833,40.775,True,True,True,True,1,1,1,1,1,1,1,1,1,0,NRT_6h,-,3,,2,,1,1,03/01/1990,19/07/2020,10022.0,29/04/2012 00:00,23/07/2020 12:00,11000.0,True,True,29/04/2012 00:00,23/07/2020 12:00,2750.0,6.0,1095.0,1460.0,0.0,,232.027296,1.0,,recommended,2012-04-29 00:00:00,2020-07-23 12:00:00,11000.0,0.19923929494527925,0.4577085828992627,1.1579106183109442,0.4323716336164455,0.1909776388854122,-0.267877481459895,2.3864067778937907,3.480984033339169,0.4577085828992627,0.49976325594595283,15.791061831094241,15.791061831094423,75.40349662668753,15.791061831094423,0.8994567033018229,0.4323716336164455
629,A111,Segre En Organya,1012,ES,1.343341,42.229438,541.05,2384,Segre,Ebro,Ebro,-,2300,3607500.0,2167500.0,2443.5,1.34167,42.225,True,True,True,True,1,1,1,1,1,1,1,1,1,0,NRT_6h,-,3,,3,,1,1,03/01/1990,31/12/2021,10056.0,29/04/2012 00:00,31/12/2021 18:00,13729.0,True,True,29/04/2012 00:00,31/12/2021 18:00,3432.25,6.0,1095.0,1460.0,0.0,,1209.227008,,,recommended,2012-04-29 00:00:00,2021-12-31 18:00:00,13729.0,0.66661647045234,0.6791562872121346,0.9801621461900599,1.0883761805826022,0.31050054987895315,0.3777845000860425,9.733680566757794,17.94517746474054,0.6791562872121346,-0.4815928038590874,-1.983785380994002,-1.9837853809940054,40.09514481293929,1.9837853809940054,0.8303610360084597,0.9116238194173978
630,A115,N.Ribagorzana (Montañana),1012,ES,0.694587,42.150305,528.99,1068,Noguera Ribagorzana,Ebro,Ebro,-,1125,3552500.0,2162500.0,1084.5,0.69167,42.15833,True,True,True,True,1,1,1,1,1,1,1,0,1,0,NRT_6h,-,3,,3,,1,1,03/01/1990,31/12/2021,5552.0,29/04/2012 00:00,31/12/2021 18:00,13702.0,True,True,29/04/2012 00:00,31/12/2021 18:00,3425.5,6.0,1095.0,1460.0,0.0,,531.82464,1.0,,recommended,2012-04-29 00:00:00,2021-12-31 18:00:00,13702.0,-1.732675783830321,0.5279973806582257,3.6330400427143963,0.4415820558669936,-4.951749802873956,-5.217986830189436,11.716162494813918,13.833947053814997,0.5279973806582257,11.44286777287729,263.30400427144525,263.3040042714396,269.59260220514926,263.3040042714396,2.4396208317838735,0.4415820558669936
631,A120,Ebro En Mendavia,1012,ES,-2.205411,42.41571,325,12010,Ebro,Ebro,Ebro,-,12025,3312500.0,2232500.0,12016.5,-2.20833,42.40833,True,True,True,True,1,1,1,1,1,1,1,1,1,0,NRT_6h,-,3,,3,,1,1,03/01/1990,31/12/2021,9484.0,29/04/2012 00:00,31/12/2021 18:00,11937.0,True,True,29/04/2012 00:00,31/12/2021 18:00,2984.25,6.0,1095.0,1460.0,0.0,,1588.29696,1.0,,recommended,2012-04-29 00:00:00,2021-12-31 18:00:00,11937.0,0.8228795126111788,0.8562919709683217,1.0679844722503808,0.9219117103688327,0.714334666991272,0.27791137059312643,43.42379753572252,70.87162394020024,0.8562919709683217,6.552048517096493,6.798447225038097,6.798447225038081,45.05680858238986,6.798447225038081,0.5344766908001958,0.9219117103688327
632,A123,Gallego En Anzanigo,1012,ES,-0.651457,42.404171,580,1391,Gallego,Ebro,Ebro,C307,1425,3442500.0,2202500.0,1366.1,-0.65833,42.40833,True,True,True,True,1,1,1,1,1,1,1,1,1,0,NRT_6h,-,3,,3,,1,1,03/01/1990,31/12/2021,10217.0,29/04/2012 00:00,31/12/2021 18:00,13706.0,True,True,29/04/2012 00:00,31/12/2021 18:00,3426.5,6.0,1095.0,1460.0,1.0,0.0,1366.063104,1.0,,recommended,2012-04-29 00:00:00,2021-12-31 18:00:00,13706.0,0.6191488485894381,0.7055668942774505,1.108036329037602,0.7839331182401994,0.4575855825100804,0.28226515736517077,11.370935113537062,16.91343176991783,0.7055668942774505,2.683138177484855,10.803632903760157,10.803632903760203,45.7849728985211,10.803632903760203,0.7364878936479006,0.7839331182401994
633,A125,Piedra En Carenas,1012,ES,-1.798645,41.266454,640,1478,Piedra,Ebro,Ebro,C520,1500,3332500.0,2097500.0,1488.8,-1.79167,41.275,True,True,True,True,1,1,1,1,1,1,1,1,1,0,NRT_6h,-,3,,3,,1,1,03/01/1990,31/12/2021,10628.0,29/04/2012 00:00,31/12/2021 18:00,13493.0,True,True,29/04/2012 00:00,31/12/2021 18:00,3373.25,6.0,1095.0,1460.0,1.0,0.0,1488.84544,1.0,,recommended,2012-04-29 00:00:00,2021-12-31 18:00:00,13493.0,-0.47175550566763835,0.03586745200591523,1.0861287410503035,2.10864536183873,-5.085853132511192,-0.3571409797359617,3.438820799822425,7.923132620814631,0.03586745200591523,0.22372379750780308,8.612874105030064,8.61287410503036,132.38703682202785,8.61287410503036,2.466952195019443,-0.10864536183873019
634,A126,Jalon En Ateca,1012,ES,-1.800571,41.322951,610,3619,Jalon,Ebro,Ebro,-,4050,3332500.0,2102500.0,3617.9,-1.80833,41.325,True,True,True,True,1,1,1,1,1,1,1,1,1,0,NRT_6h,-,3,,3,,1,1,03/01/1990,31/12/2021,10055.0,29/04/2012 00:00,31/12/2021 18:00,13680.0,True,True,29/04/2012 00:00,31/12/2021 18:00,3420.0,6.0,1095.0,1460.0,0.0,,2129.033216,1.0,,recommended,2012-04-29 00:00:00,2021-12-31 18:00:00,13680.0,-0.7593288941755867,0.17228151128479738,1.0278270478703966,2.5522067892928866,-5.97892930831324,-0.17587054136646074,3.0581950565221594,7.7555742684441205,0.17228151128479738,0.11277292329372893,2.782704787039643,2.782704787039659,75.46185533667288,2.782704787039659,2.6417663235633193,-0.5522067892928866
635,A161,Ebro En Palazuelos,1012,ES,-3.343153,42.791702,531.55,4530,Ebro,Ebro,Ebro,-,4500,3232500.0,2282500.0,4443.3,-3.34167,42.79167,True,True,True,True,1,1,1,1,1,1,1,1,1,0,NRT_6h,-,3,,3,,1,1,03/01/1990,31/12/2021,5899.0,24/10/1990 00:00,31/12/2021 18:00,12820.0,True,True,24/10/1990 00:00,31/12/2021 18:00,3205.0,6.0,1095.0,1460.0,0.0,,1859.872896,,,recommended,1991-01-03 00:00:00,2021-12-31 18:00:00,12749.0,0.6633123003741568,0.7788756018578438,1.2119728331159916,0.8602497740739172,0.5255720562576502,0.05355759657267689,18.546719280393862,32.42928830322972,0.7788756018578438,5.05442092716638,21.197283311598888,21.197283311599165,77.78142516270537,21.197283311599165,0.6887872993474393,0.8602497740739172
636,A163,Ebro En Asco,1012,ES,0.569761,41.185938,40,82245,Ebro,Ebro,Ebro,-,83350,3527500.0,2057500.0,82579.9,0.575,41.19167,True,True,True,True,1,1,1,1,1,1,1,1,1,0,NRT_6h,Moved downstream of dams  Dam oscillations,3,,3,,1,1,03/01/1990,31/12/2021,10004.0,29/04/2012 00:00,31/12/2021 18:00,13688.0,True,True,29/04/2012 00:00,31/12/2021 18:00,3422.0,6.0,1095.0,1460.0,0.0,,441.912032,1.0,,recommended,2012-04-29 00:00:00,2021-12-31 18:00:00,13688.0,0.5320319909846949,0.7338072278977619,1.3532027635707287,0.8470840971374312,0.18520147175283064,0.09113670386202644,172.41441157380243,255.3387616602281,0.7338072278977619,121.05535216166831,35.320276357072814,35.32027635707286,50.30529056324617,35.32027635707286,0.90266191248284,0.8470840971374312
637,A170,Aragon En Cola De Yesa,1012,ES,-0.998637,42.609706,497,1471,Aragon,Ebro,Ebro,C310,1500,3422500.0,2232500.0,1474.7,-0.99167,42.60833,False,False,True,False,0,0,0,0,0,0,0,1,1,0,HIST_24h,Close to 649 but not consistent  older data,0,,2,,1,0,03/01/1990,01/10/2010,7237.0,,,,True,False,03/01/1990 00:00,01/10/2010 00:00,7237.0,24.0,1095.0,1460.0,0.0,,396.977472,,,,1991-01-03 00:00:00,2010-10-01 00:00:00,6877.0,0.7038038885213466,0.7583414487790233,0.8397263034586945,0.9396210030404695,0.5571911674001004,0.5895145475677801,10.73179855586419,20.68569904922478,0.7583414487790233,-4.047024819398053,-16.027369654130574,-16.027369654130556,42.50097545339079,16.027369654130556,0.665438827090736,0.9396210030404695
638,A176,Matarraña En Nonaspe,1012,ES,0.171587,41.195372,212.01,1260,Matarranya,Ebro,Ebro,-,1150,3497500.0,2067500.0,1050.5,0.175,41.19167,True,True,True,True,1,1,1,1,1,1,1,1,1,0,NRT_6h,Manually swapped to nrt6 data because hist6 data are actually not there.,3,,3,,1,1,03/01/1990,31/12/2021,8426.0,29/04/2012 00:00,31/12/2021 18:00,10202.0,True,True,29/04/2012 00:00,31/12/2021 18:00,2550.5,6.0,1095.0,1460.0,1.0,0.0,1050.53472,1.0,,recommended,2012-04-29 00:00:00,2021-12-31 18:00:00,10202.0,0.2049503513094626,0.4604748897615853,0.8558579133717586,1.5658972151969208,-0.5652303489718622,0.09071898699907532,1.403420240885282,5.035024366787939,0.4604748897615853,-0.23386059496438488,-14.414208662824196,-14.414208662824135,86.50107213159315,14.414208662824135,1.2510916628975766,0.4341027848030792
639,A185,Alhama En Cintruenigo,1012,ES,-1.811868,42.079921,379.28,1120,Alhama,Ebro,Ebro,-,1100,3337500.0,2182500.0,1166.0,-1.80833,42.075,True,True,True,True,1,1,1,1,1,1,1,1,1,0,NRT_6h,-,3,,3,,1,1,03/01/1990,31/12/2021,9275.0,29/04/2012 00:00,31/12/2021 18:00,12188.0,True,True,29/04/2012 00:00,31/12/2021 18:00,3047.0,6.0,1095.0,1460.0,1.0,0.0,1166.03008,,,recommended,2012-04-29 00:00:00,2021-12-31 18:00:00,12188.0,0.15747999080024222,0.4091355197207644,1.5921333867554779,0.8995152542134062,-0.924463494647344,0.03171387032048978,1.5209809260745486,3.9875261639122477,0.4091355197207644,0.6117854907138756,59.21333867554766,59.213338675547796,147.2123155284536,59.213338675547796,1.3872503359694326,0.8995152542134062
640,A193,R.Alcanadre En Ballobar,1012,ES,0.195275,41.6204,150,3390,Alcanadre,Ebro,Ebro,C313,3300,3497500.0,2117500.0,3395.5,0.19167,41.625,True,True,True,True,1,1,1,1,1,1,1,1,1,0,NRT_6h,-,3,,3,,1,1,03/01/1990,31/12/2021,10651.0,29/04/2012 00:00,31/12/2021 18:00,13662.0,True,True,29/04/2012 00:00,31/12/2021 18:00,3415.5,6.0,1095.0,1460.0,0.0,,662.663744,,,recommended,2012-04-29 00:00:00,2021-12-31 18:00:00,13662.0,0.6523255225862381,0.7550027296720058,1.1212104183731744,1.2148532388738047,0.18770022510669848,0.19145799668771402,4.221082902450134,9.38787618276859,0.7550027296720058,1.2216020880011706,12.121041837317598,12.121041837317438,41.88264162441023,12.121041837317438,0.9012767471167173,0.7851467611261953
641,A209,Gallego En Zuera,1012,ES,-0.785065,41.822767,274,3276,Gallego,Ebro,Ebro,-,3250,3427500.0,2147500.0,3565.4,-0.79167,41.825,True,True,True,False,1,1,1,1,1,1,1,1,1,0,NRT_6h,Close to 619,2,Close to 619,3,,1,1,04/07/2006,31/12/2021,3453.0,04/07/2006 00:00,31/12/2021 18:00,13759.0,True,True,04/07/2006 00:00,31/12/2021 18:00,3439.75,6.0,1095.0,1460.0,0.0,,1337.033088,,,recommended,2006-07-04 00:00:00,2021-12-31 18:00:00,13759.0,0.19791691702701442,0.6970608870760472,1.6221476322953636,0.594417099125751,0.15329622680217636,-0.445348031184821,14.570724960779422,20.372646272490748,0.6970608870760472,11.315727872769362,62.21476322953492,62.21476322953636,80.11099362852599,62.21476322953636,0.9201650793188436,0.594417099125751
642,A216,Huerva En Zaragoza,1012,ES,-0.897818,41.637059,214.07,1017,Huerva,Ebro,Ebro,-,1100,3407500.0,2122500.0,1061.6,-0.89167,41.64167,True,True,True,True,1,1,1,1,1,1,1,1,1,0,NRT_6h,Moved West to avoid conflict in inflow point,3,,3,,1,1,03/01/1990,31/12/2021,9999.0,29/04/2012 00:00,31/12/2021 18:00,12605.0,True,True,29/04/2012 00:00,31/12/2021 18:00,3151.25,6.0,1095.0,1460.0,1.0,0.0,1061.643584,,,recommended,2012-04-29 00:00:00,2021-12-31 18:00:00,12605.0,0.24389310539045717,0.333014116951879,1.3435945088655388,0.9063502196048823,-0.76253979175875,-2.285034302881612,2.571867285650854,3.5693401839883245,0.333014116951879,0.8094739817084053,34.3594508865541,34.35945088655389,109.16712542329535,34.35945088655389,1.3276067910939398,0.9063502196048823
643,A260,Arba En Tauste,1012,ES,-1.280026,41.912961,243.31,2193,Arba,Ebro,Ebro,-,2175,3392500.0,2167500.0,2182.0,-1.275,41.90833,True,True,True,True,1,1,1,1,1,1,1,1,1,0,NRT_6h,-,3,,3,,1,1,21/06/1990,29/12/2021,9273.0,07/02/2005 00:00,28/12/2021 12:00,13520.0,True,True,07/02/2005 00:00,28/12/2021 12:00,3380.0,6.0,1095.0,1460.0,0.0,,1081.724288,,,recommended,2005-02-07 00:00:00,2021-12-28 12:00:00,13520.0,0.5959521951635338,0.6552063039104548,0.9970810344394793,1.2106262456820942,0.12470738890719579,-0.09943230547400428,4.306692746906594,7.1861522151190735,0.6552063039104548,-0.023764282054194476,-0.2918965560520781,-0.29189655605207104,52.89908518715932,0.29189655605207104,0.9355707408276568,0.7893737543179058
644,A263,Ebro En Gelsa,1012,ES,-0.476091,41.398134,150,47133,Ebro,Ebro,Ebro,-,47550,3442500.0,2097500.0,47059.6,-0.475,41.39167,True,False,True,False,1,1,1,1,1,1,1,0,0,0,-,No discharge data available for calibration period,-,,-,,0,0,28/11/2021,31/12/2021,33.0,28/11/2021 00:00,31/12/2021 18:00,108.0,False,False,,,,,,,,,,,,,,,,,,,,,,,,,,,,,,,
645,A266,Jalon En Calatayud,1012,ES,-1.633044,41.35486,520,6841,Jalon,Ebro,Ebro,-,7575,3347500.0,2102500.0,6833.1,-1.625,41.35833,True,True,True,False,1,1,1,1,1,1,1,1,1,0,NRT_6h,Close to 646,2,Close to 646,3,,1,1,20/05/1994,31/12/2021,8546.0,29/04/2012 00:00,31/12/2021 18:00,13736.0,True,True,29/04/2012 00:00,31/12/2021 18:00,3434.0,6.0,1095.0,1460.0,0.0,,330.65408,,,recommended,2012-04-29 00:00:00,2021-12-31 18:00:00,13736.0,-0.07113225132679135,0.41791923054112584,1.2069238216780829,1.8750364619149893,-3.335034710444968,-0.0019449658625827482,2.9868086093686443,8.484582992732228,0.41791923054112584,1.3221774804345505,20.692382167808105,20.692382167808287,46.744242828007486,20.692382167808287,2.0820746169253637,0.1249635380850107
646,A278,Jalon En Chodes,1012,ES,-1.461174,41.494452,390,7561,Jalon,Ebro,Ebro,-,8025,3357500.0,2117500.0,7547.6,-1.45833,41.49167,True,True,True,True,1,1,1,1,1,1,1,1,1,0,NRT_6h,-,3,,3,,1,1,24/03/2000,31/12/2021,6459.0,29/04/2012 00:00,31/12/2021 18:00,13727.0,True,True,29/04/2012 00:00,31/12/2021 18:00,3431.75,6.0,1095.0,1460.0,0.0,,714.517056,,,recommended,2012-04-29 00:00:00,2021-12-31 18:00:00,13727.0,-0.10502683338873386,0.43958304389462277,1.1100799711529334,1.945991298992589,-2.805986060044365,0.047306568499183244,3.100430374388478,8.318836031956684,0.43958304389462277,0.8385909447544004,11.007997115293428,11.007997115293355,40.69866104675384,11.007997115293355,1.9508936567748643,0.054008701007411064
647,A280,Ebro En Logroño,1012,ES,-2.44567,42.470961,359,1037,Ebro,Ebro,Ebro,-,10525,3297500.0,2237500.0,10428.2,-2.44167,42.475,True,True,True,False,1,1,1,1,1,1,1,0,0,0,NRT_6h,Moved on Ebro main stream  close to 631,2,close to 631,3,,1,1,29/04/2012,31/12/2021,2392.0,29/04/2012 00:00,31/12/2021 18:00,9700.0,True,True,29/04/2012 00:00,31/12/2021 18:00,2425.0,6.0,1095.0,1460.0,0.0,,1971.210112,1.0,,recommended,2012-04-29 00:00:00,2021-12-31 18:00:00,9700.0,0.8469403884269787,0.8612093956347828,1.043179312396284,0.9520421037178859,0.7232721878544273,0.13751113226406197,37.89341695844739,61.467887967856406,0.8612093956347828,3.6968119883183665,4.317931239628424,4.317931239628396,44.26007310573959,4.317931239628396,0.5260492487833919,0.9520421037178859
648,A281,Tiron En Haro,1012,ES,-2.877185,42.578981,458,1239,Tiron,Ebro,Ebro,C314,1225,3262500.0,2252500.0,1300.2,-2.875,42.575,True,True,True,True,1,1,1,1,1,1,1,1,1,0,NRT_6h,-,3,,3,,1,1,30/03/2004,31/12/2021,4739.0,29/04/2012 00:00,31/12/2021 18:00,13704.0,True,True,29/04/2012 00:00,31/12/2021 18:00,3426.0,6.0,1095.0,1460.0,1.0,0.0,1300.229248,,,recommended,2012-04-29 00:00:00,2021-12-31 18:00:00,13704.0,0.7581110940775864,0.7606220986865986,1.012757800116035,0.9676626886192892,0.5302915828831547,0.5533836809386699,2.754797048469034,5.164075213791385,0.7606220986865986,0.08398933775969702,1.2757800116034448,1.2757800116034996,41.84477582757427,1.2757800116034996,0.6853527683732371,0.9676626886192892
649,A282,Aragon En Martes,1012,ES,-0.88283,42.591487,554,1083,Aragon,Ebro,Ebro,-,1100,3427500.0,2227500.0,1077.7,-0.875,42.59167,True,True,True,True,1,1,1,1,1,1,1,1,1,0,NRT_6h,-,3,,3,,1,1,04/11/2004,31/12/2021,4257.0,29/04/2012 00:00,31/12/2021 18:00,13674.0,True,True,29/04/2012 00:00,31/12/2021 18:00,3418.5,6.0,1095.0,1460.0,1.0,0.0,1077.725184,,,recommended,2012-04-29 00:00:00,2021-12-31 18:00:00,13674.0,0.701772535423739,0.7300676032754374,1.1100503569124134,0.9370314303039303,0.4315650154431242,-0.3052311159897805,10.99182378220635,21.035217467290266,0.7300676032754374,2.0275775966478324,11.005035691241325,11.005035691241345,59.66006590081003,11.005035691241345,0.7539462743172664,0.9370314303039303
650,A284,Ebro En Tudela,1012,ES,-1.60033,42.067089,252,2534,Ebro,Ebro,Ebro,-,26500,3362500.0,2177500.0,25592.6,-1.59167,42.075,True,False,True,False,1,1,1,1,1,1,1,0,0,0,-,No discharge data available for calibration period,-,,-,,0,0,18/06/2021,31/12/2021,114.0,11/08/2021 12:00,31/12/2021 18:00,451.0,False,False,,,,,,,,,,,,,,,,,,,,,,,,,,,,,,,
651,A285,Ebro En Novillas,1012,ES,-1.386049,41.929713,239,2721,Ebro,Ebro,Ebro,-,27425,3377500.0,2162500.0,26669.4,-1.375,41.925,False,False,True,False,1,0,1,0,1,1,1,0,0,0,-,No discharge data available for calibration period,-,,-,,0,0,,,,,,,False,False,,,,,,,,,,,,,,,,,,,,,,,,,,,,,,,
652,A286,Ebro En Alagon,1012,ES,-1.136851,41.791087,211,3017,Ebro,Ebro,Ebro,-,30400,3397500.0,2147500.0,30135.9,-1.14167,41.79167,False,False,True,False,1,0,1,0,1,1,1,0,0,0,-,No discharge data available for calibration period,-,,-,,0,0,,,,,,,False,False,,,,,,,,,,,,,,,,,,,,,,,,,,,,,,,
653,A290,Arba En Ejea,1012,ES,-1.150894,42.117427,318,1046,Arba,Ebro,Ebro,-,1075,3402500.0,2182500.0,1100.3,-1.15833,42.125,True,True,True,False,1,1,1,1,1,1,1,1,1,0,NRT_6h,Close to 643 lower quality,2,close to 643,3,,1,1,01/12/2005,31/12/2021,3625.0,22/07/2013 00:00,31/12/2021 18:00,11181.0,True,True,22/07/2013 00:00,31/12/2021 18:00,2795.25,6.0,1095.0,1460.0,1.0,0.0,1100.314752,,,recommended,2013-07-22 00:00:00,2021-12-31 18:00:00,11181.0,-2.3685381366433043,0.5946379076050726,4.312320058324872,0.5403625523434047,-6.291014318942554,-1.6555690560036718,4.107909996584899,5.714605200184997,0.5946379076050726,4.033552118918737,331.2320058324627,331.2320058324871,337.33821401886127,331.2320058324871,2.700187830307894,0.5403625523434047
654,A293,Cinca Pte. Las Pilas,1012,ES,0.213411,42.06669,336,3743,Gallego,Ebro,Ebro,-,3825,3512500.0,2162500.0,3784.8,0.20833,42.05833,False,False,True,False,1,0,1,0,1,1,1,0,0,0,-,No discharge data available for calibration period,-,,-,,0,0,18/06/2021,31/12/2021,101.0,18/06/2021 00:00,31/12/2021 18:00,348.0,False,False,,,,,,,,,,,,,,,,,,,,,,,,,,,,,,,
655,A307,Jalon En Cetina,1012,ES,-1.956817,41.298495,673,1905,Noguera Pallaresa,Ebro,Ebro,C286,1975,3322500.0,2102500.0,1909.5,-1.95833,41.29167,True,False,True,False,1,1,1,1,1,1,1,1,1,0,-,Not enough discarge data available for calibration period,-,,-,,0,0,02/10/2005,31/12/2021,405.0,12/09/2006 00:00,31/12/2021 18:00,462.0,False,False,,,,,,,,,,,,,,,,,,,,,,,,,,,,,,,
656,442535,Adony,1017,HU,18.8816,47.112,-,186732,Danube,Danube,Danube,-,186325,4992500.0,2707500.0,187034.9,18.89167,47.10833,False,False,False,False,1,0,1,0,1,1,0,1,0,0,-,No discharge data available for calibration period,-,,-,,0,0,,,,,,,False,False,,,,,,,,,,,,,,,,,,,,,,,,,,,,,,,
657,444507,Agerdomajor,1017,HU,22.4201,47.763,-,1974,Kraszna,Danube,Danube,C758,200,5247500.0,2812500.0,1963.6,22.425,47.75833,True,True,True,False,1,1,1,1,1,1,1,1,1,0,HIST_24h,use after 01-1992  possible worng location or wrong area from provider,1,mapped on main river,3,,1,1,02/01/1991,31/12/2021,4259.0,01/01/2015 00:00,01/01/2020 00:00,7224.0,True,True,01/01/2015 00:00,01/01/2020 00:00,1806.0,6.0,1095.0,1460.0,1.0,0.0,1963.6288,1.0,,recommended,2015-01-01 00:00:00,2020-01-01 00:00:00,7224.0,-0.41141173527548536,0.43221926959617185,0.06668699769428921,1.893663789342811,-0.204620759154573,-16.59983615225432,3.4099741988163537,6.799234202164193,0.43221926959617185,-3.3808369745969196,-93.3313002305705,-93.33130023057109,94.13566170731212,93.33130023057109,1.097552166939948,0.10633621065718901
658,444553,Ant,1017,HU,21.451856,46.666487,-,4300,Crisul Negru,Danube,Danube,-,325,5192500.0,2682500.0,4194.7,21.45833,46.675,False,False,True,False,1,0,1,0,1,1,1,1,0,0,-,No discharge data available for calibration period,-,,-,,0,0,,,,,,,False,False,,,,,,,,,,,,,,,,,,,,,,,,,,,,,,,
659,446199,Barcs,1017,HU,17.4422,45.9514,-,33977,Drava,Danube,Danube,-,34625,4897500.0,2562500.0,34044.3,17.44167,45.95833,True,True,True,True,1,1,1,1,1,1,1,1,1,0,NRT_24h,-,3,close to 860,3,close,0,1,01/01/2015,31/12/2021,2443.0,01/01/2015 00:00,01/01/2020 00:00,7232.0,True,True,,,,,,,,,,,,recommended,,,,,,,,,,,,,,,,,,,
660,444361,Bekes,1017,HU,21.1419,46.7856,-,9011,Koros,Danube,Danube,-,10250,5167500.0,2697500.0,10758.9,21.0936,46.8596,True,True,True,True,1,1,1,1,1,1,1,1,1,0,NRT_24h,-,3,,3,,1,1,02/01/2015,31/12/2021,2442.0,01/01/2017 06:00,01/01/2020 00:00,3643.0,True,False,02/01/2015 00:00,31/12/2021 00:00,2442.0,24.0,1095.0,1460.0,0.0,,3112.60416,,,recommended,2015-01-02 00:00:00,2022-01-01 00:00:00,2443.0,0.7563546532438965,0.8057470906957691,1.1469789238272712,0.9948952793101487,0.5215531099756553,0.542938129100833,19.27299791392822,34.16237054379062,0.8057470906957691,6.088626476219945,14.697892382727133,14.697892382727117,46.52485258174474,14.697892382727117,0.6916985543026266,0.9948952793101487
661,444571,Bekessztandras duzzaszto a.,1017,HU,20.4976,46.8909,-,26647,Harmas-Koros,Danube,Danube,-,26275,5117500.0,2697500.0,27154.3,20.49167,46.875,True,True,True,False,1,1,1,1,1,1,1,1,0,0,NRT_24h,Low quality data,0,Low quality data,0,,0,0,07/09/2009,26/06/2021,1650.0,,,,True,False,,,,,,,,,,,,,,,,,,,,,,,,,,,,,,,
662,444570,Bekessztandras duzzaszto f.,1017,HU,20.4985,46.8918,-,26647,Harmas-Koros,Danube,Danube,-,26300,5112500.0,2697500.0,27156.7,20.49167,46.89167,False,False,True,False,1,0,1,0,1,1,1,1,0,0,-,No discharge data available for calibration period,-,,-,,0,0,,,,,,,False,False,,,,,,,,,,,,,,,,,,,,,,,,,,,,,,,
663,444382,Berettyoujfalu,1017,HU,21.5394,47.2077,-,3712,Barcau,Danube,Danube,-,3575,5192500.0,2747500.0,3746.2,21.54167,47.20833,True,True,True,False,1,1,1,1,1,1,1,1,1,0,NRT_24h,wrong location  not consistent with 693,0,,3,,1,0,02/01/2015,31/12/2021,2443.0,01/01/2017 00:00,01/01/2020 00:00,4369.0,True,False,02/01/2015 00:00,31/12/2021 00:00,2443.0,24.0,1095.0,1460.0,0.0,,294.837184,,,,2015-01-02 00:00:00,2022-01-01 00:00:00,2444.0,0.32195816236451325,0.6172455520648782,0.9781444287152856,1.559251374762554,-0.44379417888356576,-2.2868414732787503,4.1257446177473875,7.2297678607607825,0.6172455520648782,-0.12819180021715273,-2.1855571284714563,-2.185557128471441,70.3403068238059,2.185557128471441,1.2015798678754426,0.44074862523744596
664,442027,Budapest,1017,HU,19.0483,47.4949,-,184893,Danube,Danube,Danube,-,184600,5002500.0,2752500.0,184823.8,19.04167,47.49167,True,True,True,True,1,1,1,1,1,1,1,1,1,0,NRT_24h,-,3,,3,,1,1,01/01/2015,31/12/2021,2442.0,01/01/2015 00:00,01/01/2020 00:00,5812.0,True,True,01/01/2015 00:00,01/01/2020 00:00,1453.0,6.0,1095.0,1280.0,0.0,,4898.847744,,,recommended,2015-01-01 00:00:00,2020-01-01 00:00:00,5812.0,0.7706277252148962,0.8240501158667717,1.1250862620290913,1.0775029403647771,0.4107469135119787,0.5091370499607308,429.5939798465904,579.8228249340639,0.8240501158667717,259.0137238362831,12.508626202909138,12.508626202909145,20.746508846448826,12.508626202909145,0.7676282215291607,0.9224970596352229
665,444244,Csenger,1017,HU,22.6924,47.841,-,15283,Somea,Danube,Danube,-,14975,5267500.0,2827500.0,15325.5,22.69167,47.84167,True,True,True,False,1,1,1,1,1,1,1,1,1,0,HIST_24h,two yrs of data only,0,,3,,1,1,24/08/1994,31/12/2021,2523.0,01/01/2015 00:00,01/01/2020 00:00,6071.0,True,True,01/01/2015 00:00,01/01/2020 00:00,1517.75,6.0,1095.0,1460.0,0.0,,10978.9911,1.0,,recommended,2015-01-01 00:00:00,2020-01-01 00:00:00,6071.0,0.6515425794578764,0.8436793480150081,1.3109402742957472,1.0173946404028056,0.36849165992837374,0.4894808374403785,45.79304183912385,74.25581730839633,0.8436793480150081,30.009235187947258,31.09402742957474,31.094027429574727,47.44839680556948,31.094027429574727,0.7946749902140047,0.9826053595971944
666,444556,Doboz,1017,HU,21.2221,46.7262,-,8922,Koros,Danube,Danube,-,8100,5177500.0,2687500.0,9091.9,21.225,46.725,False,False,True,False,1,0,1,0,1,1,1,1,0,0,-,No discharge data available for calibration period,-,,-,,0,0,,,,,,,False,False,,,,,,,,,,,,,,,,,,,,,,,,,,,,,,,
667,442540,Dombori-puszta,1017,HU,18.8957,46.4227,-,189538,Danube,Danube,Danube,-,188375,5002500.0,2632500.0,188655.4,18.89167,46.425,True,True,True,True,1,1,1,1,1,1,1,1,1,0,NRT_24h,-,3,,3,,1,1,01/01/2015,31/12/2021,2444.0,01/01/2015 00:00,01/01/2020 00:00,7042.0,True,True,01/01/2015 00:00,01/01/2020 00:00,1760.5,6.0,1095.0,1460.0,0.0,,3831.6928,,,recommended,2015-01-01 00:00:00,2020-01-01 00:00:00,7042.0,0.7840618482160748,0.8172745639224674,1.0949517734991234,1.064998931648945,0.47899824807881775,0.5490990547377709,409.6810067626079,552.611648146773,0.8172745639224674,198.53138068914137,9.495177349912302,9.495177349912344,19.59384860266753,9.495177349912344,0.7218045108761658,0.935001068351055
668,446503,Dravaszabolcs,1017,HU,18.2017,45.7841,-,35764,Drava,Danube,Danube,-,37750,4957500.0,2552500.0,37906.1,18.20833,45.775,True,True,True,False,1,1,1,1,1,1,1,1,1,0,NRT_24h,close to 863,2,use 864,3,close,0,1,01/01/2015,31/12/2021,2433.0,01/01/2015 00:00,01/01/2020 00:00,7092.0,True,True,,,,,,,,,,,,recommended,,,,,,,,,,,,,,,,,,,
669,442029,Dunafoldvar,1017,HU,18.9304,46.8094,-,188700,Danube,Danube,Danube,-,187775,5002500.0,2672500.0,187901.0,18.94167,46.80833,False,False,False,False,1,0,1,0,1,1,0,1,0,0,-,No discharge data available for calibration period,-,,-,,0,0,,,,,,,False,False,,,,,,,,,,,,,,,,,,,,,,,,,,,,,,,
670,444282,Felsoberecki,1017,HU,21.692,48.3566,-,12886,Bodrog,Danube,Danube,-,11325,5182500.0,2872500.0,12852.6,21.69167,48.35833,True,True,True,True,1,1,1,1,1,1,1,1,1,0,NRT_24h,-,3,,3,,1,1,01/01/2015,31/12/2021,2430.0,01/01/2015 00:00,01/01/2020 00:00,6087.0,True,True,01/01/2015 00:00,01/01/2020 00:00,1521.75,6.0,1095.0,1460.0,0.0,,760.583616,,,recommended,2015-01-01 00:00:00,2020-01-01 00:00:00,6087.0,0.709405843248991,0.7195601318564284,1.0248240209446466,1.071987584190511,0.3734397161842339,0.5610606177935338,43.04973875940746,71.14580328525403,0.7195601318564284,2.303632113648716,2.482402094464662,2.4824020944646685,46.39055039619312,2.4824020944646685,0.7915556100589336,0.9280124158094889
671,444371,Gyoma,1017,HU,20.8443,46.9449,-,19715,Harmas-Koros,Danube,Danube,-,19800,5142500.0,2707500.0,14980.2,20.84167,46.94167,True,True,True,True,1,1,1,1,1,1,1,1,1,0,NRT_24h,-,3,,3,,1,1,02/01/2015,31/12/2021,2442.0,01/01/2017 06:00,01/01/2020 00:00,3644.0,True,False,02/01/2015 00:00,31/12/2021 00:00,2442.0,24.0,1095.0,1460.0,0.0,,444.320992,,,recommended,2015-01-02 00:00:00,2022-01-01 00:00:00,2443.0,0.7387131714312289,0.8010043288511439,1.161524450624979,1.0508072976829252,0.43762917517386735,0.5604322685470571,31.332264518778725,52.11837079659569,0.8010043288511439,11.623188344501322,16.152445062497897,16.15244506249792,43.5416398945862,16.15244506249792,0.749913878272788,0.9491927023170748
672,444552,Gyula,1017,HU,21.2968,46.6648,-,4251,Crisul Alb,Danube,Danube,C037,4025,5187500.0,2677500.0,4748.5,21.29167,46.65833,True,True,True,False,1,1,1,1,1,1,1,1,1,0,HIST_24h,Moved upstream  Same as 673,2,close to 673,3,close,0,1,02/01/1991,31/12/2021,5294.0,01/01/2015 06:00,01/01/2020 00:00,6529.0,True,True,,,,,,,,,,,,recommended,,,,,,,,,,,,,,,,,,,
673,444551,Gyulavari duzzaszto f.,1017,HU,21.3105,46.6425,-,4250,Crisul Alb,Danube,Danube,-,4400,5182500.0,2682500.0,4743.7,21.30833,46.64167,True,True,True,True,1,1,1,1,1,1,1,1,0,0,NRT_24h,-,3,use 672,2,close,0,1,08/10/2009,09/03/2019,2507.0,,,,True,False,,,,,,,,,,,,recommended,,,,,,,,,,,,,,,,,,,
674,444543,Hatvan,1017,HU,19.6826,47.662,-,1222,Zagyva,Danube,Danube,-,1250,5047500.0,2777500.0,1221.4,19.69167,47.65833,True,True,True,True,1,1,1,1,1,1,1,1,1,0,NRT_24h,-,3,,3,,1,1,02/01/2015,31/12/2021,2433.0,01/01/2015 06:00,31/12/2019 12:00,5412.0,True,False,02/01/2015 00:00,31/12/2021 00:00,2433.0,24.0,1095.0,1460.0,1.0,0.0,1221.419648,,,recommended,2015-01-02 00:00:00,2022-01-01 00:00:00,2434.0,0.29496090423914456,0.4943886650105977,1.0427827248065342,1.4894966219900272,-0.8779727158005761,0.17376981098876942,1.0378994034105964,2.8567466508462562,0.4943886650105977,0.07417916062925213,4.278272480653438,4.278272480653423,59.86069965783807,4.278272480653423,1.3703914461935969,0.5105033780099728
675,444322,Hidasnemeti,1017,HU,21.2285,48.4975,-,4515,Hornad,Danube,Danube,-,4450,5147500.0,2882500.0,4496.7,21.225,48.49167,True,True,True,True,1,1,1,1,1,1,1,1,1,0,NRT_24h,-,3,,3,,1,1,01/01/2015,31/12/2021,2129.0,01/01/2015 00:00,01/01/2020 00:00,5602.0,True,False,01/01/2015 00:00,31/12/2021 00:00,2129.0,24.0,1095.0,1460.0,0.0,,248.539168,,,recommended,2015-01-01 00:00:00,2022-01-01 00:00:00,2130.0,0.45273195062360916,0.6997285716680814,1.4557685437130554,1.040179867563619,-0.4197643538134537,-0.31339554582425455,19.048108146451614,29.0630901585197,0.6997285716680814,12.095716094246027,45.57685437130553,45.576854371305544,71.77358035484059,45.576854371305544,1.1915386497354807,0.9598201324363811
676,442626,Ipolytarnoc,1017,HU,19.606,48.2362,-,1123,Dobroda,Danube,Danube,-,1325,5032500.0,2837500.0,1205.6,19.60833,48.24167,True,True,True,False,1,1,1,1,1,1,1,1,1,0,NRT_24h,Use 690 seems to have better data,0,,3,,1,0,01/01/2015,31/12/2021,2443.0,01/01/2015 00:00,01/01/2020 00:00,5574.0,True,False,01/01/2015 00:00,31/12/2021 00:00,2443.0,24.0,1095.0,1460.0,0.0,,526.320864,1.0,,,2015-01-01 00:00:00,2022-01-01 00:00:00,2444.0,0.4569075728876335,0.6209032167747064,1.1893872390090876,1.3396578970604842,-0.5808489505681449,0.2684266949872547,2.514072282618422,6.648014010472081,0.6209032167747064,0.7602582866201129,18.938723900908798,18.938723900908766,62.627822235404764,18.938723900908766,1.2573181580523465,0.6603421029395158
677,444548,Jasztelek,1017,HU,19.9938,47.4838,-,4207,Zagyva,Danube,Danube,C031,4200,5072500.0,2752500.0,3973.7,19.99167,47.49167,True,True,True,True,1,1,1,1,1,1,1,1,1,0,HIST_24h,-,3,,3,,1,1,02/01/1991,31/12/2021,5339.0,01/01/2015 12:00,01/01/2020 00:00,6868.0,True,True,01/01/2015 12:00,01/01/2020 00:00,1717.0,6.0,1095.0,1460.0,0.0,,2752.323072,1.0,,recommended,2015-01-01 12:00:00,2020-01-01 00:00:00,6868.0,0.04101159652635533,0.6010912514603577,1.80917353177588,1.3252210998825498,-3.2181453050063062,-0.7439171437816106,5.548685118947718,13.508518395884352,0.6010912514603577,3.9032442831041627,80.91735317758746,80.91735317758798,115.02864819007699,80.91735317758798,2.05381238310765,0.6747789001174502
678,444537,Kiskore also,1017,HU,20.5165,47.4927,-,65670,Tisza,Danube,Danube,-,65000,5107500.0,2762500.0,65452.4,20.54167,47.50833,True,True,True,True,1,1,1,1,1,1,1,1,1,0,NRT_24h,Moved upstream of dam,3,,3,,1,1,01/01/2015,31/12/2021,2442.0,01/01/2015 00:00,01/01/2020 00:00,6062.0,True,True,01/01/2015 00:00,01/01/2020 00:00,1515.5,6.0,1095.0,1460.0,0.0,,2973.65632,,1.0,recommended,2015-01-01 00:00:00,2020-01-01 00:00:00,6062.0,0.6913407914247928,0.8195766916472068,1.1965136337137385,0.8447571946725749,0.5788486712531964,0.47284594876653396,161.81397555528176,213.91661930768282,0.8195766916472068,78.21651862503087,19.65136337137393,19.65136337137385,40.65465055339126,19.65136337137385,0.6489617313423051,0.8447571946725749
679,444536,Kiskore felso,1017,HU,20.5169,47.4941,-,65670,Tisza,Danube,Danube,-,64875,5112500.0,2767500.0,66051.8,20.525,47.50833,False,False,True,False,1,0,1,0,1,1,1,1,0,0,-,No discharge data available for calibration period,-,,-,,0,0,,,,,,,False,False,,,,,,,,,,,,,,,,,,,,,,,,,,,,,,,
680,444680,Kisorveto,1017,HU,20.63,46.94,-,-,Koros,Danube,Danube,-,25850,5127500.0,2707500.0,25920.3,20.625,46.94167,False,False,False,False,0,0,0,0,0,0,0,0,0,0,-,No discharge data available for calibration period,-,,-,,0,0,,,,,,,False,False,,,,,,,,,,,,,,,,,,,,,,,,,,,,,,,
681,442522,Komarom,1017,HU,18.1122,47.7507,-,-,Danube,Danube,Danube,-,150750,4922500.0,2772500.0,151481.2,18.10833,47.75833,False,False,False,False,0,0,0,0,0,0,0,0,0,0,-,No discharge data available for calibration period,-,,-,,0,0,,,,,,,False,False,,,,,,,,,,,,,,,,,,,,,,,,,,,,,,,
682,444333,Korosszakal,1017,HU,21.6081,47.0116,-,2489,Crișul Repede,Danube,Danube,-,2550,5202500.0,2727500.0,2836.3,21.60833,47.00833,True,True,True,True,1,1,1,1,1,1,1,1,1,0,NRT_24h,-,3,,3,,1,1,02/01/2015,31/12/2021,2270.0,01/01/2015 06:00,01/01/2020 00:00,6070.0,True,True,01/01/2015 06:00,01/01/2020 00:00,1517.5,6.0,1095.0,1460.0,0.0,,662.463296,,,recommended,2015-01-01 06:00:00,2020-01-01 00:00:00,6070.0,0.7251096939318016,0.7618863512631994,1.1201627698614498,0.9334606928594865,0.4825927671824787,0.3918669358803798,9.29838582389901,13.173876733581343,0.7618863512631994,2.4136921545037415,12.016276986144991,12.016276986144971,46.290898934867116,12.016276986144971,0.7193102479580837,0.9334606928594865
683,444560,Korostarcsa,1017,HU,21.0327,46.8838,-,10384,Koros,Danube,Danube,-,10425,5157500.0,2702500.0,10864.8,21.025,46.89167,False,False,True,False,1,0,1,0,1,1,1,1,0,0,-,No discharge data available for calibration period,-,,-,,0,0,,,,,,,False,False,,,,,,,,,,,,,,,,,,,,,,,,,,,,,,,
684,444372,Kunszentmarton,1017,HU,20.2725,46.8481,-,27354,Harmas-Koros,Danube,Danube,-,27000,5102500.0,2692500.0,28339.4,20.275,46.84167,True,True,True,True,1,1,1,1,1,1,1,1,1,0,NRT_24h,-,3,,3,,1,1,02/01/2015,31/12/2021,2442.0,01/01/2017 00:00,01/01/2020 00:00,3637.0,True,False,02/01/2015 00:00,31/12/2021 00:00,2442.0,24.0,1095.0,1460.0,0.0,,7085.400576,,,recommended,2015-01-02 00:00:00,2022-01-01 00:00:00,2443.0,0.7580315447883791,0.8028205111643745,1.1256337549632045,1.0623309081745573,0.46659170746602374,0.5671968568913781,33.94987019745492,57.13794955677639,0.8028205111643745,11.992947624866593,12.563375496320461,12.563375496320454,35.56464854875154,12.563375496320454,0.7303480625934291,0.9376690918254427
685,446501,Letenye,1017,HU,16.6944,46.4202,-,13033,Mur,Danube,Danube,-,13325,4837500.0,2612500.0,13034.6,16.69167,46.425,True,True,True,True,1,1,1,1,1,1,1,1,1,0,NRT_24h,-,3,use 1697,3,close,0,1,02/01/2015,31/12/2021,2443.0,01/01/2015 06:00,01/01/2020 00:00,7030.0,True,True,,,,,,,,,,,,recommended,,,,,,,,,,,,,,,,,,,
686,444396,Mako,1017,HU,20.4556,46.2026,-,30149,Mures,Danube,Danube,-,30075,5127500.0,2622500.0,29496.8,20.45833,46.20833,True,True,True,False,1,1,1,1,1,1,1,1,1,0,HIST_24h,two yrs data,0,,3,,1,1,01/01/1991,31/12/2021,4253.0,01/01/2015 06:00,01/01/2020 00:00,6850.0,True,True,01/01/2015 06:00,01/01/2020 00:00,1712.5,6.0,1095.0,1460.0,0.0,,2752.851968,,,recommended,2015-01-01 06:00:00,2020-01-01 00:00:00,6850.0,0.1915012049735758,0.715034950696529,1.7278550681440836,1.2066209621786268,-2.711849835542658,-0.4064961383950223,102.97510943394424,165.11159165533059,0.715034950696529,99.45251027634858,72.78550681440876,72.78550681440836,75.36356305730457,72.78550681440836,1.9266161619644568,0.7933790378213732
687,444559,Mezobereny,1017,HU,21.1033,46.8445,-,10127,Koros,Danube,Danube,-,75,5167500.0,2702500.0,9812.2,21.09167,46.84167,False,False,False,False,1,0,1,0,1,1,0,1,0,0,-,No discharge data available for calibration period,-,mapped on Koros river,-,,0,0,,,,,,,False,False,,,,,,,,,,,,,,,,,,,,,,,,,,,,,,,
688,442032,Mohacs,1017,HU,18.6946,45.9928,-,209064,Danube,Danube,Danube,C757,208825,4997500.0,2577500.0,209206.4,18.69167,45.99167,True,True,True,False,1,1,1,1,1,1,1,1,1,0,HIST_24h,almost same location as 228 but shorter period  use 228,2,using 288 because much longer time series and very similar data,3,close,0,1,01/01/2015,31/12/2021,2443.0,01/01/2015 00:00,01/01/2020 00:00,6877.0,True,True,,,,,,,,,,,,recommended,,,,,,,,,,,,,,,,,,,
689,442527,Nagymaros,1017,HU,18.9611,47.7886,-,183534,Danube,Danube,Danube,-,183175,4992500.0,2782500.0,183443.6,18.95833,47.79167,True,True,True,False,1,1,1,1,1,1,1,1,1,0,HIST_24h,Use 705,0,same data as 705,0,,0,0,01/01/1991,31/12/2021,5677.0,01/01/2015 06:00,01/01/2020 00:00,5686.0,True,True,,,,,,,,,,,,,,,,,,,,,,,,,,,,,,,
690,442525,Nogradszakal,1017,HU,19.5296,48.191,-,1850,Ipel,Danube,Danube,-,1875,5027500.0,2832500.0,1842.7,19.525,48.19167,True,True,True,True,1,1,1,1,1,1,1,1,1,0,NRT_24h,-,3,,3,,1,1,01/01/2015,31/12/2021,2441.0,01/01/2015 00:00,01/01/2020 00:00,4571.0,True,False,01/01/2015 00:00,31/12/2021 00:00,2441.0,24.0,1095.0,1460.0,0.0,,637.108224,,,recommended,2015-01-01 00:00:00,2022-01-01 00:00:00,2442.0,0.6756061157910996,0.7284816602430727,1.0243521699657367,1.1758299039007276,0.30385087466201555,0.43707088258768656,3.3667080687158313,7.6545984293689004,0.7284816602430727,0.15228980155330257,2.435216996573638,2.4352169965736707,53.835940606757084,2.4352169965736707,0.8343555149562973,0.8241700960992724
691,446198,Ortilos,1017,HU,16.8867,46.2979,-,30969,Drava,Danube,Danube,-,31275,4852500.0,2602500.0,31002.5,16.89167,46.29167,True,True,True,True,1,1,1,1,1,1,1,1,1,0,NRT_24h,-,3,use 858,3,close,0,1,01/01/2015,31/12/2021,2444.0,01/01/2015 00:00,01/01/2020 00:00,7260.0,True,True,,,,,,,,,,,,recommended,,,,,,,,,,,,,,,,,,,
692,442030,Paks,1017,HU,18.8692,46.6268,-,189092,Danube,Danube,Danube,-,188100,4997500.0,2652500.0,188266.7,18.875,46.625,True,True,True,False,1,1,1,1,1,1,1,1,1,0,-,No discharge data available for calibration period,-,,-,,0,0,02/01/2018,31/12/2021,1342.0,01/01/2018 06:00,01/01/2020 00:00,2790.0,False,False,,,,,,,,,,,,,,,,,,,,,,,,,,,,,,,
693,444563,Pocsaj,1017,HU,21.7975,47.2784,-,3502,Barcau,Danube,Danube,-,3450,5212500.0,2757500.0,3451.4,21.79167,47.275,True,True,True,True,1,1,1,1,1,1,1,1,1,0,NRT_24h,-,3,,3,,1,1,01/01/2015,31/12/2021,2443.0,01/01/2015 00:00,01/01/2020 00:00,7289.0,True,True,01/01/2015 00:00,01/01/2020 00:00,1822.25,6.0,1095.0,1460.0,0.0,,1760.815744,,,recommended,2015-01-01 00:00:00,2020-01-01 00:00:00,7289.0,0.48597930185316496,0.6475450736888688,1.027298295523725,1.373158955545588,-0.1635003677733109,-5.780326913051972,3.9605105982112994,7.27658503985982,0.6475450736888688,0.1501248593596863,2.7298295523724585,2.7298295523725185,72.01684597471034,2.7298295523725185,1.0786567423297018,0.6268410444544119
694,444292,Sajopuspoki,1017,HU,20.3401,48.2825,-,3224,Slana,Danube,Danube,-,3500,5087500.0,2847500.0,3176.9,20.34167,48.275,True,True,True,True,1,1,1,1,1,1,1,1,1,0,NRT_24h,-,3,use 285 and 286,3,close,0,1,01/01/2015,31/12/2021,2444.0,01/01/2015 00:00,01/01/2020 00:00,7092.0,True,True,,,,,,,,,,,,recommended,,,,,,,,,,,,,,,,,,,
695,444554,Sarkad,1017,HU,21.424,46.6982,0,4302,Crisul Negru,Danube,Danube,-,3650,5187500.0,2687500.0,4206.5,21.425,46.69167,True,True,True,True,1,1,1,1,1,1,1,1,1,0,NRT_24h,Moved downstream,3,use 778,3,close,0,1,02/01/2015,31/12/2021,2439.0,01/01/2015 06:00,01/01/2020 00:00,5850.0,True,True,,,,,,,,,,,,recommended,,,,,,,,,,,,,,,,,,,
696,442512,Sarvar,1017,HU,16.9538,47.2467,0,5566,Raba,Danube,Danube,-,5575,4847500.0,2707500.0,5547.5,16.95833,47.24167,True,True,True,True,1,1,1,1,1,1,1,1,1,0,NRT_24h,-,3,,3,,1,1,02/01/2015,31/12/2021,2442.0,01/01/2015 06:00,01/01/2020 00:00,6807.0,True,True,01/01/2015 06:00,01/01/2020 00:00,1701.75,6.0,1095.0,1460.0,0.0,,824.771328,,,recommended,2015-01-01 06:00:00,2020-01-01 00:00:00,6807.0,0.8063002742512767,0.8169567095955304,1.0533299524364623,1.03421481793259,0.5867748058361247,0.6036449664489763,6.8242507791440925,11.109088765642172,0.8169567095955304,1.386280949580709,5.3329952436462085,5.332995243646224,26.25275703141696,5.332995243646224,0.6428259439100739,0.9657851820674099
697,442634,Siojut,1017,HU,18.1404,46.8826,0,5884,Sio,Danube,Danube,-,5850,4942500.0,2672500.0,5781.0,18.14167,46.875,True,True,True,False,1,1,1,1,1,1,1,1,1,0,-,No discharge data available for calibration period,-,regulated  downstream of lake in model,3,,1,1,02/01/2017,31/12/2021,1694.0,01/01/2017 06:00,01/01/2020 00:00,2561.0,True,False,02/01/2017 00:00,31/12/2021 00:00,1694.0,24.0,1095.0,1460.0,0.0,,4250.816256,,1.0,recommended,2017-01-02 00:00:00,2022-01-01 00:00:00,1695.0,-0.8800410732530928,0.5750770545169462,2.6721571149345578,0.25308266153851894,-0.26962705894728445,-2.366094155779044,13.264622303342998,15.237160052411065,0.5750770545169462,10.387917757149166,167.21571149345502,167.21571149345579,213.52241209446913,167.21571149345579,1.1267772889738636,0.2530826615385189
698,444569,Szarvas,1017,HU,20.5603,46.913,0,25958,Harmas-Koros,Danube,Danube,-,26150,5122500.0,2702500.0,26002.7,20.55833,46.90833,False,False,False,False,1,0,1,0,1,1,0,1,0,0,-,No discharge data available for calibration period,-,,-,,0,0,,,,,,,False,False,,,,,,,,,,,,,,,,,,,,,,,,,,,,,,,
699,442131,Szentgotthard,1017,HU,16.2759,46.9573,0,3084,Raba,Danube,Danube,-,3275,4807500.0,2667500.0,3074.8,16.275,46.95833,True,True,True,False,1,1,1,1,1,1,1,1,1,0,HIST_24h,few data  use 817,0,,3,,1,0,02/01/1991,31/12/2021,4255.0,01/01/2015 18:00,01/01/2020 00:00,7043.0,True,True,01/01/2015 18:00,01/01/2020 00:00,1760.75,6.0,1095.0,1460.0,0.0,,2878.023936,,,,2015-01-01 18:00:00,2020-01-01 00:00:00,7043.0,0.7005365740842701,0.810410117981559,1.1198382757935954,0.8015741756921805,0.6262453026434545,0.5953472849305557,5.370537667499161,8.949543490172905,0.810410117981559,2.2158118299116034,11.983827579359545,11.983827579359533,29.04560601535066,11.983827579359533,0.6113548048036813,0.8015741756921805
700,444229,Szolnok,1017,HU,20.1888,47.1695,0,73113,Tisza,Danube,Danube,-,72325,5092500.0,2727500.0,72994.3,20.19167,47.175,True,True,True,False,1,1,1,1,1,1,1,1,1,0,HIST_24h,two yrs of data only,0,,3,,1,1,02/01/1991,31/12/2021,4164.0,01/01/2015 00:00,01/01/2020 00:00,6919.0,True,True,01/01/2015 00:00,01/01/2020 00:00,1729.75,6.0,1095.0,1460.0,0.0,,3568.053504,1.0,,recommended,2015-01-01 00:00:00,2020-01-01 00:00:00,6919.0,0.6270823898048801,0.8267508280671906,1.2973511667784658,0.8563526817733089,0.4697406576968225,0.4052071887403602,178.86106718621093,231.35174405961124,0.8267508280671906,115.85873138286948,29.735116677846676,29.735116677846587,45.90465162552707,29.735116677846587,0.7281890841692,0.8563526817733089
701,444226,Tiszabecs,1017,HU,22.8288,48.1034,0,9707,Tisza,Danube,Danube,-,9000,5272500.0,2857500.0,9219.3,22.825,48.10833,True,True,True,False,1,1,1,1,1,1,1,1,1,0,HIST_24h,two yrs of data only,0,,3,,1,1,01/01/2015,31/12/2021,2337.0,01/01/2015 00:00,01/01/2020 00:00,6864.0,True,True,01/01/2015 00:00,01/01/2020 00:00,1716.0,6.0,1095.0,1460.0,0.0,,6585.567744,,,recommended,2015-01-01 00:00:00,2020-01-01 00:00:00,6864.0,0.7117704489294738,0.7800954119696981,0.8399295988078602,1.0953714471722416,0.5603772206744906,0.35353596697958334,64.51588781564516,103.76963000461348,0.7800954119696981,-26.462227349940513,-16.007040119213933,-16.007040119213986,39.02575512389981,16.007040119213986,0.663040556320281,0.9046285528277584
702,444534,Tiszafured,1017,HU,20.7268,47.6408,0,63440,Tisza,Danube,Danube,-,62625,5122500.0,2782500.0,63408.2,20.725,47.64167,False,False,True,False,1,0,1,0,1,1,1,1,0,0,-,No discharge data available for calibration period,-,,-,,0,0,,,,,,,False,False,,,,,,,,,,,,,,,,,,,,,,,,,,,,,,,
703,444530,Tiszapalkonya,1017,HU,21.0582,47.8934,0,62730,Tisza,Danube,Danube,-,62225,5142500.0,2807500.0,62478.8,21.05833,47.89167,True,True,True,False,1,1,1,1,1,1,1,1,1,0,HIST_24h,two yrs of data only,0,,2,,1,1,02/01/1991,31/12/2021,3347.0,01/01/2015 00:00,01/01/2020 00:00,5422.0,True,False,02/01/1991 00:00,31/12/2021 00:00,3347.0,24.0,1095.0,1460.0,0.0,,6284.416512,,,recommended,1991-01-03 00:00:00,2022-01-01 00:00:00,3347.0,0.8356296196551007,0.8503409674211845,1.0609605858411681,0.9699400120392334,0.6858139006069502,0.6128841978878814,140.9185511253537,197.7732685182553,0.8503409674211845,25.74129983704789,6.096058584116804,6.096058584116814,33.37235293816202,6.096058584116814,0.5605230587523132,0.9699400120392334
704,444539,Tiszaroff,1017,HU,20.4415,47.3891,0,66020,Tisza,Danube,Danube,-,65625,5107500.0,2752500.0,66373.3,20.44167,47.39167,False,False,True,False,1,0,1,0,1,1,1,1,0,0,-,No discharge data available for calibration period,-,,-,,0,0,,,,,,,False,False,,,,,,,,,,,,,,,,,,,,,,,,,,,,,,,
705,442026,Vac,1017,HU,19.123,47.7799,0,183787,Danube,Danube,Danube,-,183500,5002500.0,2782500.0,183651.6,19.125,47.775,True,True,True,False,1,1,1,1,1,1,1,1,1,0,NRT_24h,Close to 664 but not consistent,0,Rating curve issue  not consistent with upstream 689 and downstream 664,0,no_calib,0,0,01/01/2015,31/12/2021,2442.0,01/01/2015 00:00,01/01/2020 00:00,5963.0,True,True,,,,,,,,,,,,,,,,,,,,,,,,,,,,,,,
706,444227,Vasarosnameny,1017,HU,22.3394,48.1268,0,29057,Tisza,Danube,Danube,-,30400,5232500.0,2857500.0,28538.1,22.34167,48.125,True,True,True,True,1,1,1,1,1,1,1,1,1,0,NRT_24h,-,3,,3,,1,1,01/01/2015,31/12/2021,2310.0,01/01/2015 00:00,01/01/2020 00:00,6700.0,True,True,01/01/2015 00:00,01/01/2020 00:00,1675.0,6.0,1095.0,1460.0,0.0,,3993.279232,1.0,,recommended,2015-01-01 00:00:00,2020-01-01 00:00:00,6700.0,0.7990244937789617,0.848122614465767,1.0058957912780941,1.1314901270411346,0.6351378883087893,0.36986096550853964,98.69029351418283,144.94948309396662,0.848122614465767,1.7258462942068549,0.5895791278094158,0.5895791278094199,33.714321703305345,0.5895791278094199,0.6040381707236828,0.8685098729588654
707,444510,Zahony,1017,HU,22.1728,48.4131,0,32782,Tisza,Danube,Danube,-,33350,5217500.0,2887500.0,32482.2,22.175,48.40833,True,True,True,True,1,1,1,1,1,1,1,1,1,0,NRT_24h,-,3,,3,,1,1,01/01/2015,31/12/2021,2444.0,01/01/2015 00:00,01/01/2020 00:00,7038.0,True,True,01/01/2015 00:00,01/01/2020 00:00,1759.5,6.0,1095.0,1460.0,0.0,,1980.412544,,,recommended,2015-01-01 00:00:00,2020-01-01 00:00:00,7038.0,0.7927070544320868,0.8382744504786762,1.0559705563725625,1.1169722562558895,0.5812761097934852,0.44489938587885924,99.84912497047138,143.3758754974577,0.8382744504786762,15.6674409683066,5.597055637256219,5.597055637256247,35.670222656117815,5.597055637256247,0.6470887807762655,0.8830277437441105
708,444555,Remete,1017,HU,21.312869,46.700142,0,-,Crisul Negru,Danube,Danube,-,3675,5182500.0,2687500.0,4291.5,21.30833,46.70833,False,False,False,False,0,0,0,0,0,0,0,0,0,0,-,No discharge data available for calibration period,-,,-,,0,0,,,,,,,False,False,,,,,,,,,,,,,,,,,,,,,,,,,,,,,,,
709,444562,Szeghalom Foki-hid,1017,HU,21.1828,46.9875,0,-,Crisul Repede,Danube,Danube,-,8550,5167500.0,2717500.0,3104.0,21.19167,46.99167,False,False,False,False,0,0,0,0,0,0,0,0,0,0,-,No discharge data available for calibration period,-,mapped before confluence,-,,0,0,,,,,,,False,False,,,,,,,,,,,,,,,,,,,,,,,,,,,,,,,
710,444656,Borz,1017,HU,20.9461,47.1899,0,-,Hortobagy-Berettyo,Danube,Danube,-,5175,5147500.0,2737500.0,9883.4,20.94167,47.19167,False,False,False,False,0,0,0,0,0,0,0,0,0,0,-,No discharge data available for calibration period,-,,-,,0,0,,,,,,,False,False,,,,,,,,,,,,,,,,,,,,,,,,,,,,,,,
711,442641,Korakaspuszta,1017,HU,18.49,47.25,0,-,Patkai Vitzarozo (Lake),Danube,Danube,-,400,4962500.0,2717500.0,359.4,18.49167,47.24167,False,False,False,False,0,0,0,0,0,0,0,0,0,0,-,No discharge data available for calibration period,-,,-,,0,0,,,,,,,False,False,,,,,,,,,,,,,,,,,,,,,,,,,,,,,,,
712,442514,Ragyogohid,1017,HU,17.0129,47.3481,0,-,Raba,Danube,Danube,-,6475,4852500.0,2717500.0,6294.3,17.00833,47.34167,False,False,False,False,0,0,0,0,0,0,0,0,0,0,-,No discharge data available for calibration period,-,,-,,0,0,,,,,,,False,False,,,,,,,,,,,,,,,,,,,,,,,,,,,,,,,
713,444666,Agota,1017,HU,21.0221,47.3779,0,3134,Barcau,Danube,Danube,-,3400,5152500.0,2757500.0,2527.7,21.025,47.375,True,True,True,False,1,1,1,1,1,1,1,1,1,0,NRT_24h,Its a small affluent impossible to locate,0,The station is located on the river Hortobagy-Berettyo,3,,1,1,02/01/2015,31/12/2021,2364.0,01/01/2017 12:00,31/12/2019 18:00,2104.0,True,False,02/01/2015 00:00,31/12/2021 00:00,2364.0,24.0,1095.0,1460.0,1.0,0.0,2527.669248,,,exclude,2015-01-02 00:00:00,2022-01-01 00:00:00,2365.0,-0.3798424662422628,0.4203202729738524,1.2471749491727977,2.2275345983807733,-5.822778692268741,-0.9929164197302356,3.8608543416079733,8.000226933454215,0.4203202729738524,2.032114549622749,24.7174949172798,24.71749491727978,46.961254021220796,24.71749491727978,2.6120449253924956,-0.22753459838077328
714,442604,Repcelak-Ujhid,1017,HU,17.0611,47.4272,0,-,Kis-Raba,Danube,Danube,-,1125,4852500.0,2727500.0,6467.0,17.05833,47.425,False,False,False,False,0,0,0,0,0,0,0,0,0,0,-,No discharge data available for calibration period,-,station is on artificial channel,-,exclude,0,0,,,,,,,False,False,,,,,,,,,,,,,,,,,,,,,,,,,,,,,,,
715,442601,Bacsa,1017,HU,17.6763,47.7251,0,17732,Mosoni-Duna,Danube,Danube,-,131675,4897500.0,2767500.0,17859.0,17.675,47.725,False,False,True,False,1,0,1,0,1,1,0,1,1,0,-,Not enough discarge data available for calibration period,-,mapped before confluence,2,,1,0,01/01/2015,01/01/2020,1450.0,01/01/2015 00:00,31/12/2019 12:00,3567.0,True,False,01/01/2015 00:00,01/01/2020 00:00,1450.0,24.0,1095.0,1280.0,0.0,,10313.99936,,1.0,,2015-01-01 00:00:00,2020-01-01 00:00:00,1450.0,-20.97509617710743,0.33253496509504116,22.964951545275596,0.9843145291386584,-3328.5156432960225,-59.492251497199796,1845.5195433835925,2000.868033969233,0.33253496509504116,1845.5195433835925,2196.4951545275594,2196.4951545275594,2196.4951545275594,2196.4951545275594,57.701955281394326,0.9843145291386584
716,444526,Belsobocs also,1017,HU,20.9749,48.0466,0,-,Hernad,Danube,Danube,-,5425,5137500.0,2832500.0,4963.7,20.975,48.05833,False,False,False,False,0,0,0,0,0,0,0,0,0,0,-,No discharge data available for calibration period,-,,-,,0,0,,,,,,,False,False,,,,,,,,,,,,,,,,,,,,,,,,,,,,,,,
717,444525,Belsobocs felso,1017,HU,20.975,48.0467,0,-,Hernad,Danube,Danube,-,5400,5132500.0,2832500.0,4977.6,20.975,48.04167,False,False,False,False,0,0,0,0,0,0,0,0,0,0,-,No discharge data available for calibration period,-,,-,,0,0,,,,,,,False,False,,,,,,,,,,,,,,,,,,,,,,,,,,,,,,,
718,444653,Taktafoldvar,1017,HU,21.22,48.13,0,-,Takta,Danube,Danube,-,500,5152500.0,2842500.0,348.4,21.225,48.14167,False,False,False,False,0,0,0,0,0,0,0,0,0,0,-,No discharge data available for calibration period,-,,-,,0,0,,,,,,,False,False,,,,,,,,,,,,,,,,,,,,,,,,,,,,,,,
772,151210050,GUSIN,1024,PL,21.254444,51.892778,91.73,81844.16,Vistula,Vistula,Vistula,C548,81900,5092500.0,3262500.0,81852.8,21.25833,51.89167,True,True,True,True,1,1,1,1,1,1,1,1,1,0,HIST_6h,-,3,,3,,1,1,01/01/1991,31/12/2021,10695.0,01/01/1995 06:00,31/12/2021 18:00,9566.0,True,True,01/01/1995 06:00,31/12/2021 18:00,2391.5,6.0,1095.0,1460.0,0.0,,15850.01472,1.0,,,1995-01-01 06:00:00,2021-12-31 18:00:00,9566.0,0.8430292982910568,0.8475916136315522,1.0149170877923257,0.9655186216725605,0.700463580377007,0.6035237366408782,131.6714725392851,201.0933924307343,0.8475916136315522,7.6792107097535585,1.4917087792325463,1.4917087792325705,25.57756245858153,1.4917087792325705,0.5472992048441118,0.9655186216725605
773,152190120,KĘPA POLSKA,1024,PL,19.963333,52.431389,57.25,168357.53,Vistula,Vistula,Vistula,C551,168025,4992500.0,3307500.0,168133.5,19.95833,52.425,True,True,True,True,1,1,1,1,1,1,1,1,1,0,HIST_6h,-,3,,3,,1,1,01/01/1991,31/12/2021,11166.0,01/01/1995 06:00,31/12/2021 18:00,9947.0,True,True,01/01/1995 06:00,31/12/2021 18:00,2486.75,6.0,1095.0,1460.0,0.0,,20314.42534,1.0,,,1995-01-01 06:00:00,2021-12-31 18:00:00,9947.0,0.785113660673973,0.7898260028489738,1.0006157631658206,0.9552490158071979,0.5962643090345489,0.5519645732041458,215.0006380455995,309.7406650042124,0.7898260028489738,0.5067217439637932,0.061576316582073645,0.06157631658205464,26.12666125215364,0.06157631658205464,0.6354019916284903,0.9552490158071979
774,152220050,FRANKOPOL,1024,PL,22.560833,52.415,109.59,30636.63,Bug,Vistula,Vistula,C220,30175,5167500.0,3332500.0,29907.3,22.55833,52.40833,True,True,True,True,1,1,1,1,1,1,1,1,1,0,HIST_6h,-,3,,3,,1,1,01/01/1991,31/12/2021,11149.0,01/01/1995 06:00,31/12/2021 18:00,9910.0,True,True,01/01/1995 06:00,31/12/2021 18:00,2477.5,6.0,1095.0,1460.0,0.0,,15929.65939,,,,1995-01-01 06:00:00,2021-12-31 18:00:00,9910.0,0.7287143070491052,0.7308837141089112,0.9946870987289339,0.9661750839155985,0.4811557800338516,0.56659478862568,31.292336102015316,49.96907677251361,0.7308837141089112,-0.5481559734891454,-0.5312901271066096,-0.531290127106609,30.329523035712647,0.531290127106609,0.7203084200300249,0.9661750839155985
775,44119,Bistra,1001,RO,24.1931,47.863,1020,1547,Viseu,Danube,Danube,C760,1500,5377500.0,2852500.0,1565.1,24.19167,47.85833,True,True,True,True,1,1,1,1,1,1,1,0,1,0,NRT_6h,outlier  negative values removed with qc,3,,3,,1,1,01/01/1991,31/12/2021,11075.0,04/12/2011 00:00,31/12/2021 18:00,13317.0,True,True,04/12/2011 00:00,31/12/2021 18:00,3329.25,6.0,1095.0,1460.0,1.0,0.0,1565.083264,,,,2011-12-04 00:00:00,2021-12-31 18:00:00,13317.0,0.6766653941020686,0.7038384494844627,0.9699199944377492,0.8737906634484659,0.47346349446020497,0.39272379126339807,12.42304995692053,18.952514078939604,0.7038384494844627,-0.9360601020207008,-3.008000556225081,-3.0080005562250767,39.921091711696874,3.0080005562250767,0.7256283522160609,0.8737906634484659
776,44220,Satu Mare,1001,RO,22.876,47.786444,537,15385,Somes,Danube,Danube,C410,14925,5277500.0,2827500.0,15258.4,22.875,47.79167,True,True,True,True,1,1,1,1,1,1,1,0,1,0,HIST_24h,-,3,use 665,3,close,0,1,01/01/1991,31/12/2021,10367.0,01/10/2018 18:00,31/12/2021 18:00,4501.0,True,False,,,,,,,,,,,,,,,,,,,,,,,,,,,,,,,
777,44210,Beclean,1001,RO,24.151194,47.177167,711,-,Somesul Mare,Danube,Danube,-,4375,5387500.0,2777500.0,4346.5,24.15833,47.175,True,True,True,True,1,1,1,1,1,1,1,0,1,0,NRT_6h,-,3,,3,,1,1,02/01/2000,31/12/2021,7128.0,04/12/2011 00:00,30/09/2021 06:00,13763.0,True,True,04/12/2011 00:00,30/09/2021 06:00,3440.75,6.0,1095.0,1460.0,1.0,0.0,4346.531328,1.0,,,2011-12-04 00:00:00,2021-09-30 06:00:00,13763.0,0.7750902090092944,0.782194158739327,0.9845499711322803,0.9460896465954822,0.5893320676715236,-0.05394224343402776,19.720973980564246,29.145162862040344,0.782194158739327,-0.661576160123916,-1.5450028867719638,-1.5450028867719747,46.05510834039023,1.5450028867719747,0.64083377901643,0.9460896465954822
778,44459,Zerind,1001,RO,21.515611,46.627167,351,3702,Crisul Negru,Danube,Danube,C759,3625,5192500.0,2687500.0,4060.1,21.525,46.625,True,True,True,False,1,1,1,1,1,1,1,0,1,0,HIST_24h,close to 695,2,close to 695,3,,1,1,01/01/1991,31/12/2021,10379.0,01/02/2017 06:00,31/12/2021 18:00,6875.0,True,True,01/02/2017 06:00,31/12/2021 18:00,1718.75,6.0,1095.0,1460.0,1.0,0.0,4060.07296,,,,2017-02-01 06:00:00,2021-12-31 18:00:00,6875.0,0.8846769182157758,0.905315379280601,0.9707095032222285,0.9410398219986932,0.8190479533543287,-1.566018878605997,8.69180668843591,13.901918969012433,0.905315379280601,-0.7170309988247118,-2.9290496777771806,-2.9290496777771557,35.50576421632298,2.9290496777771557,0.4253845867514139,0.9410398219986932
779,44409,Chisineu Cris,1001,RO,21.509667,46.519528,351,-,Crisul Alb,Danube,Danube,-,3525,5202500.0,2667500.0,3586.2,21.50833,46.525,True,True,True,False,1,1,1,1,1,1,1,0,1,0,HIST_24h,close to 673,2,close to 673,3,,1,1,02/01/2000,31/12/2021,7115.0,16/10/2017 12:00,31/12/2021 18:00,5840.0,True,False,02/01/2000 00:00,31/12/2021 00:00,7115.0,24.0,1095.0,1460.0,0.0,,1978.357504,,,,2000-01-02 00:00:00,2022-01-01 00:00:00,7116.0,0.6816400022087741,0.7482994458715492,0.8186234440613691,0.9285684649408903,0.5459607620925976,0.15636951117376918,10.61738730173926,22.525930172887648,0.7482994458715492,-3.934370286831937,-18.137655593863037,-18.13765559386309,48.94671831732129,18.13765559386309,0.6738243375742674,0.9285684649408903
780,44580,Salard,1001,RO,22.028167,47.231528,254,-,Barcau,Danube,Danube,-,1675,5227500.0,2752500.0,1690.5,22.025,47.225,True,True,True,True,1,1,1,1,1,1,1,0,1,0,NRT_6h,-,3,,3,,1,1,02/01/2000,31/12/2021,7115.0,04/12/2011 00:00,31/12/2021 18:00,12624.0,True,True,04/12/2011 00:00,31/12/2021 18:00,3156.0,6.0,1095.0,1460.0,1.0,0.0,1690.535808,,,,2011-12-04 00:00:00,2021-12-31 18:00:00,12624.0,0.7187084511946873,0.7936275578193007,0.9213324055584812,1.1742032150175485,0.5440829425233707,-10.647257131673518,2.3429709785794257,3.8559338548632778,0.7936275578193007,-0.2967492042517404,-7.866759444151839,-7.866759444151884,62.11167143510667,7.866759444151884,0.6752163042141581,0.8257967849824515
781,44610,Ocna Mures,1001,RO,23.852694,46.395333,703,-,Mures,Danube,Danube,C039,10000,5382500.0,2687500.0,9934.7,23.85833,46.39167,True,True,True,True,1,1,1,1,1,1,1,0,1,0,HIST_24h,Use untill 01-2017 better use daily data,3,,3,,1,1,01/01/1991,31/12/2021,10369.0,04/12/2011 06:00,31/12/2021 18:00,9016.0,True,True,04/12/2011 06:00,31/12/2021 18:00,2254.0,6.0,1095.0,1460.0,0.0,,1573.55648,,,,2011-12-04 06:00:00,2021-12-31 18:00:00,9016.0,0.48305678982618616,0.6556556536022483,1.3809105969526347,1.0597023515273938,-0.3878134326799807,0.18286091939828775,35.763609024711656,63.29078662803002,0.6556556536022483,21.844329562643335,38.09105969526371,38.09105969526348,62.36280964228047,38.09105969526348,1.1780549361893002,0.9402976484726062
782,44612,Alba Iulia,1001,RO,23.581361,46.036056,625,18055,Mures,Danube,Danube,C408,17975,5367500.0,2647500.0,18026.7,23.575,46.04167,True,True,True,True,1,1,1,1,1,1,1,0,1,0,HIST_24h,-,3,,3,,1,1,01/01/1991,31/12/2021,10369.0,01/10/2018 06:00,31/12/2021 18:00,4220.0,True,False,01/01/1991 00:00,31/12/2021 00:00,10369.0,24.0,1095.0,1460.0,0.0,,1838.4064,,,,1991-01-03 00:00:00,2022-01-01 00:00:00,10368.0,0.7362530465448431,0.7561508905345468,1.0425476946680896,0.9089518756469244,0.5332438955740462,0.5160503353356212,41.02137630833285,67.92895412572751,0.7561508905345468,4.285436956167418,4.254769466808956,4.254769466808954,40.72781870049201,4.254769466808954,0.6831955096646581,0.9089518756469244
783,44622,Arad,1001,RO,21.320806,46.159889,618,27280,Mures,Danube,Danube,C041,27300,5197500.0,2622500.0,27278.6,21.325,46.15833,True,True,True,False,1,1,1,1,1,1,1,0,1,0,NRT_6h,negative values  preblems with river gauge  could use hist24  close to 2743,1,negative values,0,,0,0,01/01/1991,31/12/2021,10369.0,10/08/2013 18:00,31/12/2021 18:00,9726.0,True,True,,,,,,,,,,,,,,,,,,,,,,,,,,,,,,,
784,44681,Turda,1001,RO,23.784444,46.566278,897,-,Aries,Danube,Danube,-,2650,5372500.0,2702500.0,2367.4,23.775,46.55833,True,True,True,True,1,1,1,1,1,1,1,0,1,0,HIST_24h,-,3,,3,,1,1,01/01/1991,31/12/2021,10368.0,13/04/2017 18:00,31/12/2021 18:00,6569.0,True,True,13/04/2017 18:00,31/12/2021 18:00,1642.25,6.0,1095.0,1280.0,1.0,0.0,2367.44832,,,,2017-04-13 18:00:00,2021-12-31 18:00:00,6569.0,0.5491037971325987,0.6550192901920726,1.18553502235788,1.2233214076153924,-0.24311290345875203,0.5088217027253579,8.591091248446794,19.154634782046998,0.6550192901920726,3.4233599335870952,18.553502235788034,18.553502235788006,46.56093246931755,18.553502235788006,1.11494973135956,0.7766785923846076
785,44720,Mihalt,1001,RO,23.730167,46.171611,532,-,Tarnava Mare,Danube,Danube,-,6250,5377500.0,2662500.0,6253.6,23.74167,46.175,True,True,True,True,1,1,1,1,1,1,1,0,1,0,NRT_6h,-,3,,3,,1,1,02/01/2000,31/12/2021,7099.0,04/12/2011 06:00,31/12/2021 18:00,7764.0,True,True,04/12/2011 06:00,31/12/2021 18:00,1941.0,6.0,1095.0,1460.0,0.0,,501.488832,,,,2011-12-04 06:00:00,2021-12-31 18:00:00,7764.0,0.6705234123445312,0.7553178751771763,0.886664402419229,0.8106840684826302,0.5572878492141924,0.5593477744132995,6.017627324106056,10.66519823402551,0.7553178751771763,-1.7473910745369436,-11.333559758077127,-11.333559758077108,39.03026624859412,11.333559758077108,0.6653661779695504,0.8106840684826302
786,42119,Sag,1001,RO,21.1781,45.6462,477,4493,Timis,Danube,Danube,C409,6400,5192500.0,2567500.0,4407.6,21.175,45.64167,True,True,True,True,1,1,1,1,1,1,1,0,1,0,HIST_24h,-,3,,3,,1,1,01/01/1991,31/12/2021,10333.0,17/10/2017 00:00,31/12/2021 18:00,4962.0,True,False,01/01/1991 00:00,31/12/2021 00:00,10333.0,24.0,1095.0,1460.0,0.0,,1701.135104,,,,1991-01-03 00:00:00,2022-01-01 00:00:00,10332.0,0.7932214119036621,0.8535091458418405,1.075784944625854,0.8752824939666286,0.7175980247682551,0.527076282807998,18.097836794614572,29.614199203190108,0.8535091458418405,3.1112808238314433,7.578494462585401,7.578494462585397,44.08292394636998,7.578494462585397,0.5314150686908911,0.8752824939666286
787,42231,Podari,1001,RO,23.78675,44.260139,446,9334,Jiu,Danube,Danube,C018,9325,5412500.0,2452500.0,9293.8,23.79167,44.25833,True,True,True,True,1,1,1,1,1,1,1,0,1,0,NRT_6h,negative values,3,,3,,1,1,01/01/1991,31/12/2021,10356.0,04/12/2011 00:00,08/05/2020 06:00,9023.0,True,True,04/12/2011 00:00,08/05/2020 06:00,2255.75,6.0,1095.0,1460.0,1.0,0.0,9293.81376,1.0,,,2011-12-04 00:00:00,2020-05-08 06:00:00,9023.0,0.8267969243225763,0.8408292211708025,0.9377380909859806,0.9719389366388937,0.6988057635374791,0.4710870153351967,39.97858587377211,62.03750162025837,0.8408292211708025,-6.3988552754444425,-6.226190901401947,-6.226190901401938,38.89981831178501,6.226190901401938,0.5488116584608246,0.9719389366388937
788,42450,Bals,1001,RO,24.098889,44.348333,414,-,Oltet,Danube,Danube,-,1950,5437500.0,2467500.0,2110.1,24.10833,44.34167,True,True,True,True,1,1,1,1,1,1,1,0,1,0,HIST_24h,-,3,,3,,1,1,02/01/2000,31/12/2021,7074.0,,,,True,False,02/01/2000 00:00,31/12/2021 00:00,7074.0,24.0,1095.0,1460.0,1.0,0.0,2110.077568,,,,2000-01-02 00:00:00,2022-01-01 00:00:00,7075.0,0.4810034977392892,0.6313308727038052,1.262651065937429,1.2538796200947337,-0.5298102896515078,-1.6002946230950528,8.470192743313678,21.379171642120543,0.6313308727038052,2.5818214010575584,26.265106593743155,26.2651065937429,86.16804988197704,26.2651065937429,1.236854999444765,0.7461203799052663
789,42471,Alexandria,1001,RO,25.318806,43.986778,195,-,Vedea,Danube,Danube,-,3375,5542500.0,2447500.0,3295.0,25.325,43.99167,True,True,True,True,1,1,1,1,1,1,1,0,1,0,HIST_24h,-,3,,3,,1,1,02/01/2000,31/12/2021,7068.0,,,,True,False,02/01/2000 00:00,31/12/2021 00:00,7068.0,24.0,1095.0,1460.0,1.0,0.0,3295.038464,,,,2000-01-02 00:00:00,2022-01-01 00:00:00,7069.0,0.08279510506213184,0.3958164959313938,1.5042194382058105,1.4711580104856365,-3.2201347057005485,-3.903330841543238,7.955070862909208,25.14282498585851,0.3958164959313938,3.3485023844627704,50.42194382058084,50.42194382058104,119.78792011602634,50.42194382058104,2.0542966450102824,0.5288419895143635
790,42557,Calugareni,1001,RO,25.996917,44.171167,130,-,Neajlov,Danube,Danube,-,3525,5592500.0,2477500.0,1863.5,25.99167,44.15833,True,True,True,True,1,1,1,1,1,1,1,0,1,0,HIST_24h,-,3,,3,,1,1,02/01/2000,31/12/2021,7113.0,01/10/2018 06:00,27/06/2019 06:00,1046.0,True,False,02/01/2000 00:00,31/12/2021 00:00,7113.0,24.0,1095.0,1460.0,1.0,0.0,1863.542656,,,,2000-01-02 00:00:00,2022-01-01 00:00:00,7114.0,0.5789341259056939,0.6489444687207767,1.1457585539663837,1.181137870779948,-0.08578794454855854,-1.8555255874188838,5.261949155615856,11.815051346925914,0.6489444687207767,1.1784509825717306,14.575855396638424,14.575855396638374,65.0832415866326,14.575855396638374,1.042011489643256,0.818862129220052
791,42630,Adancata,1001,RO,26.460583,44.755833,549,-,Prahova,Danube,Danube,-,3750,5612500.0,2547500.0,3710.0,26.45833,44.75833,True,True,True,True,1,1,1,1,1,1,1,0,1,0,HIST_24h,-,3,,3,,1,1,02/01/2000,31/12/2021,7108.0,06/03/2017 18:00,31/12/2021 18:00,4598.0,True,False,02/01/2000 00:00,31/12/2021 00:00,7108.0,24.0,1095.0,1460.0,1.0,0.0,3710.006272,1.0,,,2000-01-02 00:00:00,2022-01-01 00:00:00,7109.0,0.48043362616905905,0.606147412210851,1.2165024802431719,1.260683777700452,-0.5548911146616229,-0.15275165955865866,17.0612138028071,32.307798873569354,0.606147412210851,6.456133688822789,21.650248024317158,21.65024802431718,57.21373320787453,21.65024802431718,1.24695273152659,0.739316222299548
792,42718,Itcani,1001,RO,26.234639,47.672778,629,-,Suceava,Danube,Danube,-,2325,5527500.0,2862500.0,2340.7,26.225,47.675,True,True,True,True,1,1,1,1,1,1,1,0,1,0,HIST_24h,-,3,,3,,1,1,02/01/2000,31/12/2021,7097.0,,,,True,False,02/01/2000 00:00,31/12/2021 00:00,7097.0,24.0,1095.0,1460.0,1.0,0.0,2340.690176,,,,2000-01-02 00:00:00,2022-01-01 00:00:00,7098.0,0.5485777858205922,0.7885001613853031,0.9539938144946915,1.3961480337144783,0.3254002407213369,-5.070732565478313,8.392927020398671,18.92794901810192,0.7885001613853031,-0.7399090931482094,-4.600618550530831,-4.60061855053086,52.18567537669568,4.60061855053086,0.8213402213934659,0.6038519662855217
793,42839,Vranceni,1001,RO,26.89525,46.209667,734,-,Trotus,Danube,Danube,-,4175,5612500.0,2712500.0,4086.9,26.89167,46.20833,True,True,True,False,1,1,1,1,1,1,1,0,1,0,NRT_6h,low quality,0,low quality data,1,,1,1,02/01/2000,31/12/2021,7094.0,04/12/2011 06:00,31/12/2021 18:00,12593.0,True,True,04/12/2011 06:00,31/12/2021 18:00,3148.25,6.0,1095.0,1460.0,1.0,0.0,4086.90176,1.0,,,2011-12-04 06:00:00,2021-12-31 18:00:00,12593.0,0.22042751589384257,0.5788411037864966,0.8419781450401319,1.6367005068874305,-0.32588096441997316,-2.114305125692537,17.98896594991546,30.265234860161286,0.5788411037864966,-3.9142423025038897,-15.80218549598684,-15.80218549598681,72.62324476941966,15.80218549598681,1.1514690462274555,0.3632994931125695
794,42873,Botarlau,1001,RO,27.386417,45.632194,554,-,Putna,Danube,Danube,-,2600,5662500.0,2662500.0,2542.7,27.39167,45.625,True,True,True,True,1,1,1,1,1,1,1,0,1,0,NRT_6h,negative values,3,,3,,1,1,02/01/2000,31/12/2021,7078.0,04/12/2011 06:00,31/12/2021 18:00,12264.0,True,True,04/12/2011 06:00,31/12/2021 18:00,3066.0,6.0,1095.0,1460.0,1.0,0.0,2542.735872,,,,2011-12-04 06:00:00,2021-12-31 18:00:00,12264.0,0.04120746574622991,0.6406912682876356,0.9369554627123199,1.886682437727398,-0.8617318125685425,-15.96429323351336,10.218323165832217,23.553004036810876,0.6406912682876356,-0.7688982005626792,-6.30445372876808,-6.304453728768007,83.78345213637525,6.304453728768007,1.3644529352705863,0.11331756227260192
795,42911,Tecuci,1001,RO,27.4403,45.8446,220,-,Barlad,Danube,Danube,-,7025,5662500.0,2682500.0,177.2,27.44167,45.84167,True,True,True,False,1,1,1,1,1,1,1,0,1,0,HIST_24h,wrong location  it must be an affluent,0,on small river,3,,1,1,02/01/2000,31/12/2021,7096.0,21/05/2017 18:00,19/11/2018 06:00,1469.0,True,False,02/01/2000 00:00,31/12/2021 00:00,7096.0,24.0,1095.0,1460.0,1.0,0.0,177.173888,,,,2000-01-02 00:00:00,2022-01-01 00:00:00,7097.0,-4.925324588631498,0.5576370088740338,6.767426979913637,2.284746082339768,-263.7202949277798,-3.9101791016001393,21.608654822090678,53.79418998592891,0.5576370088740338,21.40060593628902,576.742697991361,576.7426979913637,582.349580154818,576.7426979913637,16.270227254951852,-0.28474608233976806
796,42708,Dragesti,1001,RO,26.945444,46.723639,525,11899,Siret,Danube,Danube,C028,11825,5602500.0,2772500.0,11848.9,26.94167,46.725,True,True,True,True,1,1,1,1,1,1,1,0,1,0,NRT_6h,negative values  removed with qc,3,,3,,1,1,01/01/1991,31/12/2021,10348.0,04/12/2011 06:00,31/12/2021 18:00,9147.0,True,True,04/12/2011 06:00,31/12/2021 18:00,2286.75,6.0,1095.0,1460.0,0.0,,3895.85792,1.0,,,2011-12-04 06:00:00,2021-12-31 18:00:00,9147.0,0.6790793926117122,0.6925805954818111,0.9079695025832586,1.0037058760606372,0.42648880009433565,-0.12747577694316314,31.852759308372825,59.5004329689386,0.6925805954818111,-5.733834404782322,-9.203049741673981,-9.203049741674144,51.12504262069843,9.203049741674144,0.7573052224207025,0.9962941239393628
797,42945,Radauti,1001,RO,26.824,48.238806,529,9074,Prut,Danube,Danube,C021,9175,5552500.0,2937500.0,9308.5,26.825,48.24167,True,True,True,True,1,1,1,1,1,1,1,0,1,0,HIST_24h,-,3,,3,,1,1,01/01/1991,31/12/2021,9988.0,,,,True,False,01/01/1991 00:00,31/12/2021 00:00,9988.0,24.0,1095.0,1460.0,0.0,,2402.3296,,,,1991-01-03 00:00:00,2022-01-01 00:00:00,9987.0,0.7377527241918063,0.7755433382180965,1.005986981293259,1.135487994691549,0.46694051340410836,0.4892315898455154,31.05210691413671,68.43354974830763,0.7755433382180965,0.48408308186189997,0.5986981293258664,0.5986981293259014,38.404230632512274,0.5986981293259014,0.7301092292225138,0.864512005308451
798,42001,Bazias,1001,RO,21.3901,44.8087,-999,570896,Danube,Danube,Danube,C403,564200,5222500.0,2477500.0,562382.8,21.39167,44.80833,False,False,True,True,1,0,1,0,1,1,1,0,1,0,HIST_24h,-,3,,2,,1,1,02/01/1991,01/12/2021,9040.0,,,,True,False,02/01/1991 00:00,01/12/2021 00:00,9040.0,24.0,1095.0,1460.0,0.0,,34519.7527,,,,1991-01-03 00:00:00,2021-12-01 00:00:00,9039.0,0.8371692113001683,0.8625421809283382,1.0839609154199132,1.0238700315567812,0.6405948619325054,0.6998018828766642,961.4923903293261,1305.932870749015,0.8625421809283382,447.65262353519967,8.396091541991312,8.396091541991328,18.033577157173347,8.396091541991328,0.5995040767730397,0.9761299684432188
799,42309,Hoghiz,1001,RO,25.301083,45.991889,797,7225,Olt,Danube,Danube,C404,7050,5502500.0,2667500.0,7157.7,25.30833,45.99167,True,True,True,True,1,1,1,1,1,1,1,0,1,0,HIST_24h,-,3,,3,,1,1,02/01/2000,31/12/2021,7863.0,01/10/2018 06:00,03/08/2021 06:00,2567.0,True,False,02/01/2000 00:00,31/12/2021 00:00,7863.0,24.0,1095.0,1460.0,1.0,0.0,7157.744128,1.0,,,2000-01-02 00:00:00,2022-01-01 00:00:00,7864.0,0.7135100805451084,0.7167574311294685,1.0391759517782317,0.9822414547002819,0.4195113388070352,0.5206050823720518,18.18851599338777,34.243329181022155,0.7167574311294685,1.9256093298602528,3.9175951778231988,3.9175951778231806,37.003997354243545,3.9175951778231806,0.761898064830831,0.9822414547002819
800,44405,Gurahont,1001,RO,22.34225,46.277722,515,-,Crisul Alb,Danube,Danube,-,1725,5267500.0,2652500.0,1607.8,22.35833,46.275,True,True,True,True,1,1,1,1,1,1,1,0,1,0,HIST_24h,-,3,,3,,1,1,02/01/2000,31/12/2021,7860.0,14/07/2017 06:00,31/12/2021 18:00,6216.0,True,False,02/01/2000 00:00,31/12/2021 00:00,7860.0,24.0,1095.0,1460.0,1.0,0.0,1607.826048,,,,2000-01-02 00:00:00,2022-01-01 00:00:00,7861.0,0.7640745667554957,0.7698678617674257,1.0186087551506535,1.0485151856211374,0.5036422442686282,-2.1705122275946813,6.877408220330684,13.978256240403114,0.7698678617674257,0.24745885665931833,1.860875515065348,1.860875515065357,51.71769051669789,1.860875515065357,0.7045266181851265,0.9514848143788626
801,42153,Gataia,1001,RO,21.4342,45.439,359,-,Barzava,Danube,Danube,-,725,5212500.0,2547500.0,718.7,21.44167,45.44167,True,True,True,False,1,1,1,1,1,1,1,0,1,0,NRT_6h,negative values  close to 263,2,close to 263,3,,1,1,02/01/2000,31/12/2021,7830.0,04/12/2011 06:00,31/12/2021 18:00,10830.0,True,True,04/12/2011 06:00,31/12/2021 18:00,2707.5,6.0,1095.0,1460.0,1.0,0.0,718.676672,,,,2011-12-04 06:00:00,2021-12-31 18:00:00,10830.0,0.38751293104019113,0.6009316327034605,0.6372415257998452,1.2903293599728203,0.14650709363351322,-2.843074573034859,4.231269881632815,6.220910790714831,0.6009316327034605,-2.740454286409611,-36.275847420015005,-36.27584742001549,56.01002044814799,36.27584742001549,0.92384679810372,0.7096706400271797
802,42109,Lugoj,1001,RO,21.9073,45.6837,666,-,Timis,Danube,Danube,-,2800,5247500.0,2582500.0,2706.5,21.90833,45.675,True,True,True,True,1,1,1,1,1,1,1,0,1,0,NRT_6h,negative values,3,,3,,1,1,02/01/2000,31/12/2021,7852.0,04/12/2011 06:00,31/12/2021 18:00,10522.0,True,True,04/12/2011 06:00,31/12/2021 18:00,2630.5,6.0,1095.0,1460.0,1.0,0.0,2706.510848,1.0,,,2011-12-04 06:00:00,2021-12-31 18:00:00,10522.0,0.8109023653829944,0.8123788350436237,0.9942763384338843,0.9771208921407464,0.6346016991225544,0.6345562280499759,12.923200076687491,23.15706189627814,0.8123788350436237,-0.20685978638122288,-0.5723661566115458,-0.5723661566115656,35.75756549116853,0.5723661566115656,0.6044818449527212,0.9771208921407464
803,42741,Tupilati,1001,RO,26.648111,47.084639,703,-,Moldova,Danube,Danube,-,4025,5572500.0,2807500.0,3939.8,26.65833,47.09167,True,True,True,True,1,1,1,1,1,1,1,0,1,0,HIST_24h,-,3,,3,,1,1,02/01/2000,31/12/2021,6755.0,09/03/2017 18:00,29/07/2019 06:00,1653.0,True,False,02/01/2000 00:00,31/12/2021 00:00,6755.0,24.0,1095.0,1460.0,1.0,0.0,3939.810816,,,,2000-01-02 00:00:00,2022-01-01 00:00:00,6756.0,0.7376465100098318,0.816859779065801,0.9630111952116542,1.1841761154615975,0.5618479197369373,0.13241313575872093,11.744446360175106,24.973757124356343,0.816859779065801,-1.033223961273233,-3.6988804788345835,-3.698880478834574,42.04442115612493,3.698880478834574,0.6619305705759976,0.8158238845384025
804,42780,Frumosu,1001,RO,25.861917,47.142472,1172,-,Bistrita,Danube,Danube,-,2850,5512500.0,2797500.0,2865.9,25.85833,47.14167,True,True,True,True,1,1,1,1,1,1,1,0,1,0,HIST_24h,low quality  use hist_24 instead,3,,3,,1,1,02/01/2000,31/12/2021,7845.0,04/12/2011 06:00,31/12/2021 18:00,13096.0,True,True,04/12/2011 06:00,31/12/2021 18:00,3274.0,6.0,1095.0,1460.0,1.0,0.0,2865.892352,,,,2011-12-04 06:00:00,2021-12-31 18:00:00,13096.0,0.4533451133360752,0.4597702796104587,0.9357982390290293,0.9465065591907494,0.024472630481663704,-0.3480135197989491,14.387142363706955,28.903119035766952,0.4597702796104587,-2.1636297710508074,-6.4201760970970705,-6.420176097097074,42.691216743677934,6.420176097097074,0.987687890741975,0.9465065591907494
805,42057,Ceatal Izmail,1001,RO,28.8,45.180222,-999,807000,Ialomita,Danube,Danube,C406,786242,5777500.0,2642500.0,785914.6,28.75833,45.24167,False,False,True,True,0,0,0,0,0,0,0,0,1,0,HIST_24h,-,3,,2,,1,1,03/01/1990,01/01/2009,6265.0,,,,True,False,03/01/1990 00:00,01/01/2009 00:00,6265.0,24.0,1095.0,1460.0,0.0,,533.830048,,,,1991-01-03 00:00:00,2009-01-01 00:00:00,6153.0,0.8448963160671215,0.8486079586199488,1.0327909690534318,1.007896513462788,0.6757627260766368,0.7025725761699406,1058.75742435779,1411.7436255436144,0.8486079586199488,212.96737665611616,3.2790969053432057,3.279096905343192,16.301878007009112,3.279096905343192,0.5694183645821083,0.992103486537212
806,42039,Harsova,1001,RO,27.8928,44.6797,-999,-,Danube,Danube,Danube,-,687095,5727500.0,2562500.0,688547.1,27.89167,44.675,False,False,False,False,0,0,0,0,0,0,0,0,0,0,-,No discharge data available for calibration period,-,,-,,0,0,,,,,,,False,False,,,,,,,,,,,,,,,,,,,,,,,,,,,,,,,
807,42025,Zimnicea,1001,RO,25.357306,43.630194,-999,658400,Danube,Danube,Danube,C405,643722,5557500.0,2407500.0,642272.9,25.35833,43.625,False,False,True,True,0,0,0,0,0,0,0,0,1,0,HIST_24h,-,3,,2,,1,1,03/01/1990,01/01/2011,7349.0,,,,True,False,03/01/1990 00:00,01/01/2011 00:00,7349.0,24.0,1095.0,1460.0,0.0,,2541.826048,,,,1991-01-03 00:00:00,2011-01-01 00:00:00,7236.0,0.8809392978519799,0.8915720015726695,1.0491511839030419,1.0017265786839082,0.7538371589881894,0.7673062351210247,880.2405721118283,1159.4425359208783,0.8915720015726695,292.4203320474549,4.915118390304179,4.915118390304188,14.79543708054,4.915118390304188,0.4961480031319413,0.9982734213160918
808,42714,Lungoci,1001,RO,27.509972,45.556611,-999,36030,Siret,Danube,Danube,C029,36300,5677500.0,2657500.0,36424.9,27.50833,45.55833,False,False,True,True,0,0,0,0,0,0,0,0,1,0,HIST_24h,dams   obscillations in low flow,3,,2,,1,1,03/01/1990,01/01/2011,7343.0,,,,True,False,03/01/1990 00:00,01/01/2011 00:00,7343.0,24.0,1095.0,1460.0,0.0,,14903.30214,1.0,,,1991-01-03 00:00:00,2011-01-01 00:00:00,7233.0,0.7911298683042329,0.8175588537446247,0.9039280815563534,0.9666511386372912,0.6572472974159014,0.3684721880074141,79.8427595289739,132.34096684050246,0.8175588537446247,-20.210931906798873,-9.6071918443647,-9.607191844364664,37.95296088847322,9.607191844364664,0.5854508541150995,0.9666511386372912
809,42612,Cosereni,1001,RO,26.571694,44.696972,-999,6265,Ialomita,Danube,Danube,C407,6325,5617500.0,2542500.0,6251.0,26.575,44.69167,False,False,True,True,0,0,0,0,0,0,0,0,1,0,HIST_24h,-,3,,2,,1,1,03/01/1990,01/01/2011,7345.0,,,,True,False,03/01/1990 00:00,01/01/2011 00:00,7345.0,24.0,1095.0,1460.0,0.0,,2540.968192,,,,1991-01-03 00:00:00,2011-01-01 00:00:00,7233.0,0.7181959932715769,0.7460913177687376,1.1095781920256154,0.9458105256698837,0.4562901534352716,0.08207409730458282,18.526199106893277,31.972185059654407,0.7460913177687376,3.958638553369154,10.957819202561543,10.957819202561543,51.281959084447756,10.957819202561543,0.7373668331059716,0.9458105256698837
810,42496,Teleormanu,1001,RO,25.460861,43.952222,-999,-,Teleorman,Danube,Danube,-,1250,5552500.0,2442500.0,1344.1,25.45833,43.95833,False,False,False,False,0,0,0,0,0,0,0,0,0,0,-,No discharge data available for calibration period,-,,-,,0,0,,,,,,,False,False,,,,,,,,,,,,,,,,,,,,,,,,,,,,,,,
811,42318,Cornet,1001,RO,24.297222,45.385111,-999,13733,Olt,Danube,Danube,C019,13750,5432500.0,2582500.0,13868.3,24.30833,45.39167,False,False,True,True,0,0,0,0,0,0,0,0,1,0,HIST_24h,dams regulated small oscillations,3,,2,,1,1,03/01/1990,01/01/2011,7346.0,,,,True,False,03/01/1990 00:00,01/01/2011 00:00,7346.0,24.0,1095.0,1460.0,0.0,,6710.555648,1.0,,,1991-01-03 00:00:00,2011-01-01 00:00:00,7235.0,0.8186272056531434,0.8384069621073245,0.974153124583774,0.9217969331482353,0.6982819516941354,0.6867687870675375,29.42364999431902,46.67500546088357,0.8384069621073245,-2.813592744014543,-2.5846875416225843,-2.584687541622596,27.029832846692397,2.584687541622596,0.5492886748385258,0.9217969331482353
812,42279,Fata Motrului,1001,RO,23.292278,44.599694,-999,-,Motru,Danube,Danube,-,1875,5372500.0,2482500.0,1794.8,23.29167,44.60833,False,False,False,False,0,0,0,0,0,0,0,0,0,0,-,No discharge data available for calibration period,-,,-,,0,0,,,,,,,False,False,,,,,,,,,,,,,,,,,,,,,,,,,,,,,,,
813,444688,Apatfalva,1017,HU,20.5469,46.1785,81.15,28585,Mures,Danube,Danube,-,30050,5132500.0,2622500.0,28134.3,20.55833,46.175,False,False,True,False,1,0,1,0,1,1,1,1,0,0,-,No discharge data available for calibration period,-,,-,,0,0,,,,,,,False,False,,,,,,,,,,,,,,,,,,,,,,,,,,,,,,,
814,444558,Bekes duzzaszto a.,1017,HU,21.1554,46.7622,81.32,8983,Koros,Danube,Danube,-,10150,5167500.0,2692500.0,9141.5,21.175,46.75833,True,True,True,False,1,1,1,1,1,1,1,1,0,0,NRT_24h,same location as 660  use 660 ,0,close to 660,2,close,0,0,08/09/2009,09/07/2021,3721.0,,,,True,False,,,,,,,,,,,,,,,,,,,,,,,,,,,,,,,
815,444557,Bekes duzzaszto f.,1017,HU,21.1565,46.7618,81.32,8983,Koros,Danube,Danube,-,9475,5172500.0,2692500.0,9101.4,21.19167,46.74167,False,False,True,False,1,0,1,0,1,1,1,1,0,0,-,No discharge data available for calibration period old station,-,,-,,0,0,,,,,,,False,False,,,,,,,,,,,,,,,,,,,,,,,,,,,,,,,
816,442532,Budapest Kvassay zsilip f.,1017,HU,19.0688,47.4615,94.76,185006,Danube,Danube,Danube,-,184625,5002500.0,2747500.0,185306.4,19.05833,47.45833,False,False,True,False,1,0,1,0,1,1,1,1,0,0,-,No discharge data available for calibration period,-,,-,,0,0,,,,,,,False,False,,,,,,,,,,,,,,,,,,,,,,,,,,,,,,,
817,442132,Kormend,1017,HU,16.6106,47.0064,184.15,4734,Raba,Danube,Danube,-,4775,4822500.0,2677500.0,4722.8,16.60833,47.00833,True,True,True,True,1,1,1,1,1,1,1,1,1,0,NRT_24h,-,3,,3,,2,1,02/01/2015,31/12/2021,2124.0,01/01/2015 06:00,01/01/2020 00:00,5698.0,True,True,01/01/2015 06:00,01/01/2020 00:00,1424.5,6.0,1095.0,1280.0,0.0,,1647.975168,,,recommended,2015-01-01 06:00:00,2020-01-01 00:00:00,5698.0,0.8064488036052766,0.8300229249230131,1.0855099561047863,0.96453301561933,0.6277404287595956,0.5954042270654538,6.661577412100758,10.2230384487319,0.8300229249230131,1.9906021689611204,8.550995610478605,8.55099561047862,28.616023883599727,8.55099561047862,0.6101307820790587,0.96453301561933
818,444567,Korosladany hid,1017,HU,21.0822,46.953,80.98,8985,Crisul Repede,Danube,Danube,-,8775,5162500.0,2712500.0,3777.0,21.075,46.95833,True,True,True,True,1,1,1,1,1,1,1,1,1,0,NRT_24h,-,3,wrong area from provider  data checked with 671 and 660,3,,1,1,02/01/2015,31/12/2021,2443.0,01/01/2017 06:00,01/01/2020 00:00,3639.0,True,False,02/01/2015 00:00,31/12/2021 00:00,2443.0,24.0,1095.0,1460.0,0.0,,940.677504,,,recommended,2015-01-02 00:00:00,2022-01-01 00:00:00,2444.0,0.7567344899127104,0.7843714120146,1.0879630558277291,1.0703201340364168,0.4591420799613922,0.5113418450355268,12.456741821730066,19.151967259694246,0.7843714120146,2.8075038546288402,8.796305582772897,8.796305582772904,39.028729185531546,8.796305582772904,0.7354304318143279,0.9296798659635832
819,442625,Szob,1017,HU,18.8598,47.8158,100.98,183340,Danube,Danube,Danube,-,183000,4982500.0,2782500.0,183288.6,18.85833,47.80833,False,False,False,False,1,0,1,0,1,1,0,1,0,0,-,No discharge data available for calibration period,-,,-,,0,0,,,,,,,False,False,,,,,,,,,,,,,,,,,,,,,,,,,,,,,,,
820,442536,Tass zsilip a.,1017,HU,18.9766,47.0324,89.28,188257,Danube,Danube,Danube,-,187300,5002500.0,2697500.0,187439.8,18.975,47.025,False,False,False,False,1,0,1,0,1,1,0,1,0,0,-,No discharge data available for calibration period,-,,-,,0,0,,,,,,,False,False,,,,,,,,,,,,,,,,,,,,,,,,,,,,,,,
821,444689,Tunyogmatolcs,1017,HU,22.4533,47.9837,106.21,15522,Somes,Danube,Danube,-,15125,5247500.0,2842500.0,15392.5,22.45833,47.99167,False,False,False,False,1,0,1,0,1,1,0,1,0,0,-,No discharge data available for calibration period,-,,-,,0,0,,,,,,,False,False,,,,,,,,,,,,,,,,,,,,,,,,,,,,,,,
822,44201,Hetin,1020,RS,20.798278,45.652777,76.69,2271,Stari Begej,Danube,Danube,-,2000,5162500.0,2567500.0,1825.4,20.80833,45.65833,True,True,True,True,1,1,1,1,1,1,1,1,1,0,NRT_6h,uncertain location,3,,3,,1,1,02/01/1991,31/12/2021,9624.0,02/02/2009 18:00,31/12/2021 18:00,17865.0,True,True,02/02/2009 18:00,31/12/2021 18:00,4466.25,6.0,1095.0,1460.0,1.0,0.0,1825.38432,,,recommended,2009-02-02 18:00:00,2021-12-31 18:00:00,17865.0,0.4654768302473612,0.6357215065452074,1.2998022236722397,1.2512664420289652,-0.6246299425819135,-1.460581327066464,2.574856458709124,4.947627533945467,0.6357215065452074,0.8444780188444957,29.980222367224282,29.980222367223973,91.41122382487656,29.980222367223973,1.2746097216724486,0.7487335579710348
823,42914,Gamzigrad,1020,RS,22.173151,43.924319,152.2,1213,Crni Timok,Danube,Danube,-,1200,5297500.0,2392500.0,1172.3,22.175,43.925,False,False,True,True,1,0,1,0,1,1,1,1,1,0,HIST_24h,-,3,,2,,1,1,01/01/1991,01/01/2020,7818.0,,,,True,False,01/01/1991 00:00,01/01/2020 00:00,7818.0,24.0,1095.0,1460.0,1.0,0.0,1172.341888,,,recommended,1991-01-03 00:00:00,2020-01-01 00:00:00,7816.0,0.7472286515292159,0.7594131736442532,0.9281151488647038,0.970950012580647,0.5544023910437035,0.07590092930832992,4.256160450427868,9.06528402110974,0.7594131736442532,-0.6392395202837882,-7.188485113529633,-7.188485113529622,47.86210030492412,7.188485113529622,0.667530979772696,0.970950012580647
824,931,Wilsele-Wijgmaal,1022,BE,4.706311,50.925234,15,899.9,Dyle,Scheldt,Scheldt,-,875,3947500.0,3097500.0,903.5,4.70833,50.925,False,False,True,False,0,0,0,0,0,0,1,0,0,0,-,Not enough discarge data available for calibration period,-,,-,,0,0,09/11/2009,08/01/2013,993.0,08/11/2009 12:00,07/01/2013 12:00,3961.0,False,False,,,,,,,,,,,,,,,,,,,,,,,,,,,,,,,
825,21974,Eppegem,1022,BE,4.455651,50.960522,-,1083.6,Zenne,Scheldt,Scheldt,-,1150,3927500.0,3107500.0,1104.4,4.45833,50.95833,True,True,True,False,0,1,0,1,1,0,1,0,1,0,-,Not enough discarge data available for calibration period,-,Q highly impacted by city of Brussels (overflows sewer system) and overflow of neighbouring canal Hydrodynamics are very important,3,DP,0,1,02/01/2014,31/12/2021,2792.0,01/01/2014 06:00,31/12/2021 18:00,11414.0,True,True,,,,,,,,,,,,exclude,,,,,,,,,,,,,,,,,,,
826,41920,Mehikoorma,1028,EE,27.475556,58.2325,28,43895,Lake Peipus,Narva,Narva,-,31775,5337500.0,4027500.0,30103.7,27.49167,58.225,False,False,False,False,1,0,1,0,1,1,0,0,0,0,-,No discharge data available for calibration period,-,,-,,0,0,,,,,,,False,False,,,,,,,,,,,,,,,,,,,,,,,,,,,,,,,
827,41925,Mustvee,1028,EE,26.951111,58.8475,28,43895,Mustvee,Narva,Narva,-,175,5292500.0,4087500.0,176.6,26.95833,58.84167,False,False,False,False,1,0,1,0,1,1,0,0,0,0,-,No discharge data available for calibration period Possibley wrong uparea,-,,-,,0,0,,,,,,,False,False,,,,,,,,,,,,,,,,,,,,,,,,,,,,,,,
828,41922,Praaga,1028,EE,27.233333,58.433333,28,43895,Emajogi,Narva,Narva,-,9825,5317500.0,4047500.0,9789.9,27.225,58.425,False,False,False,False,1,0,1,0,1,1,0,0,0,0,-,No discharge data available for calibration period,-,,-,,0,0,,,,,,,False,False,,,,,,,,,,,,,,,,,,,,,,,,,,,,,,,
829,41019,Räpina,1028,EE,27.45446,58.09556,30.79,1130,Vohandu jogi,Narva,Narva,-,1150,5337500.0,4012500.0,1111.2,27.45833,58.09167,True,True,True,False,1,1,1,1,1,1,1,1,1,0,-,No discharge data available for calibration period,-,,3,,1,0,01/01/1991,31/12/2021,10514.0,04/10/2019 18:00,31/12/2021 18:00,3070.0,True,False,01/01/1991 00:00,31/12/2021 00:00,10514.0,24.0,1095.0,1460.0,1.0,0.0,1111.178112,,,,1991-01-03 00:00:00,2022-01-01 00:00:00,10513.0,0.4628849680224504,0.7179313736636148,1.3674487859123814,1.2718662122156148,-0.8814091930984047,-0.0015430791259849475,4.324252808751149,7.098519374072319,0.7179313736636148,3.078348414720602,36.74487859123806,36.744878591238134,51.616686303457946,36.744878591238134,1.3716447036672492,0.7281337877843852
830,21965,Aarschot,1022,BE,4.822323,50.987652,-,2146.42,Demer,Scheldt,Scheldt,-,2100,3962500.0,3112500.0,2153.7,4.825,50.99167,True,True,True,True,0,1,0,1,1,0,1,0,1,0,NRT_6h,-,3,,3,,1,1,02/01/2014,31/12/2021,2548.0,01/01/2014 06:00,31/12/2021 18:00,10355.0,True,True,01/01/2014 06:00,31/12/2021 18:00,2588.75,6.0,1095.0,1460.0,1.0,1.0,2153.689856,,,recommended,2014-01-01 06:00:00,2021-12-31 18:00:00,10355.0,0.7445605038031904,0.7767346798491017,1.1204933411463915,0.9702798422854766,0.4822819638801362,0.5561803087632577,4.057366221048598,7.387447164822161,0.7767346798491017,1.6119995042023738,12.049334114639109,12.049334114639159,30.32790090531409,12.049334114639159,0.7195262581170115,0.9702798422854766
831,45837,Prijepolje,1020,RS,19.637294,43.381888,443.37,3160,Lim,Danube,Danube,C782,3225,5102500.0,2302500.0,3186.0,19.64167,43.39167,True,True,True,True,1,1,1,1,1,1,1,1,1,0,NRT_6h,-,3,,3,,1,1,02/01/1991,31/12/2021,9595.0,28/08/2011 12:00,31/12/2021 18:00,14751.0,True,True,28/08/2011 12:00,31/12/2021 18:00,3687.75,6.0,1095.0,1460.0,0.0,,375.50848,,,recommended,2011-08-28 12:00:00,2021-12-31 18:00:00,14751.0,0.7825342766856505,0.8324026589881817,0.8614914149402054,0.9957757879864811,0.6766375168034233,0.40011180830033577,25.074549814003834,42.360473502177776,0.8324026589881817,-9.306863330371302,-13.850858505979458,-13.850858505979453,37.31698094690355,13.850858505979453,0.5686497016587402,0.9957757879864811
832,47260,Raska,1020,RS,20.613816,43.296433,392.54,6270,Ibar,Danube,Danube,-,6275,5182500.0,2307500.0,6145.2,20.60833,43.29167,True,True,True,False,1,1,1,1,1,1,1,1,1,0,NRT_6h,Oscillations  close to 257,2,close to 257,3,,1,1,01/01/1991,31/12/2021,9513.0,28/08/2011 12:00,31/12/2021 18:00,14779.0,True,True,28/08/2011 12:00,31/12/2021 18:00,3694.75,6.0,1095.0,1460.0,0.0,,1447.771008,,,recommended,2011-08-28 12:00:00,2021-12-31 18:00:00,14779.0,0.4134803790032121,0.7148867895920046,1.5104536065555636,1.04639869200182,-0.4552349029828613,0.23329198066529322,26.536098880827183,51.01626592451386,0.7148867895920046,19.69791401830473,51.04536065555634,51.04536065555637,68.7658975719246,51.04536065555637,1.2063311746708933,0.95360130799818
833,A133003001,L'Ill à Ensisheim,1021,FR,7.348209,47.866887,214,1038,Ill,Rhine,Rhine,-,975,4122500.0,2747500.0,1041.6,7.35833,47.85833,True,True,True,True,1,1,1,1,1,1,1,0,0,0,NRT_6h,-,3,,3,,1,1,24/10/2011,31/12/2021,3534.0,24/10/2011 00:00,31/12/2021 18:00,14180.0,True,True,24/10/2011 00:00,31/12/2021 18:00,3545.0,6.0,1095.0,1460.0,1.0,0.0,1041.612352,,,,2011-10-24 00:00:00,2021-12-31 18:00:00,14180.0,0.8595689715756871,0.8813889755310926,1.0267072327539413,0.9297218217554465,0.7710304961295125,0.6007782214256631,3.9683089001647383,6.891014620297059,0.8813889755310926,0.30993553154489045,2.670723275394133,2.6707232753941375,34.195030465839366,2.6707232753941375,0.4785075797419373,0.9297218217554465
834,3028,Boretto,1016,IT,10.558932,44.906332,30,55183,Po,Po,Po,C464,55525,4367500.0,2422500.0,55603.9,10.55833,44.90833,True,True,True,True,1,1,1,1,1,1,1,1,1,0,NRT_6h,-,3,,3,,1,1,03/01/1990,31/12/2021,9554.0,20/09/2006 18:00,31/12/2021 18:00,15760.0,True,True,20/09/2006 18:00,31/12/2021 18:00,3940.0,6.0,1095.0,1460.0,0.0,,1661.41952,,,,2006-09-20 18:00:00,2021-12-31 18:00:00,15760.0,0.888932665676395,0.8967359660453947,0.9635009036969913,0.9815525607674863,0.7992582555443866,0.6283413212412764,269.17084625361815,385.7697692045818,0.8967359660453947,-42.85244757634979,-3.6499096303008907,-3.6499096303008747,22.926327887967187,3.6499096303008747,0.44804212352814926,0.9815525607674863
836,4031,Ladesic Draga,1031,HR,15.367278,45.479444,147.84,1445,Kupa,Danube,Danube,-,1600,4742500.0,2502500.0,1405.0,15.375,45.475,True,True,True,True,1,1,1,1,1,1,1,1,1,0,NRT_6h,-,3,,3,,1,1,03/01/2009,31/12/2021,4554.0,01/01/2014 00:00,31/12/2021 18:00,11271.0,True,True,01/01/2014 00:00,31/12/2021 18:00,2817.75,6.0,1095.0,1460.0,0.0,,277.680704,,,recommended,2014-01-01 00:00:00,2021-12-31 18:00:00,11271.0,0.8499855108733376,0.8733570210162093,0.9344519592121198,1.0465763584977943,0.7497094588470099,0.638865817112003,21.59414108949644,39.834100362551034,0.8733570210162093,-3.6470302685487894,-6.554804078788063,-6.5548040787880275,38.81112951324055,6.5548040787880275,0.5002904567878462,0.9534236415022057
837,4024,Kamanje,1031,HR,15.392528,45.637917,123.83,2047,Kupa,Danube,Danube,-,2225,4737500.0,2517500.0,2026.6,15.39167,45.64167,True,True,True,True,1,1,1,1,1,1,1,1,1,0,NRT_6h,moved downstream,3,use 1698,3,close,0,1,02/01/1991,31/12/2021,9231.0,01/01/2014 00:00,31/12/2021 18:00,11484.0,True,True,,,,,,,,,,,,recommended,,,,,,,,,,,,,,,,,,,
838,4111,Karlovac,1031,HR,15.551444,45.496361,103.17,3461,Kupa,Danube,Danube,-,3050,4752500.0,2502500.0,2528.7,15.54167,45.49167,False,False,True,False,1,0,1,0,1,1,1,1,0,0,-,No discharge data available for calibration period,-,,-,,0,0,,,,,,,False,False,,,,,,,,,,,,,,,,,,,,,,,,,,,,,,,
839,4107,Jamnicka Kiselica,1031,HR,15.8575,45.548611,100.79,6895,Kupa,Danube,Danube,C453,6600,4772500.0,2507500.0,6323.0,15.85833,45.54167,True,True,True,False,1,1,1,1,1,1,1,1,1,0,NRT_6h,close to 840,2,close to 840,3,,1,1,02/01/1991,31/12/2021,8243.0,01/01/2014 00:00,31/12/2021 18:00,11467.0,True,True,01/01/2014 00:00,31/12/2021 18:00,2866.75,6.0,1095.0,1460.0,0.0,,1110.642688,,,recommended,2014-01-01 00:00:00,2021-12-31 18:00:00,11467.0,0.9109079215081841,0.9327830627383367,1.0115935752322578,1.0573137924804097,0.851264172797743,0.6647663167836348,48.15264037781465,73.3154706369489,0.9327830627383367,1.9838167581699586,1.1593575232257403,1.1593575232257693,28.14076736437182,1.1593575232257693,0.3856628413553156,0.9426862075195903
840,4065,Sisinec,1031,HR,16.077194,45.4485,94.81,7364,Kupa,Danube,Danube,-,7050,4787500.0,2502500.0,6825.1,16.075,45.44167,True,True,True,True,1,1,1,1,1,1,1,1,1,0,NRT_6h,-,3,,3,,1,1,03/01/2009,31/12/2021,4632.0,01/01/2014 00:00,31/12/2021 18:00,11493.0,True,True,01/01/2014 00:00,31/12/2021 18:00,2873.25,6.0,1095.0,1460.0,0.0,,502.070016,,,recommended,2014-01-01 00:00:00,2021-12-31 18:00:00,11493.0,0.9139605874598579,0.9288691309335692,1.014059818918359,1.046319558159486,0.8451746286893645,0.6758937613584244,50.30745462065415,77.67838890037984,0.9288691309335692,2.4702395642629704,1.405981891835903,1.4059818918359017,28.63340513376484,1.4059818918359017,0.393478552542112,0.953680441840514
841,4010,Farkasic,1031,HR,16.152694,45.483278,93.82,8992,Kupa,Danube,Danube,C454,8525,4802500.0,2497500.0,8419.8,16.15833,45.475,True,True,True,True,1,1,1,1,1,1,1,1,1,0,NRT_6h,moved downstream of confluence,3,,3,,1,1,02/01/2000,31/12/2021,7882.0,01/01/2014 00:00,31/12/2021 18:00,11442.0,True,True,01/01/2014 00:00,31/12/2021 18:00,2860.5,6.0,1095.0,1460.0,0.0,,515.244736,,,recommended,2014-01-01 00:00:00,2021-12-31 18:00:00,11442.0,0.9089451297335668,0.935923979376327,1.0284210730386705,1.0581162248223521,0.8521301060477091,0.6903987423525093,54.96010207334068,85.46246214893677,0.935923979376327,5.617814985747845,2.842107303867038,2.8421073038670435,27.80485080412898,2.8421073038670435,0.3845385467704007,0.9418837751776479
842,3217,Kostajnica,1031,HR,16.548722,45.222389,103.2,8876,Una,Danube,Danube,-,9000,4832500.0,2472500.0,7692.7,16.54167,45.225,True,True,True,True,1,1,1,1,1,1,1,1,1,0,NRT_6h,-,3,,3,,1,1,03/01/2009,31/12/2021,4633.0,01/01/2014 00:00,31/12/2021 18:00,11493.0,True,True,01/01/2014 00:00,31/12/2021 18:00,2873.25,6.0,1095.0,1460.0,0.0,,672.752832,,,recommended,2014-01-01 00:00:00,2021-12-31 18:00:00,11493.0,0.8191797547533717,0.8917324106420615,0.8795097630772337,0.9196495613455204,0.7718145004496633,0.7014858811103579,65.56629781998768,105.69807596635667,0.8917324106420615,-28.423685816082223,-12.049023692276487,-12.04902369227663,27.794068684818356,12.04902369227663,0.4776876589889418,0.9196495613455204
843,3026,Dubica,1031,HR,16.809306,45.185722,94.17,9368,Una,Danube,Danube,-,9400,4852500.0,2477500.0,8059.3,16.80833,45.19167,False,False,True,False,1,0,1,0,1,1,1,1,1,0,-,Not enough discarge data available for calibration period,-,There is no good rating curve=no discharge  excluded by DP,2,DP,0,1,03/01/2010,29/12/2015,2008.0,22/05/2012 06:00,29/12/2015 00:00,5084.0,True,False,,,,,,,,,,,,exclude,,,,,,,,,,,,,,,,,,,
844,3405,Drenje Brdovecko,1031,HR,15.688028,45.862333,132.75,10750,Sava,Danube,Danube,-,10575,4762500.0,2542500.0,9912.8,15.70833,45.85833,True,True,True,False,1,1,1,1,1,1,1,1,1,0,NRT_6h,same location as 102 but data are not the same Moved a bit upstream   use 102,0,some issues with low flow in 2019  same location as 102  close to 102,3,close,0,1,03/01/2009,31/12/2021,4632.0,01/01/2014 00:00,31/12/2021 18:00,11493.0,True,True,,,,,,,,,,,,recommended,,,,,,,,,,,,,,,,,,,
845,3121,Zagreb,1031,HR,15.953306,45.7845,112.26,12450,Sava,Danube,Danube,C023,12250,4787500.0,2537500.0,11572.6,15.95833,45.79167,True,True,True,True,1,1,1,1,1,1,1,1,1,0,NRT_6h,-,3,,3,,1,1,02/01/1991,31/12/2021,10421.0,01/01/2014 00:00,31/12/2021 18:00,11462.0,True,True,01/01/2014 00:00,31/12/2021 18:00,2865.5,6.0,1095.0,1460.0,0.0,,508.608864,,,recommended,2014-01-01 00:00:00,2021-12-31 18:00:00,11462.0,0.9030442741932087,0.9271624948203461,0.9456069872496353,1.033712175395015,0.8535522601083227,0.7471806537626129,70.864502750811,109.43030680899543,0.9271624948203461,-17.02719326350774,-5.439301275036406,-5.439301275036471,22.637517188073755,5.439301275036471,0.38268490941201005,0.9662878246049851
846,3096,Rugvica,1031,HR,16.228278,45.743722,95.61,12730,Sava,Danube,Danube,C459,12925,4812500.0,2527500.0,11846.0,16.225,45.74167,False,False,True,True,1,0,1,0,1,1,0,1,1,0,HIST_24h,-,3,There is no good rating curve=no discharge  excluded by DP,2,DP,0,1,03/01/1990,01/01/2013,5684.0,,,,True,False,,,,,,,,,,,,exclude,,,,,,,,,,,,,,,,,,,
847,3373,Dubrovcak Lijevi,1031,HR,16.336,45.647694,94.53,12750,Sava,Danube,Danube,-,12950,4812500.0,2522500.0,11898.9,16.34167,45.64167,False,False,False,False,1,0,1,0,1,1,0,1,0,0,-,No discharge data available for calibration period,-,mapped on main river,-,,0,0,,,,,,,False,False,,,,,,,,,,,,,,,,,,,,,,,,,,,,,,,
848,3020,Crnac,1031,HR,16.415722,45.451778,91.34,22852,Sava,Danube,Danube,-,22775,4827500.0,2502500.0,21444.1,16.40833,45.45833,False,False,False,False,1,0,1,0,1,1,0,1,1,1,HIST_24h,DO NOT USE Wrong LDD,0,There is no good rating curve=no discharge  excluded by DP,2,DP,0,1,02/01/1991,01/01/2013,2540.0,,,,True,False,,,,,,,,,,,,exclude,,,,,,,,,,,,,,,,,,,
849,3036,Gusce,1031,HR,16.582583,45.421944,89.14,23284,Sava,Danube,Danube,-,22925,4837500.0,2502500.0,21639.9,16.575,45.425,False,False,False,False,1,0,1,0,1,1,0,1,0,0,-,No discharge data available for calibration period,-,,-,,0,0,,,,,,,False,False,,,,,,,,,,,,,,,,,,,,,,,,,,,,,,,
850,3219,Jasenovac,1031,HR,16.907472,45.266806,86.82,38953,Sava,Danube,Danube,C024,23400,4857500.0,2487500.0,28719.1,16.90833,45.275,True,True,True,False,1,1,1,1,1,1,1,1,1,0,NRT_6h,Moved on Sava Moved on main stream  wrong LDD cannot be located correctly on river,1,,3,,1,1,02/01/1991,31/12/2021,8783.0,01/01/2014 00:00,31/12/2021 18:00,11493.0,True,True,01/01/2014 00:00,31/12/2021 18:00,2873.25,6.0,1095.0,1460.0,0.0,,5127.638016,1.0,,recommended,2014-01-01 00:00:00,2021-12-31 18:00:00,11493.0,0.6326295573398487,0.8679382631201933,0.6873258235523253,1.1405546127858228,0.563188643802117,0.3492913078775707,278.4872699024216,377.8586942789783,0.8679382631201933,-244.62031471085555,-31.267417644767583,-31.267417644767466,35.59629864380898,31.267417644767466,0.6609170569730262,0.8594453872141772
851,3104,Stara Gradiska,1031,HR,17.249944,45.15025,85.47,40262,Sava,Danube,Danube,-,39300,4882500.0,2477500.0,37895.3,17.24167,45.14167,True,True,True,True,1,1,1,1,1,1,1,1,1,0,NRT_6h,-,3,,3,,1,1,03/01/2009,31/12/2021,4628.0,01/01/2014 00:00,31/12/2021 18:00,11472.0,True,True,01/01/2014 00:00,31/12/2021 18:00,2868.0,6.0,1095.0,1460.0,0.0,,1483.508096,1.0,,recommended,2014-01-01 00:00:00,2021-12-31 18:00:00,11472.0,0.9098807213689462,0.9122971093522558,0.9862579759216175,1.0155191535606976,0.8239678131071977,0.8126982247347623,184.00657431523788,256.97270200170806,0.9122971093522558,-11.45267881170668,-1.374202407838264,-1.3742024078382498,22.078876186032502,1.3742024078382498,0.4195618987620332,0.9844808464393024
852,3179,Davor C.S.,1031,HR,17.539556,45.128028,82.59,47179,Sava,Danube,Danube,C025,40825,4907500.0,2472500.0,44235.8,17.54167,45.125,True,True,True,True,1,1,1,1,1,1,1,1,1,0,NRT_6h,-,3,,3,,1,1,02/01/1991,31/12/2021,8063.0,01/01/2014 00:00,31/12/2021 18:00,11493.0,True,True,01/01/2014 00:00,31/12/2021 18:00,2873.25,6.0,1095.0,1460.0,0.0,,2074.492672,,,recommended,2014-01-01 00:00:00,2021-12-31 18:00:00,11493.0,0.8482590719618948,0.9041201499651033,0.8847275558876774,1.0233372497848954,0.7919799897987564,0.7659342892990253,224.2869184994308,314.26675836584036,0.9041201499651033,-109.92693855741692,-11.52724441123225,-11.527244411232266,23.51934986740902,11.527244411232266,0.4560921071463999,0.9766627502151046
853,3177,Slavonski Kobas,1031,HR,17.737833,45.098861,82.69,48744,Sava,Danube,Danube,-,46100,4917500.0,2472500.0,45839.7,17.74167,45.09167,True,True,True,True,1,1,1,1,1,1,1,1,1,0,NRT_6h,-,3,,3,,1,1,03/01/2009,31/12/2021,4629.0,01/01/2014 00:00,31/12/2021 18:00,11493.0,True,True,01/01/2014 00:00,31/12/2021 18:00,2873.25,6.0,1095.0,1460.0,0.0,,368.660064,,,recommended,2014-01-01 00:00:00,2021-12-31 18:00:00,11493.0,0.9052787503783538,0.9177714187075876,0.95308697331153,0.9968785459397532,0.8370140695971686,0.8362633095384779,198.99456337913333,280.89764221636216,0.9177714187075876,-45.32951134470405,-4.691302668846973,-4.691302668846999,20.59461261709873,4.691302668846999,0.40371515998638396,0.9968785459397532
854,3098,Slavonski Brod,1031,HR,18.004778,45.152944,81.8,50858,Sava,Danube,Danube,C463,49725,4947500.0,2477500.0,47763.7,18.00833,45.15833,True,True,True,True,1,1,1,1,1,1,1,1,1,0,NRT_6h,-,3,,3,,1,1,02/01/1991,31/12/2021,6535.0,01/01/2014 00:00,31/12/2021 18:00,8200.0,True,True,01/01/2014 00:00,31/12/2021 18:00,2050.0,6.0,1095.0,1460.0,0.0,,1924.02176,1.0,,recommended,2014-01-01 00:00:00,2021-12-31 18:00:00,8200.0,0.9084054447691935,0.9161735189992651,0.9678598647952799,0.9818424853026355,0.8360950592881945,0.8346367002994344,206.32903758670787,286.2720750856801,0.9161735189992651,-32.52061529968261,-3.214013520472021,-3.214013520472014,20.391505829723027,3.214013520472014,0.40485175152369857,0.9818424853026355
855,3101,Slavonski Samac,1031,HR,18.473111,45.06575,80.7,62288,Sava,Danube,Danube,-,61075,4987500.0,2477500.0,58845.3,18.475,45.05833,False,False,False,False,1,0,1,0,1,1,0,1,0,0,-,No discharge data available for calibration period,-,,-,,0,0,,,,,,,False,False,,,,,,,,,,,,,,,,,,,,,,,,,,,,,,,
856,3211,Zupanja Stepenica,1031,HR,18.686667,45.073472,76.28,62891,Sava,Danube,Danube,C026,61425,4997500.0,2482500.0,59242.1,18.69167,45.075,False,False,True,True,0,0,0,0,0,1,1,1,1,0,NRT_6h,-,3,,2,,1,1,02/01/1991,31/12/2021,8708.0,22/05/2012 06:00,31/12/2021 18:00,10178.0,True,True,22/05/2012 06:00,31/12/2021 18:00,2544.5,6.0,1095.0,1460.0,0.0,,1823.820288,1.0,,recommended,2012-05-22 06:00:00,2021-12-31 18:00:00,10178.0,0.9023902698921655,0.9082195132566461,0.989533008315581,0.9684651977974235,0.8221463760296918,0.8378176574041541,254.91330619467197,353.7837132817816,0.9082195132566461,-12.02340518525473,-1.0466991684418598,-1.0466991684418996,22.191512429935464,1.0466991684418996,0.421726954284768,0.9684651977974235
857,5115,Donja Dubrava,1031,HR,16.816639,46.309028,129.7,16770,Drava,Danube,Danube,-,17000,4842500.0,2602500.0,16701.1,16.80833,46.30833,True,True,True,False,1,1,1,1,1,1,1,1,1,0,NRT_6h,dams  oscillations,1,Regulated,1,,1,0,03/01/2009,31/12/2021,4633.0,01/01/2014 00:00,31/12/2021 18:00,11490.0,True,True,01/01/2014 00:00,31/12/2021 18:00,2872.5,6.0,1095.0,1460.0,0.0,,1057.74464,1.0,,recommended,2014-01-01 00:00:00,2021-12-31 18:00:00,11490.0,0.743321784993091,0.7723517034276964,0.992598119971248,1.1183434463707285,0.4822724775915491,0.4215230607533712,94.59606807251745,128.18328483201702,0.7723517034276964,-2.5444530359825874,-0.7401880028751734,-0.7401880028751947,27.51824211972611,0.7401880028751947,0.7195328501246153,0.8816565536292715
858,5008,Botovo,1031,HR,16.939111,46.242361,121.55,31038,Drava,Danube,Danube,-,31300,4852500.0,2597500.0,31121.6,16.94167,46.24167,True,True,True,False,1,1,1,1,1,1,1,1,1,0,NRT_6h,obscillations  close to 691  use 691,1,,3,,1,0,02/01/1991,31/12/2021,9332.0,01/01/2014 00:00,31/12/2021 18:00,11493.0,True,True,01/01/2014 00:00,31/12/2021 18:00,2873.25,6.0,1095.0,1460.0,0.0,,1383.527424,,,recommended,2014-01-01 00:00:00,2021-12-31 18:00:00,11493.0,0.7297555199539274,0.8236544582464256,1.035225009272947,1.2017263681840609,0.49598277389351997,0.475720039875431,127.45259507918567,172.25979394860516,0.8236544582464256,18.295449906053612,3.522500927294679,3.522500927294697,24.53899120589523,3.522500927294697,0.7099417061326115,0.7982736318159391
859,5098,Novo Virje Skela,1031,HR,17.15275,46.110167,108.86,31803,Drava,Danube,Danube,-,32150,4867500.0,2582500.0,31892.2,17.15833,46.10833,True,True,True,False,1,1,1,1,1,1,1,1,1,0,NRT_6h,oscillations,1,,3,,1,0,03/01/2009,31/12/2021,4633.0,01/01/2014 00:00,31/12/2021 18:00,11493.0,True,True,01/01/2014 00:00,31/12/2021 18:00,2873.25,6.0,1095.0,1460.0,0.0,,770.639808,,,recommended,2014-01-01 00:00:00,2021-12-31 18:00:00,11493.0,0.7198307608652617,0.8317767098846924,1.0472854105151506,1.2189972994640184,0.4831067448146955,0.5041053358166783,124.13411246391242,170.8228838944968,0.8317767098846924,24.74243736315611,4.728541051515026,4.728541051515054,23.72333970431931,4.728541051515054,0.7189528880151349,0.7810027005359816
860,5063,Terezino Polje,1031,HR,17.461778,45.944528,100.67,33916,Drava,Danube,Danube,-,34300,4892500.0,2567500.0,34237.9,17.45833,45.94167,True,True,True,False,1,1,1,1,1,1,1,1,1,0,NRT_6h,oscillations Moved upstream close to 659,1,close to 659 but longer data and RT,3,,1,0,02/01/1991,31/12/2021,9336.0,01/01/2014 00:00,31/12/2021 18:00,11493.0,True,True,01/01/2014 00:00,31/12/2021 18:00,2873.25,6.0,1095.0,1460.0,0.0,,2345.72928,,,recommended,2014-01-01 00:00:00,2021-12-31 18:00:00,11493.0,0.7338957295129889,0.8459283578303306,1.0798110705405521,1.2017513441584387,0.4796956285087487,0.559582506767822,121.00631461400523,169.72428704754768,0.8459283578303306,41.981584344974365,7.981107054055256,7.9811070540552125,23.00447603918681,7.9811070540552125,0.7213212678767004,0.7982486558415613
861,5164,Vrbovka,1031,HR,17.715083,45.829889,93.21,35029,Drava,Danube,Danube,-,35425,4922500.0,2557500.0,34556.6,17.70833,45.825,False,False,False,False,0,0,0,0,0,1,0,1,0,0,-,No discharge data available for calibration period,-,,-,,0,0,,,,,,,False,False,,,,,,,,,,,,,,,,,,,,,,,,,,,,,,,
862,5056,Podravska Moslavina,1031,HR,17.981222,45.790528,90.94,36162,Drava,Danube,Danube,-,35775,4942500.0,2552500.0,35967.2,17.975,45.79167,False,False,False,False,0,0,0,0,0,1,0,1,0,0,-,No discharge data available for calibration period,-,,-,,0,0,,,,,,,False,False,,,,,,,,,,,,,,,,,,,,,,,,,,,,,,,
863,5150,Donji Miholjac C.S.,1031,HR,18.172444,45.774639,88.57,37142,Drava,Danube,Danube,-,37725,4952500.0,2552500.0,37862.9,18.175,45.775,True,True,True,False,1,1,1,1,1,1,1,1,1,0,NRT_6h,close to 864,2,close to 864,3,close,0,1,02/01/1991,31/12/2021,9229.0,01/01/2014 00:00,31/12/2021 18:00,11493.0,True,True,,,,,,,,,,,,recommended,,,,,,,,,,,,,,,,,,,
864,5005,Belisce,1031,HR,18.4185,45.688472,83.99,38500,Drava,Danube,Danube,-,37900,4982500.0,2542500.0,38134.1,18.425,45.69167,True,True,True,True,1,1,1,1,1,1,1,1,1,0,NRT_6h,-,3,,3,,1,1,03/01/2009,31/12/2021,4633.0,01/01/2014 00:00,31/12/2021 18:00,11493.0,True,True,01/01/2014 00:00,31/12/2021 18:00,2873.25,6.0,1095.0,1460.0,0.0,,3896.184064,,,recommended,2014-01-01 00:00:00,2021-12-31 18:00:00,11493.0,0.6813489351579918,0.8410241168078985,1.0762832319919322,1.265416725556439,0.4011829021533575,0.521989219545463,122.69907473752745,174.83968038818992,0.8410241168078985,42.135346404972445,7.628323199193198,7.62832319919323,22.213848424166937,7.62832319919323,0.7738327324730099,0.734583274443561
865,5053,Osijek,1031,HR,18.701833,45.560944,81.48,39982,Drava,Danube,Danube,-,39975,4997500.0,2532500.0,39926.5,18.70833,45.55833,False,False,False,False,1,0,1,0,1,1,0,1,0,0,-,No discharge data available for calibration period,-,,-,,0,0,,,,,,,False,False,,,,,,,,,,,,,,,,,,,,,,,,,,,,,,,
866,5170,Batina,1031,HR,18.854944,45.847306,80.45,210250,Danube,Danube,Danube,-,209125,5002500.0,2572500.0,210491.5,18.84167,45.85833,True,True,True,True,1,1,1,1,1,1,1,1,1,0,NRT_6h,-,3,use 228,3,close,0,1,03/01/2009,31/12/2021,4631.0,01/01/2014 00:00,31/12/2021 18:00,11482.0,True,True,,,,,,,,,,,,recommended,,,,,,,,,,,,,,,,,,,
867,5001,Aljmas,1031,HR,18.951333,45.53125,78.08,251573,Danube,Danube,Danube,-,253200,5017500.0,2532500.0,252033.5,18.95833,45.54167,True,True,True,False,1,1,1,1,1,1,1,1,1,0,NRT_6h,close to 261,2,close to 261,3,close,0,1,03/01/2009,31/12/2021,4633.0,01/01/2014 00:00,31/12/2021 18:00,11493.0,True,True,,,,,,,,,,,,recommended,,,,,,,,,,,,,,,,,,,
868,5130,Dalj,1031,HR,18.995028,45.491028,75.2,252208,Danube,Danube,Danube,-,253225,5022500.0,2532500.0,252870.1,18.99167,45.49167,True,True,True,False,1,1,1,1,1,1,1,1,1,0,NRT_6h,seems inconsistent with 867 and 261 and has low quality data  use 261,1,,3,,1,0,03/01/2009,31/12/2021,4633.0,01/01/2014 00:00,31/12/2021 18:00,11493.0,True,True,01/01/2014 00:00,31/12/2021 18:00,2873.25,6.0,1095.0,1460.0,0.0,,663.115648,,1.0,recommended,2014-01-01 00:00:00,2021-12-31 18:00:00,11493.0,0.5381552677911092,0.7510275672797424,1.103357111383005,1.3750074558472403,-0.15089424327778245,0.23664330588948757,607.4062680013084,855.2964032068417,0.7510275672797424,285.2719536818966,10.335711138300523,10.335711138300507,22.006985434870916,10.335711138300507,1.0727973915319677,0.6249925441527597
869,5070,Vukovar,1031,HR,19.002056,45.355417,76.19,253147,Danube,Danube,Danube,-,253950,5022500.0,2517500.0,254102.5,19.00833,45.35833,True,True,True,False,1,1,1,1,1,1,1,1,1,0,NRT_6h,lake  outliers  moved station downstream  close to 261,2,close to 261,3,,1,1,03/01/2009,31/12/2021,4176.0,01/01/2014 00:00,31/12/2021 18:00,9659.0,True,True,01/01/2014 00:00,31/12/2021 18:00,2414.75,6.0,1095.0,1460.0,0.0,,1232.446592,,,recommended,2014-01-01 00:00:00,2021-12-31 18:00:00,9659.0,0.5039384953004453,0.7484297386187504,1.0904202812756625,1.4178679130627119,-0.18154978063801464,0.21399848317878367,608.9511306664282,847.7855122153828,0.7484297386187504,253.2862814664723,9.042028127566237,9.042028127566244,21.738853047704406,9.042028127566244,1.0869911594111565,0.5821320869372881
870,5024,Ilok,1031,HR,19.37825,45.230444,73.97,253737,Danube,Danube,Danube,-,255550,5052500.0,2502500.0,254717.4,19.375,45.225,True,True,True,True,1,1,1,1,1,1,1,1,1,0,NRT_6h,outliers removed after qc,3,,3,,1,1,03/01/2009,31/12/2021,4621.0,27/10/2012 12:00,31/12/2021 18:00,13145.0,True,True,27/10/2012 12:00,31/12/2021 18:00,3286.25,6.0,1095.0,1460.0,0.0,,614.867136,,,recommended,2012-10-27 12:00:00,2021-12-31 18:00:00,13145.0,0.5724372668463109,0.750510560965668,1.0994406998159787,1.332680714518133,-0.05041524007148812,0.2377290255115878,642.2305378177343,914.7099080544983,0.750510560965668,286.2865793353996,9.944069981597817,9.944069981597863,22.307666070845652,9.944069981597863,1.0248976729759325,0.667319285481867
876,10032009,Günzburg u. d. Günzmündung,1025,DE,10.285,48.4654,43864,9399.96,Danube,Danube,Danube,-,9550,4342500.0,2817500.0,9407.0,10.29167,48.45833,True,True,True,False,1,1,1,1,1,1,1,0,0,0,NRT_6h,wrong hydrometric zero or wrong rating curve,0,,-,,0,0,01/02/2013,31/12/2021,967.0,31/01/2013 06:00,31/12/2021 18:00,3966.0,False,False,,,,,,,,,,,,,,,,,,,,,,,,,,,,,,,
879,10043708,Neuburg,1025,DE,11.1787,48.7393,37549,19910.1,Danube,Danube,Danube,-,20125,4402500.0,2847500.0,19932.6,11.175,48.74167,True,True,True,False,1,1,1,1,1,1,1,0,0,0,NRT_6h,oscillations use 464 and 469,1,possibly regulated  use 469,1,close,0,0,14/01/2013,31/12/2021,3154.0,14/01/2013 00:00,31/12/2021 18:00,12893.0,True,True,,,,,,,,,,,,,,,,,,,,,,,,,,,,,,,
882,10056302,Oberndorf,1025,DE,12.0149,48.947,33115,26512.49,Danube,Danube,Danube,C361,26525,4467500.0,2872500.0,26480.2,12.00833,48.94167,True,True,True,False,1,1,1,1,1,1,1,0,1,0,NRT_6h,samll oscillations use 471,2,close to 471,3,close,0,1,03/01/1990,31/12/2021,9533.0,14/01/2013 00:00,31/12/2021 18:00,12893.0,True,True,,,,,,,,,,,,recommended,,,,,,,,,,,,,,,,,,,
883,10061007,Regensburg Eiserne Brücke,1025,DE,12.1025,49.0213,32550,32495,Danube,Danube,Danube,-,32525,4467500.0,2882500.0,32543.2,12.10833,49.025,True,True,True,True,1,1,1,1,1,1,1,0,0,0,NRT_6h,-,3,close to 1 very similar data excluded by DP,3,DP,0,1,14/01/2013,31/12/2021,3146.0,14/01/2013 00:00,31/12/2021 18:00,12858.0,True,True,,,,,,,,,,,,exclude,,,,,,,,,,,,,,,,,,,
884,10062000,Schwabelweis,1025,DE,12.1387,49.0236,32449,35449.63,Danube,Danube,Danube,-,35625,4482500.0,2882500.0,35432.7,12.125,49.025,True,True,True,False,1,1,1,1,1,1,1,0,0,0,NRT_6h,low quality data same location as 1,0,,-,,0,0,14/01/2013,31/12/2021,1250.0,14/01/2013 00:00,31/12/2021 18:00,4827.0,False,False,,,,,,,,,,,,,,,,,,,,,,,,,,,,,,,
885,10074009,Straubing,1025,DE,12.5737,48.8856,31145,37026.36,Danube,Danube,Danube,-,37075,4507500.0,2867500.0,37064.4,12.575,48.89167,False,False,False,False,1,0,1,0,1,1,0,0,0,0,-,No discharge data available for calibration period,-,,-,,0,0,,,,,,,False,False,,,,,,,,,,,,,,,,,,,,,,,,,,,,,,,
886,10078000,Pfelling,1025,DE,12.7472,48.8798,30816,37757.18,Danube,Danube,Danube,-,37750,4522500.0,2867500.0,37757.4,12.74167,48.875,True,True,True,True,1,1,1,1,1,1,1,0,0,0,NRT_6h,-,3,,3,,1,1,14/01/2013,31/12/2021,3154.0,14/01/2013 00:00,31/12/2021 18:00,12895.0,True,True,14/01/2013 00:00,31/12/2021 18:00,3223.75,6.0,1095.0,1460.0,0.0,,2317.88288,,,recommended,2013-01-14 00:00:00,2021-12-31 18:00:00,12895.0,0.8595265985013156,0.899176761230273,1.0751290856806872,0.9373655722675048,0.7790230593195535,0.7221989198100697,78.26336645762623,105.48552034619041,0.899176761230273,29.853540843289398,7.512908568068718,7.512908568068729,19.695670926002496,7.512908568068729,0.4700818446615933,0.9373655722675048
887,10081004,Deggendorf,1025,DE,12.9606,48.8258,30700,38160.08,Danube,Danube,Danube,-,38125,4537500.0,2862500.0,38172.3,12.95833,48.825,False,False,False,False,1,0,1,0,1,1,0,0,0,0,-,No discharge data available for calibration period,-,,-,,0,0,,,,,,,False,False,,,,,,,,,,,,,,,,,,,,,,,,,,,,,,,
888,10088003,Hofkirchen,1025,DE,13.1152,48.6766,29960,47609.56,Danube,Danube,Danube,-,47700,4552500.0,2842500.0,47583.4,13.10833,48.69167,True,True,True,False,1,1,1,1,1,1,1,0,0,0,NRT_6h,almost same as 2 almost same location,2,close to 2,3,close,0,1,14/01/2013,31/12/2021,3149.0,14/01/2013 00:00,31/12/2021 18:00,12867.0,True,True,,,,,,,,,,,,recommended,,,,,,,,,,,,,,,,,,,
889,10089006,Vilshofen,1025,DE,13.1824,48.6372,29707,47739.06,Danube,Danube,Danube,-,49400,4557500.0,2842500.0,47703.9,13.175,48.64167,False,False,False,False,1,0,1,0,1,1,0,0,0,0,-,No discharge data available for calibration period,-,,-,,0,0,,,,,,,False,False,,,,,,,,,,,,,,,,,,,,,,,,,,,,,,,
890,10091008,Passau,1025,DE,13.4587,48.5763,28646,49716.33,Danube,Danube,Danube,-,76800,4577500.0,2837500.0,49688.3,13.44167,48.575,False,False,False,False,1,0,1,0,1,1,0,0,0,0,-,No discharge data available for calibration period,-,,-,,0,0,,,,,,,False,False,,,,,,,,,,,,,,,,,,,,,,,,,,,,,,,
891,10092000,Passau Ilzstadt,1025,DE,13.4782,48.5752,28623,76643.21,Danube,Danube,Danube,-,76775,4577500.0,2832500.0,76601.4,13.475,48.575,True,True,True,False,1,1,1,1,1,1,1,0,0,0,NRT_6h,almost same location as 156 and same data  use 156,2,close to 156  excluded by DP,3,DP,0,1,14/01/2013,31/12/2021,3153.0,14/01/2013 00:00,31/12/2021 18:00,12885.0,True,True,,,,,,,,,,,,exclude,,,,,,,,,,,,,,,,,,,
892,11405000,Wiblingen,1025,DE,9.9874,48.3708,46824,2040.21,Iller,Danube,Danube,C053,2300,4322500.0,2802500.0,2173.0,9.99167,48.375,True,True,True,True,1,1,1,1,1,1,1,0,1,0,NRT_6h,-,3,,3,,2,1,02/01/1991,31/12/2021,8578.0,14/01/2013 00:00,31/12/2021 18:00,12870.0,True,True,14/01/2013 00:00,31/12/2021 18:00,3217.5,6.0,1095.0,1460.0,0.0,,1225.679104,,,,2013-01-14 00:00:00,2021-12-31 18:00:00,12870.0,0.7772763712555045,0.9110203772677378,1.1888758496228469,0.9224477275072621,0.756108522039126,0.745154630925328,14.838989096025575,24.03636629092559,0.9110203772677378,9.658674070639064,18.88758496228485,18.887584962284688,29.017716640588258,18.887584962284688,0.4938537009690973,0.9224477275072621
893,12003001,Landsberg,1025,DE,10.8751,48.0415,58228,2286.94,Lech,Danube,Danube,-,2325,4387500.0,2767500.0,2307.7,10.875,48.04167,True,True,True,False,1,1,1,1,1,1,1,0,0,0,NRT_6h,dam or lake  close to 894,2,close to 895  regulated flows due to river barrages along the Lech  do not rely on simulated flow from upstream ,3,close,0,1,14/01/2013,31/12/2021,3116.0,14/01/2013 00:00,31/12/2021 18:00,12718.0,True,True,,,,,,,,,,,,recommended,,,,,,,,,,,,,,,,,,,
894,12003500,Haunstetten,1025,DE,10.9457,48.3163,49156,2348.75,Lech,Danube,Danube,-,2700,4392500.0,2797500.0,2579.0,10.94167,48.30833,True,True,True,True,1,1,1,1,1,1,1,0,0,0,NRT_6h,dam,3,use 895  regulated flows due to river barrages along the Lech  do not rely on simulated flow from upstream ,3,close,0,1,14/01/2013,31/12/2021,3154.0,14/01/2013 00:00,31/12/2021 18:00,12894.0,True,True,,,,,,,,,,,,recommended,,,,,,,,,,,,,,,,,,,
895,12006000,Augsburg u. d. Wertachmündung,1025,DE,10.888,48.4081,45678,3802.87,Lech,Danube,Danube,C047,4075,4387500.0,2807500.0,4002.9,10.89167,48.40833,True,True,True,True,1,1,1,1,1,1,1,0,1,0,NRT_6h,low quality data,3,regulated flows due to river barrages along the Lech  do not rely on simulated flow from upstream ,3,,1,1,03/01/1990,31/12/2021,10147.0,14/01/2013 00:00,31/12/2021 18:00,12895.0,True,True,14/01/2013 00:00,31/12/2021 18:00,3223.75,6.0,1095.0,1460.0,0.0,,1725.825664,1.0,,recommended,2013-01-14 00:00:00,2021-12-31 18:00:00,12895.0,0.6959876052506437,0.8365220743444912,0.930766918700583,1.246789960165317,0.5753089046363073,0.2870919477791798,26.716347955750003,35.51827401379804,0.8365220743444912,-7.614247794064901,-6.9233081299417405,-6.923308129941701,24.292026475493852,6.923308129941701,0.651683278413443,0.753210039834683
900,14008006,Heitzenhofen,1025,DE,11.9363,49.1183,33364,5431.64,Naab,Danube,Danube,C443,5475,4462500.0,2887500.0,5418.0,11.94167,49.125,True,True,True,True,1,1,1,1,1,1,1,0,1,0,NRT_6h,-,3,,3,,1,1,02/01/1991,31/12/2021,7482.0,14/01/2013 00:00,31/12/2021 18:00,12740.0,True,True,14/01/2013 00:00,31/12/2021 18:00,3185.0,6.0,1095.0,1460.0,0.0,,1403.783424,,,recommended,2013-01-14 00:00:00,2021-12-31 18:00:00,12740.0,0.8618812540339408,0.8662528717806627,1.0074242260104262,0.9663343714084669,0.7387953549517874,0.5543165623409599,11.078425487124813,15.237739777969889,0.8662528717806627,0.2904133608339768,0.7424226010426125,0.7424226010426227,28.321264014812918,0.7424226010426227,0.5110818379166034,0.9663343714084669
902,15207008,Nittenau,1025,DE,12.2749,49.1997,34352,2527.5,Regen,Danube,Danube,-,2600,4487500.0,2902500.0,2553.6,12.275,49.20833,False,False,False,False,1,0,1,0,1,1,0,0,0,0,-,No discharge data available for calibration period,-,,-,,0,0,,,,,,,False,False,,,,,,,,,,,,,,,,,,,,,,,,,,,,,,,
903,15207507,Marienthal,1025,DE,12.1756,49.223,33700,2590.4,Regen,Danube,Danube,-,2675,4482500.0,2902500.0,2605.3,12.175,49.225,True,True,True,True,1,1,1,1,1,1,1,0,0,0,NRT_6h,-,3,,3,,1,1,14/01/2013,31/12/2021,3152.0,14/01/2013 00:00,31/12/2021 18:00,12874.0,True,True,14/01/2013 00:00,31/12/2021 18:00,3218.5,6.0,1095.0,1460.0,0.0,,427.73936,,,recommended,2013-01-14 00:00:00,2021-12-31 18:00:00,12874.0,0.8180303061005421,0.8262984901302348,1.0011490975646942,1.0542165522844553,0.6302670228254341,0.69840526383719,7.888537559909188,15.404672896558912,0.8262984901302348,0.034575527667030335,0.11490975646944748,0.11490975646940688,26.217096052402386,0.11490975646940688,0.6080567220042598,0.9457834477155447
904,16005701,München,1025,DE,11.5969,48.1455,50036,2814,Isar,Danube,Danube,-,2850,4437500.0,2777500.0,2878.2,11.59167,48.14167,True,True,True,True,1,1,1,1,1,1,1,0,0,0,NRT_6h,-,3,,3,,1,1,14/01/2013,31/12/2021,3153.0,14/01/2013 00:00,31/12/2021 18:00,12891.0,True,True,14/01/2013 00:00,31/12/2021 18:00,3222.75,6.0,1095.0,1460.0,0.0,,1486.291584,,,,2013-01-14 00:00:00,2021-12-31 18:00:00,12891.0,0.7190144809289051,0.8542713982082196,1.239029817620381,0.9759005635785228,0.5187844310116103,0.4239982969901611,25.351158773274253,36.54685333538754,0.8542713982082196,15.36376007803059,23.902981762038195,23.90298176203808,39.44140514603694,23.90298176203808,0.693697029681107,0.9759005635785228
905,16006500,Freising,1025,DE,11.7522,48.3982,43964,3037.65,Isar,Danube,Danube,-,3150,4447500.0,2817500.0,3176.1,11.74167,48.39167,True,True,True,False,1,1,1,1,1,1,1,0,0,0,NRT_6h,Inconsistent with upstream or downstream data  mayby wrong coords,0,Inconsistent with upstream or downstream data  mayby wrong coords,0,,0,1,14/01/2013,31/12/2021,3154.0,14/01/2013 00:00,31/12/2021 18:00,12891.0,True,True,,,,,,,,,,,,,,,,,,,,,,,,,,,,,,,
906,16007004,Landshut Birket,1025,DE,12.1332,48.5275,38865,7915.42,Isar,Danube,Danube,-,7900,4472500.0,2822500.0,7971.1,12.125,48.525,True,True,True,True,1,1,1,1,1,1,1,0,0,0,NRT_6h,-,3,,3,,1,1,14/01/2013,31/12/2021,3154.0,14/01/2013 00:00,31/12/2021 18:00,12891.0,True,True,14/01/2013 00:00,31/12/2021 18:00,3222.75,6.0,1095.0,1460.0,0.0,,1885.705856,1.0,,,2013-01-14 00:00:00,2021-12-31 18:00:00,12891.0,0.7375887148619479,0.846902733822312,1.1190336182391674,1.1767820901155273,0.42375165666798253,0.4149806710344204,35.2607417109261,51.45230189099889,0.846902733822312,18.26710856449505,11.903361823916686,11.903361823916745,22.976891240500894,11.903361823916745,0.759110231344577,0.8232179098844727
912,18004506,Mühldorf,1025,DE,12.5287,48.239,37123,12409.28,Inn,Danube,Danube,-,12500,4502500.0,2787500.0,12413.3,12.525,48.24167,True,True,True,False,1,1,1,1,1,1,1,0,0,0,NRT_6h,wrong location or wrong rating curve,0,Not consistent with upstream 489  issues with low flow,0,,0,1,14/01/2013,31/12/2021,3153.0,14/01/2013 00:00,31/12/2021 18:00,12872.0,True,True,,,,,,,,,,,,,,,,,,,,,,,,,,,,,,,
913,18009000,Passau,1025,DE,13.4656,48.5734,28919,26071.79,Inn,Danube,Danube,-,26125,4572500.0,2832500.0,26039.8,13.44167,48.54167,False,False,False,False,1,0,1,0,1,1,0,0,0,0,-,No discharge data available for calibration period,-,,-,,0,0,,,,,,,False,False,,,,,,,,,,,,,,,,,,,,,,,,,,,,,,,
914,18408200,Burgkirchen,1025,DE,12.7311,48.1716,39690,2221.95,Alz,Danube,Danube,-,2250,4527500.0,2792500.0,2265.5,12.74167,48.175,True,True,True,False,1,1,1,1,1,1,1,0,0,0,NRT_6h,wrong location or wrong rating curve,0,Not consistent with upstream 487  wrong location or wrong data  excluded by DP,0,DP,0,1,14/01/2013,31/12/2021,3128.0,14/01/2013 00:00,31/12/2021 18:00,12778.0,True,True,,,,,,,,,,,,exclude,,,,,,,,,,,,,,,,,,,
919,24012203,Trunstadt,1025,DE,10.7551,49.9295,22340,11984.97,Main,Rhine,Rhine,-,11925,4377500.0,2977500.0,12011.0,10.75833,49.94167,True,True,True,False,1,1,1,1,1,1,1,0,0,0,NRT_6h,Same location as 39 different data doubts on data  low flow,0,Major issues with low flow  same location as 39 but different data,0,,0,0,14/01/2013,31/12/2021,3056.0,14/01/2013 00:00,31/12/2021 18:00,12288.0,True,True,,,,,,,,,,,,,,,,,,,,,,,,,,,,,,,
920,24022003,Schweinfurt Neuer Hafen,1025,DE,10.2208,50.0312,20116,12689.93,Main,Rhine,Rhine,-,12675,4332500.0,2987500.0,12725.9,10.20833,50.025,True,True,True,False,1,1,1,1,1,1,1,0,0,0,NRT_6h,Wrong hydrometric zero or rating curve same 34,0,,-,,0,0,14/01/2013,31/12/2021,996.0,14/01/2013 00:00,31/12/2021 18:00,3758.0,False,False,,,,,,,,,,,,,,,,,,,,,,,,,,,,,,,
921,24042000,Würzburg,1025,DE,9.9258,49.7961,16445,13995.76,Main,Rhine,Rhine,-,13925,4317500.0,2962500.0,14114.0,9.925,49.80833,True,True,True,False,1,1,1,1,1,1,1,0,1,0,NRT_6h,Wrong hydrometric zero or rating curve same as 43,0,missing low flow after 2013  same data as 43,0,,0,0,03/01/1990,31/12/2021,8381.0,14/01/2013 00:00,31/12/2021 18:00,3055.0,True,False,,,,,,,,,,,,,,,,,,,,,,,,,,,,,,,
922,24050009,Steinbach,1025,DE,9.6037,50.01,14633,17878.46,Main,Rhine,Rhine,-,18225,4292500.0,2987500.0,17936.4,9.59167,50.00833,True,True,True,False,1,1,1,1,1,1,1,0,0,0,NRT_6h,same location as 59  Wrong hydrometric zero or rating curve,0,Major issues with low flow  same location as 59  but different data,0,,0,0,14/01/2013,31/12/2021,1830.0,14/01/2013 00:00,31/12/2021 18:00,7075.0,True,True,,,,,,,,,,,,,,,,,,,,,,,,,,,,,,,
923,24060002,Faulbach,1025,DE,9.4386,49.785,12828,20703.2,Main,Rhine,Rhine,-,20750,4277500.0,2962500.0,20731.6,9.44167,49.79167,False,False,False,False,1,0,1,0,1,1,0,0,0,0,-,No discharge data available for calibration period,-,,-,,0,0,,,,,,,False,False,,,,,,,,,,,,,,,,,,,,,,,,,,,,,,,
924,24064003,Kleinheubach,1025,DE,9.2246,49.7164,11962,21491.16,Main,Rhine,Rhine,-,21600,4262500.0,2962500.0,21539.5,9.225,49.725,True,True,True,False,1,1,1,1,1,1,1,0,0,0,NRT_6h,same location as 35  Wrong hydrometric zero or rating curve,0,Major issues with low flow  same location as 35,0,,0,0,14/01/2013,31/12/2021,1846.0,14/01/2013 00:00,31/12/2021 18:00,6817.0,True,True,,,,,,,,,,,,,,,,,,,,,,,,,,,,,,,
925,24070006,Obernau,1025,DE,9.121,49.9372,10780,22289.25,Main,Rhine,Rhine,-,22350,4257500.0,2982500.0,22347.0,9.125,49.94167,False,False,False,False,1,0,1,0,1,1,0,0,0,0,-,No discharge data available for calibration period,-,,-,,0,0,,,,,,,False,False,,,,,,,,,,,,,,,,,,,,,,,,,,,,,,,
926,24080000,Krotzenburg,1025,DE,8.9535,50.0797,9813,23374,Main,Rhine,Rhine,-,23350,4247500.0,2997500.0,23407.1,8.95833,50.075,False,False,False,False,1,0,1,0,1,1,0,0,0,0,-,No discharge data available for calibration period,-,,-,,0,0,,,,,,,False,False,,,,,,,,,,,,,,,,,,,,,,,,,,,,,,,
928,24208806,Pettstadt,1025,DE,10.9489,49.8328,23708,6991,Regnitz,Rhine,Rhine,-,6975,4392500.0,2967500.0,6994.6,10.94167,49.825,True,True,True,False,1,1,1,1,1,1,1,0,0,0,NRT_6h,Oscillations,1,,3,,1,0,14/01/2013,31/12/2021,3154.0,14/01/2013 00:00,31/12/2021 18:00,12895.0,True,True,14/01/2013 00:00,31/12/2021 18:00,3223.75,6.0,1095.0,1460.0,0.0,,2168.470016,,,,2013-01-14 00:00:00,2021-12-31 18:00:00,12895.0,0.6916153858308655,0.7630382264426532,1.1860942508022665,1.0657199965546698,0.21148737068381207,0.17221712047708726,15.932674353223137,24.48148777702986,0.7630382264426532,9.539817826907756,18.60942508022667,18.609425080226643,31.080038957102694,18.609425080226643,0.887982336150998,0.9342800034453302
930,26900510,Alken,1004,DE,7.445633,50.250872,70.5,27960,Moselle,Rhine,Rhine,-,27925,4142500.0,3022500.0,27975.6,7.44167,50.25833,True,True,True,False,0,1,0,1,1,1,1,1,1,0,NRT_6h,Close to 38 lower quality,2,close to 38 excluded by DP,3,DP,0,1,01/07/2013,31/12/2021,2946.0,01/07/2013 00:00,31/12/2021 18:00,12007.0,True,True,,,,,,,,,,,,exclude,,,,,,,,,,,,,,,,,,,
931,23800500,Lauffen,1004,DE,9.159831,49.072307,159.41,7916,Neckar,Rhine,Rhine,C209,7950,4257500.0,2877500.0,7876.4,9.175,49.05833,True,True,True,True,1,1,1,1,1,1,1,1,1,0,NRT_6h,Outliers removed with qc,3,,3,,1,1,03/01/1990,31/12/2021,10357.0,15/08/2012 06:00,31/12/2021 18:00,12913.0,True,True,15/08/2012 06:00,31/12/2021 18:00,3228.25,6.0,1095.0,1460.0,0.0,,3896.032512,,,recommended,2012-08-15 06:00:00,2021-12-31 18:00:00,12913.0,0.8643274026807962,0.8678919273499686,0.9830296086517507,0.9741830168005612,0.7448448089445774,0.7802602948868915,18.112888714899192,36.63479470831868,0.8678919273499686,-1.3273230341452515,-1.6970391348249498,-1.697039134824932,23.15810108253514,1.697039134824932,0.5051288855880459,0.9741830168005612
932,23800745,Ziegelhausen AMS,1004,DE,8.761891,49.416498,105.87,13783,Neckar,Rhine,Rhine,-,13875,4232500.0,2922500.0,13764.6,8.75833,49.425,True,True,True,True,0,1,0,1,1,1,1,1,1,0,NRT_6h,-,3,excluded by DP,3,DP,0,1,01/07/2013,31/12/2021,2991.0,01/07/2013 00:00,31/12/2021 18:00,12223.0,True,True,,,,,,,,,,,,exclude,,,,,,,,,,,,,,,,,,,
933,23800690,Rockenau SKA,1004,DE,9.005064,49.43823,119.74,1271,Neckar,Rhine,Rhine,C341,12975,4247500.0,2927500.0,12676.9,9.00833,49.44167,True,True,True,False,1,1,1,1,1,1,1,1,1,0,NRT_6h,Moved on main stream  close to 932,2,close to 932,2,,1,1,03/01/1990,22/12/2021,9308.0,19/03/2013 00:00,21/12/2021 12:00,8190.0,True,True,19/03/2013 00:00,21/12/2021 12:00,2047.5,6.0,1095.0,1460.0,0.0,,2827.529472,,,recommended,2013-03-19 00:00:00,2021-12-21 12:00:00,8190.0,0.857741424608036,0.8680948474691833,1.0311834217718625,1.0431986945979992,0.7092961695086683,0.6324316511231389,34.33624658113894,60.057764169616874,0.8680948474691833,3.8271136824399083,3.1183421771862387,3.1183421771862547,27.977262972750356,3.1183421771862547,0.5391695748939581,0.9568013054020008
934,2769510000100,Hattingen,1004,DE,7.160984,51.399742,60.37,4117.94,Ruhr,Rhine,Rhine,-,4225,4127500.0,3147500.0,4150.3,7.15833,51.39167,True,True,True,True,1,1,1,1,1,1,1,1,1,0,NRT_6h,-,3,,3,,1,1,01/07/2013,31/12/2021,2959.0,01/07/2013 00:00,31/12/2021 18:00,12033.0,True,True,01/07/2013 00:00,31/12/2021 18:00,3008.25,6.0,1095.0,1460.0,1.0,0.0,4150.267648,1.0,,recommended,2013-07-01 00:00:00,2021-12-31 18:00:00,12033.0,0.9005963898279191,0.9231553371723993,0.9653652029836276,0.9473083844830122,0.8510252837914992,0.736511247248214,13.051983488552263,22.18368819069203,0.9231553371723993,-1.9196521339516324,-3.4634797016372443,-3.46347970163724,23.54868315940635,3.46347970163724,0.38597242933725207,0.9473083844830122
